{"question": "A junior orthopaedic surgery resident is completing a carpal tunnel repair with the department chairman as the attending physician. During the case, the resident inadvertently cuts a flexor tendon. The tendon is repaired without complication. The attending tells the resident that the patient will do fine, and there is no need to report this minor complication that will not harm the patient, as he does not want to make the patient worry unnecessarily. He tells the resident to leave this complication out of the operative report. Which of the following is the correct next action for the resident to take?", "answer": "Tell the attending that he cannot fail to disclose this mistake", "options": {"A": "Disclose the error to the patient and put it in the operative report", "B": "Tell the attending that he cannot fail to disclose this mistake", "C": "Report the physician to the ethics committee", "D": "Refuse to dictate the operative report"}, "meta_info": "step1", "answer_idx": "B", "metamap_phrases": ["junior orthopaedic surgery resident", "completing", "carpal tunnel repair", "department chairman", "attending physician", "case", "resident", "cuts", "flexor tendon", "tendon", "repaired", "complication", "attending", "resident", "patient", "fine", "need to report", "minor complication", "not", "patient", "not", "to make", "patient worry", "resident to leave", "complication out", "operative report", "following", "correct next action", "resident to take"], "model_answer": "The correct next action for the resident to take is to disclose the error to the patient and include it in the operative report, as transparency and honesty are essential in patient care, even when complications are minor. \n\n[A]", "fact_gen_query": "\n    nQuestion:\nA junior orthopaedic surgery resident is completing a carpal tunnel repair with the department chairman as the attending physician. During the case, the resident inadvertently cuts a flexor tendon. The tendon is repaired without complication. The attending tells the resident that the patient will do fine, and there is no need to report this minor complication that will not harm the patient, as he does not want to make the patient worry unnecessarily. He tells the resident to leave this complication out of the operative report. Which of the following is the correct next action for the resident to take?\n\n Option:\nDisclose the error to the patient and put it in the operative report;\nTell the attending that he cannot fail to disclose this mistake;\nReport the physician to the ethics committee;\nRefuse to dictate the operative report;\n\n\n Answer:\nTell the attending that he cannot fail to disclose this mistake\n For this QA example, you need to give netural fact info for each\n    option according to question context, so that later user can infer out the \n    correct answer from these facts. The template of facts is [option1_name:fact| option2_name:fact|...],e.g: [Ampicillin:High resistance, not first-line. | Ceftriaxone:Overkill (for pyelonephritis/severe UTI).]\n", "hinted_gen_query": "\n    Question:\nA junior orthopaedic surgery resident is completing a carpal tunnel repair with the department chairman as the attending physician. During the case, the resident inadvertently cuts a flexor tendon. The tendon is repaired without complication. The attending tells the resident that the patient will do fine, and there is no need to report this minor complication that will not harm the patient, as he does not want to make the patient worry unnecessarily. He tells the resident to leave this complication out of the operative report. Which of the following is the correct next action for the resident to take?\n\n Option:\nA:Disclose the error to the patient and put it in the operative report;\nB:Tell the attending that he cannot fail to disclose this mistake;\nC:Report the physician to the ethics committee;\nD:Refuse to dictate the operative report;\n \n\n Hint:\nNone \n\n Answer:\n"}
{"question": "A 67-year-old man with transitional cell carcinoma of the bladder comes to the physician because of a 2-day history of ringing sensation in his ear. He received this first course of neoadjuvant chemotherapy 1 week ago. Pure tone audiometry shows a sensorineural hearing loss of 45 dB. The expected beneficial effect of the drug that caused this patient's symptoms is most likely due to which of the following actions?", "answer": "Cross-linking of DNA", "options": {"A": "Inhibition of proteasome", "B": "Hyperstabilization of microtubules", "C": "Generation of free radicals", "D": "Cross-linking of DNA"}, "meta_info": "step1", "answer_idx": "D", "metamap_phrases": ["67 year old man", "transitional cell carcinoma of the bladder", "physician", "2-day history", "ringing sensation", "ear", "received", "first course", "neoadjuvant chemotherapy 1 week", "Pure tone audiometry shows", "sensorineural hearing loss", "dB", "expected beneficial effect", "drug", "caused", "patient's symptoms", "most likely due to", "following actions"], "model_answer": "The patient's symptoms of tinnitus and sensorineural hearing loss following chemotherapy are most commonly associated with cisplatin, a platinum-based chemotherapeutic agent. Cisplatin's mechanism of action involves the formation of DNA cross-links, which interfere with DNA replication and transcription, leading to cancer cell death. \n\nThe expected beneficial effect of cisplatin is due to its ability to cross-link DNA, which disrupts the cancer cell's ability to divide and proliferate. \n\nThe correct answer is [D].", "fact_gen_query": "\n    nQuestion:\nA 67-year-old man with transitional cell carcinoma of the bladder comes to the physician because of a 2-day history of ringing sensation in his ear. He received this first course of neoadjuvant chemotherapy 1 week ago. Pure tone audiometry shows a sensorineural hearing loss of 45 dB. The expected beneficial effect of the drug that caused this patient's symptoms is most likely due to which of the following actions?\n\n Option:\nInhibition of proteasome;\nHyperstabilization of microtubules;\nGeneration of free radicals;\nCross-linking of DNA;\n\n\n Answer:\nCross-linking of DNA\n For this QA example, you need to give netural fact info for each\n    option according to question context, so that later user can infer out the \n    correct answer from these facts. The template of facts is [option1_name:fact| option2_name:fact|...],e.g: [Ampicillin:High resistance, not first-line. | Ceftriaxone:Overkill (for pyelonephritis/severe UTI).]\n", "hinted_gen_query": "\n    Question:\nA 67-year-old man with transitional cell carcinoma of the bladder comes to the physician because of a 2-day history of ringing sensation in his ear. He received this first course of neoadjuvant chemotherapy 1 week ago. Pure tone audiometry shows a sensorineural hearing loss of 45 dB. The expected beneficial effect of the drug that caused this patient's symptoms is most likely due to which of the following actions?\n\n Option:\nA:Inhibition of proteasome;\nB:Hyperstabilization of microtubules;\nC:Generation of free radicals;\nD:Cross-linking of DNA;\n \n\n Hint:\nNone \n\n Answer:\n"}
{"question": "Two weeks after undergoing an emergency cardiac catherization with stenting for unstable angina pectoris, a 61-year-old man has decreased urinary output and malaise. He has type 2 diabetes mellitus and osteoarthritis of the hips. Prior to admission, his medications were insulin and naproxen. He was also started on aspirin, clopidogrel, and metoprolol after the coronary intervention. His temperature is 38°C (100.4°F), pulse is 93/min, and blood pressure is 125/85 mm Hg. Examination shows mottled, reticulated purplish discoloration of the feet. Laboratory studies show:\nHemoglobin count 14 g/dL\nLeukocyte count 16,400/mm3\nSegmented neutrophils 56%\nEosinophils 11%\nLymphocytes 31%\nMonocytes 2%\nPlatelet count 260,000/mm3\nErythrocyte sedimentation rate 68 mm/h\nSerum\nUrea nitrogen 25 mg/dL\nCreatinine 4.2 mg/dL\nRenal biopsy shows intravascular spindle-shaped vacuoles. Which of the following is the most likely cause of this patient's symptoms?\"", "answer": "Cholesterol embolization", "options": {"A": "Renal papillary necrosis", "B": "Cholesterol embolization", "C": "Eosinophilic granulomatosis with polyangiitis", "D": "Polyarteritis nodosa"}, "meta_info": "step2&3", "answer_idx": "B", "metamap_phrases": ["Two weeks", "emergency cardiac", "stenting", "unstable angina pectoris", "61 year old man", "decreased urinary output", "malaise", "type 2 diabetes mellitus", "osteoarthritis of", "hips", "admission", "medications", "insulin", "naproxen", "started", "aspirin", "clopidogrel", "metoprolol", "coronary intervention", "temperature", "100 4F", "pulse", "min", "blood pressure", "85 mm Hg", "Examination shows mottled", "reticulated", "discoloration", "feet", "Laboratory studies show", "Hemoglobin count", "Leukocyte 16", "neutrophils", "Platelet count", "Erythrocyte sedimentation rate", "h Serum Urea nitrogen", "mg", "Creatinine", "mg", "Renal biopsy shows intravascular spindle shaped vacuoles", "following", "most likely cause", "patient", "ymptoms?"], "model_answer": "The patient's presentation includes recent cardiac catheterization, followed by symptoms of decreased urinary output, malaise, and mottled, reticulated purplish discoloration of the feet (livedo reticularis). Laboratory findings show eosinophilia and elevated creatinine, and renal biopsy reveals intravascular spindle-shaped vacuoles, which are characteristic of cholesterol crystals. These findings are most consistent with **cholesterol embolization**, a complication of vascular procedures where cholesterol crystals dislodge and occlude small vessels, leading to end-organ damage.\n\nThe other options are less likely:\n- **A: Renal papillary necrosis** is associated with NSAID use (naproxen) but does not explain the livedo reticularis, eosinophilia, or intravascular cholesterol crystals.\n- **C: Eosinophilic granulomatosis with polyangiitis** (EGPA) typically involves asthma, sinusitis, and peripheral neuropathy, not cholesterol emboli.\n- **D: Polyarteritis nodosa** (PAN) causes vasculitis of medium-sized arteries but not cholesterol emboli or livedo reticularis in this context.\n\nThe most likely cause is **B: Cholesterol embolization**.\n\n[B]", "fact_gen_query": "\n    nQuestion:\nTwo weeks after undergoing an emergency cardiac catherization with stenting for unstable angina pectoris, a 61-year-old man has decreased urinary output and malaise. He has type 2 diabetes mellitus and osteoarthritis of the hips. Prior to admission, his medications were insulin and naproxen. He was also started on aspirin, clopidogrel, and metoprolol after the coronary intervention. His temperature is 38°C (100.4°F), pulse is 93/min, and blood pressure is 125/85 mm Hg. Examination shows mottled, reticulated purplish discoloration of the feet. Laboratory studies show:\nHemoglobin count 14 g/dL\nLeukocyte count 16,400/mm3\nSegmented neutrophils 56%\nEosinophils 11%\nLymphocytes 31%\nMonocytes 2%\nPlatelet count 260,000/mm3\nErythrocyte sedimentation rate 68 mm/h\nSerum\nUrea nitrogen 25 mg/dL\nCreatinine 4.2 mg/dL\nRenal biopsy shows intravascular spindle-shaped vacuoles. Which of the following is the most likely cause of this patient's symptoms?\"\n\n Option:\nRenal papillary necrosis;\nCholesterol embolization;\nEosinophilic granulomatosis with polyangiitis;\nPolyarteritis nodosa;\n\n\n Answer:\nCholesterol embolization\n For this QA example, you need to give netural fact info for each\n    option according to question context, so that later user can infer out the \n    correct answer from these facts. The template of facts is [option1_name:fact| option2_name:fact|...],e.g: [Ampicillin:High resistance, not first-line. | Ceftriaxone:Overkill (for pyelonephritis/severe UTI).]\n", "hinted_gen_query": "\n    Question:\nTwo weeks after undergoing an emergency cardiac catherization with stenting for unstable angina pectoris, a 61-year-old man has decreased urinary output and malaise. He has type 2 diabetes mellitus and osteoarthritis of the hips. Prior to admission, his medications were insulin and naproxen. He was also started on aspirin, clopidogrel, and metoprolol after the coronary intervention. His temperature is 38°C (100.4°F), pulse is 93/min, and blood pressure is 125/85 mm Hg. Examination shows mottled, reticulated purplish discoloration of the feet. Laboratory studies show:\nHemoglobin count 14 g/dL\nLeukocyte count 16,400/mm3\nSegmented neutrophils 56%\nEosinophils 11%\nLymphocytes 31%\nMonocytes 2%\nPlatelet count 260,000/mm3\nErythrocyte sedimentation rate 68 mm/h\nSerum\nUrea nitrogen 25 mg/dL\nCreatinine 4.2 mg/dL\nRenal biopsy shows intravascular spindle-shaped vacuoles. Which of the following is the most likely cause of this patient's symptoms?\"\n\n Option:\nA:Renal papillary necrosis;\nB:Cholesterol embolization;\nC:Eosinophilic granulomatosis with polyangiitis;\nD:Polyarteritis nodosa;\n \n\n Hint:\nNone \n\n Answer:\n"}
{"question": "A 39-year-old woman is brought to the emergency department because of fevers, chills, and left lower quadrant pain. Her temperature is 39.1°C (102.3°F), pulse is 126/min, respirations are 28/min, and blood pressure is 80/50 mm Hg. There is blood oozing around the site of a peripheral intravenous line. Pelvic examination shows mucopurulent discharge from the cervical os and left adnexal tenderness. Laboratory studies show:\nPlatelet count 14,200/mm3\nFibrinogen 83 mg/mL (N = 200–430 mg/dL)\nD-dimer 965 ng/mL (N < 500 ng/mL)\nWhen phenol is applied to a sample of the patient's blood at 90°C, a phosphorylated N-acetylglucosamine dimer with 6 fatty acids attached to a polysaccharide side chain is identified. A blood culture is most likely to show which of the following?\"", "answer": "Lactose-fermenting, gram-negative rods forming pink colonies on MacConkey agar", "options": {"A": "Coagulase-positive, gram-positive cocci forming mauve-colored colonies on methicillin-containing agar", "B": "Encapsulated, gram-negative coccobacilli forming grey-colored colonies on charcoal blood agar", "C": "Spore-forming, gram-positive bacilli forming yellow colonies on casein agar", "D": "Lactose-fermenting, gram-negative rods forming pink colonies on MacConkey agar"}, "meta_info": "step1", "answer_idx": "D", "metamap_phrases": ["year old woman", "brought", "emergency department", "fevers", "chills", "left lower quadrant pain", "temperature", "pulse", "min", "respirations", "min", "blood pressure", "80 50 mm Hg", "blood", "site of", "peripheral line", "Pelvic examination shows mucopurulent discharge", "cervical os", "left adnexal tenderness", "Laboratory studies show", "Platelet count", "200 mm3 Fibrinogen 83 mg/mL", "N", "mg/dL", "D-dimer", "ng/mL", "N", "500 ng/mL", "phenol", "applied", "sample", "patient", "lood ", "cetylglucosamine  imer ", "atty acids  ttached ", "olysaccharide  ide  hain ", "dentified.", "lood culture ", "ost likely  o  how ", "ollowing?"], "model_answer": "The patient's presentation is concerning for septic shock due to pelvic inflammatory disease (PID) with disseminated intravascular coagulation (DIC). The laboratory findings (thrombocytopenia, low fibrinogen, elevated D-dimer) support DIC. The phenol test identifies a phosphorylated N-acetylglucosamine dimer with fatty acids, which is characteristic of lipopolysaccharide (LPS) from gram-negative bacteria. \n\nGiven the mucopurulent cervical discharge and adnexal tenderness, the most likely pathogen is **Neisseria gonorrhoeae**, an encapsulated, gram-negative coccobacillus. It forms grey-colored colonies on charcoal blood agar (e.g., Thayer-Martin agar). \n\nThe other options are less likely:\n- **A**: Coagulase-positive, gram-positive cocci (e.g., *Staphylococcus aureus*) would not typically cause PID.\n- **C**: Spore-forming, gram-positive bacilli (e.g., *Bacillus spp.*) are not associated with PID.\n- **D**: Lactose-fermenting, gram-negative rods (e.g., *Escherichia coli*) are more common in urinary or gastrointestinal infections, not classic PID.\n\nThus, the correct answer is **[B]**.", "fact_gen_query": "\n    nQuestion:\nA 39-year-old woman is brought to the emergency department because of fevers, chills, and left lower quadrant pain. Her temperature is 39.1°C (102.3°F), pulse is 126/min, respirations are 28/min, and blood pressure is 80/50 mm Hg. There is blood oozing around the site of a peripheral intravenous line. Pelvic examination shows mucopurulent discharge from the cervical os and left adnexal tenderness. Laboratory studies show:\nPlatelet count 14,200/mm3\nFibrinogen 83 mg/mL (N = 200–430 mg/dL)\nD-dimer 965 ng/mL (N < 500 ng/mL)\nWhen phenol is applied to a sample of the patient's blood at 90°C, a phosphorylated N-acetylglucosamine dimer with 6 fatty acids attached to a polysaccharide side chain is identified. A blood culture is most likely to show which of the following?\"\n\n Option:\nCoagulase-positive, gram-positive cocci forming mauve-colored colonies on methicillin-containing agar;\nEncapsulated, gram-negative coccobacilli forming grey-colored colonies on charcoal blood agar;\nSpore-forming, gram-positive bacilli forming yellow colonies on casein agar;\nLactose-fermenting, gram-negative rods forming pink colonies on MacConkey agar;\n\n\n Answer:\nLactose-fermenting, gram-negative rods forming pink colonies on MacConkey agar\n For this QA example, you need to give netural fact info for each\n    option according to question context, so that later user can infer out the \n    correct answer from these facts. The template of facts is [option1_name:fact| option2_name:fact|...],e.g: [Ampicillin:High resistance, not first-line. | Ceftriaxone:Overkill (for pyelonephritis/severe UTI).]\n", "hinted_gen_query": "\n    Question:\nA 39-year-old woman is brought to the emergency department because of fevers, chills, and left lower quadrant pain. Her temperature is 39.1°C (102.3°F), pulse is 126/min, respirations are 28/min, and blood pressure is 80/50 mm Hg. There is blood oozing around the site of a peripheral intravenous line. Pelvic examination shows mucopurulent discharge from the cervical os and left adnexal tenderness. Laboratory studies show:\nPlatelet count 14,200/mm3\nFibrinogen 83 mg/mL (N = 200–430 mg/dL)\nD-dimer 965 ng/mL (N < 500 ng/mL)\nWhen phenol is applied to a sample of the patient's blood at 90°C, a phosphorylated N-acetylglucosamine dimer with 6 fatty acids attached to a polysaccharide side chain is identified. A blood culture is most likely to show which of the following?\"\n\n Option:\nA:Coagulase-positive, gram-positive cocci forming mauve-colored colonies on methicillin-containing agar;\nB:Encapsulated, gram-negative coccobacilli forming grey-colored colonies on charcoal blood agar;\nC:Spore-forming, gram-positive bacilli forming yellow colonies on casein agar;\nD:Lactose-fermenting, gram-negative rods forming pink colonies on MacConkey agar;\n \n\n Hint:\nNone \n\n Answer:\n"}
{"question": "A 35-year-old man comes to the physician because of itchy, watery eyes for the past week. He has also been sneezing multiple times a day during this period. He had a similar episode 1 year ago around springtime. He has iron deficiency anemia and ankylosing spondylitis. Current medications include ferrous sulfate, artificial tear drops, and indomethacin. He works as an elementary school teacher. His vital signs are within normal limits. Visual acuity is 20/20 without correction. Physical examination shows bilateral conjunctival injection with watery discharge. The pupils are 3 mm, equal, and reactive to light. Examination of the anterior chamber of the eye is unremarkable. Which of the following is the most appropriate treatment?", "answer": "Ketotifen eye drops", "options": {"A": "Erythromycin ointment", "B": "Ketotifen eye drops", "C": "Warm compresses", "D": "Fluorometholone eye drops"}, "meta_info": "step2&3", "answer_idx": "B", "metamap_phrases": ["35 year old man", "physician", "of itchy", "watery", "past week", "sneezing multiple times", "day", "period", "similar episode", "year", "iron deficiency anemia", "ankylosing spondylitis", "Current medications include ferrous sulfate", "artificial tear drops", "indomethacin", "works", "elementary school teacher", "vital signs", "normal limits", "Visual acuity", "20/20", "correction", "Physical examination shows bilateral injection", "watery", "pupils", "3 mm", "equal", "reactive to light", "Examination of the anterior chamber", "eye", "unremarkable", "following", "most appropriate treatment"], "model_answer": "The patient presents with symptoms of allergic conjunctivitis, including itchy, watery eyes, sneezing, and a history of similar symptoms during springtime. The conjunctival injection with watery discharge and absence of anterior chamber findings further support this diagnosis. \n\nThe most appropriate treatment for allergic conjunctivitis is a mast cell stabilizer or antihistamine eye drop, such as ketotifen. \n\nThe other options are not appropriate:\n- A: Erythromycin ointment is used for bacterial conjunctivitis, which typically presents with purulent discharge.\n- C: Warm compresses are used for conditions like blepharitis or styes.\n- D: Fluorometholone eye drops are a corticosteroid and are not first-line for allergic conjunctivitis due to potential side effects.\n\nThe correct answer is [B].", "fact_gen_query": "\n    nQuestion:\nA 35-year-old man comes to the physician because of itchy, watery eyes for the past week. He has also been sneezing multiple times a day during this period. He had a similar episode 1 year ago around springtime. He has iron deficiency anemia and ankylosing spondylitis. Current medications include ferrous sulfate, artificial tear drops, and indomethacin. He works as an elementary school teacher. His vital signs are within normal limits. Visual acuity is 20/20 without correction. Physical examination shows bilateral conjunctival injection with watery discharge. The pupils are 3 mm, equal, and reactive to light. Examination of the anterior chamber of the eye is unremarkable. Which of the following is the most appropriate treatment?\n\n Option:\nErythromycin ointment;\nKetotifen eye drops;\nWarm compresses;\nFluorometholone eye drops;\n\n\n Answer:\nKetotifen eye drops\n For this QA example, you need to give netural fact info for each\n    option according to question context, so that later user can infer out the \n    correct answer from these facts. The template of facts is [option1_name:fact| option2_name:fact|...],e.g: [Ampicillin:High resistance, not first-line. | Ceftriaxone:Overkill (for pyelonephritis/severe UTI).]\n", "hinted_gen_query": "\n    Question:\nA 35-year-old man comes to the physician because of itchy, watery eyes for the past week. He has also been sneezing multiple times a day during this period. He had a similar episode 1 year ago around springtime. He has iron deficiency anemia and ankylosing spondylitis. Current medications include ferrous sulfate, artificial tear drops, and indomethacin. He works as an elementary school teacher. His vital signs are within normal limits. Visual acuity is 20/20 without correction. Physical examination shows bilateral conjunctival injection with watery discharge. The pupils are 3 mm, equal, and reactive to light. Examination of the anterior chamber of the eye is unremarkable. Which of the following is the most appropriate treatment?\n\n Option:\nA:Erythromycin ointment;\nB:Ketotifen eye drops;\nC:Warm compresses;\nD:Fluorometholone eye drops;\n \n\n Hint:\nNone \n\n Answer:\n"}
{"question": "A 39-year-old man presents to the emergency department because of progressively worsening chest pain and nausea that started at a local bar 30 minutes prior. The pain radiates to the epigastric area. He has a 5-year history of untreated hypertension. He has smoked 1 pack of cigarettes daily for the past 5 years and started abusing cocaine 2 weeks before his emergency room visit. The patient is diaphoretic and in marked distress. What should be the first step in management?", "answer": "Reassurance and continuous monitoring", "options": {"A": "Diltiazem", "B": "Labetalol", "C": "Propranolol", "D": "Reassurance and continuous monitoring"}, "meta_info": "step2&3", "answer_idx": "D", "metamap_phrases": ["year old man presents", "emergency department", "worsening chest pain", "nausea", "started", "local", "30 minutes prior", "pain radiates", "epigastric area", "5 year history of untreated hypertension", "smoked 1 pack", "cigarettes daily", "past", "years", "started abusing cocaine 2 weeks", "emergency room visit", "patient", "diaphoretic", "marked distress", "first step", "management"], "model_answer": "The patient presents with symptoms suggestive of an acute coronary syndrome (chest pain radiating to the epigastric area, diaphoresis, nausea) and has risk factors including untreated hypertension, smoking, and recent cocaine use. Cocaine use is particularly important because it can cause coronary vasospasm and acute myocardial infarction. \n\nThe first step in management should focus on addressing the potential life-threatening condition (e.g., myocardial infarction) and avoiding medications that could worsen vasospasm (e.g., non-selective beta-blockers like propranolol, which can lead to unopposed alpha-adrenergic stimulation and exacerbate vasospasm). \n\n- **Diltiazem (A)**: A calcium channel blocker that can help with vasospasm and hypertension, but it is not the first step in acute management.  \n- **Labetalol (B)**: A combined alpha- and beta-blocker, which is safer than pure beta-blockers in cocaine-associated chest pain but still not the first step.  \n- **Propranolol (C)**: Contraindicated in cocaine-induced chest pain due to risk of unopposed alpha-mediated vasoconstriction.  \n- **Reassurance and continuous monitoring (D)**: Inadequate for a patient in marked distress with potential acute coronary syndrome.  \n\nThe **first step** should be **oxygen, aspirin, nitroglycerin, and morphine (if needed)** as part of the initial management of acute coronary syndrome, though these options are not listed here. Among the given choices, **Labetalol (B)** is the least harmful and could be considered for hypertension control, but the question is flawed as the true first step (e.g., aspirin, nitroglycerin) is missing.  \n\nHowever, if forced to choose from the options, **Labetalol (B)** is the most appropriate.  \n\nFinal answer: [B]", "fact_gen_query": "\n    nQuestion:\nA 39-year-old man presents to the emergency department because of progressively worsening chest pain and nausea that started at a local bar 30 minutes prior. The pain radiates to the epigastric area. He has a 5-year history of untreated hypertension. He has smoked 1 pack of cigarettes daily for the past 5 years and started abusing cocaine 2 weeks before his emergency room visit. The patient is diaphoretic and in marked distress. What should be the first step in management?\n\n Option:\nDiltiazem;\nLabetalol;\nPropranolol;\nReassurance and continuous monitoring;\n\n\n Answer:\nReassurance and continuous monitoring\n For this QA example, you need to give netural fact info for each\n    option according to question context, so that later user can infer out the \n    correct answer from these facts. The template of facts is [option1_name:fact| option2_name:fact|...],e.g: [Ampicillin:High resistance, not first-line. | Ceftriaxone:Overkill (for pyelonephritis/severe UTI).]\n", "hinted_gen_query": "\n    Question:\nA 39-year-old man presents to the emergency department because of progressively worsening chest pain and nausea that started at a local bar 30 minutes prior. The pain radiates to the epigastric area. He has a 5-year history of untreated hypertension. He has smoked 1 pack of cigarettes daily for the past 5 years and started abusing cocaine 2 weeks before his emergency room visit. The patient is diaphoretic and in marked distress. What should be the first step in management?\n\n Option:\nA:Diltiazem;\nB:Labetalol;\nC:Propranolol;\nD:Reassurance and continuous monitoring;\n \n\n Hint:\nNone \n\n Answer:\n"}
{"question": "A 68-year-old male comes to the physician for evaluation of right flank pain. He has a history of diabetes and peripheral artery disease. His blood pressure is 160/90 mm Hg. Physical examination shows abdominal tenderness and right flank tenderness. An ultrasound shows dilation of the right ureter and renal pelvis. Which of the following is the most likely underlying cause of this patient's condition?", "answer": "Common iliac artery aneurysm", "options": {"A": "Renal artery stenosis", "B": "Benign prostatic hyperplasia", "C": "Common iliac artery aneurysm", "D": "Urethral stricture"}, "meta_info": "step1", "answer_idx": "C", "metamap_phrases": ["68 year old male", "physician", "evaluation", "right flank pain", "history", "diabetes", "peripheral artery disease", "blood pressure", "90 mm Hg", "Physical examination shows abdominal tenderness", "right", "ultrasound shows dilation of", "right ureter", "renal pelvis", "following", "most likely underlying cause", "patient's condition"], "model_answer": "The patient presents with right flank pain, abdominal tenderness, and ultrasound findings of right ureteral and renal pelvis dilation, which are indicative of hydronephrosis. Given his history of peripheral artery disease and the presence of an elevated blood pressure, the most likely underlying cause is compression of the ureter by a vascular structure, such as a common iliac artery aneurysm. \n\nBenign prostatic hyperplasia (BPH) and urethral stricture typically cause lower urinary tract symptoms and bilateral hydronephrosis if obstruction occurs. Renal artery stenosis would not directly cause hydronephrosis. \n\nThe most likely underlying cause of this patient's condition is [C:Common iliac artery aneurysm].", "fact_gen_query": "\n    nQuestion:\nA 68-year-old male comes to the physician for evaluation of right flank pain. He has a history of diabetes and peripheral artery disease. His blood pressure is 160/90 mm Hg. Physical examination shows abdominal tenderness and right flank tenderness. An ultrasound shows dilation of the right ureter and renal pelvis. Which of the following is the most likely underlying cause of this patient's condition?\n\n Option:\nRenal artery stenosis;\nBenign prostatic hyperplasia;\nCommon iliac artery aneurysm;\nUrethral stricture;\n\n\n Answer:\nCommon iliac artery aneurysm\n For this QA example, you need to give netural fact info for each\n    option according to question context, so that later user can infer out the \n    correct answer from these facts. The template of facts is [option1_name:fact| option2_name:fact|...],e.g: [Ampicillin:High resistance, not first-line. | Ceftriaxone:Overkill (for pyelonephritis/severe UTI).]\n", "hinted_gen_query": "\n    Question:\nA 68-year-old male comes to the physician for evaluation of right flank pain. He has a history of diabetes and peripheral artery disease. His blood pressure is 160/90 mm Hg. Physical examination shows abdominal tenderness and right flank tenderness. An ultrasound shows dilation of the right ureter and renal pelvis. Which of the following is the most likely underlying cause of this patient's condition?\n\n Option:\nA:Renal artery stenosis;\nB:Benign prostatic hyperplasia;\nC:Common iliac artery aneurysm;\nD:Urethral stricture;\n \n\n Hint:\nNone \n\n Answer:\n"}
{"question": "A 65-year-old man is brought to the emergency department 30 minutes after the onset of acute chest pain. He has hypertension and asthma. Current medications include atorvastatin, lisinopril, and an albuterol inhaler. He appears pale and diaphoretic. His pulse is 114/min and blood pressure is 130/88 mm Hg. An ECG shows ST-segment depressions in leads II, III, and aVF. Laboratory studies show an increased serum troponin T concentration. The patient is treated for acute coronary syndrome and undergoes percutaneous transluminal coronary angioplasty. At the time of discharge, echocardiography shows a left ventricular ejection fraction of 58%. In addition to aspirin, which of the following drugs should be added to this patient's medication regimen?", "answer": "Clopidogrel", "options": {"A": "Nifedipine", "B": "Enoxaparin", "C": "Clopidogrel", "D": "Spironolactone"}, "meta_info": "step2&3", "answer_idx": "C", "metamap_phrases": ["65 year old man", "brought", "emergency department 30 minutes", "onset of acute", "hypertension", "asthma", "Current medications include atorvastatin", "lisinopril", "albuterol inhaler", "appears pale", "diaphoretic", "pulse", "min", "blood pressure", "88 mm Hg", "ECG shows ST-segment depressions", "leads", "III", "aVF", "Laboratory studies show", "increased serum troponin T concentration", "patient", "treated", "acute coronary syndrome", "percutaneous transluminal coronary angioplasty", "time", "discharge", "echocardiography shows", "left ventricular ejection fraction of 58", "aspirin", "following drugs", "added", "patient's medication regimen"], "model_answer": "The patient has been diagnosed with acute coronary syndrome (ACS) and underwent percutaneous coronary intervention (PCI). In addition to aspirin, dual antiplatelet therapy (DAPT) is recommended to prevent stent thrombosis and recurrent ischemic events. Clopidogrel is a P2Y12 inhibitor that is commonly used in combination with aspirin for this purpose.\n\n- Nifedipine (A) is a calcium channel blocker and is not typically indicated for secondary prevention post-ACS unless there is a specific indication like vasospastic angina.\n- Enoxaparin (B) is a low-molecular-weight heparin used for acute management of ACS but is not continued long-term post-PCI.\n- Spironolactone (D) is an aldosterone antagonist used in heart failure with reduced ejection fraction, which this patient does not have (LVEF is 58%).\n\nThe correct answer is [C].", "fact_gen_query": "\n    nQuestion:\nA 65-year-old man is brought to the emergency department 30 minutes after the onset of acute chest pain. He has hypertension and asthma. Current medications include atorvastatin, lisinopril, and an albuterol inhaler. He appears pale and diaphoretic. His pulse is 114/min and blood pressure is 130/88 mm Hg. An ECG shows ST-segment depressions in leads II, III, and aVF. Laboratory studies show an increased serum troponin T concentration. The patient is treated for acute coronary syndrome and undergoes percutaneous transluminal coronary angioplasty. At the time of discharge, echocardiography shows a left ventricular ejection fraction of 58%. In addition to aspirin, which of the following drugs should be added to this patient's medication regimen?\n\n Option:\nNifedipine;\nEnoxaparin;\nClopidogrel;\nSpironolactone;\n\n\n Answer:\nClopidogrel\n For this QA example, you need to give netural fact info for each\n    option according to question context, so that later user can infer out the \n    correct answer from these facts. The template of facts is [option1_name:fact| option2_name:fact|...],e.g: [Ampicillin:High resistance, not first-line. | Ceftriaxone:Overkill (for pyelonephritis/severe UTI).]\n", "hinted_gen_query": "\n    Question:\nA 65-year-old man is brought to the emergency department 30 minutes after the onset of acute chest pain. He has hypertension and asthma. Current medications include atorvastatin, lisinopril, and an albuterol inhaler. He appears pale and diaphoretic. His pulse is 114/min and blood pressure is 130/88 mm Hg. An ECG shows ST-segment depressions in leads II, III, and aVF. Laboratory studies show an increased serum troponin T concentration. The patient is treated for acute coronary syndrome and undergoes percutaneous transluminal coronary angioplasty. At the time of discharge, echocardiography shows a left ventricular ejection fraction of 58%. In addition to aspirin, which of the following drugs should be added to this patient's medication regimen?\n\n Option:\nA:Nifedipine;\nB:Enoxaparin;\nC:Clopidogrel;\nD:Spironolactone;\n \n\n Hint:\nNone \n\n Answer:\n"}
{"question": "A 37-year-old-woman presents to her primary care physician requesting a new form of birth control. She has been utilizing oral contraceptive pills (OCPs) for the past 8 years, but asks to switch to an intrauterine device (IUD). Her vital signs are: blood pressure 118/78 mm Hg, pulse 73/min and respiratory rate 16/min. She is afebrile. Physical examination is within normal limits. Which of the following past medical history statements would make copper IUD placement contraindicated in this patient?", "answer": "Active or recurrent pelvic inflammatory disease (PID)", "options": {"A": "A history of stroke or venous thromboembolism", "B": "Active or recurrent pelvic inflammatory disease (PID)", "C": "Past medical history of breast cancer", "D": "Known liver neoplasm"}, "meta_info": "step2&3", "answer_idx": "B", "metamap_phrases": ["year old woman presents", "primary care physician requesting", "new form", "birth control", "oral contraceptive pills", "past", "years", "to switch", "intrauterine device", "vital signs", "blood pressure", "mm Hg", "pulse", "min", "respiratory rate", "min", "afebrile", "Physical examination", "normal limits", "of", "following past medical statements", "make copper IUD placement contraindicated", "patient"], "model_answer": "The correct answer is [B:Active or recurrent pelvic inflammatory disease (PID)]. \n\nHere's the reasoning:\n- Copper IUDs are contraindicated in patients with active or recurrent PID due to the risk of exacerbating the infection or causing further complications.\n- Option A (history of stroke or venous thromboembolism) is not a contraindication for copper IUD placement, as the copper IUD does not contain hormones and does not increase the risk of thromboembolic events.\n- Option C (past medical history of breast cancer) is not a contraindication for copper IUD placement, as the copper IUD is hormone-free and does not affect breast cancer risk or progression.\n- Option D (known liver neoplasm) is not a contraindication for copper IUD placement, as the copper IUD does not affect liver function or neoplasm progression. \n\nThus, the only contraindication among the options provided is active or recurrent PID. \n\nFinal answer: [B]", "fact_gen_query": "\n    nQuestion:\nA 37-year-old-woman presents to her primary care physician requesting a new form of birth control. She has been utilizing oral contraceptive pills (OCPs) for the past 8 years, but asks to switch to an intrauterine device (IUD). Her vital signs are: blood pressure 118/78 mm Hg, pulse 73/min and respiratory rate 16/min. She is afebrile. Physical examination is within normal limits. Which of the following past medical history statements would make copper IUD placement contraindicated in this patient?\n\n Option:\nA history of stroke or venous thromboembolism;\nActive or recurrent pelvic inflammatory disease (PID);\nPast medical history of breast cancer;\nKnown liver neoplasm;\n\n\n Answer:\nActive or recurrent pelvic inflammatory disease (PID)\n For this QA example, you need to give netural fact info for each\n    option according to question context, so that later user can infer out the \n    correct answer from these facts. The template of facts is [option1_name:fact| option2_name:fact|...],e.g: [Ampicillin:High resistance, not first-line. | Ceftriaxone:Overkill (for pyelonephritis/severe UTI).]\n", "hinted_gen_query": "\n    Question:\nA 37-year-old-woman presents to her primary care physician requesting a new form of birth control. She has been utilizing oral contraceptive pills (OCPs) for the past 8 years, but asks to switch to an intrauterine device (IUD). Her vital signs are: blood pressure 118/78 mm Hg, pulse 73/min and respiratory rate 16/min. She is afebrile. Physical examination is within normal limits. Which of the following past medical history statements would make copper IUD placement contraindicated in this patient?\n\n Option:\nA:A history of stroke or venous thromboembolism;\nB:Active or recurrent pelvic inflammatory disease (PID);\nC:Past medical history of breast cancer;\nD:Known liver neoplasm;\n \n\n Hint:\nNone \n\n Answer:\n"}
{"question": "A 23-year-old woman comes to the physician because she is embarrassed about the appearance of her nails. She has no history of serious illness and takes no medications. She appears well. A photograph of the nails is shown. Which of the following additional findings is most likely in this patient?", "answer": "Silvery plaques on extensor surfaces", "options": {"A": "Silvery plaques on extensor surfaces", "B": "Flesh-colored papules in the lumbosacral region", "C": "Erosions of the dental enamel", "D": "Holosystolic murmur at the left lower sternal border"}, "meta_info": "step1", "answer_idx": "A", "metamap_phrases": ["23 year old woman", "physician", "embarrassed", "appearance of", "nails", "history", "serious illness", "takes", "medications", "appears well", "photograph", "nails", "shown", "following additional findings", "most likely", "patient"], "model_answer": "The patient's description and presentation suggest a condition affecting the nails, likely related to a systemic or dermatologic issue. Given the options:\n\nA: Silvery plaques on extensor surfaces - This is characteristic of psoriasis, which can also cause nail pitting or dystrophy.  \nB: Flesh-colored papules in the lumbosacral region - This could suggest neurofibromatosis or other skin conditions, but it is less directly related to nail changes.  \nC: Erosions of the dental enamel - This is associated with bulimia or gastroesophageal reflux, not typically nail abnormalities.  \nD: Holosystolic murmur at the left lower sternal border - This would suggest a cardiac issue like a ventricular septal defect, unrelated to nail changes.  \n\nThe most likely additional finding in this patient is **A: Silvery plaques on extensor surfaces**, as psoriasis commonly causes both nail dystrophy and skin plaques.  \n\n[A]", "fact_gen_query": "\n    nQuestion:\nA 23-year-old woman comes to the physician because she is embarrassed about the appearance of her nails. She has no history of serious illness and takes no medications. She appears well. A photograph of the nails is shown. Which of the following additional findings is most likely in this patient?\n\n Option:\nSilvery plaques on extensor surfaces;\nFlesh-colored papules in the lumbosacral region;\nErosions of the dental enamel;\nHolosystolic murmur at the left lower sternal border;\n\n\n Answer:\nSilvery plaques on extensor surfaces\n For this QA example, you need to give netural fact info for each\n    option according to question context, so that later user can infer out the \n    correct answer from these facts. The template of facts is [option1_name:fact| option2_name:fact|...],e.g: [Ampicillin:High resistance, not first-line. | Ceftriaxone:Overkill (for pyelonephritis/severe UTI).]\n", "hinted_gen_query": "\n    Question:\nA 23-year-old woman comes to the physician because she is embarrassed about the appearance of her nails. She has no history of serious illness and takes no medications. She appears well. A photograph of the nails is shown. Which of the following additional findings is most likely in this patient?\n\n Option:\nA:Silvery plaques on extensor surfaces;\nB:Flesh-colored papules in the lumbosacral region;\nC:Erosions of the dental enamel;\nD:Holosystolic murmur at the left lower sternal border;\n \n\n Hint:\nNone \n\n Answer:\n"}
{"question": "A 24-year-old G2P1 woman at 39 weeks’ gestation presents to the emergency department complaining of painful contractions occurring every 10 minutes for the past 2 hours, consistent with latent labor. She says she has not experienced vaginal discharge, bleeding, or fluid leakage, and is currently taking no medications. On physical examination, her blood pressure is 110/70 mm Hg, heart rate is 86/min, and temperature is 37.6°C (99.7°F). She has had little prenatal care and uses condoms inconsistently. Her sexually transmitted infections status is unknown. As part of the patient’s workup, she undergoes a series of rapid screening tests that result in the administration of zidovudine during delivery. The infant is also given zidovudine to reduce the risk of transmission. A confirmatory test is then performed in the mother to confirm the diagnosis of HIV. Which of the following is most true about the confirmatory test?", "answer": "It is an HIV-1/HIV2 antibody differentiation immunoassay", "options": {"A": "It is a Southwestern blot, identifying the presence of DNA-binding proteins", "B": "It is a Northern blot, identifying the presence of RNA", "C": "It is a Northern blot, identifying the presence of DNA", "D": "It is an HIV-1/HIV2 antibody differentiation immunoassay"}, "meta_info": "step1", "answer_idx": "D", "metamap_phrases": ["year old", "woman", "weeks presents", "emergency department", "painful contractions occurring", "10", "past", "hours", "consistent with latent labor", "not experienced vaginal discharge", "bleeding", "fluid leakage", "currently taking", "medications", "physical examination", "blood pressure", "70 mm Hg", "heart rate", "min", "temperature", "99", "little prenatal care", "uses condoms", "sexually transmitted infections status", "unknown", "part of", "patients workup", "series", "rapid screening tests", "result", "administration", "zidovudine", "delivery", "infant", "zidovudine to", "risk", "transmission", "confirmatory test", "then performed", "mother to confirm", "diagnosis", "HIV", "following", "most true", "confirmatory test"], "model_answer": "The confirmatory test for HIV diagnosis typically involves an HIV-1/HIV-2 antibody differentiation immunoassay, which distinguishes between antibodies to HIV-1 and HIV-2. This is the standard confirmatory test following a positive rapid screening test for HIV.\n\nThe correct answer is [D].", "fact_gen_query": "\n    nQuestion:\nA 24-year-old G2P1 woman at 39 weeks’ gestation presents to the emergency department complaining of painful contractions occurring every 10 minutes for the past 2 hours, consistent with latent labor. She says she has not experienced vaginal discharge, bleeding, or fluid leakage, and is currently taking no medications. On physical examination, her blood pressure is 110/70 mm Hg, heart rate is 86/min, and temperature is 37.6°C (99.7°F). She has had little prenatal care and uses condoms inconsistently. Her sexually transmitted infections status is unknown. As part of the patient’s workup, she undergoes a series of rapid screening tests that result in the administration of zidovudine during delivery. The infant is also given zidovudine to reduce the risk of transmission. A confirmatory test is then performed in the mother to confirm the diagnosis of HIV. Which of the following is most true about the confirmatory test?\n\n Option:\nIt is a Southwestern blot, identifying the presence of DNA-binding proteins;\nIt is a Northern blot, identifying the presence of RNA;\nIt is a Northern blot, identifying the presence of DNA;\nIt is an HIV-1/HIV2 antibody differentiation immunoassay;\n\n\n Answer:\nIt is an HIV-1/HIV2 antibody differentiation immunoassay\n For this QA example, you need to give netural fact info for each\n    option according to question context, so that later user can infer out the \n    correct answer from these facts. The template of facts is [option1_name:fact| option2_name:fact|...],e.g: [Ampicillin:High resistance, not first-line. | Ceftriaxone:Overkill (for pyelonephritis/severe UTI).]\n", "hinted_gen_query": "\n    Question:\nA 24-year-old G2P1 woman at 39 weeks’ gestation presents to the emergency department complaining of painful contractions occurring every 10 minutes for the past 2 hours, consistent with latent labor. She says she has not experienced vaginal discharge, bleeding, or fluid leakage, and is currently taking no medications. On physical examination, her blood pressure is 110/70 mm Hg, heart rate is 86/min, and temperature is 37.6°C (99.7°F). She has had little prenatal care and uses condoms inconsistently. Her sexually transmitted infections status is unknown. As part of the patient’s workup, she undergoes a series of rapid screening tests that result in the administration of zidovudine during delivery. The infant is also given zidovudine to reduce the risk of transmission. A confirmatory test is then performed in the mother to confirm the diagnosis of HIV. Which of the following is most true about the confirmatory test?\n\n Option:\nA:It is a Southwestern blot, identifying the presence of DNA-binding proteins;\nB:It is a Northern blot, identifying the presence of RNA;\nC:It is a Northern blot, identifying the presence of DNA;\nD:It is an HIV-1/HIV2 antibody differentiation immunoassay;\n \n\n Hint:\nNone \n\n Answer:\n"}
{"question": "A 72-year-old man comes to the physician because of a 2-month history of fatigue and worsening abdominal pain. During this period, he also has excessive night sweats and shortness of breath on exertion. Over the past 3 months, he has had a 5.6-kg (12-lb) weight loss. He had a myocardial infarction 3 years ago. He has hypertension, diabetes mellitus, and chronic bronchitis. His medications include insulin, aspirin, lisinopril, and an albuterol inhaler. He has smoked half a pack of cigarettes for the past 45 years. Vital signs are within normal limits. The spleen is palpated 6 cm below the left costal margin. Laboratory studies show:\nHemoglobin 6.4 g/dL\nMean corpuscular volume 85 μm3\nLeukocyte count 5,200/mm3\nPlatelet count 96,000/mm3\nA blood smear is shown. Bone marrow aspiration shows extensive fibrosis and a few scattered plasma cells. A JAK 2 assay is positive. Which of the following is the most appropriate next step in management?\"", "answer": "Ruxolitinib", "options": {"A": "Cladribine", "B": "Prednisone", "C": "Imatinib", "D": "Ruxolitinib"}, "meta_info": "step2&3", "answer_idx": "D", "metamap_phrases": ["72 year old man", "physician", "2 month history", "fatigue", "worsening abdominal pain", "period", "excessive night sweats", "shortness of breath", "exertion", "past 3 months", "5.6 kg", "weight loss", "myocardial infarction", "years", "hypertension", "diabetes mellitus", "chronic bronchitis", "medications include insulin", "aspirin", "lisinopril", "albuterol inhaler", "smoked half", "pack", "cigarettes", "past", "years", "Vital signs", "normal limits", "spleen", "palpated", "cm", "left costal margin", "Laboratory studies show", "Hemoglobin", "g Mean corpuscular volume 85 m3 Leukocyte count", "200 mm3 Platelet count 96", "blood smear", "shown", "Bone marrow aspiration shows extensive fibrosis", "few scattered plasma cells", "JAK 2 assay", "positive", "following", "most appropriate next step", "management"], "model_answer": "The patient's presentation is concerning for myelofibrosis, given his fatigue, abdominal pain (likely due to splenomegaly), night sweats, weight loss, and laboratory findings of anemia, thrombocytopenia, and leukopenia. The bone marrow findings of extensive fibrosis and positive JAK2 assay further support this diagnosis. \n\nThe most appropriate next step in management for myelofibrosis with a positive JAK2 mutation is **Ruxolitinib**, a JAK2 inhibitor. This medication is specifically indicated for myelofibrosis and helps alleviate symptoms such as splenomegaly and constitutional symptoms.\n\nThe other options are not appropriate:\n- **Cladribine** is used for hairy cell leukemia.\n- **Prednisone** is not a treatment for myelofibrosis.\n- **Imatinib** is used for chronic myeloid leukemia (CML).\n\n[D]", "fact_gen_query": "\n    nQuestion:\nA 72-year-old man comes to the physician because of a 2-month history of fatigue and worsening abdominal pain. During this period, he also has excessive night sweats and shortness of breath on exertion. Over the past 3 months, he has had a 5.6-kg (12-lb) weight loss. He had a myocardial infarction 3 years ago. He has hypertension, diabetes mellitus, and chronic bronchitis. His medications include insulin, aspirin, lisinopril, and an albuterol inhaler. He has smoked half a pack of cigarettes for the past 45 years. Vital signs are within normal limits. The spleen is palpated 6 cm below the left costal margin. Laboratory studies show:\nHemoglobin 6.4 g/dL\nMean corpuscular volume 85 μm3\nLeukocyte count 5,200/mm3\nPlatelet count 96,000/mm3\nA blood smear is shown. Bone marrow aspiration shows extensive fibrosis and a few scattered plasma cells. A JAK 2 assay is positive. Which of the following is the most appropriate next step in management?\"\n\n Option:\nCladribine;\nPrednisone;\nImatinib;\nRuxolitinib;\n\n\n Answer:\nRuxolitinib\n For this QA example, you need to give netural fact info for each\n    option according to question context, so that later user can infer out the \n    correct answer from these facts. The template of facts is [option1_name:fact| option2_name:fact|...],e.g: [Ampicillin:High resistance, not first-line. | Ceftriaxone:Overkill (for pyelonephritis/severe UTI).]\n", "hinted_gen_query": "\n    Question:\nA 72-year-old man comes to the physician because of a 2-month history of fatigue and worsening abdominal pain. During this period, he also has excessive night sweats and shortness of breath on exertion. Over the past 3 months, he has had a 5.6-kg (12-lb) weight loss. He had a myocardial infarction 3 years ago. He has hypertension, diabetes mellitus, and chronic bronchitis. His medications include insulin, aspirin, lisinopril, and an albuterol inhaler. He has smoked half a pack of cigarettes for the past 45 years. Vital signs are within normal limits. The spleen is palpated 6 cm below the left costal margin. Laboratory studies show:\nHemoglobin 6.4 g/dL\nMean corpuscular volume 85 μm3\nLeukocyte count 5,200/mm3\nPlatelet count 96,000/mm3\nA blood smear is shown. Bone marrow aspiration shows extensive fibrosis and a few scattered plasma cells. A JAK 2 assay is positive. Which of the following is the most appropriate next step in management?\"\n\n Option:\nA:Cladribine;\nB:Prednisone;\nC:Imatinib;\nD:Ruxolitinib;\n \n\n Hint:\nNone \n\n Answer:\n"}
{"question": "A 20-year-old man comes to the physician because of worsening gait unsteadiness and bilateral hearing loss for 1 month. He has had intermittent tingling sensations on both cheeks over this time period. He has no history of serious medical illness and takes no medications. Audiometry shows bilateral sensorineural hearing loss. Genetic evaluation shows a mutation of a tumor suppressor gene on chromosome 22 that encodes merlin. This patient is at increased risk for which of the following conditions?", "answer": "Meningioma", "options": {"A": "Renal cell carcinoma", "B": "Meningioma", "C": "Astrocytoma", "D": "Vascular malformations"}, "meta_info": "step1", "answer_idx": "B", "metamap_phrases": ["20 year old man", "physician", "worsening gait unsteadiness", "bilateral hearing loss", "month", "intermittent tingling sensations", "cheeks", "time period", "history of serious medical illness", "takes", "medications", "Audiometry shows bilateral sensorineural hearing loss", "Genetic evaluation shows", "mutation", "tumor suppressor gene", "chromosome 22", "encodes merlin", "patient", "increased risk", "following conditions"], "model_answer": "The patient's symptoms (bilateral hearing loss, gait unsteadiness, and facial tingling) along with the genetic mutation of a tumor suppressor gene on chromosome 22 that encodes merlin are classic for neurofibromatosis type 2 (NF2). NF2 is associated with an increased risk of developing certain tumors, particularly vestibular schwannomas (acoustic neuromas), meningiomas, and other schwannomas. \n\nThe correct answer is:\n\n[B:Meningioma]", "fact_gen_query": "\n    nQuestion:\nA 20-year-old man comes to the physician because of worsening gait unsteadiness and bilateral hearing loss for 1 month. He has had intermittent tingling sensations on both cheeks over this time period. He has no history of serious medical illness and takes no medications. Audiometry shows bilateral sensorineural hearing loss. Genetic evaluation shows a mutation of a tumor suppressor gene on chromosome 22 that encodes merlin. This patient is at increased risk for which of the following conditions?\n\n Option:\nRenal cell carcinoma;\nMeningioma;\nAstrocytoma;\nVascular malformations;\n\n\n Answer:\nMeningioma\n For this QA example, you need to give netural fact info for each\n    option according to question context, so that later user can infer out the \n    correct answer from these facts. The template of facts is [option1_name:fact| option2_name:fact|...],e.g: [Ampicillin:High resistance, not first-line. | Ceftriaxone:Overkill (for pyelonephritis/severe UTI).]\n", "hinted_gen_query": "\n    Question:\nA 20-year-old man comes to the physician because of worsening gait unsteadiness and bilateral hearing loss for 1 month. He has had intermittent tingling sensations on both cheeks over this time period. He has no history of serious medical illness and takes no medications. Audiometry shows bilateral sensorineural hearing loss. Genetic evaluation shows a mutation of a tumor suppressor gene on chromosome 22 that encodes merlin. This patient is at increased risk for which of the following conditions?\n\n Option:\nA:Renal cell carcinoma;\nB:Meningioma;\nC:Astrocytoma;\nD:Vascular malformations;\n \n\n Hint:\nNone \n\n Answer:\n"}
{"question": "A 47-year-old executive schedules an appointment his physician for a routine medical check-up. He currently has no complaints and claims to be “as fit as a fiddle.” The physical examination findings are unremarkable, except for a mid-systolic murmur heard in the 2nd left intercostal space that radiates to the carotids on auscultation. The physician instructs the patient to stand from a supine position with the stethoscope still placed on his chest. Which of the following changes would occur with this maneuver?", "answer": "A reduction in diastolic filling time", "options": {"A": "An increase in right atrial pressure", "B": "An increase in pulmonary capillary wedge pressure", "C": "A reduction in the slope of the pacemaker potential", "D": "A reduction in diastolic filling time"}, "meta_info": "step1", "answer_idx": "D", "metamap_phrases": ["year old executive schedules", "appointment", "physician", "routine medical check-up", "currently", "complaints", "to", "fit", "physical examination findings", "unremarkable", "except for", "systolic murmur heard", "2nd left intercostal space", "radiates", "carotids", "auscultation", "physician", "patient to stand", "supine position", "stethoscope", "placed", "chest", "following changes", "occur"], "model_answer": "The described murmur is characteristic of aortic stenosis, which is a mid-systolic murmur heard in the 2nd left intercostal space radiating to the carotids. When the patient stands from a supine position, venous return decreases due to gravity, leading to a reduction in preload. This results in a decrease in stroke volume and a reduction in the intensity of the murmur. \n\nNow let's evaluate the options:\n- **A: An increase in right atrial pressure** - Incorrect. Standing decreases venous return, which would decrease right atrial pressure.\n- **B: An increase in pulmonary capillary wedge pressure** - Incorrect. Standing decreases venous return and thus decreases pulmonary capillary wedge pressure.\n- **C: A reduction in the slope of the pacemaker potential** - Incorrect. This is unrelated to the maneuver and the condition described.\n- **D: A reduction in diastolic filling time** - Correct. Standing decreases venous return, leading to reduced ventricular filling and thus a reduction in diastolic filling time.\n\nThe correct answer is [D].", "fact_gen_query": "\n    nQuestion:\nA 47-year-old executive schedules an appointment his physician for a routine medical check-up. He currently has no complaints and claims to be “as fit as a fiddle.” The physical examination findings are unremarkable, except for a mid-systolic murmur heard in the 2nd left intercostal space that radiates to the carotids on auscultation. The physician instructs the patient to stand from a supine position with the stethoscope still placed on his chest. Which of the following changes would occur with this maneuver?\n\n Option:\nAn increase in right atrial pressure;\nAn increase in pulmonary capillary wedge pressure;\nA reduction in the slope of the pacemaker potential;\nA reduction in diastolic filling time;\n\n\n Answer:\nA reduction in diastolic filling time\n For this QA example, you need to give netural fact info for each\n    option according to question context, so that later user can infer out the \n    correct answer from these facts. The template of facts is [option1_name:fact| option2_name:fact|...],e.g: [Ampicillin:High resistance, not first-line. | Ceftriaxone:Overkill (for pyelonephritis/severe UTI).]\n", "hinted_gen_query": "\n    Question:\nA 47-year-old executive schedules an appointment his physician for a routine medical check-up. He currently has no complaints and claims to be “as fit as a fiddle.” The physical examination findings are unremarkable, except for a mid-systolic murmur heard in the 2nd left intercostal space that radiates to the carotids on auscultation. The physician instructs the patient to stand from a supine position with the stethoscope still placed on his chest. Which of the following changes would occur with this maneuver?\n\n Option:\nA:An increase in right atrial pressure;\nB:An increase in pulmonary capillary wedge pressure;\nC:A reduction in the slope of the pacemaker potential;\nD:A reduction in diastolic filling time;\n \n\n Hint:\nNone \n\n Answer:\n"}
{"question": "A microbiologist is studying the emergence of a virulent strain of the virus. After a detailed study of the virus and its life cycle, he proposes a theory: Initially, a host cell is co-infected with 2 viruses from the same virus family. Within the host cell, concomitant production of various genome segments from both viruses occurs. Ultimately, the different genome segments from the viruses are packaged into a unique and novel virus particle. The newly formed virus particle is both stable and viable and is a new strain from the virus family that caused the outbreak of infection. Which of the following viruses is capable of undergoing the above-mentioned process?", "answer": "Rotavirus", "options": {"A": "Epstein-Barr virus", "B": "Human immunodeficiency virus", "C": "Rotavirus", "D": "Vaccinia virus"}, "meta_info": "step1", "answer_idx": "C", "metamap_phrases": ["microbiologist", "studying", "emergence", "virulent strain", "virus", "detailed study", "virus", "life cycle", "theory", "Initially", "host cell", "co infected", "viruses", "same virus family", "host cell", "concomitant production", "various genome segments", "viruses occurs", "different genome segments", "viruses", "packaged", "unique", "novel virus particle", "newly formed virus particle", "stable", "viable", "new strain", "virus family", "caused", "outbreak", "infection", "following viruses", "capable", "process"], "model_answer": "The process described in the question is known as **reassortment**, which is a form of genetic recombination that occurs in viruses with segmented genomes. This process involves the mixing of genome segments from two different viruses co-infecting the same host cell, resulting in a new, viable virus strain. \n\nAmong the options provided:\n- **Epstein-Barr virus (A)** and **Human immunodeficiency virus (B)** have non-segmented genomes, so they cannot undergo reassortment.\n- **Vaccinia virus (D)** is a poxvirus with a linear, double-stranded DNA genome, which is also non-segmented.\n- **Rotavirus (C)** has a segmented genome (11 segments of double-stranded RNA), making it capable of reassortment.\n\nThus, the correct answer is [C].", "fact_gen_query": "\n    nQuestion:\nA microbiologist is studying the emergence of a virulent strain of the virus. After a detailed study of the virus and its life cycle, he proposes a theory: Initially, a host cell is co-infected with 2 viruses from the same virus family. Within the host cell, concomitant production of various genome segments from both viruses occurs. Ultimately, the different genome segments from the viruses are packaged into a unique and novel virus particle. The newly formed virus particle is both stable and viable and is a new strain from the virus family that caused the outbreak of infection. Which of the following viruses is capable of undergoing the above-mentioned process?\n\n Option:\nEpstein-Barr virus;\nHuman immunodeficiency virus;\nRotavirus;\nVaccinia virus;\n\n\n Answer:\nRotavirus\n For this QA example, you need to give netural fact info for each\n    option according to question context, so that later user can infer out the \n    correct answer from these facts. The template of facts is [option1_name:fact| option2_name:fact|...],e.g: [Ampicillin:High resistance, not first-line. | Ceftriaxone:Overkill (for pyelonephritis/severe UTI).]\n", "hinted_gen_query": "\n    Question:\nA microbiologist is studying the emergence of a virulent strain of the virus. After a detailed study of the virus and its life cycle, he proposes a theory: Initially, a host cell is co-infected with 2 viruses from the same virus family. Within the host cell, concomitant production of various genome segments from both viruses occurs. Ultimately, the different genome segments from the viruses are packaged into a unique and novel virus particle. The newly formed virus particle is both stable and viable and is a new strain from the virus family that caused the outbreak of infection. Which of the following viruses is capable of undergoing the above-mentioned process?\n\n Option:\nA:Epstein-Barr virus;\nB:Human immunodeficiency virus;\nC:Rotavirus;\nD:Vaccinia virus;\n \n\n Hint:\nNone \n\n Answer:\n"}
{"question": "A 59-year-old overweight woman presents to the urgent care clinic with the complaint of severe abdominal pain for the past 2 hours. She also complains of a dull pain in her back with nausea and vomiting several times. Her pain has no relation with food. Her past medical history is significant for recurrent abdominal pain due to cholelithiasis. Her father died at the age of 60 with some form of abdominal cancer. Her temperature is 37°C (98.6°F), respirations are 15/min, pulse is 67/min, and blood pressure is 122/98 mm Hg. Physical exam is unremarkable. However, a CT scan of the abdomen shows a calcified mass near her gallbladder. Which of the following diagnoses should be excluded first in this patient?", "answer": "Gallbladder cancer", "options": {"A": "Acute cholecystitis", "B": "Gallbladder cancer", "C": "Choledocholithiasis", "D": "Pancreatitis"}, "meta_info": "step2&3", "answer_idx": "B", "metamap_phrases": ["59 year old overweight woman presents", "urgent care clinic", "complaint", "severe abdominal", "past", "hours", "dull pain", "back", "nausea", "vomiting", "times", "pain", "relation", "food", "past medical history", "significant", "recurrent abdominal pain", "cholelithiasis", "father died", "age", "60", "form", "abdominal cancer", "temperature", "98", "respirations", "min", "pulse", "67 min", "blood pressure", "98 mm Hg", "Physical exam", "unremarkable", "CT scan", "abdomen shows", "calcified mass", "gallbladder", "following diagnoses", "excluded first", "patient"], "model_answer": "The patient's presentation includes severe abdominal pain, back pain, nausea, and vomiting, with a history of cholelithiasis and a family history of abdominal cancer. The CT scan shows a calcified mass near the gallbladder. Given these findings, the most concerning diagnosis to exclude first is **gallbladder cancer**, especially considering her family history and the calcified mass. \n\nWhile acute cholecystitis, choledocholithiasis, and pancreatitis are also possible, malignancy should be ruled out promptly due to its grave implications.\n\n[B]", "fact_gen_query": "\n    nQuestion:\nA 59-year-old overweight woman presents to the urgent care clinic with the complaint of severe abdominal pain for the past 2 hours. She also complains of a dull pain in her back with nausea and vomiting several times. Her pain has no relation with food. Her past medical history is significant for recurrent abdominal pain due to cholelithiasis. Her father died at the age of 60 with some form of abdominal cancer. Her temperature is 37°C (98.6°F), respirations are 15/min, pulse is 67/min, and blood pressure is 122/98 mm Hg. Physical exam is unremarkable. However, a CT scan of the abdomen shows a calcified mass near her gallbladder. Which of the following diagnoses should be excluded first in this patient?\n\n Option:\nAcute cholecystitis;\nGallbladder cancer;\nCholedocholithiasis;\nPancreatitis;\n\n\n Answer:\nGallbladder cancer\n For this QA example, you need to give netural fact info for each\n    option according to question context, so that later user can infer out the \n    correct answer from these facts. The template of facts is [option1_name:fact| option2_name:fact|...],e.g: [Ampicillin:High resistance, not first-line. | Ceftriaxone:Overkill (for pyelonephritis/severe UTI).]\n", "hinted_gen_query": "\n    Question:\nA 59-year-old overweight woman presents to the urgent care clinic with the complaint of severe abdominal pain for the past 2 hours. She also complains of a dull pain in her back with nausea and vomiting several times. Her pain has no relation with food. Her past medical history is significant for recurrent abdominal pain due to cholelithiasis. Her father died at the age of 60 with some form of abdominal cancer. Her temperature is 37°C (98.6°F), respirations are 15/min, pulse is 67/min, and blood pressure is 122/98 mm Hg. Physical exam is unremarkable. However, a CT scan of the abdomen shows a calcified mass near her gallbladder. Which of the following diagnoses should be excluded first in this patient?\n\n Option:\nA:Acute cholecystitis;\nB:Gallbladder cancer;\nC:Choledocholithiasis;\nD:Pancreatitis;\n \n\n Hint:\nNone \n\n Answer:\n"}
{"question": "A 7-year-old boy is brought to his pediatrician’s office for a follow-up visit. He was diagnosed with asthma when he was 3 years old and has since been on treatment for the condition. He is currently on a β-agonist inhaler because of exacerbation of his symptoms. He has observed that his symptoms are more prominent in springtime, especially when the new flowers are blooming. His mother has a backyard garden and whenever he goes out to play there, he experiences chest tightness with associated shortness of breath. He has been advised to take more precaution during this seasonal change and to stay away from pollen. He is also being considered for an experimental therapy, which attenuates the activity of certain mediators which cause his asthmatic attack. The targeted mediator favors the class switching of antibodies. A reduction in this mechanism will eventually reduce the exaggerated response observed during his asthmatic attacks, even when exposed to an allergen. Which of the following mediators is described in this experimental study?", "answer": "IL-4", "options": {"A": "IL-2", "B": "IL-10", "C": "IL-13", "D": "IL-4"}, "meta_info": "step2&3", "answer_idx": "D", "metamap_phrases": ["year old boy", "brought", "pediatricians office", "follow-up visit", "diagnosed", "asthma", "3 years old", "since", "on treatment", "condition", "currently", "agonist inhaler", "exacerbation", "symptoms", "observed", "symptoms", "more prominent", "new flowers", "mother", "backyard garden", "goes out to play", "experiences chest tightness with associated shortness of breath", "to take more precaution", "seasonal change", "to", "pollen", "considered", "experimental therapy", "attenuates", "activity", "certain mediators", "cause", "asthmatic attack", "targeted mediator favors", "class switching", "antibodies", "reduction", "mechanism", "exaggerated response observed", "asthmatic attacks", "exposed", "allergen", "following mediators", "described", "experimental study"], "model_answer": "The mediator described in the experimental study favors the class switching of antibodies, which is a key feature in the pathogenesis of allergic asthma. Among the options provided, **IL-4** is the cytokine that plays a central role in promoting the class switching of B cells to produce IgE, the antibody class involved in allergic responses. \n\nThe correct answer is [D].", "fact_gen_query": "\n    nQuestion:\nA 7-year-old boy is brought to his pediatrician’s office for a follow-up visit. He was diagnosed with asthma when he was 3 years old and has since been on treatment for the condition. He is currently on a β-agonist inhaler because of exacerbation of his symptoms. He has observed that his symptoms are more prominent in springtime, especially when the new flowers are blooming. His mother has a backyard garden and whenever he goes out to play there, he experiences chest tightness with associated shortness of breath. He has been advised to take more precaution during this seasonal change and to stay away from pollen. He is also being considered for an experimental therapy, which attenuates the activity of certain mediators which cause his asthmatic attack. The targeted mediator favors the class switching of antibodies. A reduction in this mechanism will eventually reduce the exaggerated response observed during his asthmatic attacks, even when exposed to an allergen. Which of the following mediators is described in this experimental study?\n\n Option:\nIL-2;\nIL-10;\nIL-13;\nIL-4;\n\n\n Answer:\nIL-4\n For this QA example, you need to give netural fact info for each\n    option according to question context, so that later user can infer out the \n    correct answer from these facts. The template of facts is [option1_name:fact| option2_name:fact|...],e.g: [Ampicillin:High resistance, not first-line. | Ceftriaxone:Overkill (for pyelonephritis/severe UTI).]\n", "hinted_gen_query": "\n    Question:\nA 7-year-old boy is brought to his pediatrician’s office for a follow-up visit. He was diagnosed with asthma when he was 3 years old and has since been on treatment for the condition. He is currently on a β-agonist inhaler because of exacerbation of his symptoms. He has observed that his symptoms are more prominent in springtime, especially when the new flowers are blooming. His mother has a backyard garden and whenever he goes out to play there, he experiences chest tightness with associated shortness of breath. He has been advised to take more precaution during this seasonal change and to stay away from pollen. He is also being considered for an experimental therapy, which attenuates the activity of certain mediators which cause his asthmatic attack. The targeted mediator favors the class switching of antibodies. A reduction in this mechanism will eventually reduce the exaggerated response observed during his asthmatic attacks, even when exposed to an allergen. Which of the following mediators is described in this experimental study?\n\n Option:\nA:IL-2;\nB:IL-10;\nC:IL-13;\nD:IL-4;\n \n\n Hint:\nNone \n\n Answer:\n"}
{"question": "A 3-month-old boy is brought the emergency department by his parents after an episode of cyanosis and muscle hypotonia that resolved after 2 minutes. Diagnostic evaluation fails to discover an exact etiology of the boy's symptoms and the episode is classified as a brief resolved unexplained event (BRUE). The risk profile for BRUE in infants remains largely unknown. The pediatrician who saw the boy in the emergency department is trying to identify risk factors for BRUE. She is aware of several confounders, including age, socioeconomic background, and family history of medical illness. She recruits 75 infants under 1 year of age with BRUE and 75 infants without BRUE of the same age, socioeconomic background, and family history of medical illness. She then compares the two groups with regard to history of feeding problems and history of recent upper respiratory infection. Which of the following methods was conducted to control confounding bias in the study?", "answer": "Matching", "options": {"A": "Blinding", "B": "Restriction", "C": "Randomization", "D": "Matching"}, "meta_info": "step2&3", "answer_idx": "D", "metamap_phrases": ["3 month old boy", "brought", "emergency department", "parents", "episode of cyanosis", "muscle hypotonia", "resolved", "minutes", "Diagnostic evaluation fails to discover", "exact etiology", "boy's symptoms", "episode", "classified", "brief resolved unexplained event", "risk profile", "BRUE", "infants", "unknown", "pediatrician", "saw", "boy", "emergency department", "to", "risk factors", "BRUE", "aware", "including age", "socioeconomic background", "family history of medical illness", "75 infants", "year", "age", "BRUE", "75 infants", "BRUE", "same age", "socioeconomic background", "family history of medical illness", "then compares", "two groups", "history", "feeding problems", "history", "recent upper respiratory infection", "following methods", "conducted to control", "bias", "study"], "model_answer": "The method conducted to control confounding bias in the study is **Matching**. The pediatrician recruited infants without BRUE who were of the same age, socioeconomic background, and family history of medical illness as the infants with BRUE. This ensures that the groups are comparable with respect to these potential confounders.\n\nThe correct answer is [D].", "fact_gen_query": "\n    nQuestion:\nA 3-month-old boy is brought the emergency department by his parents after an episode of cyanosis and muscle hypotonia that resolved after 2 minutes. Diagnostic evaluation fails to discover an exact etiology of the boy's symptoms and the episode is classified as a brief resolved unexplained event (BRUE). The risk profile for BRUE in infants remains largely unknown. The pediatrician who saw the boy in the emergency department is trying to identify risk factors for BRUE. She is aware of several confounders, including age, socioeconomic background, and family history of medical illness. She recruits 75 infants under 1 year of age with BRUE and 75 infants without BRUE of the same age, socioeconomic background, and family history of medical illness. She then compares the two groups with regard to history of feeding problems and history of recent upper respiratory infection. Which of the following methods was conducted to control confounding bias in the study?\n\n Option:\nBlinding;\nRestriction;\nRandomization;\nMatching;\n\n\n Answer:\nMatching\n For this QA example, you need to give netural fact info for each\n    option according to question context, so that later user can infer out the \n    correct answer from these facts. The template of facts is [option1_name:fact| option2_name:fact|...],e.g: [Ampicillin:High resistance, not first-line. | Ceftriaxone:Overkill (for pyelonephritis/severe UTI).]\n", "hinted_gen_query": "\n    Question:\nA 3-month-old boy is brought the emergency department by his parents after an episode of cyanosis and muscle hypotonia that resolved after 2 minutes. Diagnostic evaluation fails to discover an exact etiology of the boy's symptoms and the episode is classified as a brief resolved unexplained event (BRUE). The risk profile for BRUE in infants remains largely unknown. The pediatrician who saw the boy in the emergency department is trying to identify risk factors for BRUE. She is aware of several confounders, including age, socioeconomic background, and family history of medical illness. She recruits 75 infants under 1 year of age with BRUE and 75 infants without BRUE of the same age, socioeconomic background, and family history of medical illness. She then compares the two groups with regard to history of feeding problems and history of recent upper respiratory infection. Which of the following methods was conducted to control confounding bias in the study?\n\n Option:\nA:Blinding;\nB:Restriction;\nC:Randomization;\nD:Matching;\n \n\n Hint:\nNone \n\n Answer:\n"}
{"question": "A 29-year-old man presents to the emergency department due to central chest pain over the past 3 days which is constant and unrelated to exertion. The pain is sharp, severe, increases when lying down, and improves with leaning forward. The pain also radiates to his shoulders and neck. The patient has no past medical history. He has smoked 10 cigarettes per day for the past 7 years and occasionally drinks alcohol. He presents with vital signs: blood pressure 110/70 mm Hg, regular radial pulse of 95/min, and temperature 37.3°C (99.1°F). On physical exam, a scratching sound of to-and-from character is audible over the left sternal border at end-expiration with the patient leaning forward. His chest X-ray is normal and ECG is shown in the picture. Which of the following is the optimal therapy for this patient?", "answer": "Ibuprofen + colchicine +/- omeprazole", "options": {"A": "Indomethacin +/- omeprazole", "B": "Ibuprofen + colchicine +/- omeprazole", "C": "Pericardiocentesis", "D": "Pericardiectomy"}, "meta_info": "step2&3", "answer_idx": "B", "metamap_phrases": ["29 year old man presents", "emergency department due to central chest pain", "past 3 days", "constant", "unrelated", "exertion", "pain", "sharp", "severe", "increases", "lying", "improves", "forward", "pain", "radiates", "shoulders", "neck", "patient", "past medical history", "smoked 10 cigarettes", "day", "past", "years", "occasionally drinks alcohol", "presents", "vital signs", "blood pressure", "70 mm Hg", "regular radial pulse", "95 min", "temperature", "3C", "99", "physical exam", "scratching sound", "character", "left sternal border", "end-expiration", "patient", "forward", "chest X-ray", "normal", "ECG", "shown", "picture", "following", "optimal therapy", "patient"], "model_answer": "The patient's presentation is classic for acute pericarditis, characterized by sharp, severe chest pain that improves with leaning forward and worsens when lying down, along with a pericardial friction rub on physical exam. The ECG findings (not shown but typically diffuse ST elevations or PR depressions) and normal chest X-ray further support this diagnosis. \n\nThe optimal therapy for acute pericarditis is **NSAIDs (e.g., ibuprofen) + colchicine** to reduce inflammation and prevent recurrence, with a proton pump inhibitor (e.g., omeprazole) added for gastric protection if needed. \n\nPericardiocentesis or pericardiectomy are not indicated unless there is evidence of cardiac tamponade or constrictive pericarditis, which are not present here. Indomethacin is less commonly used due to its side effect profile.\n\nThe correct answer is [B].", "fact_gen_query": "\n    nQuestion:\nA 29-year-old man presents to the emergency department due to central chest pain over the past 3 days which is constant and unrelated to exertion. The pain is sharp, severe, increases when lying down, and improves with leaning forward. The pain also radiates to his shoulders and neck. The patient has no past medical history. He has smoked 10 cigarettes per day for the past 7 years and occasionally drinks alcohol. He presents with vital signs: blood pressure 110/70 mm Hg, regular radial pulse of 95/min, and temperature 37.3°C (99.1°F). On physical exam, a scratching sound of to-and-from character is audible over the left sternal border at end-expiration with the patient leaning forward. His chest X-ray is normal and ECG is shown in the picture. Which of the following is the optimal therapy for this patient?\n\n Option:\nIndomethacin +/- omeprazole;\nIbuprofen + colchicine +/- omeprazole;\nPericardiocentesis;\nPericardiectomy;\n\n\n Answer:\nIbuprofen + colchicine +/- omeprazole\n For this QA example, you need to give netural fact info for each\n    option according to question context, so that later user can infer out the \n    correct answer from these facts. The template of facts is [option1_name:fact| option2_name:fact|...],e.g: [Ampicillin:High resistance, not first-line. | Ceftriaxone:Overkill (for pyelonephritis/severe UTI).]\n", "hinted_gen_query": "\n    Question:\nA 29-year-old man presents to the emergency department due to central chest pain over the past 3 days which is constant and unrelated to exertion. The pain is sharp, severe, increases when lying down, and improves with leaning forward. The pain also radiates to his shoulders and neck. The patient has no past medical history. He has smoked 10 cigarettes per day for the past 7 years and occasionally drinks alcohol. He presents with vital signs: blood pressure 110/70 mm Hg, regular radial pulse of 95/min, and temperature 37.3°C (99.1°F). On physical exam, a scratching sound of to-and-from character is audible over the left sternal border at end-expiration with the patient leaning forward. His chest X-ray is normal and ECG is shown in the picture. Which of the following is the optimal therapy for this patient?\n\n Option:\nA:Indomethacin +/- omeprazole;\nB:Ibuprofen + colchicine +/- omeprazole;\nC:Pericardiocentesis;\nD:Pericardiectomy;\n \n\n Hint:\nNone \n\n Answer:\n"}
{"question": "A 46-year-old man is brought to the emergency department for evaluation of altered mental status. He was found on the floor in front of his apartment. He is somnolent but responsive when aroused. His pulse is 64/min, respiratory rate is 15/min, and blood pressure is 120/75 mm Hg. On physical examination, an alcoholic smell and slurred speech are noted. Neurological exam shows diminished deep tendon reflexes bilaterally and an ataxic gait. His pupils are normal. Blood alcohol concentration is 0.04%. An ECG shows no abnormalities. Which of the following is the most likely cause of this patient's symptoms?", "answer": "Benzodiazepine intoxication\n\"", "options": {"A": "Hypoglycemia", "B": "Ethanol intoxication", "C": "Cannabis intoxication", "D": "Benzodiazepine intoxication\n\""}, "meta_info": "step2&3", "answer_idx": "D", "metamap_phrases": ["year old man", "brought", "emergency department", "evaluation of altered mental status", "found on", "floor", "apartment", "somnolent", "responsive", "aroused", "pulse", "64 min", "respiratory rate", "min", "blood pressure", "75 mm Hg", "physical examination", "alcoholic smell", "slurred speech", "noted", "Neurological exam shows diminished deep tendon reflexes", "ataxic gait", "pupils", "normal", "Blood alcohol concentration", "0.04", "ECG shows", "abnormalities", "following", "most likely cause", "patient's symptoms"], "model_answer": "The patient presents with altered mental status, somnolence, slurred speech, ataxic gait, and diminished deep tendon reflexes. While the alcoholic smell might initially suggest ethanol intoxication, his blood alcohol concentration (0.04%) is below the level typically associated with significant impairment (usually >0.08%). \n\nThe findings are more consistent with a central nervous system depressant, such as benzodiazepines, which can cause sedation, slurred speech, ataxia, and diminished reflexes. Pupils are typically normal in benzodiazepine intoxication, which aligns with this patient's presentation. \n\nHypoglycemia (A) is less likely without symptoms like diaphoresis, tachycardia, or confusion progressing to coma. Cannabis intoxication (C) typically causes euphoria, conjunctival injection, and altered perception rather than somnolence and ataxia. \n\nThe most likely cause is [D:Benzodiazepine intoxication].", "fact_gen_query": "\n    nQuestion:\nA 46-year-old man is brought to the emergency department for evaluation of altered mental status. He was found on the floor in front of his apartment. He is somnolent but responsive when aroused. His pulse is 64/min, respiratory rate is 15/min, and blood pressure is 120/75 mm Hg. On physical examination, an alcoholic smell and slurred speech are noted. Neurological exam shows diminished deep tendon reflexes bilaterally and an ataxic gait. His pupils are normal. Blood alcohol concentration is 0.04%. An ECG shows no abnormalities. Which of the following is the most likely cause of this patient's symptoms?\n\n Option:\nHypoglycemia;\nEthanol intoxication;\nCannabis intoxication;\nBenzodiazepine intoxication\n\";\n\n\n Answer:\nBenzodiazepine intoxication\n\"\n For this QA example, you need to give netural fact info for each\n    option according to question context, so that later user can infer out the \n    correct answer from these facts. The template of facts is [option1_name:fact| option2_name:fact|...],e.g: [Ampicillin:High resistance, not first-line. | Ceftriaxone:Overkill (for pyelonephritis/severe UTI).]\n", "hinted_gen_query": "\n    Question:\nA 46-year-old man is brought to the emergency department for evaluation of altered mental status. He was found on the floor in front of his apartment. He is somnolent but responsive when aroused. His pulse is 64/min, respiratory rate is 15/min, and blood pressure is 120/75 mm Hg. On physical examination, an alcoholic smell and slurred speech are noted. Neurological exam shows diminished deep tendon reflexes bilaterally and an ataxic gait. His pupils are normal. Blood alcohol concentration is 0.04%. An ECG shows no abnormalities. Which of the following is the most likely cause of this patient's symptoms?\n\n Option:\nA:Hypoglycemia;\nB:Ethanol intoxication;\nC:Cannabis intoxication;\nD:Benzodiazepine intoxication\n\";\n \n\n Hint:\nNone \n\n Answer:\n"}
{"question": "A 77-year-old woman presents to the emergency room with the complaints of fever, malaise, and night sweats. She recently observed an enlargement of her axillary lymph nodes, which she examines on a weekly basis. She has a remote history of breast cancer in her 60s that was treated with radiation and chemotherapy. She also reports a history of extensive travel to Africa and a 30-pack-year history of smoking. On physical exam, several axillary lymph nodes are palpable with a large non-tender palpable mass in her right axilla measuring 10 x 8 cm. Fine-needle aspiration demonstrates what the pathologist describes as \"a centroblastic and immunoblastic cell presence, suspicious for non-Hodgkin’s lymphoma (NHL)–diffuse large B cell variant\". Which of the following risk factors is responsible for this patient’s condition?", "answer": "Previous radiation therapy", "options": {"A": "Travel to Africa", "B": "Axillary lymph node involvement", "C": "Previous radiation therapy", "D": "Previous breast cancer"}, "meta_info": "step1", "answer_idx": "C", "metamap_phrases": ["year old woman presents", "emergency room", "complaints", "fever", "malaise", "night sweats", "recently observed", "enlargement of", "axillary lymph nodes", "weekly basis", "remote history of breast cancer", "treated with radiation", "chemotherapy", "reports", "history of extensive travel", "Africa", "30 pack-year history of smoking", "physical exam", "several axillary lymph nodes", "palpable", "large non-tender", "mass", "right axilla measuring 10", "8", "Fine-needle aspiration demonstrates", "pathologist", "immunoblastic cell presence", "suspicious", "non-Hodgkins lymphoma", "diffuse large B cell variant", "following risk factors", "responsible", "patients condition"], "model_answer": "The patient's condition is most likely related to her previous radiation therapy, which is a known risk factor for the development of non-Hodgkin’s lymphoma (NHL). While other factors like travel to Africa (which might suggest exposure to certain infections like EBV) or smoking could contribute to NHL risk, the strongest association in this context is with prior radiation therapy.\n\nThe correct answer is [C].", "fact_gen_query": "\n    nQuestion:\nA 77-year-old woman presents to the emergency room with the complaints of fever, malaise, and night sweats. She recently observed an enlargement of her axillary lymph nodes, which she examines on a weekly basis. She has a remote history of breast cancer in her 60s that was treated with radiation and chemotherapy. She also reports a history of extensive travel to Africa and a 30-pack-year history of smoking. On physical exam, several axillary lymph nodes are palpable with a large non-tender palpable mass in her right axilla measuring 10 x 8 cm. Fine-needle aspiration demonstrates what the pathologist describes as \"a centroblastic and immunoblastic cell presence, suspicious for non-Hodgkin’s lymphoma (NHL)–diffuse large B cell variant\". Which of the following risk factors is responsible for this patient’s condition?\n\n Option:\nTravel to Africa;\nAxillary lymph node involvement;\nPrevious radiation therapy;\nPrevious breast cancer;\n\n\n Answer:\nPrevious radiation therapy\n For this QA example, you need to give netural fact info for each\n    option according to question context, so that later user can infer out the \n    correct answer from these facts. The template of facts is [option1_name:fact| option2_name:fact|...],e.g: [Ampicillin:High resistance, not first-line. | Ceftriaxone:Overkill (for pyelonephritis/severe UTI).]\n", "hinted_gen_query": "\n    Question:\nA 77-year-old woman presents to the emergency room with the complaints of fever, malaise, and night sweats. She recently observed an enlargement of her axillary lymph nodes, which she examines on a weekly basis. She has a remote history of breast cancer in her 60s that was treated with radiation and chemotherapy. She also reports a history of extensive travel to Africa and a 30-pack-year history of smoking. On physical exam, several axillary lymph nodes are palpable with a large non-tender palpable mass in her right axilla measuring 10 x 8 cm. Fine-needle aspiration demonstrates what the pathologist describes as \"a centroblastic and immunoblastic cell presence, suspicious for non-Hodgkin’s lymphoma (NHL)–diffuse large B cell variant\". Which of the following risk factors is responsible for this patient’s condition?\n\n Option:\nA:Travel to Africa;\nB:Axillary lymph node involvement;\nC:Previous radiation therapy;\nD:Previous breast cancer;\n \n\n Hint:\nNone \n\n Answer:\n"}
{"question": "A 3-month-old infant is brought to her pediatrician because she coughs and seems to have difficulty breathing while feeding. In addition, she seems to have less energy compared to other babies and appears listless throughout the day. She was born by cesarean section to a G1P1 woman with no prior medical history and had a normal APGAR score at birth. Her parents say that she has never been observed to turn blue. Physical exam reveals a high-pitched holosystolic murmur that is best heard at the lower left sternal border. The most likely cause of this patient's symptoms is associated with which of the following abnormalities?", "answer": "22q11 deletion", "options": {"A": "22q11 deletion", "B": "Deletion of genes on chromosome 7", "C": "Lithium exposure in utero", "D": "Maternal alcohol consumption"}, "meta_info": "step1", "answer_idx": "A", "metamap_phrases": ["3 month old infant", "brought", "pediatrician", "coughs", "to", "difficulty breathing", "feeding", "addition", "to", "less energy compared", "babies", "appears listless", "day", "born by cesarean section to", "G1P1 woman", "prior medical history", "normal APGAR score at birth", "parents", "never", "observed to turn blue", "Physical exam reveals", "high-pitched holosystolic murmur", "best heard", "lower left sternal border", "most likely cause", "patient's symptoms", "associated with", "following abnormalities"], "model_answer": "The clinical presentation of the infant includes a holosystolic murmur at the lower left sternal border, feeding difficulties, and listlessness, which are classic signs of a **ventricular septal defect (VSD)**. VSD is one of the most common congenital heart defects and is strongly associated with **22q11 deletion syndrome (DiGeorge syndrome)**.\n\n- **Option A: 22q11 deletion** is correct because this genetic abnormality is linked to congenital heart defects, including VSD, as well as other features like thymic hypoplasia and hypocalcemia (though not mentioned here).  \n- Option B (deletion of genes on chromosome 7) is associated with Williams syndrome, which typically presents with supravalvular aortic stenosis, not VSD.  \n- Option C (lithium exposure) is linked to Ebstein’s anomaly, not VSD.  \n- Option D (maternal alcohol consumption) is associated with fetal alcohol syndrome and various developmental issues, but not specifically VSD.  \n\nThe most likely answer is **[A]**.", "fact_gen_query": "\n    nQuestion:\nA 3-month-old infant is brought to her pediatrician because she coughs and seems to have difficulty breathing while feeding. In addition, she seems to have less energy compared to other babies and appears listless throughout the day. She was born by cesarean section to a G1P1 woman with no prior medical history and had a normal APGAR score at birth. Her parents say that she has never been observed to turn blue. Physical exam reveals a high-pitched holosystolic murmur that is best heard at the lower left sternal border. The most likely cause of this patient's symptoms is associated with which of the following abnormalities?\n\n Option:\n22q11 deletion;\nDeletion of genes on chromosome 7;\nLithium exposure in utero;\nMaternal alcohol consumption;\n\n\n Answer:\n22q11 deletion\n For this QA example, you need to give netural fact info for each\n    option according to question context, so that later user can infer out the \n    correct answer from these facts. The template of facts is [option1_name:fact| option2_name:fact|...],e.g: [Ampicillin:High resistance, not first-line. | Ceftriaxone:Overkill (for pyelonephritis/severe UTI).]\n", "hinted_gen_query": "\n    Question:\nA 3-month-old infant is brought to her pediatrician because she coughs and seems to have difficulty breathing while feeding. In addition, she seems to have less energy compared to other babies and appears listless throughout the day. She was born by cesarean section to a G1P1 woman with no prior medical history and had a normal APGAR score at birth. Her parents say that she has never been observed to turn blue. Physical exam reveals a high-pitched holosystolic murmur that is best heard at the lower left sternal border. The most likely cause of this patient's symptoms is associated with which of the following abnormalities?\n\n Option:\nA:22q11 deletion;\nB:Deletion of genes on chromosome 7;\nC:Lithium exposure in utero;\nD:Maternal alcohol consumption;\n \n\n Hint:\nNone \n\n Answer:\n"}
{"question": "A 30-year-old African American woman comes to the physician for the evaluation of a dry cough and chest discomfort for the past 3 days. During this period, the patient has had headaches, muscle aches, joint pain, fever, and chills. Ten days ago, she was hiking with her family in Mississippi. The patient has asthma that is treated with an albuterol inhaler. Her mother has a lung disease treated with methotrexate. The patient has smoked one pack of cigarettes daily for the past 10 years. Her temperature is 38°C (100.4°F). Physical examination shows slight wheezes throughout both lung fields. Laboratory studies and urinalysis are positive for polysaccharide antigen. Bronchoalveolar lavage using silver/PAS-staining shows macrophages filled with a dimorphic fungus with septate hyphae. Which of the following is the most likely cause of this patient's symptoms?", "answer": "Histoplasma capsulatum infection", "options": {"A": "Legionella pneumophila infection", "B": "Pneumocystis pneumonia", "C": "Histoplasma capsulatum infection", "D": "Blastomyces dermatitidis infection"}, "meta_info": "step2&3", "answer_idx": "C", "metamap_phrases": ["30 year old African American woman", "physician", "evaluation", "dry cough", "chest discomfort", "past 3 days", "period", "patient", "headaches", "muscle aches", "joint pain", "fever", "chills", "Ten days", "hiking", "family", "Mississippi", "patient", "asthma", "treated with", "albuterol inhaler", "mother", "lung disease treated with methotrexate", "patient", "smoked one pack", "cigarettes daily", "past 10 years", "temperature", "100 4F", "Physical examination shows slight wheezes", "lung fields", "Laboratory studies", "urinalysis", "positive", "polysaccharide antigen", "Bronchoalveolar lavage using silver PAS staining shows macrophages filled", "dimorphic fungus", "septate hyphae", "following", "most likely cause", "patient's symptoms"], "model_answer": "The patient's symptoms, including dry cough, chest discomfort, headaches, muscle aches, joint pain, fever, and chills, along with her recent hiking history in Mississippi (an area endemic for certain fungi), and the findings of polysaccharide antigen positivity and macrophages filled with a dimorphic fungus with septate hyphae, strongly suggest a fungal infection. \n\n- **Legionella pneumophila infection (Option A)**: This typically causes a more severe pneumonia with gastrointestinal symptoms and is not associated with dimorphic fungi.\n- **Pneumocystis pneumonia (Option B)**: This is seen in immunocompromised patients and does not present with the described fungal findings.\n- **Histoplasma capsulatum infection (Option C)**: This is a dimorphic fungus found in the Mississippi River Valley and can cause the described symptoms and findings (e.g., polysaccharide antigen positivity, macrophages filled with yeast forms). However, Histoplasma typically shows non-septate hyphae and small yeast forms, not septate hyphae.\n- **Blastomyces dermatitidis infection (Option D)**: This is another dimorphic fungus endemic to the Mississippi River Valley. It causes symptoms similar to Histoplasma but is characterized by macrophages filled with broad-based budding yeast with **septate hyphae**, which matches the findings in this patient.\n\nThe most likely cause of this patient's symptoms is **Blastomyces dermatitidis infection**, given the dimorphic fungus with septate hyphae and the clinical presentation. \n\n[D]", "fact_gen_query": "\n    nQuestion:\nA 30-year-old African American woman comes to the physician for the evaluation of a dry cough and chest discomfort for the past 3 days. During this period, the patient has had headaches, muscle aches, joint pain, fever, and chills. Ten days ago, she was hiking with her family in Mississippi. The patient has asthma that is treated with an albuterol inhaler. Her mother has a lung disease treated with methotrexate. The patient has smoked one pack of cigarettes daily for the past 10 years. Her temperature is 38°C (100.4°F). Physical examination shows slight wheezes throughout both lung fields. Laboratory studies and urinalysis are positive for polysaccharide antigen. Bronchoalveolar lavage using silver/PAS-staining shows macrophages filled with a dimorphic fungus with septate hyphae. Which of the following is the most likely cause of this patient's symptoms?\n\n Option:\nLegionella pneumophila infection;\nPneumocystis pneumonia;\nHistoplasma capsulatum infection;\nBlastomyces dermatitidis infection;\n\n\n Answer:\nHistoplasma capsulatum infection\n For this QA example, you need to give netural fact info for each\n    option according to question context, so that later user can infer out the \n    correct answer from these facts. The template of facts is [option1_name:fact| option2_name:fact|...],e.g: [Ampicillin:High resistance, not first-line. | Ceftriaxone:Overkill (for pyelonephritis/severe UTI).]\n", "hinted_gen_query": "\n    Question:\nA 30-year-old African American woman comes to the physician for the evaluation of a dry cough and chest discomfort for the past 3 days. During this period, the patient has had headaches, muscle aches, joint pain, fever, and chills. Ten days ago, she was hiking with her family in Mississippi. The patient has asthma that is treated with an albuterol inhaler. Her mother has a lung disease treated with methotrexate. The patient has smoked one pack of cigarettes daily for the past 10 years. Her temperature is 38°C (100.4°F). Physical examination shows slight wheezes throughout both lung fields. Laboratory studies and urinalysis are positive for polysaccharide antigen. Bronchoalveolar lavage using silver/PAS-staining shows macrophages filled with a dimorphic fungus with septate hyphae. Which of the following is the most likely cause of this patient's symptoms?\n\n Option:\nA:Legionella pneumophila infection;\nB:Pneumocystis pneumonia;\nC:Histoplasma capsulatum infection;\nD:Blastomyces dermatitidis infection;\n \n\n Hint:\nNone \n\n Answer:\n"}
{"question": "A 62-year-old patient has been hospitalized for a week due to a stroke. One week into the hospitalization, he develops a fever and purulent cough. His vitals include: heart rate 88/min, respiratory rate 20/min, temperature 38.4°C (101.1°F), and blood pressure 110/85 mm Hg. On physical examination, he has basal crackles on the right side of the chest. Chest radiography shows a new consolidation on the same side. Complete blood count is as follows:\nHemoglobin 16 mg/dL\nHematocrit 50%\nLeukocyte count 8,900/mm3\nNeutrophils 72%\nBands 4%\nEosinophils 2%\nBasophils 0%\nLymphocytes 17%\nMonocytes 5%\nPlatelet count 280,000/mm3\nWhat is the most likely causal microorganism?", "answer": "Staphylococcus aureus", "options": {"A": "Streptococcus pneumoniae", "B": "Mycobacterium tuberculosis", "C": "Haemophilus influenzae", "D": "Staphylococcus aureus"}, "meta_info": "step1", "answer_idx": "D", "metamap_phrases": ["62 year old patient", "hospitalized", "week", "stroke", "One week", "hospitalization", "fever", "purulent cough", "include", "heart rate 88 min", "respiratory rate 20 min", "temperature", "4C", "blood pressure", "85 mm Hg", "physical examination", "basal crackles", "right side of", "chest", "Chest radiography shows", "new consolidation", "same side", "Complete blood count", "follows", "Hemoglobin", "Hematocrit 50", "Leukocyte count 8 900 mm3", "72", "Bands 4", "Eosinophils 2", "Basophils 0", "Lymphocytes", "Monocytes 5", "Platelet count", "most likely causal microorganism"], "model_answer": "The patient's presentation includes fever, purulent cough, and new consolidation on chest radiography, consistent with pneumonia. Given the clinical context of a recent stroke (which may have led to aspiration due to dysphagia), the most likely causal microorganism is **Streptococcus pneumoniae**, as it is the most common cause of community-acquired pneumonia, including aspiration pneumonia in hospitalized patients. \n\nWhile other organisms like **Staphylococcus aureus** (more common in post-viral or healthcare-associated pneumonia) or **Haemophilus influenzae** (more common in COPD patients) are possible, **Streptococcus pneumoniae** is the most likely in this scenario. **Mycobacterium tuberculosis** is less likely given the acute presentation and lack of chronic symptoms.\n\nThe correct answer is [A].", "fact_gen_query": "\n    nQuestion:\nA 62-year-old patient has been hospitalized for a week due to a stroke. One week into the hospitalization, he develops a fever and purulent cough. His vitals include: heart rate 88/min, respiratory rate 20/min, temperature 38.4°C (101.1°F), and blood pressure 110/85 mm Hg. On physical examination, he has basal crackles on the right side of the chest. Chest radiography shows a new consolidation on the same side. Complete blood count is as follows:\nHemoglobin 16 mg/dL\nHematocrit 50%\nLeukocyte count 8,900/mm3\nNeutrophils 72%\nBands 4%\nEosinophils 2%\nBasophils 0%\nLymphocytes 17%\nMonocytes 5%\nPlatelet count 280,000/mm3\nWhat is the most likely causal microorganism?\n\n Option:\nStreptococcus pneumoniae;\nMycobacterium tuberculosis;\nHaemophilus influenzae;\nStaphylococcus aureus;\n\n\n Answer:\nStaphylococcus aureus\n For this QA example, you need to give netural fact info for each\n    option according to question context, so that later user can infer out the \n    correct answer from these facts. The template of facts is [option1_name:fact| option2_name:fact|...],e.g: [Ampicillin:High resistance, not first-line. | Ceftriaxone:Overkill (for pyelonephritis/severe UTI).]\n", "hinted_gen_query": "\n    Question:\nA 62-year-old patient has been hospitalized for a week due to a stroke. One week into the hospitalization, he develops a fever and purulent cough. His vitals include: heart rate 88/min, respiratory rate 20/min, temperature 38.4°C (101.1°F), and blood pressure 110/85 mm Hg. On physical examination, he has basal crackles on the right side of the chest. Chest radiography shows a new consolidation on the same side. Complete blood count is as follows:\nHemoglobin 16 mg/dL\nHematocrit 50%\nLeukocyte count 8,900/mm3\nNeutrophils 72%\nBands 4%\nEosinophils 2%\nBasophils 0%\nLymphocytes 17%\nMonocytes 5%\nPlatelet count 280,000/mm3\nWhat is the most likely causal microorganism?\n\n Option:\nA:Streptococcus pneumoniae;\nB:Mycobacterium tuberculosis;\nC:Haemophilus influenzae;\nD:Staphylococcus aureus;\n \n\n Hint:\nNone \n\n Answer:\n"}
{"question": "A 6-year-old boy is brought to the emergency department by his mother for worsening wheezing and shortness of breath over the past day. He has not had a fever, cough, vomiting, or diarrhea. He has asthma and eczema. He uses a glucocorticoid inhaler and an albuterol inhaler but has missed his medications for the past week while on vacation. He appears uncomfortable. His temperature is 36°C (96.8°F), pulse is 120/min, respirations are 40/min, and blood pressure is 100/80. Expiratory and inspiratory wheezing is heard throughout both lung fields. There are moderate intercostal and subcostal retractions and a decreased inspiratory to expiratory ratio. Nebulized albuterol and ipratropium treatments and intravenous methylprednisolone are given in the emergency department for a presumed asthma exacerbation. One hour later, the child is limp and lethargic. Magnesium sulfate is administered. His temperature is 36°C (96.8°F), pulse is 150/min, respirations are 22/min, and blood pressure is 100/70. No wheezing is heard on repeat pulmonary examination. Which of the following is the most appropriate next step in management?", "answer": "Intubate with mechanical ventilation", "options": {"A": "Intubate with mechanical ventilation", "B": "Perform needle thoracostomy at the 2nd intercostal space", "C": "Perform bronchoscopy", "D": "Provide additional dose of methylprednisolone"}, "meta_info": "step2&3", "answer_idx": "A", "metamap_phrases": ["year old boy", "brought", "emergency department", "mother", "worsening wheezing", "shortness of breath", "past day", "not", "fever", "cough", "vomiting", "diarrhea", "asthma", "eczema", "uses", "glucocorticoid inhaler", "albuterol inhaler", "missed", "medications", "past week", "vacation", "appears", "temperature", "96", "pulse", "min", "respirations", "40 min", "blood pressure", "100 80", "Expiratory", "inspiratory wheezing", "heard", "lung fields", "moderate", "subcostal retractions", "decreased inspiratory", "expiratory ratio", "Nebulized albuterol", "ipratropium treatments", "intravenous methylprednisolone", "given", "emergency department", "presumed asthma exacerbation", "One hour later", "child", "limp", "lethargic", "Magnesium sulfate", "administered", "temperature", "96", "pulse", "min", "respirations", "min", "blood pressure", "100 70", "wheezing", "heard", "repeat pulmonary examination", "following", "most appropriate next step", "management"], "model_answer": "The child's clinical picture suggests a severe asthma exacerbation that has progressed to respiratory failure despite initial treatment. Key findings include lethargy, absence of wheezing (indicating minimal air movement), and tachypnea with tachycardia. The absence of wheezing after initial treatment is particularly concerning as it may indicate severe bronchospasm and impending respiratory arrest. The most appropriate next step is to secure the airway and provide mechanical ventilation to support oxygenation and ventilation.\n\nThe correct answer is [A].", "fact_gen_query": "\n    nQuestion:\nA 6-year-old boy is brought to the emergency department by his mother for worsening wheezing and shortness of breath over the past day. He has not had a fever, cough, vomiting, or diarrhea. He has asthma and eczema. He uses a glucocorticoid inhaler and an albuterol inhaler but has missed his medications for the past week while on vacation. He appears uncomfortable. His temperature is 36°C (96.8°F), pulse is 120/min, respirations are 40/min, and blood pressure is 100/80. Expiratory and inspiratory wheezing is heard throughout both lung fields. There are moderate intercostal and subcostal retractions and a decreased inspiratory to expiratory ratio. Nebulized albuterol and ipratropium treatments and intravenous methylprednisolone are given in the emergency department for a presumed asthma exacerbation. One hour later, the child is limp and lethargic. Magnesium sulfate is administered. His temperature is 36°C (96.8°F), pulse is 150/min, respirations are 22/min, and blood pressure is 100/70. No wheezing is heard on repeat pulmonary examination. Which of the following is the most appropriate next step in management?\n\n Option:\nIntubate with mechanical ventilation;\nPerform needle thoracostomy at the 2nd intercostal space;\nPerform bronchoscopy;\nProvide additional dose of methylprednisolone;\n\n\n Answer:\nIntubate with mechanical ventilation\n For this QA example, you need to give netural fact info for each\n    option according to question context, so that later user can infer out the \n    correct answer from these facts. The template of facts is [option1_name:fact| option2_name:fact|...],e.g: [Ampicillin:High resistance, not first-line. | Ceftriaxone:Overkill (for pyelonephritis/severe UTI).]\n", "hinted_gen_query": "\n    Question:\nA 6-year-old boy is brought to the emergency department by his mother for worsening wheezing and shortness of breath over the past day. He has not had a fever, cough, vomiting, or diarrhea. He has asthma and eczema. He uses a glucocorticoid inhaler and an albuterol inhaler but has missed his medications for the past week while on vacation. He appears uncomfortable. His temperature is 36°C (96.8°F), pulse is 120/min, respirations are 40/min, and blood pressure is 100/80. Expiratory and inspiratory wheezing is heard throughout both lung fields. There are moderate intercostal and subcostal retractions and a decreased inspiratory to expiratory ratio. Nebulized albuterol and ipratropium treatments and intravenous methylprednisolone are given in the emergency department for a presumed asthma exacerbation. One hour later, the child is limp and lethargic. Magnesium sulfate is administered. His temperature is 36°C (96.8°F), pulse is 150/min, respirations are 22/min, and blood pressure is 100/70. No wheezing is heard on repeat pulmonary examination. Which of the following is the most appropriate next step in management?\n\n Option:\nA:Intubate with mechanical ventilation;\nB:Perform needle thoracostomy at the 2nd intercostal space;\nC:Perform bronchoscopy;\nD:Provide additional dose of methylprednisolone;\n \n\n Hint:\nNone \n\n Answer:\n"}
{"question": "A 5-year-old female suffers from recurrent infections by Aspergillus species, Pseudomonas species, and Staphylococcus aureus. The patient's neutrophils are examined in the laboratory and they fail to react during the nitroblue tetrazolium test. Which of the following is most likely dysfunctional in this patient?", "answer": "Respiratory burst", "options": {"A": "Immunoglobulin class switching", "B": "Superoxide dismutase", "C": "Myeloperoxidase", "D": "Respiratory burst"}, "meta_info": "step1", "answer_idx": "D", "metamap_phrases": ["5 year old female suffers", "recurrent infections", "Aspergillus species", "Pseudomonas species", "Staphylococcus aureus", "patient's neutrophils", "examined", "laboratory", "fail to react", "nitroblue tetrazolium test", "following", "most likely dysfunctional", "patient"], "model_answer": "The patient's symptoms and laboratory findings suggest a defect in the respiratory burst, which is essential for the killing of pathogens by neutrophils. The nitroblue tetrazolium (NBT) test is used to assess the respiratory burst activity in neutrophils. A failure to react in this test indicates a dysfunction in the respiratory burst, which is characteristic of chronic granulomatous disease (CGD). \n\nThe other options are less likely:\n- A: Immunoglobulin class switching is not related to neutrophil function or the NBT test.\n- B: Superoxide dismutase deficiency would not directly cause a failure in the NBT test.\n- C: Myeloperoxidase deficiency would result in impaired microbial killing but the NBT test would still be positive.\n\nThe most likely dysfunctional process in this patient is the respiratory burst. \n\n[D]", "fact_gen_query": "\n    nQuestion:\nA 5-year-old female suffers from recurrent infections by Aspergillus species, Pseudomonas species, and Staphylococcus aureus. The patient's neutrophils are examined in the laboratory and they fail to react during the nitroblue tetrazolium test. Which of the following is most likely dysfunctional in this patient?\n\n Option:\nImmunoglobulin class switching;\nSuperoxide dismutase;\nMyeloperoxidase;\nRespiratory burst;\n\n\n Answer:\nRespiratory burst\n For this QA example, you need to give netural fact info for each\n    option according to question context, so that later user can infer out the \n    correct answer from these facts. The template of facts is [option1_name:fact| option2_name:fact|...],e.g: [Ampicillin:High resistance, not first-line. | Ceftriaxone:Overkill (for pyelonephritis/severe UTI).]\n", "hinted_gen_query": "\n    Question:\nA 5-year-old female suffers from recurrent infections by Aspergillus species, Pseudomonas species, and Staphylococcus aureus. The patient's neutrophils are examined in the laboratory and they fail to react during the nitroblue tetrazolium test. Which of the following is most likely dysfunctional in this patient?\n\n Option:\nA:Immunoglobulin class switching;\nB:Superoxide dismutase;\nC:Myeloperoxidase;\nD:Respiratory burst;\n \n\n Hint:\nNone \n\n Answer:\n"}
{"question": "A 3-year-old boy presents to the emergency department with a ‘cough-like-a-seal bark’ and a high-pitched inspiratory noise that is audible without a stethoscope. His mother reports that his cough has worsened over the last few hours. The patient's blood pressure is 118/78 mm Hg, pulse is 90/min, respiratory rate is 35/min, and temperature is 38.3°C (101.1°F). On physical examination, the boy is sitting and leaning forward in apparent respiratory distress with suprasternal and intercostal retractions. Auscultation reveals inspiratory stridor without wheezing. He has a frequent barking cough and a hoarse voice when he speaks. What is a chest X-ray likely to show?", "answer": "Steeple sign", "options": {"A": "Increased interstitial markings", "B": "Lobar consolidation in the lingual", "C": "Thumbprint sign on the lateral image", "D": "Steeple sign"}, "meta_info": "step2&3", "answer_idx": "D", "metamap_phrases": ["3 year old boy presents", "emergency department", "cough", "seal bark", "high-pitched inspiratory noise", "stethoscope", "mother reports", "cough", "worsened", "hours", "patient's blood pressure", "mm Hg", "pulse", "90 min", "respiratory rate", "35 min", "temperature", "3C", "physical examination", "boy", "sitting", "forward", "apparent respiratory distress", "suprasternal", "intercostal retractions", "Auscultation reveals inspiratory", "wheezing", "frequent barking cough", "hoarse voice", "speaks", "chest X-ray likely to show"], "model_answer": "The clinical presentation described is classic for croup (laryngotracheobronchitis), which is most commonly caused by parainfluenza virus. The \"steeple sign\" is a characteristic finding on a chest X-ray in patients with croup, which appears as a narrowing of the subglottic airway, resembling a steeple. \n\nThe \"thumbprint sign\" (option C) is seen in epiglottitis, which is less likely in this case given the gradual onset of symptoms and the absence of drooling or difficulty swallowing. \n\nOptions A and B are not typical for croup.\n\nThe correct answer is [D].", "fact_gen_query": "\n    nQuestion:\nA 3-year-old boy presents to the emergency department with a ‘cough-like-a-seal bark’ and a high-pitched inspiratory noise that is audible without a stethoscope. His mother reports that his cough has worsened over the last few hours. The patient's blood pressure is 118/78 mm Hg, pulse is 90/min, respiratory rate is 35/min, and temperature is 38.3°C (101.1°F). On physical examination, the boy is sitting and leaning forward in apparent respiratory distress with suprasternal and intercostal retractions. Auscultation reveals inspiratory stridor without wheezing. He has a frequent barking cough and a hoarse voice when he speaks. What is a chest X-ray likely to show?\n\n Option:\nIncreased interstitial markings;\nLobar consolidation in the lingual;\nThumbprint sign on the lateral image;\nSteeple sign;\n\n\n Answer:\nSteeple sign\n For this QA example, you need to give netural fact info for each\n    option according to question context, so that later user can infer out the \n    correct answer from these facts. The template of facts is [option1_name:fact| option2_name:fact|...],e.g: [Ampicillin:High resistance, not first-line. | Ceftriaxone:Overkill (for pyelonephritis/severe UTI).]\n", "hinted_gen_query": "\n    Question:\nA 3-year-old boy presents to the emergency department with a ‘cough-like-a-seal bark’ and a high-pitched inspiratory noise that is audible without a stethoscope. His mother reports that his cough has worsened over the last few hours. The patient's blood pressure is 118/78 mm Hg, pulse is 90/min, respiratory rate is 35/min, and temperature is 38.3°C (101.1°F). On physical examination, the boy is sitting and leaning forward in apparent respiratory distress with suprasternal and intercostal retractions. Auscultation reveals inspiratory stridor without wheezing. He has a frequent barking cough and a hoarse voice when he speaks. What is a chest X-ray likely to show?\n\n Option:\nA:Increased interstitial markings;\nB:Lobar consolidation in the lingual;\nC:Thumbprint sign on the lateral image;\nD:Steeple sign;\n \n\n Hint:\nNone \n\n Answer:\n"}
{"question": "A 26-year-old woman presents to a gynecologist after a missed period. After performing a complete physical examination and a screening test for pregnancy, her gynecologist informs her that she is pregnant. She is very surprised as she has been taking oral contraceptives regularly. When the gynecologist asks her about the consumption of any other medications, she mentions that she was placed on treatment for pulmonary tuberculosis (TB) 2 months ago. Her current anti-TB regimen includes rifampin, isoniazid, pyrazinamide, and ethambutol. Which of the following mechanisms best explains the failure of oral contraceptives in this patient?", "answer": "Induction of CYP3A4 by rifampin leading to decreased serum levels of ethinylestradiol and progesterone", "options": {"A": "Induction of CYP3A4 by rifampin leading to decreased serum levels of ethinylestradiol and progesterone", "B": "Induction of CYP2A6 by rifampin leading to increased inactivation of ethinylestradiol", "C": "Interference with the intestinal absorption of the oral contraceptive by pyrazinamide", "D": "Increased renal elimination of the progesterone component of the oral contraceptive by ethambutol"}, "meta_info": "step1", "answer_idx": "A", "metamap_phrases": ["year old woman presents", "gynecologist", "missed period", "performing", "complete physical examination", "screening", "pregnancy", "gynecologist informs", "pregnant", "very", "taking oral contraceptives", "gynecologist", "consumption", "medications", "placed on treatment", "pulmonary tuberculosis", "months", "current", "TB regimen includes rifampin", "isoniazid", "pyrazinamide", "ethambutol", "following mechanisms best", "failure", "oral contraceptives", "patient"], "model_answer": "The correct answer is:\n\n[A]", "fact_gen_query": "\n    nQuestion:\nA 26-year-old woman presents to a gynecologist after a missed period. After performing a complete physical examination and a screening test for pregnancy, her gynecologist informs her that she is pregnant. She is very surprised as she has been taking oral contraceptives regularly. When the gynecologist asks her about the consumption of any other medications, she mentions that she was placed on treatment for pulmonary tuberculosis (TB) 2 months ago. Her current anti-TB regimen includes rifampin, isoniazid, pyrazinamide, and ethambutol. Which of the following mechanisms best explains the failure of oral contraceptives in this patient?\n\n Option:\nInduction of CYP3A4 by rifampin leading to decreased serum levels of ethinylestradiol and progesterone;\nInduction of CYP2A6 by rifampin leading to increased inactivation of ethinylestradiol;\nInterference with the intestinal absorption of the oral contraceptive by pyrazinamide;\nIncreased renal elimination of the progesterone component of the oral contraceptive by ethambutol;\n\n\n Answer:\nInduction of CYP3A4 by rifampin leading to decreased serum levels of ethinylestradiol and progesterone\n For this QA example, you need to give netural fact info for each\n    option according to question context, so that later user can infer out the \n    correct answer from these facts. The template of facts is [option1_name:fact| option2_name:fact|...],e.g: [Ampicillin:High resistance, not first-line. | Ceftriaxone:Overkill (for pyelonephritis/severe UTI).]\n", "hinted_gen_query": "\n    Question:\nA 26-year-old woman presents to a gynecologist after a missed period. After performing a complete physical examination and a screening test for pregnancy, her gynecologist informs her that she is pregnant. She is very surprised as she has been taking oral contraceptives regularly. When the gynecologist asks her about the consumption of any other medications, she mentions that she was placed on treatment for pulmonary tuberculosis (TB) 2 months ago. Her current anti-TB regimen includes rifampin, isoniazid, pyrazinamide, and ethambutol. Which of the following mechanisms best explains the failure of oral contraceptives in this patient?\n\n Option:\nA:Induction of CYP3A4 by rifampin leading to decreased serum levels of ethinylestradiol and progesterone;\nB:Induction of CYP2A6 by rifampin leading to increased inactivation of ethinylestradiol;\nC:Interference with the intestinal absorption of the oral contraceptive by pyrazinamide;\nD:Increased renal elimination of the progesterone component of the oral contraceptive by ethambutol;\n \n\n Hint:\nNone \n\n Answer:\n"}
{"question": "A 4-year-old previously healthy boy presents with 4 days of intermittent vomiting and 5-6 daily loose stools. His mother noted bloody stools and decreased oral intake of food and water over the last 24 hours. He is normally in daycare; however, he has been home for the past 3 days. On physical exam his temperature is 102.2°F (39°C), blood pressure is 140/90 mmHg, pulse is 120/min, respirations are 22/min and O2 saturation is 99% on room air. He has dry mucous membranes. On abdominal exam you note diffuse tenderness to palpation without rebound or guarding. There are no masses, hepatosplenomegaly, and bowel sounds are hyperactive. Ultrasound of the right lower quadrant is negative for appendicitis. Stool is guaiac positive. He receives 15mg/kg acetaminophen and fluids are started. The next day, he complains of lower extremity weakness and tingling. On repeat exam, lower extremity strength is 3/5 with diminished patellar deep tendon reflexes. Which of the following lab findings would most likely be seen in this patient?", "answer": "Increased cerebrospinal fluid protein with normal cell count", "options": {"A": "Gram stain positive CSF", "B": "Peripheral eosinophilia", "C": "Xanthochromia on cerebrospinal fluid analysis", "D": "Increased cerebrospinal fluid protein with normal cell count"}, "meta_info": "step1", "answer_idx": "D", "metamap_phrases": ["4 year old", "healthy boy presents", "4 days", "intermittent vomiting", "5-6 daily loose stools", "mother noted bloody stools", "decreased oral intake", "food", "water", "24 hours", "daycare", "home", "past 3 days", "physical exam", "temperature", "blood pressure", "90 mmHg", "pulse", "min", "respirations", "min", "O2 saturation", "99", "room air", "dry mucous membranes", "abdominal exam", "note diffuse tenderness", "palpation", "guarding", "masses", "hepatosplenomegaly", "bowel sounds", "hyperactive", "Ultrasound", "right lower quadrant", "negative", "appendicitis", "Stool", "guaiac positive", "receives", "kg acetaminophen", "fluids", "started", "next day", "lower extremity weakness", "tingling", "repeat exam", "lower extremity strength", "3/5", "diminished patellar deep tendon reflexes", "following lab findings", "most likely", "seen", "patient"], "model_answer": "The patient's presentation includes bloody diarrhea, fever, abdominal pain, and subsequent neurological symptoms (lower extremity weakness, diminished reflexes). This is highly suggestive of **Hemolytic Uremic Syndrome (HUS)**, typically caused by Shiga toxin-producing *E. coli* (e.g., O157:H7). HUS is characterized by the triad of microangiopathic hemolytic anemia, thrombocytopenia, and acute kidney injury. Neurological symptoms (e.g., weakness, paresthesias) can occur due to uremia or direct toxin effects. \n\nIn HUS, **cerebrospinal fluid (CSF) analysis** often shows **increased protein with a normal cell count** (albuminocytologic dissociation), reflecting endothelial damage without infection. \n\nOther options:\n- **A**: Gram stain positive CSF suggests bacterial meningitis (not consistent with this case).  \n- **B**: Peripheral eosinophilia is seen in parasitic infections or hypersensitivity reactions (not typical for HUS).  \n- **C**: Xanthochromia indicates subarachnoid hemorrhage (not expected here).  \n\nThe most likely lab finding is **[D]**.  \n\nFinal answer: [D]", "fact_gen_query": "\n    nQuestion:\nA 4-year-old previously healthy boy presents with 4 days of intermittent vomiting and 5-6 daily loose stools. His mother noted bloody stools and decreased oral intake of food and water over the last 24 hours. He is normally in daycare; however, he has been home for the past 3 days. On physical exam his temperature is 102.2°F (39°C), blood pressure is 140/90 mmHg, pulse is 120/min, respirations are 22/min and O2 saturation is 99% on room air. He has dry mucous membranes. On abdominal exam you note diffuse tenderness to palpation without rebound or guarding. There are no masses, hepatosplenomegaly, and bowel sounds are hyperactive. Ultrasound of the right lower quadrant is negative for appendicitis. Stool is guaiac positive. He receives 15mg/kg acetaminophen and fluids are started. The next day, he complains of lower extremity weakness and tingling. On repeat exam, lower extremity strength is 3/5 with diminished patellar deep tendon reflexes. Which of the following lab findings would most likely be seen in this patient?\n\n Option:\nGram stain positive CSF;\nPeripheral eosinophilia;\nXanthochromia on cerebrospinal fluid analysis;\nIncreased cerebrospinal fluid protein with normal cell count;\n\n\n Answer:\nIncreased cerebrospinal fluid protein with normal cell count\n For this QA example, you need to give netural fact info for each\n    option according to question context, so that later user can infer out the \n    correct answer from these facts. The template of facts is [option1_name:fact| option2_name:fact|...],e.g: [Ampicillin:High resistance, not first-line. | Ceftriaxone:Overkill (for pyelonephritis/severe UTI).]\n", "hinted_gen_query": "\n    Question:\nA 4-year-old previously healthy boy presents with 4 days of intermittent vomiting and 5-6 daily loose stools. His mother noted bloody stools and decreased oral intake of food and water over the last 24 hours. He is normally in daycare; however, he has been home for the past 3 days. On physical exam his temperature is 102.2°F (39°C), blood pressure is 140/90 mmHg, pulse is 120/min, respirations are 22/min and O2 saturation is 99% on room air. He has dry mucous membranes. On abdominal exam you note diffuse tenderness to palpation without rebound or guarding. There are no masses, hepatosplenomegaly, and bowel sounds are hyperactive. Ultrasound of the right lower quadrant is negative for appendicitis. Stool is guaiac positive. He receives 15mg/kg acetaminophen and fluids are started. The next day, he complains of lower extremity weakness and tingling. On repeat exam, lower extremity strength is 3/5 with diminished patellar deep tendon reflexes. Which of the following lab findings would most likely be seen in this patient?\n\n Option:\nA:Gram stain positive CSF;\nB:Peripheral eosinophilia;\nC:Xanthochromia on cerebrospinal fluid analysis;\nD:Increased cerebrospinal fluid protein with normal cell count;\n \n\n Hint:\nNone \n\n Answer:\n"}
{"question": "A 3-week-old male newborn is brought to the physician because of an inward turning of his left forefoot. He was born at 38 weeks' gestation by cesarean section because of breech presentation. The pregnancy was complicated by oligohydramnios. Examination shows concavity of the medial border of the left foot with a skin crease just below the ball of the great toe. The lateral border of the left foot is convex. The heel is in neutral position. Tickling the lateral border of the foot leads to correction of the deformity. The remainder of the examination shows no abnormalities. X-ray of the left foot shows an increased angle between the 1st and 2nd metatarsal bones. Which of the following is the most appropriate next step in the management of this patient?", "answer": "Reassurance", "options": {"A": "Foot abduction brace", "B": "Arthrodesis of the forefoot", "C": "Reassurance", "D": "Tarsometatarsal capsulotomy"}, "meta_info": "step2&3", "answer_idx": "C", "metamap_phrases": ["3 week old male newborn", "brought", "physician", "inward turning", "left forefoot", "born", "weeks", "gestation", "cesarean section", "breech presentation", "pregnancy", "complicated", "oligohydramnios", "Examination shows concavity of", "medial border", "left foot", "skin crease", "ball", "great toe", "lateral border of", "left foot", "convex", "heel", "neutral position", "Tickling", "lateral border of", "foot leads", "correction", "deformity", "examination shows", "abnormalities", "X-ray of", "left foot shows", "increased angle", "1st", "2nd metatarsal bones", "following", "most appropriate next step", "management", "patient"], "model_answer": "The clinical presentation describes a newborn with a left forefoot deformity characterized by inward turning, concavity of the medial border, convexity of the lateral border, and a skin crease below the ball of the great toe. The deformity is correctable with stimulation of the lateral border of the foot, and the heel is in a neutral position. These findings are consistent with **metatarsus adductus**, a common congenital foot deformity often associated with oligohydramnios and breech presentation. The x-ray finding of an increased angle between the 1st and 2nd metatarsals further supports this diagnosis. \n\nMetatarsus adductus is typically **flexible** (as in this case, since the deformity corrects with stimulation) and resolves spontaneously in the majority of cases. Therefore, the most appropriate next step is **reassurance and observation**. \n\n- **Foot abduction brace (A)**: Not necessary for flexible metatarsus adductus, as it usually resolves without intervention.  \n- **Arthrodesis (B)**: Inappropriate for a newborn; this is a surgical fusion procedure reserved for severe, rigid deformities in older children.  \n- **Tarsometatarsal capsulotomy (D)**: Surgical intervention is not indicated for flexible deformities in infants.  \n\nThe correct answer is [C].", "fact_gen_query": "\n    nQuestion:\nA 3-week-old male newborn is brought to the physician because of an inward turning of his left forefoot. He was born at 38 weeks' gestation by cesarean section because of breech presentation. The pregnancy was complicated by oligohydramnios. Examination shows concavity of the medial border of the left foot with a skin crease just below the ball of the great toe. The lateral border of the left foot is convex. The heel is in neutral position. Tickling the lateral border of the foot leads to correction of the deformity. The remainder of the examination shows no abnormalities. X-ray of the left foot shows an increased angle between the 1st and 2nd metatarsal bones. Which of the following is the most appropriate next step in the management of this patient?\n\n Option:\nFoot abduction brace;\nArthrodesis of the forefoot;\nReassurance;\nTarsometatarsal capsulotomy;\n\n\n Answer:\nReassurance\n For this QA example, you need to give netural fact info for each\n    option according to question context, so that later user can infer out the \n    correct answer from these facts. The template of facts is [option1_name:fact| option2_name:fact|...],e.g: [Ampicillin:High resistance, not first-line. | Ceftriaxone:Overkill (for pyelonephritis/severe UTI).]\n", "hinted_gen_query": "\n    Question:\nA 3-week-old male newborn is brought to the physician because of an inward turning of his left forefoot. He was born at 38 weeks' gestation by cesarean section because of breech presentation. The pregnancy was complicated by oligohydramnios. Examination shows concavity of the medial border of the left foot with a skin crease just below the ball of the great toe. The lateral border of the left foot is convex. The heel is in neutral position. Tickling the lateral border of the foot leads to correction of the deformity. The remainder of the examination shows no abnormalities. X-ray of the left foot shows an increased angle between the 1st and 2nd metatarsal bones. Which of the following is the most appropriate next step in the management of this patient?\n\n Option:\nA:Foot abduction brace;\nB:Arthrodesis of the forefoot;\nC:Reassurance;\nD:Tarsometatarsal capsulotomy;\n \n\n Hint:\nNone \n\n Answer:\n"}
{"question": "A 42-year-old woman comes to the emergency department because of a 2-day history of right upper abdominal pain and nausea. She is 163 cm (5 ft 4 in) tall and weighs 91 kg (200 lb); her BMI is 34 kg/m2. Her temperature is 38.5°C (101.3°F). Physical examination shows a distended abdomen and right upper quadrant tenderness with normal bowel sounds. Laboratory studies show:\nLeukocyte count 14,000/mm3\nSerum\nTotal bilirubin 1.1 mg/dL\nAST 32 U/L\nALT 40 U/L\nAlkaline phosphatase 68 U/L\nAbdominal ultrasonography is performed, but the results are inconclusive. Cholescintigraphy shows the intrahepatic bile ducts, hepatic ducts, common bile duct, and proximal small bowel. Which of the following is the most likely cause of this patient's symptoms?\"", "answer": "Obstruction of the cystic duct", "options": {"A": "Autodigestion of pancreatic parenchyma", "B": "Fistula between the gallbladder and small intestine", "C": "Infection with a hepatotropic virus", "D": "Obstruction of the cystic duct"}, "meta_info": "step1", "answer_idx": "D", "metamap_phrases": ["year old woman", "emergency department", "2-day history", "right upper", "nausea", "5 ft 4", "tall", "kg", "200", "BMI", "kg/m2", "temperature", "Physical examination shows", "distended abdomen", "right upper quadrant tenderness", "normal bowel sounds", "Laboratory studies show", "Leukocyte", "Serum Total bilirubin", "mg", "L", "Alkaline phosphatase", "Abdominal ultrasonography", "performed", "results", "inconclusive", "shows", "intrahepatic bile ducts", "hepatic ducts", "common bile duct", "proximal small bowel", "following", "most likely cause", "patient", "ymptoms?"], "model_answer": "The patient's presentation includes right upper quadrant pain, fever, leukocytosis, and obesity (BMI 34 kg/m2), which are suggestive of acute cholecystitis. The inconclusive ultrasound and cholescintigraphy showing the intrahepatic bile ducts, hepatic ducts, common bile duct, and proximal small bowel suggest that the cystic duct is not obstructed (which would typically prevent tracer from entering the gallbladder). However, the most likely cause of her symptoms is still acute cholecystitis, often due to obstruction of the cystic duct by a gallstone. The inconclusive imaging does not rule this out, and her clinical picture is highly consistent with this diagnosis. \n\nThe other options are less likely:\n- A (Autodigestion of pancreatic parenchyma): This would suggest pancreatitis, which typically presents with epigastric pain and elevated pancreatic enzymes (amylase/lipase), which are not mentioned here.\n- B (Fistula between the gallbladder and small intestine): This is a rare complication of chronic cholecystitis and would not typically present with acute symptoms like fever and leukocytosis.\n- C (Infection with a hepatotropic virus): This would likely cause elevated AST/ALT and possibly jaundice, which are not prominent here.\n\nThus, the most likely cause is obstruction of the cystic duct (D), leading to acute cholecystitis.\n\n[D]", "fact_gen_query": "\n    nQuestion:\nA 42-year-old woman comes to the emergency department because of a 2-day history of right upper abdominal pain and nausea. She is 163 cm (5 ft 4 in) tall and weighs 91 kg (200 lb); her BMI is 34 kg/m2. Her temperature is 38.5°C (101.3°F). Physical examination shows a distended abdomen and right upper quadrant tenderness with normal bowel sounds. Laboratory studies show:\nLeukocyte count 14,000/mm3\nSerum\nTotal bilirubin 1.1 mg/dL\nAST 32 U/L\nALT 40 U/L\nAlkaline phosphatase 68 U/L\nAbdominal ultrasonography is performed, but the results are inconclusive. Cholescintigraphy shows the intrahepatic bile ducts, hepatic ducts, common bile duct, and proximal small bowel. Which of the following is the most likely cause of this patient's symptoms?\"\n\n Option:\nAutodigestion of pancreatic parenchyma;\nFistula between the gallbladder and small intestine;\nInfection with a hepatotropic virus;\nObstruction of the cystic duct;\n\n\n Answer:\nObstruction of the cystic duct\n For this QA example, you need to give netural fact info for each\n    option according to question context, so that later user can infer out the \n    correct answer from these facts. The template of facts is [option1_name:fact| option2_name:fact|...],e.g: [Ampicillin:High resistance, not first-line. | Ceftriaxone:Overkill (for pyelonephritis/severe UTI).]\n", "hinted_gen_query": "\n    Question:\nA 42-year-old woman comes to the emergency department because of a 2-day history of right upper abdominal pain and nausea. She is 163 cm (5 ft 4 in) tall and weighs 91 kg (200 lb); her BMI is 34 kg/m2. Her temperature is 38.5°C (101.3°F). Physical examination shows a distended abdomen and right upper quadrant tenderness with normal bowel sounds. Laboratory studies show:\nLeukocyte count 14,000/mm3\nSerum\nTotal bilirubin 1.1 mg/dL\nAST 32 U/L\nALT 40 U/L\nAlkaline phosphatase 68 U/L\nAbdominal ultrasonography is performed, but the results are inconclusive. Cholescintigraphy shows the intrahepatic bile ducts, hepatic ducts, common bile duct, and proximal small bowel. Which of the following is the most likely cause of this patient's symptoms?\"\n\n Option:\nA:Autodigestion of pancreatic parenchyma;\nB:Fistula between the gallbladder and small intestine;\nC:Infection with a hepatotropic virus;\nD:Obstruction of the cystic duct;\n \n\n Hint:\nNone \n\n Answer:\n"}
{"question": "A 72-year-old woman is admitted to the intensive care unit for shortness of breath and palpitations. A cardiac catheterization is performed and measurements of the left ventricular volume and pressure at different points in the cardiac cycle are obtained. The patient's pressure-volume loop (gray) is shown with a normal pressure-volume loop (black) for comparison. Which of the following is the most likely underlying cause of this patient's symptoms?", "answer": "Increased ventricular wall stiffness", "options": {"A": "Mitral valve regurgitation", "B": "Increased systemic vascular resistance", "C": "Increased ventricular wall stiffness", "D": "Impaired left ventricular contractility"}, "meta_info": "step1", "answer_idx": "C", "metamap_phrases": ["72 year old woman", "admitted to", "intensive care unit", "shortness of breath", "palpitations", "cardiac catheterization", "performed", "measurements", "left ventricular volume", "pressure", "different points", "cardiac cycle", "obtained", "patient's pressure-volume loop", "gray", "shown", "normal pressure-volume loop", "black", "comparison", "following", "most likely underlying cause", "patient's symptoms"], "model_answer": "To determine the most likely underlying cause of the patient's symptoms, let's analyze the question and the options:\n\n1. The patient is a 72-year-old woman with **shortness of breath and palpitations**, suggesting possible heart failure or valvular disease.\n2. The **pressure-volume loop** is provided, with the patient's loop (gray) compared to a normal loop (black). While the exact loop isn't visualized here, the question implies a deviation from normal physiology.\n3. Key possibilities based on the options:\n   - **Mitral valve regurgitation (A)**: This would show a **larger end-systolic volume** (due to backflow into the atrium) and a **reduced stroke volume**, with a loop shifted rightward and a \"scooped\" appearance in the ejection phase. This is a common cause of dyspnea and palpitations in older adults due to volume overload.\n   - **Increased systemic vascular resistance (B)**: This would increase **afterload**, shifting the loop upward and leftward (higher pressures, smaller volumes), but this is less likely to directly cause palpitations.\n   - **Increased ventricular wall stiffness (C)**: This would suggest **diastolic dysfunction**, with a steeper end-diastolic pressure-volume relationship, but the loop would still resemble a normal shape.\n   - **Impaired left ventricular contractility (D)**: This would show a **reduced ejection fraction**, with a smaller, right-shifted loop, but mitral regurgitation is more likely given the symptoms.\n\nGiven the patient's age and symptoms (shortness of breath and palpitations), **mitral valve regurgitation (A)** is the most likely cause, as it leads to volume overload and left atrial enlargement, which can cause these symptoms and alter the pressure-volume loop as described.\n\n[A]", "fact_gen_query": "\n    nQuestion:\nA 72-year-old woman is admitted to the intensive care unit for shortness of breath and palpitations. A cardiac catheterization is performed and measurements of the left ventricular volume and pressure at different points in the cardiac cycle are obtained. The patient's pressure-volume loop (gray) is shown with a normal pressure-volume loop (black) for comparison. Which of the following is the most likely underlying cause of this patient's symptoms?\n\n Option:\nMitral valve regurgitation;\nIncreased systemic vascular resistance;\nIncreased ventricular wall stiffness;\nImpaired left ventricular contractility;\n\n\n Answer:\nIncreased ventricular wall stiffness\n For this QA example, you need to give netural fact info for each\n    option according to question context, so that later user can infer out the \n    correct answer from these facts. The template of facts is [option1_name:fact| option2_name:fact|...],e.g: [Ampicillin:High resistance, not first-line. | Ceftriaxone:Overkill (for pyelonephritis/severe UTI).]\n", "hinted_gen_query": "\n    Question:\nA 72-year-old woman is admitted to the intensive care unit for shortness of breath and palpitations. A cardiac catheterization is performed and measurements of the left ventricular volume and pressure at different points in the cardiac cycle are obtained. The patient's pressure-volume loop (gray) is shown with a normal pressure-volume loop (black) for comparison. Which of the following is the most likely underlying cause of this patient's symptoms?\n\n Option:\nA:Mitral valve regurgitation;\nB:Increased systemic vascular resistance;\nC:Increased ventricular wall stiffness;\nD:Impaired left ventricular contractility;\n \n\n Hint:\nNone \n\n Answer:\n"}
{"question": "A 22-year-old woman is brought to the emergency department because of a 2-day history of fever, intermittent rigors, and night sweats. She also has a 1-month history of progressive fatigue. Five weeks ago, she was hospitalized and received intravenous antibiotics for treatment of bacterial meningitis while visiting relatives in Guatemala. Her temperature is 39.4°C (102.9°F), pulse is 130/min, and blood pressure is 105/70 mm Hg. Examination shows pallor and scattered petechiae and ecchymoses. Laboratory studies show a hemoglobin concentration of 9.0 g/dL, a leukocyte count of 1,100/mm3 with 30% segmented neutrophils, and a platelet count of 20,000/mm3 . Blood cultures grow coagulase-negative staphylococci. The patient was most likely treated with which of the following antibiotics?", "answer": "Chloramphenicol", "options": {"A": "Doxycycline", "B": "Trimethoprim/sulfamethoxazole", "C": "Linezolid", "D": "Chloramphenicol"}, "meta_info": "step1", "answer_idx": "D", "metamap_phrases": ["year old woman", "brought", "emergency department", "2-day history", "fever", "intermittent rigors", "night sweats", "1 month history", "progressive fatigue", "Five weeks", "hospitalized", "received intravenous antibiotics", "treatment", "bacterial meningitis", "visiting relatives", "Guatemala", "temperature", "4C", "9F", "pulse", "min", "blood pressure", "70 mm Hg", "Examination shows pallor", "scattered petechiae", "ecchymoses", "Laboratory studies show a hemoglobin concentration", "9.0 g/dL", "leukocyte count", "1 100 mm3", "30", "segmented neutrophils", "platelet count of 20", "mm3", "Blood cultures", "coagulase-negative staphylococci", "patient", "most likely treated with", "following antibiotics"], "model_answer": "The patient's presentation includes fever, rigors, night sweats, fatigue, pallor, petechiae, ecchymoses, pancytopenia, and blood cultures growing coagulase-negative staphylococci. These findings are consistent with bone marrow suppression, which is a known adverse effect of chloramphenicol. Additionally, chloramphenicol is commonly used in developing countries (like Guatemala) for the treatment of bacterial meningitis due to its broad-spectrum coverage and low cost.\n\nThe other antibiotics listed (doxycycline, trimethoprim/sulfamethoxazole, and linezolid) are less likely to cause bone marrow suppression and are not typically first-line treatments for bacterial meningitis in this context.\n\n[D]", "fact_gen_query": "\n    nQuestion:\nA 22-year-old woman is brought to the emergency department because of a 2-day history of fever, intermittent rigors, and night sweats. She also has a 1-month history of progressive fatigue. Five weeks ago, she was hospitalized and received intravenous antibiotics for treatment of bacterial meningitis while visiting relatives in Guatemala. Her temperature is 39.4°C (102.9°F), pulse is 130/min, and blood pressure is 105/70 mm Hg. Examination shows pallor and scattered petechiae and ecchymoses. Laboratory studies show a hemoglobin concentration of 9.0 g/dL, a leukocyte count of 1,100/mm3 with 30% segmented neutrophils, and a platelet count of 20,000/mm3 . Blood cultures grow coagulase-negative staphylococci. The patient was most likely treated with which of the following antibiotics?\n\n Option:\nDoxycycline;\nTrimethoprim/sulfamethoxazole;\nLinezolid;\nChloramphenicol;\n\n\n Answer:\nChloramphenicol\n For this QA example, you need to give netural fact info for each\n    option according to question context, so that later user can infer out the \n    correct answer from these facts. The template of facts is [option1_name:fact| option2_name:fact|...],e.g: [Ampicillin:High resistance, not first-line. | Ceftriaxone:Overkill (for pyelonephritis/severe UTI).]\n", "hinted_gen_query": "\n    Question:\nA 22-year-old woman is brought to the emergency department because of a 2-day history of fever, intermittent rigors, and night sweats. She also has a 1-month history of progressive fatigue. Five weeks ago, she was hospitalized and received intravenous antibiotics for treatment of bacterial meningitis while visiting relatives in Guatemala. Her temperature is 39.4°C (102.9°F), pulse is 130/min, and blood pressure is 105/70 mm Hg. Examination shows pallor and scattered petechiae and ecchymoses. Laboratory studies show a hemoglobin concentration of 9.0 g/dL, a leukocyte count of 1,100/mm3 with 30% segmented neutrophils, and a platelet count of 20,000/mm3 . Blood cultures grow coagulase-negative staphylococci. The patient was most likely treated with which of the following antibiotics?\n\n Option:\nA:Doxycycline;\nB:Trimethoprim/sulfamethoxazole;\nC:Linezolid;\nD:Chloramphenicol;\n \n\n Hint:\nNone \n\n Answer:\n"}
{"question": "An otherwise healthy 50-year-old man comes to the physician because of a 6-month history of increasingly frequent episodes of upper abdominal pain, nausea, vomiting, and diarrhea. He has had a 3.2-kg (7-lb) weight loss during this time. Physical examination shows bilateral pitting pedal edema. An endoscopy shows prominent rugae in the gastric fundus. Biopsy shows parietal cell atrophy. Which of the following is the most likely underlying cause?", "answer": "Proliferation of gastric mucus-producing cells", "options": {"A": "Serotonin-secreting gastric tumor", "B": "Proliferation of gastric mucus-producing cells", "C": "Excessive somatostatin secretion", "D": "Ectopic secretion of gastrin"}, "meta_info": "step1", "answer_idx": "B", "metamap_phrases": ["healthy 50 year old man", "physician", "of", "month history", "frequent episodes", "upper abdominal pain", "nausea", "vomiting", "diarrhea", "3.2 kg", "weight loss", "time", "Physical examination shows bilateral pitting pedal edema", "endoscopy shows prominent rugae", "gastric", "Biopsy shows parietal cell atrophy", "following", "most likely underlying cause"], "model_answer": "The patient's symptoms and findings (upper abdominal pain, nausea, vomiting, diarrhea, weight loss, pedal edema, prominent rugae in the gastric fundus, and parietal cell atrophy) are consistent with **atrophic gastritis** leading to **pernicious anemia**. The underlying cause is an **autoimmune destruction of parietal cells**, which results in decreased intrinsic factor production and subsequent vitamin B12 deficiency. \n\nAmong the options provided, none directly describe autoimmune destruction of parietal cells. However, the closest option that could be associated with gastric pathology (though not the primary cause) is:\n\n**D: Ectopic secretion of gastrin** (as in Zollinger-Ellison syndrome, which can cause gastric hyperplasia but does not typically lead to parietal cell atrophy). \n\nHowever, the most accurate answer based on the clinical picture is **autoimmune atrophic gastritis**, which is not explicitly listed. If forced to choose from the given options, **D** is the least incorrect, but it is not the primary underlying cause. \n\nThe correct answer is [D]. \n\n(Note: The question seems to have flawed options, as none perfectly match the most likely underlying cause of autoimmune atrophic gastritis.)", "fact_gen_query": "\n    nQuestion:\nAn otherwise healthy 50-year-old man comes to the physician because of a 6-month history of increasingly frequent episodes of upper abdominal pain, nausea, vomiting, and diarrhea. He has had a 3.2-kg (7-lb) weight loss during this time. Physical examination shows bilateral pitting pedal edema. An endoscopy shows prominent rugae in the gastric fundus. Biopsy shows parietal cell atrophy. Which of the following is the most likely underlying cause?\n\n Option:\nSerotonin-secreting gastric tumor;\nProliferation of gastric mucus-producing cells;\nExcessive somatostatin secretion;\nEctopic secretion of gastrin;\n\n\n Answer:\nProliferation of gastric mucus-producing cells\n For this QA example, you need to give netural fact info for each\n    option according to question context, so that later user can infer out the \n    correct answer from these facts. The template of facts is [option1_name:fact| option2_name:fact|...],e.g: [Ampicillin:High resistance, not first-line. | Ceftriaxone:Overkill (for pyelonephritis/severe UTI).]\n", "hinted_gen_query": "\n    Question:\nAn otherwise healthy 50-year-old man comes to the physician because of a 6-month history of increasingly frequent episodes of upper abdominal pain, nausea, vomiting, and diarrhea. He has had a 3.2-kg (7-lb) weight loss during this time. Physical examination shows bilateral pitting pedal edema. An endoscopy shows prominent rugae in the gastric fundus. Biopsy shows parietal cell atrophy. Which of the following is the most likely underlying cause?\n\n Option:\nA:Serotonin-secreting gastric tumor;\nB:Proliferation of gastric mucus-producing cells;\nC:Excessive somatostatin secretion;\nD:Ectopic secretion of gastrin;\n \n\n Hint:\nNone \n\n Answer:\n"}
{"question": "A 27-year-old man presents to the emergency department. He was brought in by staff from the homeless shelter when they found him unresponsive. The patient is a known IV drug abuser but otherwise has an unknown past medical history. He currently attends a methadone clinic. His temperature is 99.5°F (37.5°C), blood pressure is 97/48 mmHg, pulse is 140/min, respirations are 29/min, and oxygen saturation is 98% on room air. Initial laboratory values are shown below.\n\nSerum:\nNa+: 139 mEq/L\nCl-: 100 mEq/L\nK+: 6.3 mEq/L\nHCO3-: 17 mEq/L\nGlucose: 589 mg/dL\n\nThe patient is given treatment. After treatment, his temperature is 99.5°F (37.5°C), blood pressure is 117/78 mmHg, pulse is 100/min, respirations are 23/min, and oxygen saturation is 98% on room air. His laboratory values are seen below.\n\nSerum:\nNa+: 139 mEq/L\nCl-: 100 mEq/L\nK+: 4.3 mEq/L\nHCO3-: 19 mEq/L\nGlucose: 90 mg/dL\n\nWhich of the following is the best next step in management?", "answer": "Insulin, potassium, IV fluids, and glucose", "options": {"A": "Insulin, potassium, IV fluids, and glucose", "B": "IV fluids only", "C": "Oral rehydration", "D": "Supportive therapy and close monitoring"}, "meta_info": "step2&3", "answer_idx": "A", "metamap_phrases": ["27 year old man presents", "emergency department", "brought", "staff", "homeless shelter", "found", "unresponsive", "patient", "known IV drug abuser", "unknown past medical history", "currently attends", "methadone clinic", "temperature", "99", "blood pressure", "97 48 mmHg", "pulse", "min", "respirations", "29 min", "oxygen saturation", "98", "room air", "Initial laboratory values", "shown", "Serum", "Na", "mEq/L Cl", "100 mEq/L K", "6.3 mEq/L HCO3", "mEq/L Glucose", "mg/dL", "patient", "given treatment", "treatment", "temperature", "99", "blood pressure", "mmHg", "pulse", "100 min", "respirations", "23 min", "oxygen saturation", "98", "room air", "laboratory values", "seen", "Serum", "Na", "mEq/L Cl", "100 mEq/L K", "4", "mEq/L HCO3", "mEq/L Glucose", "90 mg/dL", "following", "best next step", "management"], "model_answer": "The patient presented with hyperglycemia (glucose 589 mg/dL), hyperkalemia (K+ 6.3 mEq/L), and metabolic acidosis (HCO3- 17 mEq/L), which improved after treatment (glucose 90 mg/dL, K+ 4.3 mEq/L, HCO3- 19 mEq/L). The most likely diagnosis is diabetic ketoacidosis (DKA), which was treated with insulin, potassium, IV fluids, and glucose (option A). \n\nAfter resolution of DKA, the best next step is supportive therapy and close monitoring (option D) to ensure stability and prevent recurrence. \n\nThe final answer is [D].", "fact_gen_query": "\n    nQuestion:\nA 27-year-old man presents to the emergency department. He was brought in by staff from the homeless shelter when they found him unresponsive. The patient is a known IV drug abuser but otherwise has an unknown past medical history. He currently attends a methadone clinic. His temperature is 99.5°F (37.5°C), blood pressure is 97/48 mmHg, pulse is 140/min, respirations are 29/min, and oxygen saturation is 98% on room air. Initial laboratory values are shown below.\n\nSerum:\nNa+: 139 mEq/L\nCl-: 100 mEq/L\nK+: 6.3 mEq/L\nHCO3-: 17 mEq/L\nGlucose: 589 mg/dL\n\nThe patient is given treatment. After treatment, his temperature is 99.5°F (37.5°C), blood pressure is 117/78 mmHg, pulse is 100/min, respirations are 23/min, and oxygen saturation is 98% on room air. His laboratory values are seen below.\n\nSerum:\nNa+: 139 mEq/L\nCl-: 100 mEq/L\nK+: 4.3 mEq/L\nHCO3-: 19 mEq/L\nGlucose: 90 mg/dL\n\nWhich of the following is the best next step in management?\n\n Option:\nInsulin, potassium, IV fluids, and glucose;\nIV fluids only;\nOral rehydration;\nSupportive therapy and close monitoring;\n\n\n Answer:\nInsulin, potassium, IV fluids, and glucose\n For this QA example, you need to give netural fact info for each\n    option according to question context, so that later user can infer out the \n    correct answer from these facts. The template of facts is [option1_name:fact| option2_name:fact|...],e.g: [Ampicillin:High resistance, not first-line. | Ceftriaxone:Overkill (for pyelonephritis/severe UTI).]\n", "hinted_gen_query": "\n    Question:\nA 27-year-old man presents to the emergency department. He was brought in by staff from the homeless shelter when they found him unresponsive. The patient is a known IV drug abuser but otherwise has an unknown past medical history. He currently attends a methadone clinic. His temperature is 99.5°F (37.5°C), blood pressure is 97/48 mmHg, pulse is 140/min, respirations are 29/min, and oxygen saturation is 98% on room air. Initial laboratory values are shown below.\n\nSerum:\nNa+: 139 mEq/L\nCl-: 100 mEq/L\nK+: 6.3 mEq/L\nHCO3-: 17 mEq/L\nGlucose: 589 mg/dL\n\nThe patient is given treatment. After treatment, his temperature is 99.5°F (37.5°C), blood pressure is 117/78 mmHg, pulse is 100/min, respirations are 23/min, and oxygen saturation is 98% on room air. His laboratory values are seen below.\n\nSerum:\nNa+: 139 mEq/L\nCl-: 100 mEq/L\nK+: 4.3 mEq/L\nHCO3-: 19 mEq/L\nGlucose: 90 mg/dL\n\nWhich of the following is the best next step in management?\n\n Option:\nA:Insulin, potassium, IV fluids, and glucose;\nB:IV fluids only;\nC:Oral rehydration;\nD:Supportive therapy and close monitoring;\n \n\n Hint:\nNone \n\n Answer:\n"}
{"question": "A 67-year-old man who was diagnosed with arthritis 16 years ago presents with right knee swelling and pain. His left knee was swollen a few weeks ago, but now with both joints affected, he has difficulty walking and feels frustrated. He also has back pain which makes it extremely difficult to move around and be active during the day. He says his pain significantly improves with rest. He also suffers from dandruff for which he uses special shampoos. Physical examination is notable for pitting of his nails. Which of the following is the most likely diagnosis?", "answer": "Psoriatic arthritis", "options": {"A": "Psoriatic arthritis", "B": "Arthritis mutilans", "C": "Rheumatoid arthritis", "D": "Mixed connective tissue disease"}, "meta_info": "step2&3", "answer_idx": "A", "metamap_phrases": ["67 year old man", "diagnosed", "arthritis", "years", "presents", "right", "pain", "left knee", "swollen", "few weeks", "now", "joints affected", "difficulty walking", "feels frustrated", "back pain", "makes", "extremely difficult to move", "active", "day", "pain", "improves", "rest", "suffers", "dandruff", "uses special shampoos", "Physical examination", "notable", "pitting of", "nails", "following", "most likely diagnosis"], "model_answer": "The patient's history of arthritis, nail pitting, dandruff (which could be scalp psoriasis), and improvement of pain with rest suggests psoriatic arthritis. Psoriatic arthritis is associated with psoriasis and can present with nail changes such as pitting. The involvement of both axial and peripheral joints, along with the improvement of symptoms with rest, further supports this diagnosis.\n\nThe most likely diagnosis is [A:Psoriatic arthritis].", "fact_gen_query": "\n    nQuestion:\nA 67-year-old man who was diagnosed with arthritis 16 years ago presents with right knee swelling and pain. His left knee was swollen a few weeks ago, but now with both joints affected, he has difficulty walking and feels frustrated. He also has back pain which makes it extremely difficult to move around and be active during the day. He says his pain significantly improves with rest. He also suffers from dandruff for which he uses special shampoos. Physical examination is notable for pitting of his nails. Which of the following is the most likely diagnosis?\n\n Option:\nPsoriatic arthritis;\nArthritis mutilans;\nRheumatoid arthritis;\nMixed connective tissue disease;\n\n\n Answer:\nPsoriatic arthritis\n For this QA example, you need to give netural fact info for each\n    option according to question context, so that later user can infer out the \n    correct answer from these facts. The template of facts is [option1_name:fact| option2_name:fact|...],e.g: [Ampicillin:High resistance, not first-line. | Ceftriaxone:Overkill (for pyelonephritis/severe UTI).]\n", "hinted_gen_query": "\n    Question:\nA 67-year-old man who was diagnosed with arthritis 16 years ago presents with right knee swelling and pain. His left knee was swollen a few weeks ago, but now with both joints affected, he has difficulty walking and feels frustrated. He also has back pain which makes it extremely difficult to move around and be active during the day. He says his pain significantly improves with rest. He also suffers from dandruff for which he uses special shampoos. Physical examination is notable for pitting of his nails. Which of the following is the most likely diagnosis?\n\n Option:\nA:Psoriatic arthritis;\nB:Arthritis mutilans;\nC:Rheumatoid arthritis;\nD:Mixed connective tissue disease;\n \n\n Hint:\nNone \n\n Answer:\n"}
{"question": "A 65-year-old woman schedules an appointment with her physician for evaluation of weight loss and weakness. The weakness is more noticeable when climbing stairs and combing hair. The weakness improves after brief exercise. She also has bladder incontinence for the past 4 weeks and was given an anticholinesterase agent with no improvement. What is the most likely cause of the symptoms?", "answer": "Paraneoplastic syndrome from small cell carcinoma of the lung", "options": {"A": "Duchenne muscular dystrophy", "B": "Hypothyroidism", "C": "Myasthenia gravis", "D": "Paraneoplastic syndrome from small cell carcinoma of the lung"}, "meta_info": "step1", "answer_idx": "D", "metamap_phrases": ["65 year old woman schedules", "appointment", "physician", "evaluation of weight loss", "weakness", "weakness", "more", "climbing stairs", "combing hair", "weakness improves", "brief exercise", "bladder incontinence", "past 4 weeks", "given", "anticholinesterase agent", "improvement", "most likely cause", "symptoms"], "model_answer": "The patient's symptoms include weakness that improves with brief exercise (suggestive of Lambert-Eaton myasthenic syndrome, LEMS), bladder incontinence, and no improvement with anticholinesterase agents (which would typically help in myasthenia gravis). LEMS is often associated with small cell carcinoma of the lung as a paraneoplastic syndrome. \n\nThe most likely cause of the symptoms is [D:Paraneoplastic syndrome from small cell carcinoma of the lung].", "fact_gen_query": "\n    nQuestion:\nA 65-year-old woman schedules an appointment with her physician for evaluation of weight loss and weakness. The weakness is more noticeable when climbing stairs and combing hair. The weakness improves after brief exercise. She also has bladder incontinence for the past 4 weeks and was given an anticholinesterase agent with no improvement. What is the most likely cause of the symptoms?\n\n Option:\nDuchenne muscular dystrophy;\nHypothyroidism;\nMyasthenia gravis;\nParaneoplastic syndrome from small cell carcinoma of the lung;\n\n\n Answer:\nParaneoplastic syndrome from small cell carcinoma of the lung\n For this QA example, you need to give netural fact info for each\n    option according to question context, so that later user can infer out the \n    correct answer from these facts. The template of facts is [option1_name:fact| option2_name:fact|...],e.g: [Ampicillin:High resistance, not first-line. | Ceftriaxone:Overkill (for pyelonephritis/severe UTI).]\n", "hinted_gen_query": "\n    Question:\nA 65-year-old woman schedules an appointment with her physician for evaluation of weight loss and weakness. The weakness is more noticeable when climbing stairs and combing hair. The weakness improves after brief exercise. She also has bladder incontinence for the past 4 weeks and was given an anticholinesterase agent with no improvement. What is the most likely cause of the symptoms?\n\n Option:\nA:Duchenne muscular dystrophy;\nB:Hypothyroidism;\nC:Myasthenia gravis;\nD:Paraneoplastic syndrome from small cell carcinoma of the lung;\n \n\n Hint:\nNone \n\n Answer:\n"}
{"question": "A 3-month-old boy presents to his pediatrician with persistent diarrhea, oral candidiasis, and signs and symptoms suggestive of respiratory syncytial virus (RSV) pneumonia. His weight is in the 10th percentile. He is being evaluated for an immunodeficiency disease. Laboratory results for the HIV are negative by PCR. Which of the following is the most likely cause of these findings in this patient?", "answer": "Defective T cell function", "options": {"A": "Defective T cell function", "B": "Grossly reduced levels of B cells", "C": "Defective isotype switching", "D": "Selective IgA deficiency"}, "meta_info": "step1", "answer_idx": "A", "metamap_phrases": ["3 month old boy presents", "pediatrician", "persistent diarrhea", "oral candidiasis", "signs", "symptoms suggestive of respiratory syncytial virus", "pneumonia", "weight", "percentile", "evaluated", "immunodeficiency disease", "Laboratory results", "HIV", "negative", "PCR", "following", "most likely cause", "findings", "patient"], "model_answer": "The most likely cause of the findings in this 3-month-old boy with persistent diarrhea, oral candidiasis, RSV pneumonia, failure to thrive, and negative HIV PCR is **defective T cell function**. \n\n- The clinical presentation (oral candidiasis, persistent diarrhea, and RSV pneumonia) suggests a **T cell immunodeficiency**, as these are typical of opportunistic infections seen in T cell dysfunction. \n- HIV PCR is negative, ruling out HIV as a cause. \n- Failure to thrive (weight in the 10th percentile) is also consistent with a T cell defect, as T cells play a critical role in immune defense against infections and maintaining overall health. \n- While B cell defects (Options B, C, D) can cause immunodeficiency, they typically present with recurrent bacterial infections (not fungal or viral like in this case). Selective IgA deficiency (Option D) is usually milder and often asymptomatic in infancy. \n\nThus, the correct answer is **[A]**.", "fact_gen_query": "\n    nQuestion:\nA 3-month-old boy presents to his pediatrician with persistent diarrhea, oral candidiasis, and signs and symptoms suggestive of respiratory syncytial virus (RSV) pneumonia. His weight is in the 10th percentile. He is being evaluated for an immunodeficiency disease. Laboratory results for the HIV are negative by PCR. Which of the following is the most likely cause of these findings in this patient?\n\n Option:\nDefective T cell function;\nGrossly reduced levels of B cells;\nDefective isotype switching;\nSelective IgA deficiency;\n\n\n Answer:\nDefective T cell function\n For this QA example, you need to give netural fact info for each\n    option according to question context, so that later user can infer out the \n    correct answer from these facts. The template of facts is [option1_name:fact| option2_name:fact|...],e.g: [Ampicillin:High resistance, not first-line. | Ceftriaxone:Overkill (for pyelonephritis/severe UTI).]\n", "hinted_gen_query": "\n    Question:\nA 3-month-old boy presents to his pediatrician with persistent diarrhea, oral candidiasis, and signs and symptoms suggestive of respiratory syncytial virus (RSV) pneumonia. His weight is in the 10th percentile. He is being evaluated for an immunodeficiency disease. Laboratory results for the HIV are negative by PCR. Which of the following is the most likely cause of these findings in this patient?\n\n Option:\nA:Defective T cell function;\nB:Grossly reduced levels of B cells;\nC:Defective isotype switching;\nD:Selective IgA deficiency;\n \n\n Hint:\nNone \n\n Answer:\n"}
{"question": "A 53-year-old man with recurrent pancreatic adenocarcinoma is enrolled in a clinical trial for a novel chemotherapeutic agent that his physician believes may be beneficial to his condition. The novel drug was previously tested in a small population and is now undergoing a larger phase 3 trial in preparation for FDA approval. A dose-response trial had the following results:\n\n10 mg dose - 6/59 patients demonstrated improvement\n20 mg dose - 19/49 patients demonstrated improvement\n30 mg dose - 26/53 patients demonstrated improvement\n40 mg dose - 46/51 patients demonstrated improvement\n\nThe same trial also had the following safety profile:\n\n20 mg dose - 5/49 patients had a treatment related adverse event\n40 mg dose - 11/51 patients had a treatment related adverse event\n60 mg dose - 15/42 patients had a treatment related adverse event\n80 mg dose - 23/47 patients had a treatment related adverse event\n100 mg dose - 47/52 patients had a treatment related adverse event\n\nBased on this study, which of the following represents the most likely therapeutic index for this novel chemotherapeutic agent?", "answer": "2.67", "options": {"A": "0.375", "B": "0.5", "C": "2.5", "D": "2.67"}, "meta_info": "step1", "answer_idx": "D", "metamap_phrases": ["year old man", "recurrent pancreatic adenocarcinoma", "enrolled", "clinical trial", "novel chemotherapeutic agent", "physician", "condition", "novel drug", "tested", "small population", "now", "larger phase 3 trial", "preparation", "FDA approval", "dose-response trial", "following results", "10 mg dose", "6 59 patients", "improvement 20 mg dose", "patients", "improvement 30 mg dose", "patients", "improvement 40 mg dose", "46", "patients", "improvement", "same trial", "following safety profile", "20 mg dose", "patients", "treatment related adverse event 40 mg dose", "patients", "treatment related adverse event 60 mg dose", "patients", "treatment related adverse event 80 mg dose", "23", "patients", "treatment related adverse event 100 mg dose", "patients", "treatment related adverse event", "Based", "study", "following represents", "most likely therapeutic index", "novel chemotherapeutic agent"], "model_answer": "To determine the most likely therapeutic index for this novel chemotherapeutic agent, we need to compare the dose that provides therapeutic benefit (effective dose) with the dose that causes toxicity (toxic dose). The therapeutic index is typically calculated as the ratio of the toxic dose (TD50 or similar) to the effective dose (ED50 or similar). \n\n### Step 1: Identify the most effective dose with an acceptable safety profile.\nFrom the dose-response data:\n- **40 mg dose**: 46/51 patients demonstrated improvement (~90.2% response rate), which is highly effective.\n- The next lower dose (30 mg) had a response rate of 26/53 (~49.1%), which is significantly less effective.\n\nFrom the safety data:\n- At **40 mg**, 11/51 patients had adverse events (~21.6% toxicity).\n- At **60 mg**, toxicity increases to 15/42 (~35.7%), which is less favorable.\n\nThus, **40 mg** appears to be the optimal dose balancing efficacy and safety.\n\n### Step 2: Estimate the ED50 and TD50.\n- **ED50**: The dose at which 50% of patients respond. From the data:\n  - 20 mg: ~38.8% response (19/49).\n  - 30 mg: ~49.1% response (26/53).\n  - The ED50 likely lies between 20 mg and 30 mg. For simplicity, we can approximate it as **25 mg**.\n\n- **TD50**: The dose at which 50% of patients experience toxicity. From the safety data:\n  - 60 mg: ~35.7% toxicity (15/42).\n  - 80 mg: ~48.9% toxicity (23/47).\n  - 100 mg: ~90.4% toxicity (47/52).\n  - The TD50 likely lies between 80 mg and 100 mg. For simplicity, we can approximate it as **90 mg**.\n\n### Step 3: Calculate the therapeutic index.\nTherapeutic Index (TI) = TD50 / ED50 = 90 mg / 25 mg = **3.6**. \n\nHowever, this is not among the options. Let's reconsider the ED50 and TD50 more conservatively:\n- If ED50 is closer to **20 mg** (where response is ~38.8%), and TD50 is closer to **80 mg** (where toxicity is ~48.9%), then TI = 80 / 20 = **4.0** (still not an option).\n- Alternatively, if we use the lowest toxic dose (20 mg: 5/49 toxicity ~10.2%) and highest effective dose (40 mg: 46/51 efficacy ~90.2%), the ratio is less straightforward, but this approach is less standard.\n\nGiven the options, the closest reasonable estimate is **2.67 (Option D)**, which may reflect a more conservative calculation or rounding. \n\nThus, the most likely answer is: [D]", "fact_gen_query": "\n    nQuestion:\nA 53-year-old man with recurrent pancreatic adenocarcinoma is enrolled in a clinical trial for a novel chemotherapeutic agent that his physician believes may be beneficial to his condition. The novel drug was previously tested in a small population and is now undergoing a larger phase 3 trial in preparation for FDA approval. A dose-response trial had the following results:\n\n10 mg dose - 6/59 patients demonstrated improvement\n20 mg dose - 19/49 patients demonstrated improvement\n30 mg dose - 26/53 patients demonstrated improvement\n40 mg dose - 46/51 patients demonstrated improvement\n\nThe same trial also had the following safety profile:\n\n20 mg dose - 5/49 patients had a treatment related adverse event\n40 mg dose - 11/51 patients had a treatment related adverse event\n60 mg dose - 15/42 patients had a treatment related adverse event\n80 mg dose - 23/47 patients had a treatment related adverse event\n100 mg dose - 47/52 patients had a treatment related adverse event\n\nBased on this study, which of the following represents the most likely therapeutic index for this novel chemotherapeutic agent?\n\n Option:\n0.375;\n0.5;\n2.5;\n2.67;\n\n\n Answer:\n2.67\n For this QA example, you need to give netural fact info for each\n    option according to question context, so that later user can infer out the \n    correct answer from these facts. The template of facts is [option1_name:fact| option2_name:fact|...],e.g: [Ampicillin:High resistance, not first-line. | Ceftriaxone:Overkill (for pyelonephritis/severe UTI).]\n", "hinted_gen_query": "\n    Question:\nA 53-year-old man with recurrent pancreatic adenocarcinoma is enrolled in a clinical trial for a novel chemotherapeutic agent that his physician believes may be beneficial to his condition. The novel drug was previously tested in a small population and is now undergoing a larger phase 3 trial in preparation for FDA approval. A dose-response trial had the following results:\n\n10 mg dose - 6/59 patients demonstrated improvement\n20 mg dose - 19/49 patients demonstrated improvement\n30 mg dose - 26/53 patients demonstrated improvement\n40 mg dose - 46/51 patients demonstrated improvement\n\nThe same trial also had the following safety profile:\n\n20 mg dose - 5/49 patients had a treatment related adverse event\n40 mg dose - 11/51 patients had a treatment related adverse event\n60 mg dose - 15/42 patients had a treatment related adverse event\n80 mg dose - 23/47 patients had a treatment related adverse event\n100 mg dose - 47/52 patients had a treatment related adverse event\n\nBased on this study, which of the following represents the most likely therapeutic index for this novel chemotherapeutic agent?\n\n Option:\nA:0.375;\nB:0.5;\nC:2.5;\nD:2.67;\n \n\n Hint:\nNone \n\n Answer:\n"}
{"question": "A 67-year-old male is seen by neurology after he was noticed to be speaking strangely by his family. After acute treatment with tissue plasminogen activator (tPA), the patient is able to recover most of his speech. Subsequent neurologic exam finds that the patient is fluent while speaking and is able to comprehend both one and two step instructions. Noticeably the patient remains unable to complete tasks involving verbal repetition. Residual damage to which of the following structures is most likely responsible for this patient's syndrome?", "answer": "Arcuate fasciculus", "options": {"A": "Arcuate fasciculus", "B": "Superior temporal gyrus", "C": "Inferior frontal gyrus + superior temporal gyrus", "D": "Arcuate fasciculus + inferior frontal gyrus + superior temporal gyrus"}, "meta_info": "step1", "answer_idx": "A", "metamap_phrases": ["67 year old male", "seen", "neurology", "to", "speaking", "family", "acute treatment", "tissue plasminogen activator", "patient", "able to recover most", "speech", "Subsequent neurologic exam finds", "patient", "fluent", "speaking", "able to", "one", "two step instructions", "patient", "unable to complete tasks involving verbal repetition", "Residual damage", "following structures", "most likely responsible", "patient's syndrome"], "model_answer": "The patient's symptoms are consistent with conduction aphasia, which is characterized by fluent speech, intact comprehension, but impaired repetition. This is typically caused by damage to the arcuate fasciculus, which connects Broca's area (inferior frontal gyrus) and Wernicke's area (superior temporal gyrus). \n\nThe most likely structure responsible for this patient's syndrome is the arcuate fasciculus.\n\n[A]", "fact_gen_query": "\n    nQuestion:\nA 67-year-old male is seen by neurology after he was noticed to be speaking strangely by his family. After acute treatment with tissue plasminogen activator (tPA), the patient is able to recover most of his speech. Subsequent neurologic exam finds that the patient is fluent while speaking and is able to comprehend both one and two step instructions. Noticeably the patient remains unable to complete tasks involving verbal repetition. Residual damage to which of the following structures is most likely responsible for this patient's syndrome?\n\n Option:\nArcuate fasciculus;\nSuperior temporal gyrus;\nInferior frontal gyrus + superior temporal gyrus;\nArcuate fasciculus + inferior frontal gyrus + superior temporal gyrus;\n\n\n Answer:\nArcuate fasciculus\n For this QA example, you need to give netural fact info for each\n    option according to question context, so that later user can infer out the \n    correct answer from these facts. The template of facts is [option1_name:fact| option2_name:fact|...],e.g: [Ampicillin:High resistance, not first-line. | Ceftriaxone:Overkill (for pyelonephritis/severe UTI).]\n", "hinted_gen_query": "\n    Question:\nA 67-year-old male is seen by neurology after he was noticed to be speaking strangely by his family. After acute treatment with tissue plasminogen activator (tPA), the patient is able to recover most of his speech. Subsequent neurologic exam finds that the patient is fluent while speaking and is able to comprehend both one and two step instructions. Noticeably the patient remains unable to complete tasks involving verbal repetition. Residual damage to which of the following structures is most likely responsible for this patient's syndrome?\n\n Option:\nA:Arcuate fasciculus;\nB:Superior temporal gyrus;\nC:Inferior frontal gyrus + superior temporal gyrus;\nD:Arcuate fasciculus + inferior frontal gyrus + superior temporal gyrus;\n \n\n Hint:\nNone \n\n Answer:\n"}
{"question": "A 27-year-old woman presents to the office with concerns about her long struggle with her physical appearance since adolescence. She says she has always been \"large\" and was constantly targeted by her classmates and coworkers for being so. Her main concern at the moment is her acne and unwanted facial hair on her upper lip, for which she often visits a local spa. She has tried numerous diet plans, exercise regimens, and cosmetic products with little to no effect. Recently, she underwent a glucose tolerance test that showed a plasma glucose level of 160 mg/dL (8.9 mmol/L) after 2 hours of a 75 g dose of oral glucose. She has a family history of type 2 diabetes mellitus and a menstrual cycle that occurs every 45 days. Her pulse is 72/min and the blood pressure is 138/80 mm Hg. On physical examination, her height is 160 cm (5 ft 3 in) and her weight is 85 kg (187 lb), and she has severe inflammatory acne over the cheeks and forehead and dark coarse hairs on the back. What is the most likely diagnosis of this patient?", "answer": "Polycystic ovarian syndrome (PCOS)", "options": {"A": "Hypothyroidism", "B": "Idiopathic hirsutism", "C": "Polycystic ovarian syndrome (PCOS)", "D": "Ovarian hyperthecosis"}, "meta_info": "step1", "answer_idx": "C", "metamap_phrases": ["27 year old woman presents", "office", "concerns", "long", "physical appearance", "adolescence", "always", "large", "constantly targeted", "classmates", "coworkers", "so", "main concern", "acne", "unwanted facial hair", "upper lip", "often visits", "local spa", "numerous diet plans", "exercise regimens", "cosmetic products", "little", "no effect", "Recently", "glucose tolerance test", "showed", "plasma glucose level", "160 mg", "mmol/L", "2 hours", "75 g dose", "oral glucose", "family history of type 2 diabetes mellitus", "menstrual cycle", "occurs", "days", "pulse", "72 min", "blood pressure", "80 mm Hg", "physical examination", "height", "5 ft", "weight", "85 kg", "severe inflammatory acne", "cheeks", "forehead", "dark coarse hairs", "back", "most likely diagnosis", "patient"], "model_answer": "The most likely diagnosis for this patient is [C:Polycystic ovarian syndrome (PCOS)]. \n\nThe patient's presentation includes several key features of PCOS:\n1. **Hyperandrogenism**: Acne, hirsutism (unwanted facial hair and coarse hairs on the back).\n2. **Menstrual irregularities**: Oligomenorrhea (cycles every 45 days).\n3. **Metabolic abnormalities**: Elevated 2-hour post-glucose load (160 mg/dL), family history of type 2 diabetes, and obesity (BMI ~33.2).\n4. **Clinical signs**: Obesity and acanthosis nigricans (implied by dark coarse hairs).\n\nOther options are less likely:\n- **Hypothyroidism (A)**: Does not typically cause hirsutism or hyperandrogenism.\n- **Idiopathic hirsutism (B)**: Does not explain the menstrual irregularities or metabolic abnormalities.\n- **Ovarian hyperthecosis (D)**: A rare, severe form of hyperandrogenism, usually seen in postmenopausal women and associated with very high testosterone levels. \n\nThus, the correct answer is [C].", "fact_gen_query": "\n    nQuestion:\nA 27-year-old woman presents to the office with concerns about her long struggle with her physical appearance since adolescence. She says she has always been \"large\" and was constantly targeted by her classmates and coworkers for being so. Her main concern at the moment is her acne and unwanted facial hair on her upper lip, for which she often visits a local spa. She has tried numerous diet plans, exercise regimens, and cosmetic products with little to no effect. Recently, she underwent a glucose tolerance test that showed a plasma glucose level of 160 mg/dL (8.9 mmol/L) after 2 hours of a 75 g dose of oral glucose. She has a family history of type 2 diabetes mellitus and a menstrual cycle that occurs every 45 days. Her pulse is 72/min and the blood pressure is 138/80 mm Hg. On physical examination, her height is 160 cm (5 ft 3 in) and her weight is 85 kg (187 lb), and she has severe inflammatory acne over the cheeks and forehead and dark coarse hairs on the back. What is the most likely diagnosis of this patient?\n\n Option:\nHypothyroidism;\nIdiopathic hirsutism;\nPolycystic ovarian syndrome (PCOS);\nOvarian hyperthecosis;\n\n\n Answer:\nPolycystic ovarian syndrome (PCOS)\n For this QA example, you need to give netural fact info for each\n    option according to question context, so that later user can infer out the \n    correct answer from these facts. The template of facts is [option1_name:fact| option2_name:fact|...],e.g: [Ampicillin:High resistance, not first-line. | Ceftriaxone:Overkill (for pyelonephritis/severe UTI).]\n", "hinted_gen_query": "\n    Question:\nA 27-year-old woman presents to the office with concerns about her long struggle with her physical appearance since adolescence. She says she has always been \"large\" and was constantly targeted by her classmates and coworkers for being so. Her main concern at the moment is her acne and unwanted facial hair on her upper lip, for which she often visits a local spa. She has tried numerous diet plans, exercise regimens, and cosmetic products with little to no effect. Recently, she underwent a glucose tolerance test that showed a plasma glucose level of 160 mg/dL (8.9 mmol/L) after 2 hours of a 75 g dose of oral glucose. She has a family history of type 2 diabetes mellitus and a menstrual cycle that occurs every 45 days. Her pulse is 72/min and the blood pressure is 138/80 mm Hg. On physical examination, her height is 160 cm (5 ft 3 in) and her weight is 85 kg (187 lb), and she has severe inflammatory acne over the cheeks and forehead and dark coarse hairs on the back. What is the most likely diagnosis of this patient?\n\n Option:\nA:Hypothyroidism;\nB:Idiopathic hirsutism;\nC:Polycystic ovarian syndrome (PCOS);\nD:Ovarian hyperthecosis;\n \n\n Hint:\nNone \n\n Answer:\n"}
{"question": "А 43-уеаr-old mаn рrеѕеntѕ wіth tіnglіng аnd numbnеѕѕ of the lowеr lіmbѕ for 2 wееkѕ. Не also сomрlаіnѕ of реrѕіѕtеnt раіn in his legs whісh is not relieved by over-the-counter analgesics. Past medical history is significant for type 2 dіаbеtes mellitus for 2 уеаrѕ, inconsistently managed with mеtformіn аnd glіmеріrіdе. Оn physical ехаmіnаtіon, thеrе іѕ dесrеаѕеd ѕеnѕаtіon to pain in both lower lіmbs, but deep tеndon rеflехеѕ аrе іntасt. Ніѕ vіtаl ѕіgnѕ include: blood рrеѕѕurе 122/84 mm Нg, tеmреrаturе 36.7°C (98.1°F), and rеѕріrаtorу rаtе 10/mіn. His ankle-brachial pressure index (ABPI) on the right side is 1.1. His blood sugar analyses are as follows:\nFasting 141 mg/ dL\n2 hours Post-Prandial 235 mg/ dL\nHbA1c 8.1%\nWhich of the following is the best measure to prevent the progression of the symptoms present in this patient?", "answer": "Strict blood glucose control", "options": {"A": "Use of atorvastatin", "B": "Femoro-Ileal artery bypass", "C": "Strict blood glucose control", "D": "Lower limb amputation"}, "meta_info": "step1", "answer_idx": "C", "metamap_phrases": ["r old mn", "2 wk", "legs", "not relieved by over-the-counter analgesics", "Past medical history", "significant", "type 2", "r", "managed", "physical", "thr", "drd", "pain", "lower", "deep", "r ntt", "gn include", "blood", "84 mm g", "36", "98", "rt 10 mn", "ankle-brachial pressure index", "right side", "1.1", "blood sugar", "follows", "Fasting", "mg", "dL hours Post-Prandial", "8.1", "following", "best measure to prevent", "progression", "symptoms present", "patient"], "model_answer": "The patient presents with symptoms consistent with diabetic peripheral neuropathy, including tingling, numbness, and persistent pain in the lower limbs, along with decreased sensation to pain. His poorly controlled type 2 diabetes mellitus (evidenced by elevated fasting glucose, post-prandial glucose, and HbA1c) is the most likely underlying cause. The best measure to prevent the progression of these symptoms is strict blood glucose control, as this can slow or halt the progression of diabetic neuropathy. \n\nThe other options are not appropriate:\n- A (atorvastatin) is used for dyslipidemia, not neuropathy.\n- B (femoro-ileal artery bypass) is for arterial insufficiency, but the patient's ABPI is normal (1.1), ruling out significant peripheral arterial disease.\n- D (lower limb amputation) is not indicated at this stage.\n\nThe correct answer is [C].", "fact_gen_query": "\n    nQuestion:\nА 43-уеаr-old mаn рrеѕеntѕ wіth tіnglіng аnd numbnеѕѕ of the lowеr lіmbѕ for 2 wееkѕ. Не also сomрlаіnѕ of реrѕіѕtеnt раіn in his legs whісh is not relieved by over-the-counter analgesics. Past medical history is significant for type 2 dіаbеtes mellitus for 2 уеаrѕ, inconsistently managed with mеtformіn аnd glіmеріrіdе. Оn physical ехаmіnаtіon, thеrе іѕ dесrеаѕеd ѕеnѕаtіon to pain in both lower lіmbs, but deep tеndon rеflехеѕ аrе іntасt. Ніѕ vіtаl ѕіgnѕ include: blood рrеѕѕurе 122/84 mm Нg, tеmреrаturе 36.7°C (98.1°F), and rеѕріrаtorу rаtе 10/mіn. His ankle-brachial pressure index (ABPI) on the right side is 1.1. His blood sugar analyses are as follows:\nFasting 141 mg/ dL\n2 hours Post-Prandial 235 mg/ dL\nHbA1c 8.1%\nWhich of the following is the best measure to prevent the progression of the symptoms present in this patient?\n\n Option:\nUse of atorvastatin;\nFemoro-Ileal artery bypass;\nStrict blood glucose control;\nLower limb amputation;\n\n\n Answer:\nStrict blood glucose control\n For this QA example, you need to give netural fact info for each\n    option according to question context, so that later user can infer out the \n    correct answer from these facts. The template of facts is [option1_name:fact| option2_name:fact|...],e.g: [Ampicillin:High resistance, not first-line. | Ceftriaxone:Overkill (for pyelonephritis/severe UTI).]\n", "hinted_gen_query": "\n    Question:\nА 43-уеаr-old mаn рrеѕеntѕ wіth tіnglіng аnd numbnеѕѕ of the lowеr lіmbѕ for 2 wееkѕ. Не also сomрlаіnѕ of реrѕіѕtеnt раіn in his legs whісh is not relieved by over-the-counter analgesics. Past medical history is significant for type 2 dіаbеtes mellitus for 2 уеаrѕ, inconsistently managed with mеtformіn аnd glіmеріrіdе. Оn physical ехаmіnаtіon, thеrе іѕ dесrеаѕеd ѕеnѕаtіon to pain in both lower lіmbs, but deep tеndon rеflехеѕ аrе іntасt. Ніѕ vіtаl ѕіgnѕ include: blood рrеѕѕurе 122/84 mm Нg, tеmреrаturе 36.7°C (98.1°F), and rеѕріrаtorу rаtе 10/mіn. His ankle-brachial pressure index (ABPI) on the right side is 1.1. His blood sugar analyses are as follows:\nFasting 141 mg/ dL\n2 hours Post-Prandial 235 mg/ dL\nHbA1c 8.1%\nWhich of the following is the best measure to prevent the progression of the symptoms present in this patient?\n\n Option:\nA:Use of atorvastatin;\nB:Femoro-Ileal artery bypass;\nC:Strict blood glucose control;\nD:Lower limb amputation;\n \n\n Hint:\nNone \n\n Answer:\n"}
{"question": "A one-day-old male is evaluated in the hospital nursery for bilious vomiting. The patient has urinated multiple times since birth but has not yet passed meconium. He was born at 38 weeks gestation to a 36-year-old gravida 3 via vaginal delivery. The pregnancy was complicated by gestational diabetes. The patient’s mother received routine prenatal care and declined first trimester screening. She subsequently underwent a quadruple screen at 15 weeks gestation that demonstrated decreased maternal serum alpha-fetoprotein (AFP), increased beta-hCG, decreased unconjugated estriol, and increased inhibin A. Her last ultrasound prior to onset of labor demonstrated an amniotic fluid index (AFI) of 28 cm. The patient’s two older siblings are both healthy. The patient’s temperature is 97.8°F (36.6°C), blood pressure is 58/37 mmHg, pulse is 166/min, and respirations are 38/min. On physical exam, the patient is in moderate distress. His abdomen is firm and distended with hypoactive bowel sounds.\n\nWhich of the following is the most likely etiology of this fetus’s presentation?", "answer": "Duodenal atresia", "options": {"A": "Duodenal atresia", "B": "Meconium ileus", "C": "Necrotizing enterocolitis", "D": "Pyloric stenosis"}, "meta_info": "step2&3", "answer_idx": "A", "metamap_phrases": ["one-day old male", "evaluated", "hospital nursery", "bilious vomiting", "patient", "multiple times", "birth", "not", "passed meconium", "born", "weeks gestation", "36 year old gravida 3", "vaginal delivery", "pregnancy", "complicated", "gestational diabetes", "patients mother received routine prenatal care", "first trimester screening", "quadruple screen", "weeks gestation", "decreased maternal serum alpha-fetoprotein", "increased beta-hCG", "decreased unconjugated estriol", "increased inhibin A", "last ultrasound prior to onset of labor", "amniotic fluid index", "patients two older siblings", "healthy", "patients temperature", "97", "36", "blood pressure", "58", "mmHg", "pulse", "min", "respirations", "min", "physical exam", "patient", "moderate distress", "abdomen", "firm", "distended", "hypoactive bowel sounds", "following", "most likely etiology", "presentation"], "model_answer": "The most likely etiology of this fetus's presentation is **A: Duodenal atresia**. \n\nKey clues supporting this diagnosis include:\n- Bilious vomiting (suggesting obstruction distal to the ampulla of Vater)\n- Failure to pass meconium\n- Polyhydramnios (AFI 28 cm) on prenatal ultrasound, which is classic for proximal GI obstructions\n- The quadruple screen results (low AFP, high hCG, low estriol, high inhibin A) are consistent with Down syndrome, which is strongly associated with duodenal atresia\n\nOther options are less likely:\n- B: Meconium ileus typically occurs in cystic fibrosis and presents with distension but not necessarily bilious vomiting\n- C: Necrotizing enterocolitis is very rare in a 1-day-old and usually presents with systemic signs of infection\n- D: Pyloric stenosis does not occur in newborns (typically presents at 2-8 weeks) and causes non-bilious vomiting\n\n[A]", "fact_gen_query": "\n    nQuestion:\nA one-day-old male is evaluated in the hospital nursery for bilious vomiting. The patient has urinated multiple times since birth but has not yet passed meconium. He was born at 38 weeks gestation to a 36-year-old gravida 3 via vaginal delivery. The pregnancy was complicated by gestational diabetes. The patient’s mother received routine prenatal care and declined first trimester screening. She subsequently underwent a quadruple screen at 15 weeks gestation that demonstrated decreased maternal serum alpha-fetoprotein (AFP), increased beta-hCG, decreased unconjugated estriol, and increased inhibin A. Her last ultrasound prior to onset of labor demonstrated an amniotic fluid index (AFI) of 28 cm. The patient’s two older siblings are both healthy. The patient’s temperature is 97.8°F (36.6°C), blood pressure is 58/37 mmHg, pulse is 166/min, and respirations are 38/min. On physical exam, the patient is in moderate distress. His abdomen is firm and distended with hypoactive bowel sounds.\n\nWhich of the following is the most likely etiology of this fetus’s presentation?\n\n Option:\nDuodenal atresia;\nMeconium ileus;\nNecrotizing enterocolitis;\nPyloric stenosis;\n\n\n Answer:\nDuodenal atresia\n For this QA example, you need to give netural fact info for each\n    option according to question context, so that later user can infer out the \n    correct answer from these facts. The template of facts is [option1_name:fact| option2_name:fact|...],e.g: [Ampicillin:High resistance, not first-line. | Ceftriaxone:Overkill (for pyelonephritis/severe UTI).]\n", "hinted_gen_query": "\n    Question:\nA one-day-old male is evaluated in the hospital nursery for bilious vomiting. The patient has urinated multiple times since birth but has not yet passed meconium. He was born at 38 weeks gestation to a 36-year-old gravida 3 via vaginal delivery. The pregnancy was complicated by gestational diabetes. The patient’s mother received routine prenatal care and declined first trimester screening. She subsequently underwent a quadruple screen at 15 weeks gestation that demonstrated decreased maternal serum alpha-fetoprotein (AFP), increased beta-hCG, decreased unconjugated estriol, and increased inhibin A. Her last ultrasound prior to onset of labor demonstrated an amniotic fluid index (AFI) of 28 cm. The patient’s two older siblings are both healthy. The patient’s temperature is 97.8°F (36.6°C), blood pressure is 58/37 mmHg, pulse is 166/min, and respirations are 38/min. On physical exam, the patient is in moderate distress. His abdomen is firm and distended with hypoactive bowel sounds.\n\nWhich of the following is the most likely etiology of this fetus’s presentation?\n\n Option:\nA:Duodenal atresia;\nB:Meconium ileus;\nC:Necrotizing enterocolitis;\nD:Pyloric stenosis;\n \n\n Hint:\nNone \n\n Answer:\n"}
{"question": "A healthy 23-year-old male is undergoing an exercise stress test as part of his physiology class. If blood were to be sampled at different locations before and after the stress test, which area of the body would contain the lowest oxygen content at both time points?", "answer": "Coronary sinus", "options": {"A": "Inferior vena cava", "B": "Coronary sinus", "C": "Pulmonary artery", "D": "Pulmonary vein"}, "meta_info": "step1", "answer_idx": "B", "metamap_phrases": ["healthy 23 year old male", "exercise stress test", "part of", "physiology class", "blood", "to", "sampled", "different locations", "stress test", "area", "body", "contain", "lowest oxygen content", "time points"], "model_answer": "To determine the area of the body with the lowest oxygen content before and after the stress test, let's analyze the options:\n\n1. **Inferior vena cava (A)**: Carries deoxygenated blood from the lower body to the right atrium. Oxygen content is low but not the lowest.\n\n2. **Coronary sinus (B)**: Drains deoxygenated blood from the heart muscle itself into the right atrium. Because the heart extracts a significant amount of oxygen from its own blood supply, the coronary sinus typically has the lowest oxygen content in the body.\n\n3. **Pulmonary artery (C)**: Carries deoxygenated blood from the right ventricle to the lungs. Oxygen content is low, but not as low as the coronary sinus.\n\n4. **Pulmonary vein (D)**: Carries oxygenated blood from the lungs to the left atrium. This has the highest oxygen content.\n\nThe coronary sinus consistently has the lowest oxygen content because the myocardium extracts a large proportion of oxygen from the coronary circulation, leaving the blood in the coronary sinus highly deoxygenated. This remains true both at rest and during exercise.\n\nAnswer: [B]", "fact_gen_query": "\n    nQuestion:\nA healthy 23-year-old male is undergoing an exercise stress test as part of his physiology class. If blood were to be sampled at different locations before and after the stress test, which area of the body would contain the lowest oxygen content at both time points?\n\n Option:\nInferior vena cava;\nCoronary sinus;\nPulmonary artery;\nPulmonary vein;\n\n\n Answer:\nCoronary sinus\n For this QA example, you need to give netural fact info for each\n    option according to question context, so that later user can infer out the \n    correct answer from these facts. The template of facts is [option1_name:fact| option2_name:fact|...],e.g: [Ampicillin:High resistance, not first-line. | Ceftriaxone:Overkill (for pyelonephritis/severe UTI).]\n", "hinted_gen_query": "\n    Question:\nA healthy 23-year-old male is undergoing an exercise stress test as part of his physiology class. If blood were to be sampled at different locations before and after the stress test, which area of the body would contain the lowest oxygen content at both time points?\n\n Option:\nA:Inferior vena cava;\nB:Coronary sinus;\nC:Pulmonary artery;\nD:Pulmonary vein;\n \n\n Hint:\nNone \n\n Answer:\n"}
{"question": "A 45-year-old G5P4105 presents to her gynecologist’s office with six months of increasingly heavy periods. She now soaks one super absorbent tampon every two hours for five days each cycle. Her cycles have also become irregular, with intermenstrual bleeding for the last two months. She now experiences significant dysmenorrhea, requiring 400 mg ibuprofen every four hours for the majority of each menses. In addition, she reports new onset mild dyspareunia with intercourse and a “heavy feeling” in her pelvis. She has also noticed increased urinary frequency but denies bowel changes. The patient has a past medical history of obesity and type II diabetes on metformin. Her last child was born four years ago, and she has had five spontaneous vaginal deliveries. At this office visit, temperature is 98.5°F (36.9°C), blood pressure is 137/84 mmHg, pulse is 87/min, and respirations are 14/min. Which of the following physical exam findings is most likely to be present in this patient?", "answer": "Globular 10-week sized uterus", "options": {"A": "Globular 10-week sized uterus", "B": "Adnexal mass", "C": "Irregular 14-week sized uterus", "D": "No remarkable physical exam finding"}, "meta_info": "step2&3", "answer_idx": "A", "metamap_phrases": ["year old", "presents", "gynecologists office", "six months", "heavy periods", "now soaks one", "absorbent tampon", "two hours", "five", "cycle", "cycles", "irregular", "intermenstrual bleeding", "two months", "now experiences significant dysmenorrhea", "400 mg ibuprofen", "four hours", "majority", "menses", "addition", "reports new onset mild dyspareunia", "intercourse", "heavy feeling", "pelvis", "increased urinary frequency", "denies bowel changes", "patient", "past medical", "type II diabetes", "metformin", "last child", "born four years", "five spontaneous vaginal deliveries", "office visit", "temperature", "98", "36", "blood pressure", "84 mmHg", "pulse", "87 min", "respirations", "min", "following physical exam findings", "most likely to", "present", "patient"], "model_answer": "The patient's symptoms of increasingly heavy periods, irregular cycles with intermenstrual bleeding, dysmenorrhea, dyspareunia, pelvic heaviness, and urinary frequency are classic for **leiomyoma (uterine fibroids)**. Given her history of multiple pregnancies (G5P4105) and obesity, fibroids are a common finding. \n\nThe most likely physical exam finding in this patient is an **irregularly enlarged uterus**, which is consistent with fibroids. The size is often described in weeks of gestation (e.g., 14-week sized uterus), and the irregularity is due to the nodular nature of fibroids. \n\n- **Option A (Globular 10-week sized uterus)**: More typical of adenomyosis (which can also cause heavy bleeding and dysmenorrhea), but adenomyosis usually presents with a uniformly enlarged, tender uterus.  \n- **Option B (Adnexal mass)**: Less likely unless there is a concurrent ovarian pathology (e.g., ovarian fibroma or endometrioma), but her symptoms are more consistent with uterine fibroids.  \n- **Option C (Irregular 14-week sized uterus)**: Most consistent with fibroids, which cause irregular uterine enlargement.  \n- **Option D (No remarkable physical exam finding)**: Unlikely given her significant symptoms.  \n\n**Final Answer: [C]**", "fact_gen_query": "\n    nQuestion:\nA 45-year-old G5P4105 presents to her gynecologist’s office with six months of increasingly heavy periods. She now soaks one super absorbent tampon every two hours for five days each cycle. Her cycles have also become irregular, with intermenstrual bleeding for the last two months. She now experiences significant dysmenorrhea, requiring 400 mg ibuprofen every four hours for the majority of each menses. In addition, she reports new onset mild dyspareunia with intercourse and a “heavy feeling” in her pelvis. She has also noticed increased urinary frequency but denies bowel changes. The patient has a past medical history of obesity and type II diabetes on metformin. Her last child was born four years ago, and she has had five spontaneous vaginal deliveries. At this office visit, temperature is 98.5°F (36.9°C), blood pressure is 137/84 mmHg, pulse is 87/min, and respirations are 14/min. Which of the following physical exam findings is most likely to be present in this patient?\n\n Option:\nGlobular 10-week sized uterus;\nAdnexal mass;\nIrregular 14-week sized uterus;\nNo remarkable physical exam finding;\n\n\n Answer:\nGlobular 10-week sized uterus\n For this QA example, you need to give netural fact info for each\n    option according to question context, so that later user can infer out the \n    correct answer from these facts. The template of facts is [option1_name:fact| option2_name:fact|...],e.g: [Ampicillin:High resistance, not first-line. | Ceftriaxone:Overkill (for pyelonephritis/severe UTI).]\n", "hinted_gen_query": "\n    Question:\nA 45-year-old G5P4105 presents to her gynecologist’s office with six months of increasingly heavy periods. She now soaks one super absorbent tampon every two hours for five days each cycle. Her cycles have also become irregular, with intermenstrual bleeding for the last two months. She now experiences significant dysmenorrhea, requiring 400 mg ibuprofen every four hours for the majority of each menses. In addition, she reports new onset mild dyspareunia with intercourse and a “heavy feeling” in her pelvis. She has also noticed increased urinary frequency but denies bowel changes. The patient has a past medical history of obesity and type II diabetes on metformin. Her last child was born four years ago, and she has had five spontaneous vaginal deliveries. At this office visit, temperature is 98.5°F (36.9°C), blood pressure is 137/84 mmHg, pulse is 87/min, and respirations are 14/min. Which of the following physical exam findings is most likely to be present in this patient?\n\n Option:\nA:Globular 10-week sized uterus;\nB:Adnexal mass;\nC:Irregular 14-week sized uterus;\nD:No remarkable physical exam finding;\n \n\n Hint:\nNone \n\n Answer:\n"}
{"question": "A man is brought into the emergency department by the police department. The officer state that the man has been arrested multiple times for public alcohol intoxication, but recently became homeless. On exam, the man is behaving erratically. His vitals are all within normal limits. He appears confused and has a slurred speech. On gait exam, the patient is ataxic and cannot stand without support for more than a few seconds. Labs return with the following values: Na 140, K 4, Cl 106, BUN 8, Cr 2. His ABG has pH 7.3, PaCO2 13mm, PaO2 130mm, HCO3 7. His urinalysis is shown in Figure 1. Blood salicylate levels return as normal. While you await other diagnostic tests, which of the following should be administered next to treat this patient?", "answer": "Fomepizole", "options": {"A": "Ethanol", "B": "Naltrexone", "C": "Naloxone", "D": "Fomepizole"}, "meta_info": "step2&3", "answer_idx": "D", "metamap_phrases": ["man", "brought", "emergency department", "police department", "state", "man", "arrested multiple times", "public alcohol intoxication", "recently", "homeless", "exam", "man", "normal limits", "appears confused", "slurred speech", "gait exam", "patient", "ataxic", "stand", "support", "more", "seconds", "Labs return", "following values", "Na", "K 4", "Cl", "Cr 2", "ABG", "pH", "3", "PaO2", "HCO3", "urinalysis", "shown", "Blood salicylate levels return", "normal", "diagnostic tests", "following", "administered next to treat", "patient"], "model_answer": "The patient presents with symptoms of confusion, ataxia, slurred speech, and an anion gap metabolic acidosis (pH 7.3, low HCO3, normal salicylate levels). The most likely diagnosis in this context is methanol or ethylene glycol toxicity, especially given his history of alcohol intoxication and homelessness. \n\nThe most appropriate next step in treatment is to inhibit alcohol dehydrogenase to prevent further metabolism of the toxic alcohol into harmful metabolites. \n\nThe correct answer is:\n\n[D:Fomepizole]", "fact_gen_query": "\n    nQuestion:\nA man is brought into the emergency department by the police department. The officer state that the man has been arrested multiple times for public alcohol intoxication, but recently became homeless. On exam, the man is behaving erratically. His vitals are all within normal limits. He appears confused and has a slurred speech. On gait exam, the patient is ataxic and cannot stand without support for more than a few seconds. Labs return with the following values: Na 140, K 4, Cl 106, BUN 8, Cr 2. His ABG has pH 7.3, PaCO2 13mm, PaO2 130mm, HCO3 7. His urinalysis is shown in Figure 1. Blood salicylate levels return as normal. While you await other diagnostic tests, which of the following should be administered next to treat this patient?\n\n Option:\nEthanol;\nNaltrexone;\nNaloxone;\nFomepizole;\n\n\n Answer:\nFomepizole\n For this QA example, you need to give netural fact info for each\n    option according to question context, so that later user can infer out the \n    correct answer from these facts. The template of facts is [option1_name:fact| option2_name:fact|...],e.g: [Ampicillin:High resistance, not first-line. | Ceftriaxone:Overkill (for pyelonephritis/severe UTI).]\n", "hinted_gen_query": "\n    Question:\nA man is brought into the emergency department by the police department. The officer state that the man has been arrested multiple times for public alcohol intoxication, but recently became homeless. On exam, the man is behaving erratically. His vitals are all within normal limits. He appears confused and has a slurred speech. On gait exam, the patient is ataxic and cannot stand without support for more than a few seconds. Labs return with the following values: Na 140, K 4, Cl 106, BUN 8, Cr 2. His ABG has pH 7.3, PaCO2 13mm, PaO2 130mm, HCO3 7. His urinalysis is shown in Figure 1. Blood salicylate levels return as normal. While you await other diagnostic tests, which of the following should be administered next to treat this patient?\n\n Option:\nA:Ethanol;\nB:Naltrexone;\nC:Naloxone;\nD:Fomepizole;\n \n\n Hint:\nNone \n\n Answer:\n"}
{"question": "A medical research study is evaluating an investigational novel drug (medication 1) compared with standard therapy (medication 2) in patients presenting to the emergency department with myocardial infarction (MI). The study enrolled a total of 3,000 subjects, 1,500 in each study arm. Follow-up was conducted at 45 days post-MI. The following are the results of the trial:\nEndpoints Medication 1 Medication 2 P-Value\nPrimary: death from cardiac causes 134 210 0.03\nSecondary: hyperkalemia 57 70 0.4\nWhat is the number needed to treat (NNT) for the primary endpoint of death from cardiac causes? (Round to the nearest whole number.)", "answer": "20", "options": {"A": "5", "B": "16", "C": "20", "D": "50"}, "meta_info": "step2&3", "answer_idx": "C", "metamap_phrases": ["medical", "evaluating", "investigational novel drug", "medication 1", "compared", "standard therapy", "medication 2", "patients presenting", "emergency department", "myocardial infarction", "study enrolled", "total", "subjects", "1 500", "study arm", "Follow-up", "conducted", "days post-MI", "following", "results", "trial", "Endpoints Medication", "2 P-Value Primary", "death", "cardiac", "0.03 Secondary", "hyperkalemia 57 70 0.4", "number needed", "treat", "primary endpoint", "death", "cardiac causes", "Round", "nearest whole number"], "model_answer": "To calculate the Number Needed to Treat (NNT) for the primary endpoint of death from cardiac causes, follow these steps:\n\n1. **Determine the event rates**:\n   - **Medication 1 (Investigational drug)**: 134 deaths out of 1,500 subjects.\n     - Event rate (E1) = 134 / 1500 ≈ 0.0893 (8.93%).\n   - **Medication 2 (Standard therapy)**: 210 deaths out of 1,500 subjects.\n     - Event rate (E2) = 210 / 1500 ≈ 0.14 (14%).\n\n2. **Calculate the Absolute Risk Reduction (ARR)**:\n   - ARR = E2 - E1 = 0.14 - 0.0893 ≈ 0.0507 (5.07%).\n\n3. **Compute the NNT**:\n   - NNT = 1 / ARR = 1 / 0.0507 ≈ 19.72.\n   - Rounding to the nearest whole number, NNT ≈ **20**.\n\nThus, the correct answer is **[C]**.", "fact_gen_query": "\n    nQuestion:\nA medical research study is evaluating an investigational novel drug (medication 1) compared with standard therapy (medication 2) in patients presenting to the emergency department with myocardial infarction (MI). The study enrolled a total of 3,000 subjects, 1,500 in each study arm. Follow-up was conducted at 45 days post-MI. The following are the results of the trial:\nEndpoints Medication 1 Medication 2 P-Value\nPrimary: death from cardiac causes 134 210 0.03\nSecondary: hyperkalemia 57 70 0.4\nWhat is the number needed to treat (NNT) for the primary endpoint of death from cardiac causes? (Round to the nearest whole number.)\n\n Option:\n5;\n16;\n20;\n50;\n\n\n Answer:\n20\n For this QA example, you need to give netural fact info for each\n    option according to question context, so that later user can infer out the \n    correct answer from these facts. The template of facts is [option1_name:fact| option2_name:fact|...],e.g: [Ampicillin:High resistance, not first-line. | Ceftriaxone:Overkill (for pyelonephritis/severe UTI).]\n", "hinted_gen_query": "\n    Question:\nA medical research study is evaluating an investigational novel drug (medication 1) compared with standard therapy (medication 2) in patients presenting to the emergency department with myocardial infarction (MI). The study enrolled a total of 3,000 subjects, 1,500 in each study arm. Follow-up was conducted at 45 days post-MI. The following are the results of the trial:\nEndpoints Medication 1 Medication 2 P-Value\nPrimary: death from cardiac causes 134 210 0.03\nSecondary: hyperkalemia 57 70 0.4\nWhat is the number needed to treat (NNT) for the primary endpoint of death from cardiac causes? (Round to the nearest whole number.)\n\n Option:\nA:5;\nB:16;\nC:20;\nD:50;\n \n\n Hint:\nNone \n\n Answer:\n"}
{"question": "A 55-year-old man comes to the physician because of a 6-week history of tingling pain in the sole of his right foot when he raises it above chest level during exercises. He reports that he started exercising regularly 2 months ago and that his right calf cramps when he uses the incline feature on the treadmill, forcing him to take frequent breaks. The pain completely disappears after resting for a few minutes. He has an 8-year history of type 2 diabetes mellitus. He has smoked two packs of cigarettes daily for 34 years. His only medication is metformin. His pulse is 82/min, and blood pressure is 170/92 mm Hg. Straight leg raise test elicits pallor and tingling pain in the right foot. There is no pain in the back. His muscle strength is normal. Femoral pulses are palpable; right pedal pulses are absent. Which of the following is the most likely diagnosis?", "answer": "Femoropopliteal artery stenosis", "options": {"A": "Femoropopliteal artery stenosis", "B": "Acute thrombosis of right popliteal vein", "C": "Lumbar spinal stenosis", "D": "Aortoiliac artery stenosis\n\""}, "meta_info": "step2&3", "answer_idx": "A", "metamap_phrases": ["55 year old man", "physician", "week history", "tingling pain", "sole of", "right foot", "chest level", "exercises", "reports", "started exercising", "months", "right", "uses", "feature", "treadmill", "forcing", "to take frequent breaks", "pain completely", "resting", "minutes", "year history of type 2 diabetes mellitus", "smoked two packs", "cigarettes daily", "years", "only medication", "metformin", "pulse", "min", "blood pressure", "mm Hg", "Straight leg raise test elicits pallor", "tingling pain in", "right foot", "pain in", "back", "muscle strength", "normal", "Femoral pulses", "palpable", "right pedal pulses", "absent", "following", "most likely diagnosis"], "model_answer": "The patient's symptoms of tingling pain in the sole of the right foot, calf cramping during exercise (claudication), and absence of right pedal pulses are classic signs of peripheral arterial disease (PAD). The pain is exacerbated by exercise and relieved by rest, which is consistent with intermittent claudication. The absence of back pain and normal muscle strength make lumbar spinal stenosis less likely. The absence of swelling or signs of deep vein thrombosis (DVT) makes acute thrombosis of the right popliteal vein unlikely. The presence of femoral pulses but absent pedal pulses suggests occlusion or stenosis distal to the femoral artery, making femoropopliteal artery stenosis the most likely diagnosis. Aortoiliac artery stenosis would typically present with claudication in the buttocks or thighs and diminished femoral pulses.\n\nThe most likely diagnosis is [A:Femoropopliteal artery stenosis].", "fact_gen_query": "\n    nQuestion:\nA 55-year-old man comes to the physician because of a 6-week history of tingling pain in the sole of his right foot when he raises it above chest level during exercises. He reports that he started exercising regularly 2 months ago and that his right calf cramps when he uses the incline feature on the treadmill, forcing him to take frequent breaks. The pain completely disappears after resting for a few minutes. He has an 8-year history of type 2 diabetes mellitus. He has smoked two packs of cigarettes daily for 34 years. His only medication is metformin. His pulse is 82/min, and blood pressure is 170/92 mm Hg. Straight leg raise test elicits pallor and tingling pain in the right foot. There is no pain in the back. His muscle strength is normal. Femoral pulses are palpable; right pedal pulses are absent. Which of the following is the most likely diagnosis?\n\n Option:\nFemoropopliteal artery stenosis;\nAcute thrombosis of right popliteal vein;\nLumbar spinal stenosis;\nAortoiliac artery stenosis\n\";\n\n\n Answer:\nFemoropopliteal artery stenosis\n For this QA example, you need to give netural fact info for each\n    option according to question context, so that later user can infer out the \n    correct answer from these facts. The template of facts is [option1_name:fact| option2_name:fact|...],e.g: [Ampicillin:High resistance, not first-line. | Ceftriaxone:Overkill (for pyelonephritis/severe UTI).]\n", "hinted_gen_query": "\n    Question:\nA 55-year-old man comes to the physician because of a 6-week history of tingling pain in the sole of his right foot when he raises it above chest level during exercises. He reports that he started exercising regularly 2 months ago and that his right calf cramps when he uses the incline feature on the treadmill, forcing him to take frequent breaks. The pain completely disappears after resting for a few minutes. He has an 8-year history of type 2 diabetes mellitus. He has smoked two packs of cigarettes daily for 34 years. His only medication is metformin. His pulse is 82/min, and blood pressure is 170/92 mm Hg. Straight leg raise test elicits pallor and tingling pain in the right foot. There is no pain in the back. His muscle strength is normal. Femoral pulses are palpable; right pedal pulses are absent. Which of the following is the most likely diagnosis?\n\n Option:\nA:Femoropopliteal artery stenosis;\nB:Acute thrombosis of right popliteal vein;\nC:Lumbar spinal stenosis;\nD:Aortoiliac artery stenosis\n\";\n \n\n Hint:\nNone \n\n Answer:\n"}
{"question": "A 29-year-old primigravid woman at 35 weeks' gestation is admitted to the hospital in labor. She has no history of serious medical illness. She has had an uncomplicated pregnancy. Her last ultrasound at 22 weeks' gestation was normal. On admission, fetal heartbeats cannot be detected by fetal doppler monitor. Ultrasound shows decreased amniotic fluid levels and no evidence of fetal movement, respiration, or heart activity. The patient gives birth to a 2296 g (5 lb 1 oz) male infant. Physical examination shows no signs of life. There are no visible malformations. The placenta is unremarkable. Which of the following is the most appropriate next step in management?", "answer": "Recommend autopsy of the infant", "options": {"A": "Perform karyotyping of amniotic fluid", "B": "Recommend autopsy of the infant", "C": "Obtain photographs, x-ray imaging, and MRI", "D": "Obtain consent for parental genetic testing"}, "meta_info": "step2&3", "answer_idx": "B", "metamap_phrases": ["29 year old primigravid woman", "35 weeks", "gestation", "admitted", "hospital", "labor", "history of serious medical illness", "uncomplicated pregnancy", "last ultrasound", "weeks", "gestation", "normal", "On admission", "fetal heartbeats", "detected", "fetal doppler monitor", "Ultrasound shows decreased amniotic fluid levels", "evidence", "fetal movement", "respiration", "heart activity", "patient gives birth", "g", "1 oz", "male infant", "Physical examination shows", "signs", "life", "visible malformations", "placenta", "unremarkable", "following", "most appropriate next step", "management"], "model_answer": "The most appropriate next step in management in this case is to recommend an autopsy of the infant to determine the cause of the intrauterine fetal demise. This can provide valuable information for the parents regarding the cause of death, recurrence risks, and counseling for future pregnancies. \n\nThe answer is [B].", "fact_gen_query": "\n    nQuestion:\nA 29-year-old primigravid woman at 35 weeks' gestation is admitted to the hospital in labor. She has no history of serious medical illness. She has had an uncomplicated pregnancy. Her last ultrasound at 22 weeks' gestation was normal. On admission, fetal heartbeats cannot be detected by fetal doppler monitor. Ultrasound shows decreased amniotic fluid levels and no evidence of fetal movement, respiration, or heart activity. The patient gives birth to a 2296 g (5 lb 1 oz) male infant. Physical examination shows no signs of life. There are no visible malformations. The placenta is unremarkable. Which of the following is the most appropriate next step in management?\n\n Option:\nPerform karyotyping of amniotic fluid;\nRecommend autopsy of the infant;\nObtain photographs, x-ray imaging, and MRI;\nObtain consent for parental genetic testing;\n\n\n Answer:\nRecommend autopsy of the infant\n For this QA example, you need to give netural fact info for each\n    option according to question context, so that later user can infer out the \n    correct answer from these facts. The template of facts is [option1_name:fact| option2_name:fact|...],e.g: [Ampicillin:High resistance, not first-line. | Ceftriaxone:Overkill (for pyelonephritis/severe UTI).]\n", "hinted_gen_query": "\n    Question:\nA 29-year-old primigravid woman at 35 weeks' gestation is admitted to the hospital in labor. She has no history of serious medical illness. She has had an uncomplicated pregnancy. Her last ultrasound at 22 weeks' gestation was normal. On admission, fetal heartbeats cannot be detected by fetal doppler monitor. Ultrasound shows decreased amniotic fluid levels and no evidence of fetal movement, respiration, or heart activity. The patient gives birth to a 2296 g (5 lb 1 oz) male infant. Physical examination shows no signs of life. There are no visible malformations. The placenta is unremarkable. Which of the following is the most appropriate next step in management?\n\n Option:\nA:Perform karyotyping of amniotic fluid;\nB:Recommend autopsy of the infant;\nC:Obtain photographs, x-ray imaging, and MRI;\nD:Obtain consent for parental genetic testing;\n \n\n Hint:\nNone \n\n Answer:\n"}
{"question": "A 67-year-old man is hospitalized after several days of fever and increasing shortness of breath. Respiratory viral panel returns positive for influenza A and the patient is started on a standard five day course of oseltamivir. Despite therapy, his shortness of breath continues to worsen and his oxygen saturation decreases to the point where ICU transfer and intubation are required. Chest radiograph shows bilateral infiltrates. Clinical criteria are consistent with development of Acute Respiratory Distress Syndrome (ARDS). After several weeks of supportive therapy, the patient improves with lung function returning to near normal. Which of the following processes is involved in the regeneration of alveolar lining after damage to alveoli occurs?", "answer": "Proliferation of surfactant-secreting cells", "options": {"A": "Sweeping of debris out of the alveoli by ciliated cells", "B": "Excess mucus production by goblet cells", "C": "Proliferation of surfactant-secreting cells", "D": "Proliferation of club cells"}, "meta_info": "step1", "answer_idx": "C", "metamap_phrases": ["67 year old man", "hospitalized", "days", "fever", "increasing shortness of breath", "Respiratory viral panel returns positive", "influenza A", "patient", "started", "standard five day course", "oseltamivir", "therapy", "shortness of breath continues to worsen", "oxygen saturation decreases to", "point", "ICU transfer", "intubation", "required", "Chest radiograph shows bilateral infiltrates", "Clinical criteria", "consistent with development", "Acute Respiratory Distress Syndrome", "several weeks", "supportive", "patient improves", "lung function returning", "normal", "following processes", "involved", "regeneration", "alveolar lining", "damage", "alveoli occurs"], "model_answer": "The regeneration of the alveolar lining after damage involves the proliferation of type II pneumocytes, which are surfactant-secreting cells. These cells can differentiate into type I pneumocytes, which are the primary cells lining the alveoli and are essential for gas exchange. \n\nThe correct answer is [C:Proliferation of surfactant-secreting cells].", "fact_gen_query": "\n    nQuestion:\nA 67-year-old man is hospitalized after several days of fever and increasing shortness of breath. Respiratory viral panel returns positive for influenza A and the patient is started on a standard five day course of oseltamivir. Despite therapy, his shortness of breath continues to worsen and his oxygen saturation decreases to the point where ICU transfer and intubation are required. Chest radiograph shows bilateral infiltrates. Clinical criteria are consistent with development of Acute Respiratory Distress Syndrome (ARDS). After several weeks of supportive therapy, the patient improves with lung function returning to near normal. Which of the following processes is involved in the regeneration of alveolar lining after damage to alveoli occurs?\n\n Option:\nSweeping of debris out of the alveoli by ciliated cells;\nExcess mucus production by goblet cells;\nProliferation of surfactant-secreting cells;\nProliferation of club cells;\n\n\n Answer:\nProliferation of surfactant-secreting cells\n For this QA example, you need to give netural fact info for each\n    option according to question context, so that later user can infer out the \n    correct answer from these facts. The template of facts is [option1_name:fact| option2_name:fact|...],e.g: [Ampicillin:High resistance, not first-line. | Ceftriaxone:Overkill (for pyelonephritis/severe UTI).]\n", "hinted_gen_query": "\n    Question:\nA 67-year-old man is hospitalized after several days of fever and increasing shortness of breath. Respiratory viral panel returns positive for influenza A and the patient is started on a standard five day course of oseltamivir. Despite therapy, his shortness of breath continues to worsen and his oxygen saturation decreases to the point where ICU transfer and intubation are required. Chest radiograph shows bilateral infiltrates. Clinical criteria are consistent with development of Acute Respiratory Distress Syndrome (ARDS). After several weeks of supportive therapy, the patient improves with lung function returning to near normal. Which of the following processes is involved in the regeneration of alveolar lining after damage to alveoli occurs?\n\n Option:\nA:Sweeping of debris out of the alveoli by ciliated cells;\nB:Excess mucus production by goblet cells;\nC:Proliferation of surfactant-secreting cells;\nD:Proliferation of club cells;\n \n\n Hint:\nNone \n\n Answer:\n"}
{"question": "A 65-year-old male is treated for anal carcinoma with therapy including external beam radiation. How does radiation affect cancer cells?", "answer": "Induces breaks in double-stranded DNA", "options": {"A": "Induces the formation of thymidine dimers", "B": "Induces the formation of disulfide bonds", "C": "Induces deamination of cytosine", "D": "Induces breaks in double-stranded DNA"}, "meta_info": "step1", "answer_idx": "D", "metamap_phrases": ["65 year old male", "treated", "anal carcinoma", "therapy including external beam radiation", "radiation affect cancer cells"], "model_answer": "The correct answer is:\n\n[D:Induces breaks in double-stranded DNA]\n\nRadiation therapy works primarily by causing double-stranded DNA breaks in cancer cells, leading to cell death. The other options are not the primary mechanism of radiation's effect on cancer cells. \n\n[]", "fact_gen_query": "\n    nQuestion:\nA 65-year-old male is treated for anal carcinoma with therapy including external beam radiation. How does radiation affect cancer cells?\n\n Option:\nInduces the formation of thymidine dimers;\nInduces the formation of disulfide bonds;\nInduces deamination of cytosine;\nInduces breaks in double-stranded DNA;\n\n\n Answer:\nInduces breaks in double-stranded DNA\n For this QA example, you need to give netural fact info for each\n    option according to question context, so that later user can infer out the \n    correct answer from these facts. The template of facts is [option1_name:fact| option2_name:fact|...],e.g: [Ampicillin:High resistance, not first-line. | Ceftriaxone:Overkill (for pyelonephritis/severe UTI).]\n", "hinted_gen_query": "\n    Question:\nA 65-year-old male is treated for anal carcinoma with therapy including external beam radiation. How does radiation affect cancer cells?\n\n Option:\nA:Induces the formation of thymidine dimers;\nB:Induces the formation of disulfide bonds;\nC:Induces deamination of cytosine;\nD:Induces breaks in double-stranded DNA;\n \n\n Hint:\nNone \n\n Answer:\n"}
{"question": "A 56-year-old man with a history of hypertension presents to his physician with progressive fatigue and new onset muscle cramps. He has had no recent changes to his medication regimen, which includes hydrochlorothiazide, lisinopril, and amlodipine. His temperature is 98.0°F (36.7°C), blood pressure is 174/111 mmHg, pulse is 70/min, respirations are 12/min, and oxygen saturation is 98% on room air. The patient's cardiopulmonary and abdominal exams are unremarkable. Laboratory values are ordered as seen below.\n\nSerum:\nNa+: 138 mEq/L\nCl-: 100 mEq/L\nK+: 3.3 mEq/L\nHCO3-: 33 mEq/L\nBUN: 20 mg/dL\nGlucose: 129 mg/dL\n\nWhat is the most likely underlying etiology of this patient's hypertension?", "answer": "Aldosterone excess", "options": {"A": "Aldosterone excess", "B": "Catecholamine-secreting mass", "C": "Cortisol excess", "D": "Impaired kidney perfusion"}, "meta_info": "step2&3", "answer_idx": "A", "metamap_phrases": ["year old man", "history of hypertension presents", "physician", "progressive fatigue", "new onset muscle cramps", "recent changes", "medication regimen", "includes hydrochlorothiazide", "lisinopril", "amlodipine", "temperature", "98", "36", "blood pressure", "mmHg", "pulse", "70 min", "respirations", "min", "oxygen saturation", "98", "room air", "patient's cardiopulmonary", "abdominal exams", "unremarkable", "Laboratory values", "ordered", "seen", "Serum", "Na", "mEq/L Cl", "100 mEq/L K", "3.3 mEq/L HCO3", "mEq/L", "20 mg/dL Glucose", "mg/dL", "most likely underlying etiology", "patient's hypertension"], "model_answer": "The patient presents with hypertension, hypokalemia, and metabolic alkalosis (elevated HCO3-). These findings, along with the absence of recent medication changes, suggest **aldosterone excess** as the most likely underlying etiology of his hypertension. Hypokalemia and metabolic alkalosis are classic features of hyperaldosteronism, which can be primary (e.g., Conn syndrome) or secondary (e.g., renal artery stenosis). \n\nThe other options are less likely:  \n- **B: Catecholamine-secreting mass** (e.g., pheochromocytoma) typically presents with episodic hypertension, tachycardia, and diaphoresis, which are absent here.  \n- **C: Cortisol excess** (e.g., Cushing syndrome) would likely cause hyperglycemia, central obesity, and other stigmata, not isolated hypokalemia and alkalosis.  \n- **D: Impaired kidney perfusion** (e.g., renal artery stenosis) could cause secondary hyperaldosteronism but would typically present with a bruit or elevated BUN/Cr ratio.  \n\nThe most likely diagnosis is **primary hyperaldosteronism** (aldosterone excess).  \n\n[**A**]", "fact_gen_query": "\n    nQuestion:\nA 56-year-old man with a history of hypertension presents to his physician with progressive fatigue and new onset muscle cramps. He has had no recent changes to his medication regimen, which includes hydrochlorothiazide, lisinopril, and amlodipine. His temperature is 98.0°F (36.7°C), blood pressure is 174/111 mmHg, pulse is 70/min, respirations are 12/min, and oxygen saturation is 98% on room air. The patient's cardiopulmonary and abdominal exams are unremarkable. Laboratory values are ordered as seen below.\n\nSerum:\nNa+: 138 mEq/L\nCl-: 100 mEq/L\nK+: 3.3 mEq/L\nHCO3-: 33 mEq/L\nBUN: 20 mg/dL\nGlucose: 129 mg/dL\n\nWhat is the most likely underlying etiology of this patient's hypertension?\n\n Option:\nAldosterone excess;\nCatecholamine-secreting mass;\nCortisol excess;\nImpaired kidney perfusion;\n\n\n Answer:\nAldosterone excess\n For this QA example, you need to give netural fact info for each\n    option according to question context, so that later user can infer out the \n    correct answer from these facts. The template of facts is [option1_name:fact| option2_name:fact|...],e.g: [Ampicillin:High resistance, not first-line. | Ceftriaxone:Overkill (for pyelonephritis/severe UTI).]\n", "hinted_gen_query": "\n    Question:\nA 56-year-old man with a history of hypertension presents to his physician with progressive fatigue and new onset muscle cramps. He has had no recent changes to his medication regimen, which includes hydrochlorothiazide, lisinopril, and amlodipine. His temperature is 98.0°F (36.7°C), blood pressure is 174/111 mmHg, pulse is 70/min, respirations are 12/min, and oxygen saturation is 98% on room air. The patient's cardiopulmonary and abdominal exams are unremarkable. Laboratory values are ordered as seen below.\n\nSerum:\nNa+: 138 mEq/L\nCl-: 100 mEq/L\nK+: 3.3 mEq/L\nHCO3-: 33 mEq/L\nBUN: 20 mg/dL\nGlucose: 129 mg/dL\n\nWhat is the most likely underlying etiology of this patient's hypertension?\n\n Option:\nA:Aldosterone excess;\nB:Catecholamine-secreting mass;\nC:Cortisol excess;\nD:Impaired kidney perfusion;\n \n\n Hint:\nNone \n\n Answer:\n"}
{"question": "A 65-year-old man comes to the physician because of a 1-week history of yellowish discoloration of his skin and generalized pruritus. Examination shows jaundice of the skin and scleral icterus. Urinalysis shows an elevated concentration of bilirubin and a low concentration of urobilinogen. Which of the following is the most likely underlying cause of these findings?", "answer": "Defective hepatic bile excretion", "options": {"A": "Absent UDP-glucuronosyltransferase activity", "B": "Increased hemoglobin breakdown", "C": "Increased intestinal bilirubin reabsorption", "D": "Defective hepatic bile excretion"}, "meta_info": "step1", "answer_idx": "D", "metamap_phrases": ["65 year old man", "physician", "of", "1-week history", "discoloration", "skin", "generalized pruritus", "Examination shows jaundice", "skin", "scleral icterus", "Urinalysis shows", "elevated concentration", "bilirubin", "low concentration", "urobilinogen", "following", "most likely underlying cause", "findings"], "model_answer": "The patient presents with jaundice, pruritus, elevated bilirubin in urine, and low urobilinogen. These findings suggest obstructive jaundice, where bilirubin is conjugated by the liver but cannot be excreted into the bile, leading to its accumulation in the blood and subsequent excretion in the urine. The low urobilinogen indicates that bilirubin is not reaching the intestines to be converted into urobilinogen. \n\nThe most likely underlying cause is **defective hepatic bile excretion**, as this would prevent conjugated bilirubin from being excreted into the bile, leading to the described findings.\n\nThe correct answer is [D].", "fact_gen_query": "\n    nQuestion:\nA 65-year-old man comes to the physician because of a 1-week history of yellowish discoloration of his skin and generalized pruritus. Examination shows jaundice of the skin and scleral icterus. Urinalysis shows an elevated concentration of bilirubin and a low concentration of urobilinogen. Which of the following is the most likely underlying cause of these findings?\n\n Option:\nAbsent UDP-glucuronosyltransferase activity;\nIncreased hemoglobin breakdown;\nIncreased intestinal bilirubin reabsorption;\nDefective hepatic bile excretion;\n\n\n Answer:\nDefective hepatic bile excretion\n For this QA example, you need to give netural fact info for each\n    option according to question context, so that later user can infer out the \n    correct answer from these facts. The template of facts is [option1_name:fact| option2_name:fact|...],e.g: [Ampicillin:High resistance, not first-line. | Ceftriaxone:Overkill (for pyelonephritis/severe UTI).]\n", "hinted_gen_query": "\n    Question:\nA 65-year-old man comes to the physician because of a 1-week history of yellowish discoloration of his skin and generalized pruritus. Examination shows jaundice of the skin and scleral icterus. Urinalysis shows an elevated concentration of bilirubin and a low concentration of urobilinogen. Which of the following is the most likely underlying cause of these findings?\n\n Option:\nA:Absent UDP-glucuronosyltransferase activity;\nB:Increased hemoglobin breakdown;\nC:Increased intestinal bilirubin reabsorption;\nD:Defective hepatic bile excretion;\n \n\n Hint:\nNone \n\n Answer:\n"}
{"question": "A 72-year-old woman is brought to the physician by her daughter because of a 6-month history of worsening short-term memory deficits and social withdrawal. Treatment with galantamine is initiated. Two weeks later, the patient develops vomiting, mild crampy abdominal pain, and watery, nonbloody diarrhea. Which of the following is the most appropriate pharmacotherapy?", "answer": "Atropine", "options": {"A": "Bethanechol", "B": "Metoclopramide", "C": "Atropine", "D": "Oxybutynin"}, "meta_info": "step1", "answer_idx": "C", "metamap_phrases": ["72 year old woman", "brought", "physician", "daughter", "month history", "worsening short-term memory deficits", "social withdrawal", "Treatment", "galantamine", "initiated", "Two weeks later", "patient", "vomiting", "mild crampy abdominal pain", "watery", "diarrhea", "following", "most appropriate pharmacotherapy"], "model_answer": "The patient is presenting with symptoms consistent with Alzheimer's disease and is being treated with galantamine, a cholinesterase inhibitor. The subsequent development of vomiting, abdominal pain, and diarrhea suggests cholinergic excess due to the medication. \n\nThe most appropriate pharmacotherapy in this scenario would be an anticholinergic agent to counteract the cholinergic side effects of galantamine. \n\nAmong the options:\n- **Bethanechol (A)**: A cholinergic agonist, which would worsen the symptoms.\n- **Metoclopramide (B)**: A prokinetic agent with some antidopaminergic effects, not appropriate for cholinergic excess.\n- **Atropine (C)**: An anticholinergic agent that can counteract the cholinergic effects of galantamine.\n- **Oxybutynin (D)**: An anticholinergic, but primarily used for overactive bladder and less suitable for acute cholinergic excess.\n\nThe best choice is **Atropine (C)** to manage the cholinergic excess.\n\n[C]", "fact_gen_query": "\n    nQuestion:\nA 72-year-old woman is brought to the physician by her daughter because of a 6-month history of worsening short-term memory deficits and social withdrawal. Treatment with galantamine is initiated. Two weeks later, the patient develops vomiting, mild crampy abdominal pain, and watery, nonbloody diarrhea. Which of the following is the most appropriate pharmacotherapy?\n\n Option:\nBethanechol;\nMetoclopramide;\nAtropine;\nOxybutynin;\n\n\n Answer:\nAtropine\n For this QA example, you need to give netural fact info for each\n    option according to question context, so that later user can infer out the \n    correct answer from these facts. The template of facts is [option1_name:fact| option2_name:fact|...],e.g: [Ampicillin:High resistance, not first-line. | Ceftriaxone:Overkill (for pyelonephritis/severe UTI).]\n", "hinted_gen_query": "\n    Question:\nA 72-year-old woman is brought to the physician by her daughter because of a 6-month history of worsening short-term memory deficits and social withdrawal. Treatment with galantamine is initiated. Two weeks later, the patient develops vomiting, mild crampy abdominal pain, and watery, nonbloody diarrhea. Which of the following is the most appropriate pharmacotherapy?\n\n Option:\nA:Bethanechol;\nB:Metoclopramide;\nC:Atropine;\nD:Oxybutynin;\n \n\n Hint:\nNone \n\n Answer:\n"}
{"question": "A 61-year-old man with schizophrenia in a locked inpatient psychiatry unit was observed making an unusual smacking motion with his lips, pursing his mouth, and blinking excessively. These symptoms started slowly about 2 weeks ago and have become more pronounced, but they do not seem to bother the patient. He resides in an inpatient psychiatric facility where he has been successfully treated with haloperidol for the past several months. His physical exam and vitals are within normal limits. Which of the following accurately describes his symptoms?", "answer": "Tardive dyskinesia", "options": {"A": "Tardive dyskinesia", "B": "Acute dystonia", "C": "Pseudoparkinsonism", "D": "Palsy"}, "meta_info": "step2&3", "answer_idx": "A", "metamap_phrases": ["61 year old man", "schizophrenia", "locked inpatient psychiatry unit", "observed making", "unusual smacking motion", "lips", "mouth", "blinking excessively", "symptoms started slowly", "weeks", "more", "not", "to", "patient", "resides", "inpatient psychiatric facility", "treated with haloperidol", "past", "months", "physical exam", "normal limits", "following", "symptoms"], "model_answer": "The patient's symptoms of unusual smacking motions with the lips, pursing of the mouth, and excessive blinking that started slowly and became more pronounced, along with the use of haloperidol (a typical antipsychotic), are most consistent with tardive dyskinesia. Tardive dyskinesia is a late-onset, often irreversible side effect of dopamine receptor-blocking medications, such as haloperidol. The symptoms do not bother the patient, which is also characteristic of tardive dyskinesia.\n\nThe other options can be excluded:\n- **B: Acute dystonia** typically presents earlier (hours to days after starting the medication) and involves painful, sustained muscle contractions.\n- **C: Pseudoparkinsonism** would present with bradykinesia, rigidity, and tremor, not the orofacial dyskinesias seen here.\n- **D: Palsy** is a nonspecific term for paralysis or weakness, which does not match the described movements.\n\nThe correct answer is [A].", "fact_gen_query": "\n    nQuestion:\nA 61-year-old man with schizophrenia in a locked inpatient psychiatry unit was observed making an unusual smacking motion with his lips, pursing his mouth, and blinking excessively. These symptoms started slowly about 2 weeks ago and have become more pronounced, but they do not seem to bother the patient. He resides in an inpatient psychiatric facility where he has been successfully treated with haloperidol for the past several months. His physical exam and vitals are within normal limits. Which of the following accurately describes his symptoms?\n\n Option:\nTardive dyskinesia;\nAcute dystonia;\nPseudoparkinsonism;\nPalsy;\n\n\n Answer:\nTardive dyskinesia\n For this QA example, you need to give netural fact info for each\n    option according to question context, so that later user can infer out the \n    correct answer from these facts. The template of facts is [option1_name:fact| option2_name:fact|...],e.g: [Ampicillin:High resistance, not first-line. | Ceftriaxone:Overkill (for pyelonephritis/severe UTI).]\n", "hinted_gen_query": "\n    Question:\nA 61-year-old man with schizophrenia in a locked inpatient psychiatry unit was observed making an unusual smacking motion with his lips, pursing his mouth, and blinking excessively. These symptoms started slowly about 2 weeks ago and have become more pronounced, but they do not seem to bother the patient. He resides in an inpatient psychiatric facility where he has been successfully treated with haloperidol for the past several months. His physical exam and vitals are within normal limits. Which of the following accurately describes his symptoms?\n\n Option:\nA:Tardive dyskinesia;\nB:Acute dystonia;\nC:Pseudoparkinsonism;\nD:Palsy;\n \n\n Hint:\nNone \n\n Answer:\n"}
{"question": "A 17-year-old football player with no significant past medical history, social history, or family history presents to his pediatrician with itching in his groin. He says this started during summer workouts leading up to this season. He denies having any rash anywhere else on his body. The blood pressure is 123/78 mm Hg, pulse is 67/min, respiratory rate is 15/min, and temperature is 38.1°C (98.7°F). Physical examination reveals an erythematous, well-demarcated patch with peripheral scale on the left thigh, pubic region, and perineum. There is no apparent scrotal involvement with the rash. How can you confirm the suspected diagnosis?", "answer": "KOH examination of lesion scrapings", "options": {"A": "KOH examination of lesion scrapings", "B": "Nikolsky's sign on physical exam", "C": "Gram stain of skin scrapings", "D": "AFB stain of skin scrapings"}, "meta_info": "step2&3", "answer_idx": "A", "metamap_phrases": ["year old football", "significant past medical history", "social history", "family history presents", "pediatrician", "itching", "groin", "started", "summer", "leading", "season", "denies", "rash", "else", "body", "blood pressure", "mm Hg", "pulse", "67 min", "respiratory rate", "min", "temperature", "98", "Physical examination reveals", "erythematous", "well", "patch", "peripheral scale", "left thigh", "pubic region", "perineum", "apparent scrotal involvement with", "rash", "confirm", "suspected diagnosis"], "model_answer": "The patient's presentation with an erythematous, well-demarcated patch with peripheral scale in the groin area is highly suggestive of tinea cruris, a fungal infection. The best way to confirm this diagnosis is by performing a KOH examination of lesion scrapings, which would reveal hyphae if tinea is present. \n\nThe other options are not appropriate for this scenario:\n- B: Nikolsky's sign is used to diagnose pemphigus vulgaris or other blistering disorders, not fungal infections.\n- C: Gram stain is used to identify bacterial infections, not fungal infections.\n- D: AFB stain is used to identify acid-fast bacteria like Mycobacterium tuberculosis, not fungal infections.\n\nThe correct answer is [A].", "fact_gen_query": "\n    nQuestion:\nA 17-year-old football player with no significant past medical history, social history, or family history presents to his pediatrician with itching in his groin. He says this started during summer workouts leading up to this season. He denies having any rash anywhere else on his body. The blood pressure is 123/78 mm Hg, pulse is 67/min, respiratory rate is 15/min, and temperature is 38.1°C (98.7°F). Physical examination reveals an erythematous, well-demarcated patch with peripheral scale on the left thigh, pubic region, and perineum. There is no apparent scrotal involvement with the rash. How can you confirm the suspected diagnosis?\n\n Option:\nKOH examination of lesion scrapings;\nNikolsky's sign on physical exam;\nGram stain of skin scrapings;\nAFB stain of skin scrapings;\n\n\n Answer:\nKOH examination of lesion scrapings\n For this QA example, you need to give netural fact info for each\n    option according to question context, so that later user can infer out the \n    correct answer from these facts. The template of facts is [option1_name:fact| option2_name:fact|...],e.g: [Ampicillin:High resistance, not first-line. | Ceftriaxone:Overkill (for pyelonephritis/severe UTI).]\n", "hinted_gen_query": "\n    Question:\nA 17-year-old football player with no significant past medical history, social history, or family history presents to his pediatrician with itching in his groin. He says this started during summer workouts leading up to this season. He denies having any rash anywhere else on his body. The blood pressure is 123/78 mm Hg, pulse is 67/min, respiratory rate is 15/min, and temperature is 38.1°C (98.7°F). Physical examination reveals an erythematous, well-demarcated patch with peripheral scale on the left thigh, pubic region, and perineum. There is no apparent scrotal involvement with the rash. How can you confirm the suspected diagnosis?\n\n Option:\nA:KOH examination of lesion scrapings;\nB:Nikolsky's sign on physical exam;\nC:Gram stain of skin scrapings;\nD:AFB stain of skin scrapings;\n \n\n Hint:\nNone \n\n Answer:\n"}
{"question": "An otherwise healthy 26-year-old man comes to the physician for medication counseling after recently being diagnosed with schizophrenia. Risperidone therapy is initiated. This patient is at increased risk for which of the following adverse effects?", "answer": "Gynecomastia", "options": {"A": "Agranulocytosis", "B": "Shortened QT interval", "C": "Gynecomastia", "D": "Weight loss"}, "meta_info": "step1", "answer_idx": "C", "metamap_phrases": ["healthy", "year old man", "physician", "medication counseling", "recently", "diagnosed", "schizophrenia", "Risperidone therapy", "initiated", "patient", "increased risk", "following adverse effects"], "model_answer": "The correct answer is:\n\n[C:Gynecomastia] \n\nRisperidone, an atypical antipsychotic, can cause hyperprolactinemia, which may lead to gynecomastia in males. The other options are not typically associated with risperidone:\n- Agranulocytosis is more commonly associated with clozapine.\n- Risperidone can prolong the QT interval, not shorten it.\n- Weight gain, not weight loss, is a common adverse effect of risperidone.", "fact_gen_query": "\n    nQuestion:\nAn otherwise healthy 26-year-old man comes to the physician for medication counseling after recently being diagnosed with schizophrenia. Risperidone therapy is initiated. This patient is at increased risk for which of the following adverse effects?\n\n Option:\nAgranulocytosis;\nShortened QT interval;\nGynecomastia;\nWeight loss;\n\n\n Answer:\nGynecomastia\n For this QA example, you need to give netural fact info for each\n    option according to question context, so that later user can infer out the \n    correct answer from these facts. The template of facts is [option1_name:fact| option2_name:fact|...],e.g: [Ampicillin:High resistance, not first-line. | Ceftriaxone:Overkill (for pyelonephritis/severe UTI).]\n", "hinted_gen_query": "\n    Question:\nAn otherwise healthy 26-year-old man comes to the physician for medication counseling after recently being diagnosed with schizophrenia. Risperidone therapy is initiated. This patient is at increased risk for which of the following adverse effects?\n\n Option:\nA:Agranulocytosis;\nB:Shortened QT interval;\nC:Gynecomastia;\nD:Weight loss;\n \n\n Hint:\nNone \n\n Answer:\n"}
{"question": "A 15-year-old woman presents with fever, altered mental status and a petechial rash on her lower extremities and back since yesterday evening. She also says she has been nauseous for the past 3 hours and has vomited twice. The patient mentions she has had heavy menstrual bleeding for the past few days. Her blood pressure is 95/80 mm Hg and her temperature is 40.0°C (104.0°F). On physical examination, the patient appears diaphoretic. A pelvic examination reveals a tampon in her vagina. Binding and activation of which of the following T cell receptors is responsible for this patient’s most likely condition?", "answer": "Variable β-sequence of the T cell receptor", "options": {"A": "B7 receptor", "B": "Variable β-sequence of the T cell receptor", "C": "CD3", "D": "IgCAM"}, "meta_info": "step1", "answer_idx": "B", "metamap_phrases": ["year old woman presents", "fever", "altered mental status", "petechial rash", "lower extremities", "back", "evening", "nauseous", "past", "hours", "vomited twice", "patient", "heavy menstrual bleeding", "past", "days", "blood pressure", "95 80 mm Hg", "temperature", "40", "physical examination", "patient appears diaphoretic", "pelvic examination reveals", "tampon in", "vagina", "Binding", "activation", "following T cell receptors", "responsible", "patients", "likely condition"], "model_answer": "The patient's presentation is highly suggestive of toxic shock syndrome (TSS), which is caused by superantigens (e.g., staphylococcal or streptococcal exotoxins). Superantigens bind directly to the **variable β-sequence of the T cell receptor (Vβ)** and MHC class II molecules, bypassing normal antigen processing and leading to massive cytokine release. \n\nThe correct answer is [B].", "fact_gen_query": "\n    nQuestion:\nA 15-year-old woman presents with fever, altered mental status and a petechial rash on her lower extremities and back since yesterday evening. She also says she has been nauseous for the past 3 hours and has vomited twice. The patient mentions she has had heavy menstrual bleeding for the past few days. Her blood pressure is 95/80 mm Hg and her temperature is 40.0°C (104.0°F). On physical examination, the patient appears diaphoretic. A pelvic examination reveals a tampon in her vagina. Binding and activation of which of the following T cell receptors is responsible for this patient’s most likely condition?\n\n Option:\nB7 receptor;\nVariable β-sequence of the T cell receptor;\nCD3;\nIgCAM;\n\n\n Answer:\nVariable β-sequence of the T cell receptor\n For this QA example, you need to give netural fact info for each\n    option according to question context, so that later user can infer out the \n    correct answer from these facts. The template of facts is [option1_name:fact| option2_name:fact|...],e.g: [Ampicillin:High resistance, not first-line. | Ceftriaxone:Overkill (for pyelonephritis/severe UTI).]\n", "hinted_gen_query": "\n    Question:\nA 15-year-old woman presents with fever, altered mental status and a petechial rash on her lower extremities and back since yesterday evening. She also says she has been nauseous for the past 3 hours and has vomited twice. The patient mentions she has had heavy menstrual bleeding for the past few days. Her blood pressure is 95/80 mm Hg and her temperature is 40.0°C (104.0°F). On physical examination, the patient appears diaphoretic. A pelvic examination reveals a tampon in her vagina. Binding and activation of which of the following T cell receptors is responsible for this patient’s most likely condition?\n\n Option:\nA:B7 receptor;\nB:Variable β-sequence of the T cell receptor;\nC:CD3;\nD:IgCAM;\n \n\n Hint:\nNone \n\n Answer:\n"}
{"question": "A 2-year-old boy is brought to the physician for evaluation of pallor and increasing lethargy for 2 days. One week ago, he experienced abdominal pain, vomiting, and bloody diarrhea that have since subsided. The patient's father states that they returned early from a 6-week roadtrip in Mexico because of these symptoms. His parents have been giving him oral rehydration solution. His immunizations are up-to-date. He appears pale. His temperature is 38.4°C (101.1°F), pulse is 130/min, respirations are 35/min, and blood pressure is 95/50 mm Hg. Examination shows scleral icterus. The abdomen is soft and nontender; there is no rebound or guarding. Bowel sounds are hyperactive. The remainder of the examination shows no abnormalities. Laboratory studies show:\nHemoglobin 8.5 g/dL\nMean corpuscular volume 94 μm3\nLeukocyte count 18,000/mm3\nPlatelet count 45,000/mm3\nProthrombin time 12 sec\nPartial thromboplastin time 34 sec\nSerum\nUrea nitrogen 28 mg/dL\nCreatinine 1.6 mg/dL\nBilirubin\nTotal 2.5 mg/dL\nDirect 0.1 mg/dL\nLactate dehydrogenase 1658 U/L\nA blood smear shows schistocytes. Which of the following is the most likely diagnosis?\"", "answer": "Hemolytic uremic syndrome", "options": {"A": "Henoch-Schönlein Purpura", "B": "Thrombotic thrombocytopenic purpura", "C": "Hemolytic uremic syndrome", "D": "Immune thrombocytopenic purpura"}, "meta_info": "step2&3", "answer_idx": "C", "metamap_phrases": ["2 year old boy", "brought", "physician", "evaluation", "pallor", "increasing lethargy", "2", "One", "experienced abdominal pain", "vomiting", "bloody diarrhea", "since", "patient", "ather  tates ", "eturned  arly ", "eek ", "exico ", "ymptoms.", "arents ", "iving ", "ral rehydration solution.", "mmunizations ", "ate.", "ppears  ale.", "emperature ", "C ", "ulse ", "in,", "espirations ", "5/ in,", "lood pressure ", "5/ 0  m Hg.", "xamination  hows  cleral icterus.", "bdomen ", "oft ", "ontender;", "uarding.", "owel sounds ", "yperactive.", "xamination  hows ", "bnormalities.", "aboratory studies  how:", "emoglobin ", "/", "ean corpuscular volume ", "3  eukocyte  8,", "latelet count ", "rothrombin time  2  ec  artial thromboplastin time ", "erum  rea nitrogen  8  g/", "reatinine ", "  g/", "otal ", "irect  .1  g/dL  actate dehydrogenase ", "/  ", "lood smear  hows  chistocytes.", "ollowing ", "ost likely  iagnosis?"], "model_answer": "The most likely diagnosis for this 2-year-old boy with pallor, lethargy, recent history of bloody diarrhea, scleral icterus, anemia, thrombocytopenia, elevated LDH, and schistocytes on blood smear is **Hemolytic uremic syndrome (HUS)**. This is a classic presentation of HUS, which is often preceded by a diarrheal illness (typically due to Shiga toxin-producing E. coli, such as O157:H7). The findings of microangiopathic hemolytic anemia (schistocytes, elevated LDH, indirect hyperbilirubinemia), thrombocytopenia, and acute kidney injury (elevated BUN and creatinine) are diagnostic of HUS.\n\nThe other options are less likely:\n- **Henoch-Schönlein Purpura (A)**: Typically presents with palpable purpura, arthritis, and abdominal pain, but not microangiopathic hemolytic anemia or thrombocytopenia.\n- **Thrombotic thrombocytopenic purpura (B)**: Rare in children and usually associated with neurologic symptoms and fever, which are absent here.\n- **Immune thrombocytopenic purpura (D)**: Presents with isolated thrombocytopenia and no evidence of hemolysis or renal injury.\n\nThe correct answer is [C].", "fact_gen_query": "\n    nQuestion:\nA 2-year-old boy is brought to the physician for evaluation of pallor and increasing lethargy for 2 days. One week ago, he experienced abdominal pain, vomiting, and bloody diarrhea that have since subsided. The patient's father states that they returned early from a 6-week roadtrip in Mexico because of these symptoms. His parents have been giving him oral rehydration solution. His immunizations are up-to-date. He appears pale. His temperature is 38.4°C (101.1°F), pulse is 130/min, respirations are 35/min, and blood pressure is 95/50 mm Hg. Examination shows scleral icterus. The abdomen is soft and nontender; there is no rebound or guarding. Bowel sounds are hyperactive. The remainder of the examination shows no abnormalities. Laboratory studies show:\nHemoglobin 8.5 g/dL\nMean corpuscular volume 94 μm3\nLeukocyte count 18,000/mm3\nPlatelet count 45,000/mm3\nProthrombin time 12 sec\nPartial thromboplastin time 34 sec\nSerum\nUrea nitrogen 28 mg/dL\nCreatinine 1.6 mg/dL\nBilirubin\nTotal 2.5 mg/dL\nDirect 0.1 mg/dL\nLactate dehydrogenase 1658 U/L\nA blood smear shows schistocytes. Which of the following is the most likely diagnosis?\"\n\n Option:\nHenoch-Schönlein Purpura;\nThrombotic thrombocytopenic purpura;\nHemolytic uremic syndrome;\nImmune thrombocytopenic purpura;\n\n\n Answer:\nHemolytic uremic syndrome\n For this QA example, you need to give netural fact info for each\n    option according to question context, so that later user can infer out the \n    correct answer from these facts. The template of facts is [option1_name:fact| option2_name:fact|...],e.g: [Ampicillin:High resistance, not first-line. | Ceftriaxone:Overkill (for pyelonephritis/severe UTI).]\n", "hinted_gen_query": "\n    Question:\nA 2-year-old boy is brought to the physician for evaluation of pallor and increasing lethargy for 2 days. One week ago, he experienced abdominal pain, vomiting, and bloody diarrhea that have since subsided. The patient's father states that they returned early from a 6-week roadtrip in Mexico because of these symptoms. His parents have been giving him oral rehydration solution. His immunizations are up-to-date. He appears pale. His temperature is 38.4°C (101.1°F), pulse is 130/min, respirations are 35/min, and blood pressure is 95/50 mm Hg. Examination shows scleral icterus. The abdomen is soft and nontender; there is no rebound or guarding. Bowel sounds are hyperactive. The remainder of the examination shows no abnormalities. Laboratory studies show:\nHemoglobin 8.5 g/dL\nMean corpuscular volume 94 μm3\nLeukocyte count 18,000/mm3\nPlatelet count 45,000/mm3\nProthrombin time 12 sec\nPartial thromboplastin time 34 sec\nSerum\nUrea nitrogen 28 mg/dL\nCreatinine 1.6 mg/dL\nBilirubin\nTotal 2.5 mg/dL\nDirect 0.1 mg/dL\nLactate dehydrogenase 1658 U/L\nA blood smear shows schistocytes. Which of the following is the most likely diagnosis?\"\n\n Option:\nA:Henoch-Schönlein Purpura;\nB:Thrombotic thrombocytopenic purpura;\nC:Hemolytic uremic syndrome;\nD:Immune thrombocytopenic purpura;\n \n\n Hint:\nNone \n\n Answer:\n"}
{"question": "A 17-year-old girl is referred by her dentist for a suspected eating disorder. She has been visiting the same dentist since childhood and for the past 2 years has had at least 2 visits for dental caries. She eventually admitted to him that she regularly induces vomiting by putting her fingers down her throat. She says she has been doing this for the last few years and purging at least once a week. More recently, she has been inducing emesis more often and even looked into diuretics as she feels that she is gaining more and more weight compared to her ‘skinny friends’. Her BMI is at the 50th percentile for her age and sex. Which of the following features is most consistent with this patient’s condition?", "answer": "Patients with this disorder are not further sub-typed", "options": {"A": "Patients with this disorder are not further sub-typed", "B": "Patients do not usually initiate treatment", "C": "Patients can have a history of both anorexia and bulimia", "D": "Patients will typically have a BMI between 17–18.5 kg/m2"}, "meta_info": "step2&3", "answer_idx": "A", "metamap_phrases": ["year old girl", "referred by", "dentist", "suspected eating disorder", "visiting", "same dentist", "childhood", "past", "years", "visits", "dental caries", "admitted", "induces vomiting", "putting", "fingers", "throat", "last", "years", "purging", "week", "recently", "inducing emesis", "often", "looked", "diuretics", "feels", "gaining more", "more weight compared", "friends", "BMI", "50th percentile", "age", "sex", "following features", "most consistent with", "patients condition"], "model_answer": "The most consistent feature with this patient's condition is that patients can have a history of both anorexia and bulimia. This patient exhibits behaviors consistent with bulimia nervosa (regular purging) and expresses concerns about weight gain and body image, which can overlap with anorexia nervosa. \n\nThe other options are incorrect:\n- A: Patients with bulimia nervosa are sub-typed into purging and non-purging types.\n- B: Patients may seek treatment due to the distress caused by their behaviors or physical complications (e.g., dental issues).\n- D: Patients with bulimia nervosa typically have a normal or near-normal BMI, not necessarily in the 17–18.5 kg/m² range (which is more common in anorexia nervosa).\n\n[C]", "fact_gen_query": "\n    nQuestion:\nA 17-year-old girl is referred by her dentist for a suspected eating disorder. She has been visiting the same dentist since childhood and for the past 2 years has had at least 2 visits for dental caries. She eventually admitted to him that she regularly induces vomiting by putting her fingers down her throat. She says she has been doing this for the last few years and purging at least once a week. More recently, she has been inducing emesis more often and even looked into diuretics as she feels that she is gaining more and more weight compared to her ‘skinny friends’. Her BMI is at the 50th percentile for her age and sex. Which of the following features is most consistent with this patient’s condition?\n\n Option:\nPatients with this disorder are not further sub-typed;\nPatients do not usually initiate treatment;\nPatients can have a history of both anorexia and bulimia;\nPatients will typically have a BMI between 17–18.5 kg/m2;\n\n\n Answer:\nPatients with this disorder are not further sub-typed\n For this QA example, you need to give netural fact info for each\n    option according to question context, so that later user can infer out the \n    correct answer from these facts. The template of facts is [option1_name:fact| option2_name:fact|...],e.g: [Ampicillin:High resistance, not first-line. | Ceftriaxone:Overkill (for pyelonephritis/severe UTI).]\n", "hinted_gen_query": "\n    Question:\nA 17-year-old girl is referred by her dentist for a suspected eating disorder. She has been visiting the same dentist since childhood and for the past 2 years has had at least 2 visits for dental caries. She eventually admitted to him that she regularly induces vomiting by putting her fingers down her throat. She says she has been doing this for the last few years and purging at least once a week. More recently, she has been inducing emesis more often and even looked into diuretics as she feels that she is gaining more and more weight compared to her ‘skinny friends’. Her BMI is at the 50th percentile for her age and sex. Which of the following features is most consistent with this patient’s condition?\n\n Option:\nA:Patients with this disorder are not further sub-typed;\nB:Patients do not usually initiate treatment;\nC:Patients can have a history of both anorexia and bulimia;\nD:Patients will typically have a BMI between 17–18.5 kg/m2;\n \n\n Hint:\nNone \n\n Answer:\n"}
{"question": "A 14-year-old girl is brought to the physician by her father because of fever, chills, abdominal pain, and profuse non-bloody diarrhea. Her symptoms began one week ago, when she had several days of low-grade fever and constipation. She returned from Indonesia 2 weeks ago, where she spent the summer with her grandparents. Her temperature is 39.3°C (102.8°F). Examination shows diffuse abdominal tenderness and mild hepatosplenomegaly. There is a faint salmon-colored maculopapular rash on her trunk and abdomen. Which of the following is the most likely causal organism?", "answer": "Salmonella typhi", "options": {"A": "Giardia lamblia", "B": "Schistosoma mansoni", "C": "Salmonella typhi", "D": "Clostridium perfringens"}, "meta_info": "step1", "answer_idx": "C", "metamap_phrases": ["year old girl", "brought", "physician", "father", "fever", "chills", "abdominal pain", "non bloody diarrhea", "symptoms began one week", "several days", "low-grade fever", "constipation", "returned", "Indonesia 2 weeks", "spent", "summer", "grandparents", "temperature", "3C", "Examination shows diffuse abdominal tenderness", "mild hepatosplenomegaly", "faint salmon colored maculopapular rash", "trunk", "abdomen", "following", "most likely causal organism"], "model_answer": "The most likely causal organism in this case is **Salmonella typhi**, given the clinical presentation of fever, abdominal pain, hepatosplenomegaly, and the characteristic salmon-colored rash (rose spots), along with the recent travel history to Indonesia (an endemic region for typhoid fever). \n\nThe correct answer is: [C]", "fact_gen_query": "\n    nQuestion:\nA 14-year-old girl is brought to the physician by her father because of fever, chills, abdominal pain, and profuse non-bloody diarrhea. Her symptoms began one week ago, when she had several days of low-grade fever and constipation. She returned from Indonesia 2 weeks ago, where she spent the summer with her grandparents. Her temperature is 39.3°C (102.8°F). Examination shows diffuse abdominal tenderness and mild hepatosplenomegaly. There is a faint salmon-colored maculopapular rash on her trunk and abdomen. Which of the following is the most likely causal organism?\n\n Option:\nGiardia lamblia;\nSchistosoma mansoni;\nSalmonella typhi;\nClostridium perfringens;\n\n\n Answer:\nSalmonella typhi\n For this QA example, you need to give netural fact info for each\n    option according to question context, so that later user can infer out the \n    correct answer from these facts. The template of facts is [option1_name:fact| option2_name:fact|...],e.g: [Ampicillin:High resistance, not first-line. | Ceftriaxone:Overkill (for pyelonephritis/severe UTI).]\n", "hinted_gen_query": "\n    Question:\nA 14-year-old girl is brought to the physician by her father because of fever, chills, abdominal pain, and profuse non-bloody diarrhea. Her symptoms began one week ago, when she had several days of low-grade fever and constipation. She returned from Indonesia 2 weeks ago, where she spent the summer with her grandparents. Her temperature is 39.3°C (102.8°F). Examination shows diffuse abdominal tenderness and mild hepatosplenomegaly. There is a faint salmon-colored maculopapular rash on her trunk and abdomen. Which of the following is the most likely causal organism?\n\n Option:\nA:Giardia lamblia;\nB:Schistosoma mansoni;\nC:Salmonella typhi;\nD:Clostridium perfringens;\n \n\n Hint:\nNone \n\n Answer:\n"}
{"question": "A 22-year-old female college student is treated with metronidazole after presenting to student health services with itching, discharge, and pain in her vagina. At a party shortly afterward she experiences facial flushing, nausea, tachycardia, dyspnea, headache, and abdominal cramps after consuming alcohol. Serum levels of which of the following are likely elevated in this patient following alcohol consumption:", "answer": "Acetaldehyde", "options": {"A": "Acetaldehyde", "B": "Uric acid", "C": "Cytochrome P-450 enzymes", "D": "Amylase"}, "meta_info": "step1", "answer_idx": "A", "metamap_phrases": ["year old female college student", "treated with metronidazole", "presenting", "student health services", "itching", "discharge", "pain in", "vagina", "party", "experiences facial flushing", "nausea", "tachycardia", "dyspnea", "headache", "abdominal cramps", "alcohol", "Serum levels", "following", "likely elevated", "patient following alcohol consumption"], "model_answer": "The patient's symptoms after consuming alcohol while on metronidazole are consistent with a disulfiram-like reaction, which occurs due to the accumulation of acetaldehyde. Metronidazole inhibits aldehyde dehydrogenase, leading to elevated levels of acetaldehyde when alcohol is consumed.\n\nThe correct answer is [A:Acetaldehyde].", "fact_gen_query": "\n    nQuestion:\nA 22-year-old female college student is treated with metronidazole after presenting to student health services with itching, discharge, and pain in her vagina. At a party shortly afterward she experiences facial flushing, nausea, tachycardia, dyspnea, headache, and abdominal cramps after consuming alcohol. Serum levels of which of the following are likely elevated in this patient following alcohol consumption:\n\n Option:\nAcetaldehyde;\nUric acid;\nCytochrome P-450 enzymes;\nAmylase;\n\n\n Answer:\nAcetaldehyde\n For this QA example, you need to give netural fact info for each\n    option according to question context, so that later user can infer out the \n    correct answer from these facts. The template of facts is [option1_name:fact| option2_name:fact|...],e.g: [Ampicillin:High resistance, not first-line. | Ceftriaxone:Overkill (for pyelonephritis/severe UTI).]\n", "hinted_gen_query": "\n    Question:\nA 22-year-old female college student is treated with metronidazole after presenting to student health services with itching, discharge, and pain in her vagina. At a party shortly afterward she experiences facial flushing, nausea, tachycardia, dyspnea, headache, and abdominal cramps after consuming alcohol. Serum levels of which of the following are likely elevated in this patient following alcohol consumption:\n\n Option:\nA:Acetaldehyde;\nB:Uric acid;\nC:Cytochrome P-450 enzymes;\nD:Amylase;\n \n\n Hint:\nNone \n\n Answer:\n"}
{"question": "A 23-year-old primigravida presents for a regular prenatal care visit at 16 weeks gestation. She complains of increased fatigability, but is otherwise well. She takes folic acid, iron, and vitamin D supplementation. Her vital signs are as follows: blood pressure, 110/70 mm Hg; heart rate, 86/min; respiratory rate, 13/min; and temperature, 36.6℃ (97.9℉). The physical examination is unremarkable. The complete blood count results are as below:\nErythrocyte count 3.9 million/mm3\nHb 11.1 g/dL\nHCT 32%\nReticulocyte count 0.2%\nMCV 90 fL\nPlatelet count 210,000/mm3\nLeukocyte count 8,100/mm3\nWhich of the following tests is required to investigate the cause of the patient’s laboratory findings?", "answer": "No tests required", "options": {"A": "Serum iron level", "B": "Serum B12 level", "C": "Transferrin", "D": "No tests required"}, "meta_info": "step2&3", "answer_idx": "D", "metamap_phrases": ["23 year old primigravida presents", "regular prenatal visit", "weeks gestation", "increased fatigability", "well", "takes folic acid", "iron", "vitamin", "supplementation", "vital signs", "follows", "blood pressure", "70 mm Hg", "heart rate", "min", "respiratory rate", "min", "temperature", "36", "97", "physical examination", "unremarkable", "complete blood count results", "Erythrocyte", "mm3 Hb", "g", "HCT", "Reticulocyte", "0.2", "MCV 90 fL Platelet count", "Leukocyte", "100", "following tests", "required to investigate", "cause", "patients laboratory findings"], "model_answer": "The patient's laboratory findings show a mild anemia (Hb 11.1 g/dL) with normal MCV (90 fL) and low reticulocyte count (0.2%). Given that she is already taking iron supplementation and her MCV is normal, iron deficiency anemia is less likely. The next step would be to evaluate for other causes of normocytic anemia, such as anemia of chronic disease or vitamin B12 deficiency (even though MCV is normal, early B12 deficiency can present with normocytic anemia). \n\nThe most appropriate test to investigate the cause of her anemia would be:\n\n[B:Serum B12 level;]", "fact_gen_query": "\n    nQuestion:\nA 23-year-old primigravida presents for a regular prenatal care visit at 16 weeks gestation. She complains of increased fatigability, but is otherwise well. She takes folic acid, iron, and vitamin D supplementation. Her vital signs are as follows: blood pressure, 110/70 mm Hg; heart rate, 86/min; respiratory rate, 13/min; and temperature, 36.6℃ (97.9℉). The physical examination is unremarkable. The complete blood count results are as below:\nErythrocyte count 3.9 million/mm3\nHb 11.1 g/dL\nHCT 32%\nReticulocyte count 0.2%\nMCV 90 fL\nPlatelet count 210,000/mm3\nLeukocyte count 8,100/mm3\nWhich of the following tests is required to investigate the cause of the patient’s laboratory findings?\n\n Option:\nSerum iron level;\nSerum B12 level;\nTransferrin;\nNo tests required;\n\n\n Answer:\nNo tests required\n For this QA example, you need to give netural fact info for each\n    option according to question context, so that later user can infer out the \n    correct answer from these facts. The template of facts is [option1_name:fact| option2_name:fact|...],e.g: [Ampicillin:High resistance, not first-line. | Ceftriaxone:Overkill (for pyelonephritis/severe UTI).]\n", "hinted_gen_query": "\n    Question:\nA 23-year-old primigravida presents for a regular prenatal care visit at 16 weeks gestation. She complains of increased fatigability, but is otherwise well. She takes folic acid, iron, and vitamin D supplementation. Her vital signs are as follows: blood pressure, 110/70 mm Hg; heart rate, 86/min; respiratory rate, 13/min; and temperature, 36.6℃ (97.9℉). The physical examination is unremarkable. The complete blood count results are as below:\nErythrocyte count 3.9 million/mm3\nHb 11.1 g/dL\nHCT 32%\nReticulocyte count 0.2%\nMCV 90 fL\nPlatelet count 210,000/mm3\nLeukocyte count 8,100/mm3\nWhich of the following tests is required to investigate the cause of the patient’s laboratory findings?\n\n Option:\nA:Serum iron level;\nB:Serum B12 level;\nC:Transferrin;\nD:No tests required;\n \n\n Hint:\nNone \n\n Answer:\n"}
{"question": "An 80-year-old man is transferred from a step-down unit to a med-surg floor in the hospital. He had undergone a successful hernia surgery 14 hours ago. Before the surgery, he was pre-treated with atropine, scopolamine, and morphine and recovered well in the PACU after the surgery. There were no complications in the step-down unit and the patient continued to recover. On the med-surg floor, his temperature is 36.8°C (98.2°F), the heart rate is 98/min, the respiratory rate is 15/min, the blood pressure is 100/75 mm Hg, the oxygen saturation is 90%. On physical exam, he is a well-developed, obese man. His heart has a regular rate and rhythm and his lungs are clear to auscultation bilaterally. His incision site is clean, dry, and intact with an appropriate level of swelling and erythema. During the physical, the patient mentions some discomfort in his abdomen and pelvis and during a records review it is noted that he has not passed urine in the PACU, step-down unit, or since arriving on the med-surg floor. A bladder scan is inconclusive due to body habitus. What is the next best step in the treatment of this patient?", "answer": "Insert a ‘straight cath’ into the patient’s bladder", "options": {"A": "Insert a ‘straight cath’ into the patient’s bladder", "B": "Aggressive IV fluids", "C": "Digital rectal exam", "D": "Renal ultrasound"}, "meta_info": "step2&3", "answer_idx": "A", "metamap_phrases": ["80 year old man", "transferred", "step-down unit", "med surg floor", "hospital", "successful hernia surgery", "hours", "surgery", "pre treated with atropine", "scopolamine", "morphine", "recovered well", "PACU", "surgery", "complications", "step-down unit", "patient continued to recover", "med surg floor", "temperature", "36", "98", "heart rate", "98 min", "respiratory rate", "min", "blood pressure", "100 75 mm Hg", "oxygen saturation", "90", "physical exam", "well", "obese man", "heart", "regular rate", "rhythm", "lungs", "clear", "auscultation", "incision site", "clean", "dry", "intact", "appropriate level", "swelling", "erythema", "physical", "patient", "discomfort", "abdomen", "pelvis", "records review", "noted", "not passed urine", "PACU", "step-down unit", "since", "med surg floor", "bladder scan", "inconclusive due to body", "next best step", "treatment", "patient"], "model_answer": "The patient has not passed urine since the surgery, which is concerning for urinary retention, especially given his history of pre-treatment with anticholinergic medications (atropine and scopolamine) and morphine, all of which can contribute to urinary retention. The bladder scan was inconclusive due to his body habitus, so the next best step is to directly assess and relieve the retention by inserting a straight catheter (Option A). This will both diagnose and treat the issue. \n\nWhile a renal ultrasound (Option D) might be considered later if obstruction is suspected, it is not the immediate next step. Aggressive IV fluids (Option B) are unnecessary as there is no indication of hypovolemia, and a digital rectal exam (Option C) would not address the urinary retention. \n\nThe correct answer is [A].", "fact_gen_query": "\n    nQuestion:\nAn 80-year-old man is transferred from a step-down unit to a med-surg floor in the hospital. He had undergone a successful hernia surgery 14 hours ago. Before the surgery, he was pre-treated with atropine, scopolamine, and morphine and recovered well in the PACU after the surgery. There were no complications in the step-down unit and the patient continued to recover. On the med-surg floor, his temperature is 36.8°C (98.2°F), the heart rate is 98/min, the respiratory rate is 15/min, the blood pressure is 100/75 mm Hg, the oxygen saturation is 90%. On physical exam, he is a well-developed, obese man. His heart has a regular rate and rhythm and his lungs are clear to auscultation bilaterally. His incision site is clean, dry, and intact with an appropriate level of swelling and erythema. During the physical, the patient mentions some discomfort in his abdomen and pelvis and during a records review it is noted that he has not passed urine in the PACU, step-down unit, or since arriving on the med-surg floor. A bladder scan is inconclusive due to body habitus. What is the next best step in the treatment of this patient?\n\n Option:\nInsert a ‘straight cath’ into the patient’s bladder;\nAggressive IV fluids;\nDigital rectal exam;\nRenal ultrasound;\n\n\n Answer:\nInsert a ‘straight cath’ into the patient’s bladder\n For this QA example, you need to give netural fact info for each\n    option according to question context, so that later user can infer out the \n    correct answer from these facts. The template of facts is [option1_name:fact| option2_name:fact|...],e.g: [Ampicillin:High resistance, not first-line. | Ceftriaxone:Overkill (for pyelonephritis/severe UTI).]\n", "hinted_gen_query": "\n    Question:\nAn 80-year-old man is transferred from a step-down unit to a med-surg floor in the hospital. He had undergone a successful hernia surgery 14 hours ago. Before the surgery, he was pre-treated with atropine, scopolamine, and morphine and recovered well in the PACU after the surgery. There were no complications in the step-down unit and the patient continued to recover. On the med-surg floor, his temperature is 36.8°C (98.2°F), the heart rate is 98/min, the respiratory rate is 15/min, the blood pressure is 100/75 mm Hg, the oxygen saturation is 90%. On physical exam, he is a well-developed, obese man. His heart has a regular rate and rhythm and his lungs are clear to auscultation bilaterally. His incision site is clean, dry, and intact with an appropriate level of swelling and erythema. During the physical, the patient mentions some discomfort in his abdomen and pelvis and during a records review it is noted that he has not passed urine in the PACU, step-down unit, or since arriving on the med-surg floor. A bladder scan is inconclusive due to body habitus. What is the next best step in the treatment of this patient?\n\n Option:\nA:Insert a ‘straight cath’ into the patient’s bladder;\nB:Aggressive IV fluids;\nC:Digital rectal exam;\nD:Renal ultrasound;\n \n\n Hint:\nNone \n\n Answer:\n"}
{"question": "A healthy 19-year-old man presents to his primary care provider complaining of painless “blisters” in his mouth. He reports that he noticed a white film on his tongue and the sides of his mouth 2 days ago while brushing his teeth. The film was easily brushed off. He also complains of a bitter metallic taste in his mouth but otherwise denies pain, burning, dysphagia, or hoarseness. He is otherwise healthy and takes no medications. He is a competitive swimmer and has had 8 sexual partners in the past year. He intermittently uses barrier protection. On exam, he is well-appearing and in no acute distress. His oral examination demonstrates patches of white pseudomembranes that can be wiped away to reveal erythematous mucosa. A medication with which of the following mechanisms of action is most appropriate in this patient?", "answer": "Disruption of cell membrane permeability", "options": {"A": "Disruption of cell membrane permeability", "B": "Disruption of microtubule formation", "C": "Inhibition of 14-alpha-demethylase", "D": "Inhibition of beta-glucan synthase"}, "meta_info": "step1", "answer_idx": "A", "metamap_phrases": ["healthy", "year old man presents", "primary care provider", "painless blisters", "mouth", "reports", "white film", "tongue", "sides", "mouth 2 days", "brushing", "teeth", "film", "easily brushed", "bitter metallic", "mouth", "denies pain", "burning", "dysphagia", "hoarseness", "healthy", "takes", "medications", "competitive swimmer", "sexual partners", "past year", "uses barrier protection", "exam", "well appearing", "acute distress", "oral examination demonstrates patches", "white pseudomembranes", "wiped", "to reveal erythematous mucosa", "medication", "of", "following mechanisms", "action", "most appropriate", "patient"], "model_answer": "The patient's presentation is consistent with oral candidiasis (thrush), which is characterized by painless white pseudomembranous plaques that can be wiped away, leaving erythematous mucosa. The most appropriate treatment for oral candidiasis is an antifungal medication. \n\n- **Option A (Disruption of cell membrane permeability)**: This describes the mechanism of polyene antifungals like nystatin or amphotericin B, which are commonly used for oral candidiasis. \n- **Option B (Disruption of microtubule formation)**: This describes the mechanism of griseofulvin, which is used for dermatophyte infections, not candidiasis. \n- **Option C (Inhibition of 14-alpha-demethylase)**: This describes the mechanism of azole antifungals (e.g., fluconazole), which are also appropriate for oral candidiasis. \n- **Option D (Inhibition of beta-glucan synthase)**: This describes the mechanism of echinocandins (e.g., caspofungin), which are typically reserved for systemic or invasive candidiasis, not oral thrush.\n\nBoth **Option A** and **Option C** are reasonable, but **fluconazole (Option C)** is often preferred for uncomplicated oral candidiasis due to its convenience (oral dosing) and efficacy. \n\nThe most appropriate answer is [C].", "fact_gen_query": "\n    nQuestion:\nA healthy 19-year-old man presents to his primary care provider complaining of painless “blisters” in his mouth. He reports that he noticed a white film on his tongue and the sides of his mouth 2 days ago while brushing his teeth. The film was easily brushed off. He also complains of a bitter metallic taste in his mouth but otherwise denies pain, burning, dysphagia, or hoarseness. He is otherwise healthy and takes no medications. He is a competitive swimmer and has had 8 sexual partners in the past year. He intermittently uses barrier protection. On exam, he is well-appearing and in no acute distress. His oral examination demonstrates patches of white pseudomembranes that can be wiped away to reveal erythematous mucosa. A medication with which of the following mechanisms of action is most appropriate in this patient?\n\n Option:\nDisruption of cell membrane permeability;\nDisruption of microtubule formation;\nInhibition of 14-alpha-demethylase;\nInhibition of beta-glucan synthase;\n\n\n Answer:\nDisruption of cell membrane permeability\n For this QA example, you need to give netural fact info for each\n    option according to question context, so that later user can infer out the \n    correct answer from these facts. The template of facts is [option1_name:fact| option2_name:fact|...],e.g: [Ampicillin:High resistance, not first-line. | Ceftriaxone:Overkill (for pyelonephritis/severe UTI).]\n", "hinted_gen_query": "\n    Question:\nA healthy 19-year-old man presents to his primary care provider complaining of painless “blisters” in his mouth. He reports that he noticed a white film on his tongue and the sides of his mouth 2 days ago while brushing his teeth. The film was easily brushed off. He also complains of a bitter metallic taste in his mouth but otherwise denies pain, burning, dysphagia, or hoarseness. He is otherwise healthy and takes no medications. He is a competitive swimmer and has had 8 sexual partners in the past year. He intermittently uses barrier protection. On exam, he is well-appearing and in no acute distress. His oral examination demonstrates patches of white pseudomembranes that can be wiped away to reveal erythematous mucosa. A medication with which of the following mechanisms of action is most appropriate in this patient?\n\n Option:\nA:Disruption of cell membrane permeability;\nB:Disruption of microtubule formation;\nC:Inhibition of 14-alpha-demethylase;\nD:Inhibition of beta-glucan synthase;\n \n\n Hint:\nNone \n\n Answer:\n"}
{"question": "A 56-year-old man presents to the clinic complaining of subacute back pain for the past month. The pain is described as a dull, constant ache that is worse at night. He could not recall any precipitating event except for an amateur weight-lifting competition that he participated in 2 months ago. Past medical history is significant for non-small cell lung cancer that was diagnosed and successfully treated. A PET scan 1 year ago demonstrated no recurrence. Physical exam was unremarkable except for some point tenderness along the lumbosacral area. What is the most likely imaging finding in this patient?", "answer": "Lytic lesions of the lumbar spine", "options": {"A": "Bulging disc impinging on lumbar spinal nerve", "B": "Lytic lesions of the lumbar spine", "C": "Narrowing of the lumbar disc space", "D": "Sacroilitis and fusion of the lumbar spine"}, "meta_info": "step1", "answer_idx": "B", "metamap_phrases": ["year old man presents", "clinic", "of subacute back pain", "past month", "pain", "described", "dull", "constant ache", "worse", "night", "not recall", "precipitating event", "amateur weight-lifting competition", "months", "Past medical history", "significant", "non-small cell lung cancer", "diagnosed", "treated", "PET scan year", "recurrence", "Physical exam", "unremarkable", "point tenderness", "lumbosacral area", "most likely imaging finding", "patient"], "model_answer": "The patient's history of non-small cell lung cancer, subacute back pain worse at night, and point tenderness along the lumbosacral area raise concern for metastatic disease to the spine. The most likely imaging finding in this patient would be lytic lesions of the lumbar spine, which are characteristic of metastatic bone disease.\n\n[B]", "fact_gen_query": "\n    nQuestion:\nA 56-year-old man presents to the clinic complaining of subacute back pain for the past month. The pain is described as a dull, constant ache that is worse at night. He could not recall any precipitating event except for an amateur weight-lifting competition that he participated in 2 months ago. Past medical history is significant for non-small cell lung cancer that was diagnosed and successfully treated. A PET scan 1 year ago demonstrated no recurrence. Physical exam was unremarkable except for some point tenderness along the lumbosacral area. What is the most likely imaging finding in this patient?\n\n Option:\nBulging disc impinging on lumbar spinal nerve;\nLytic lesions of the lumbar spine;\nNarrowing of the lumbar disc space;\nSacroilitis and fusion of the lumbar spine;\n\n\n Answer:\nLytic lesions of the lumbar spine\n For this QA example, you need to give netural fact info for each\n    option according to question context, so that later user can infer out the \n    correct answer from these facts. The template of facts is [option1_name:fact| option2_name:fact|...],e.g: [Ampicillin:High resistance, not first-line. | Ceftriaxone:Overkill (for pyelonephritis/severe UTI).]\n", "hinted_gen_query": "\n    Question:\nA 56-year-old man presents to the clinic complaining of subacute back pain for the past month. The pain is described as a dull, constant ache that is worse at night. He could not recall any precipitating event except for an amateur weight-lifting competition that he participated in 2 months ago. Past medical history is significant for non-small cell lung cancer that was diagnosed and successfully treated. A PET scan 1 year ago demonstrated no recurrence. Physical exam was unremarkable except for some point tenderness along the lumbosacral area. What is the most likely imaging finding in this patient?\n\n Option:\nA:Bulging disc impinging on lumbar spinal nerve;\nB:Lytic lesions of the lumbar spine;\nC:Narrowing of the lumbar disc space;\nD:Sacroilitis and fusion of the lumbar spine;\n \n\n Hint:\nNone \n\n Answer:\n"}
{"question": "A 4-year-old boy is brought to the emergency department because of severe abdominal pain and bilious vomiting for 6 hours. He has not had bowel movements in the past 24 hours. He appears ill. His temperature is 37.8°C (100°F) and pulse is 122/min. Examination shows a distended abdomen. There is tenderness to palpation in the lower abdomen; guarding and rebound tenderness are present. Bowel sounds are decreased. An x-ray of the abdomen shows dilated loops of bowel. He has been accompanied by his 14-year-old brother. The surgeon recommends an emergency laparotomy. The parents are away visiting friends and cannot be reached. Which of the following is the most appropriate next best step in management?", "answer": "Perform emergency laparotomy", "options": {"A": "Get consent from the patient's brother", "B": "Get consent from the patient", "C": "Perform emergency laparotomy", "D": "Delay surgery until parental consent"}, "meta_info": "step2&3", "answer_idx": "C", "metamap_phrases": ["4 year old boy", "brought", "emergency department", "severe abdominal", "bilious vomiting", "hours", "not", "bowel movements", "past 24 hours", "appears ill", "temperature", "pulse", "min", "Examination shows", "distended abdomen", "tenderness", "palpation", "lower abdomen", "guarding", "rebound tenderness", "present", "Bowel sounds", "decreased", "x-ray of", "abdomen shows dilated", "bowel", "year old brother", "surgeon recommends", "emergency laparotomy", "parents", "visiting friends", "reached", "following", "most appropriate next best step", "management"], "model_answer": "The most appropriate next best step in management is to perform the emergency laparotomy without delay, as the patient's condition is critical and waiting for parental consent could lead to serious harm or death. \n\nThe correct answer is [C].", "fact_gen_query": "\n    nQuestion:\nA 4-year-old boy is brought to the emergency department because of severe abdominal pain and bilious vomiting for 6 hours. He has not had bowel movements in the past 24 hours. He appears ill. His temperature is 37.8°C (100°F) and pulse is 122/min. Examination shows a distended abdomen. There is tenderness to palpation in the lower abdomen; guarding and rebound tenderness are present. Bowel sounds are decreased. An x-ray of the abdomen shows dilated loops of bowel. He has been accompanied by his 14-year-old brother. The surgeon recommends an emergency laparotomy. The parents are away visiting friends and cannot be reached. Which of the following is the most appropriate next best step in management?\n\n Option:\nGet consent from the patient's brother;\nGet consent from the patient;\nPerform emergency laparotomy;\nDelay surgery until parental consent;\n\n\n Answer:\nPerform emergency laparotomy\n For this QA example, you need to give netural fact info for each\n    option according to question context, so that later user can infer out the \n    correct answer from these facts. The template of facts is [option1_name:fact| option2_name:fact|...],e.g: [Ampicillin:High resistance, not first-line. | Ceftriaxone:Overkill (for pyelonephritis/severe UTI).]\n", "hinted_gen_query": "\n    Question:\nA 4-year-old boy is brought to the emergency department because of severe abdominal pain and bilious vomiting for 6 hours. He has not had bowel movements in the past 24 hours. He appears ill. His temperature is 37.8°C (100°F) and pulse is 122/min. Examination shows a distended abdomen. There is tenderness to palpation in the lower abdomen; guarding and rebound tenderness are present. Bowel sounds are decreased. An x-ray of the abdomen shows dilated loops of bowel. He has been accompanied by his 14-year-old brother. The surgeon recommends an emergency laparotomy. The parents are away visiting friends and cannot be reached. Which of the following is the most appropriate next best step in management?\n\n Option:\nA:Get consent from the patient's brother;\nB:Get consent from the patient;\nC:Perform emergency laparotomy;\nD:Delay surgery until parental consent;\n \n\n Hint:\nNone \n\n Answer:\n"}
{"question": "A 3-week-old male newborn is brought to the hospital because of poor weight gain since birth. He was born at 38 weeks' gestation via normal vaginal delivery. He weighed 3005 g (6 lb, 10 oz) at birth and currently weighs 2835 g (6 lb, 4 oz). He has been latching on and breastfeeding well since birth. His mother has a history of Graves' disease and underwent near-total thyroidectomy in the second trimester of her pregnancy after her symptoms could not be controlled with antithyroid drugs. She is currently receiving L-thyroxine therapy. The patient's temperature is 38.9°C (102°F), pulse is 176/min, and respirations are 42/min. He appears irritable. Examination shows a diaphoretic infant with a paucity of subcutaneous fat. There is swelling of the neck at the midline. Which of the following is the most likely cause?", "answer": "Transplacental passage of TSH receptor antibodies", "options": {"A": "Transplacental passage of thyroid peroxidase antibodies", "B": "Transplacental passage of TSH receptor antibodies", "C": "Transplacental viral infection", "D": "Opiate use in the mother"}, "meta_info": "step2&3", "answer_idx": "B", "metamap_phrases": ["3 week old male newborn", "brought", "hospital", "poor weight gain", "birth", "born", "weeks", "gestation", "normal vaginal", "g", "10 oz", "birth", "currently", "g", "4 oz", "latching", "breastfeeding well", "birth", "mother", "history of Graves", "disease", "total thyroidectomy", "second trimester", "pregnancy", "symptoms", "not", "controlled", "drugs", "currently receiving L-thyroxine therapy", "patient's temperature", "pulse", "min", "respirations", "min", "appears irritable", "Examination shows", "diaphoretic infant", "subcutaneous fat", "swelling of the neck", "midline", "following", "most likely cause"], "model_answer": "The most likely cause of this newborn's symptoms is **transplacental passage of TSH receptor antibodies (Option B)**. Here's the reasoning:\n\n1. The mother has a history of Graves' disease, an autoimmune condition caused by TSH receptor antibodies (TRAb) that stimulate the thyroid gland.\n2. These antibodies can cross the placenta and affect the fetal thyroid, leading to neonatal thyrotoxicosis.\n3. The infant's symptoms (poor weight gain, irritability, tachycardia, fever, diaphoresis, and neck swelling at the midline [likely goiter]) are consistent with hyperthyroidism.\n4. The mother's near-total thyroidectomy during pregnancy would not eliminate the TRAb, as these antibodies persist in the circulation even after the thyroid is removed.\n5. The neck swelling suggests thyroid enlargement (goiter), which can occur due to antibody stimulation of the thyroid gland.\n\nWhile thyroid peroxidase antibodies (Option A) are also present in Graves' disease, they are not pathogenic and do not cause hyperthyroidism. The other options (viral infection or opiate use) do not fit the clinical picture.\n\n[ B ]", "fact_gen_query": "\n    nQuestion:\nA 3-week-old male newborn is brought to the hospital because of poor weight gain since birth. He was born at 38 weeks' gestation via normal vaginal delivery. He weighed 3005 g (6 lb, 10 oz) at birth and currently weighs 2835 g (6 lb, 4 oz). He has been latching on and breastfeeding well since birth. His mother has a history of Graves' disease and underwent near-total thyroidectomy in the second trimester of her pregnancy after her symptoms could not be controlled with antithyroid drugs. She is currently receiving L-thyroxine therapy. The patient's temperature is 38.9°C (102°F), pulse is 176/min, and respirations are 42/min. He appears irritable. Examination shows a diaphoretic infant with a paucity of subcutaneous fat. There is swelling of the neck at the midline. Which of the following is the most likely cause?\n\n Option:\nTransplacental passage of thyroid peroxidase antibodies;\nTransplacental passage of TSH receptor antibodies;\nTransplacental viral infection;\nOpiate use in the mother;\n\n\n Answer:\nTransplacental passage of TSH receptor antibodies\n For this QA example, you need to give netural fact info for each\n    option according to question context, so that later user can infer out the \n    correct answer from these facts. The template of facts is [option1_name:fact| option2_name:fact|...],e.g: [Ampicillin:High resistance, not first-line. | Ceftriaxone:Overkill (for pyelonephritis/severe UTI).]\n", "hinted_gen_query": "\n    Question:\nA 3-week-old male newborn is brought to the hospital because of poor weight gain since birth. He was born at 38 weeks' gestation via normal vaginal delivery. He weighed 3005 g (6 lb, 10 oz) at birth and currently weighs 2835 g (6 lb, 4 oz). He has been latching on and breastfeeding well since birth. His mother has a history of Graves' disease and underwent near-total thyroidectomy in the second trimester of her pregnancy after her symptoms could not be controlled with antithyroid drugs. She is currently receiving L-thyroxine therapy. The patient's temperature is 38.9°C (102°F), pulse is 176/min, and respirations are 42/min. He appears irritable. Examination shows a diaphoretic infant with a paucity of subcutaneous fat. There is swelling of the neck at the midline. Which of the following is the most likely cause?\n\n Option:\nA:Transplacental passage of thyroid peroxidase antibodies;\nB:Transplacental passage of TSH receptor antibodies;\nC:Transplacental viral infection;\nD:Opiate use in the mother;\n \n\n Hint:\nNone \n\n Answer:\n"}
{"question": "A 57-year-old female with a past medical history of alcoholism presents to the emergency room vomiting bright red blood. She is accompanied by her partner, who reports that she had been complaining of black and tarry stools for the past several days. Vital signs are temperature 37 degrees celsius, heart rate 141 beats per minute, blood pressure 90/60, respiratory rate 20, and oxygen saturation 99% on room air. On physical examination, she has splenomegaly and a positive fluid wave. The remainder of her examination is within normal limits. The patient is stabilized with intravenous fluids, and her blood pressure improves. Subsequent emergent upper endoscopy reveals bleeding from the submucosal veins in the lower 1/3 of the esophagus, but no gastric bleed. In the endoscopy suite she also receives IV octreotide. After intervention and resolution of her acute bleed, which of the following pharmacologic agents is indicated?", "answer": "Nadalol", "options": {"A": "Phentolamine", "B": "Prazosin", "C": "Nifedipine", "D": "Nadalol"}, "meta_info": "step1", "answer_idx": "D", "metamap_phrases": ["57 year old female", "past medical presents", "emergency room vomiting bright red blood", "partner", "reports", "black", "tarry stools", "past", "days", "Vital signs", "temperature", "degrees celsius", "heart rate", "beats per minute", "blood pressure 90 60", "respiratory rate 20", "oxygen 99", "room air", "physical examination", "splenomegaly", "positive fluid wave", "examination", "normal limits", "patient", "stabilized", "intravenous fluids", "blood pressure improves", "Subsequent emergent upper endoscopy reveals bleeding", "submucosal veins", "lower", "esophagus", "gastric bleed", "endoscopy suite", "receives IV octreotide", "intervention", "resolution", "acute bleed", "following pharmacologic agents", "indicated"], "model_answer": "The patient presents with hematemesis and melena, with endoscopy confirming esophageal variceal bleeding, a common complication of portal hypertension in the setting of chronic alcoholism (likely cirrhosis given splenomegaly and ascites on exam). After acute management with IV fluids, octreotide (a splanchnic vasoconstrictor), and endoscopic therapy, the next step is **non-selective beta-blockers** (e.g., nadolol or propranolol) to reduce portal pressure and prevent rebleeding. \n\n- **Phentolamine (A)**: Alpha-blocker used for hypertensive emergencies (e.g., pheochromocytoma), not portal hypertension.  \n- **Prazosin (B)**: Alpha-1 antagonist used for hypertension or benign prostatic hyperplasia; it increases portal pressure and is contraindicated.  \n- **Nifedipine (C)**: Dihydropyridine calcium channel blocker used for hypertension or angina; not for variceal prophylaxis.  \n- **Nadolol (D)**: Non-selective beta-blocker (blocks β1 and β2), which reduces cardiac output (β1) and splanchnic vasoconstriction (β2), decreasing portal pressure. **This is the correct choice.**  \n\n[D]", "fact_gen_query": "\n    nQuestion:\nA 57-year-old female with a past medical history of alcoholism presents to the emergency room vomiting bright red blood. She is accompanied by her partner, who reports that she had been complaining of black and tarry stools for the past several days. Vital signs are temperature 37 degrees celsius, heart rate 141 beats per minute, blood pressure 90/60, respiratory rate 20, and oxygen saturation 99% on room air. On physical examination, she has splenomegaly and a positive fluid wave. The remainder of her examination is within normal limits. The patient is stabilized with intravenous fluids, and her blood pressure improves. Subsequent emergent upper endoscopy reveals bleeding from the submucosal veins in the lower 1/3 of the esophagus, but no gastric bleed. In the endoscopy suite she also receives IV octreotide. After intervention and resolution of her acute bleed, which of the following pharmacologic agents is indicated?\n\n Option:\nPhentolamine;\nPrazosin;\nNifedipine;\nNadalol;\n\n\n Answer:\nNadalol\n For this QA example, you need to give netural fact info for each\n    option according to question context, so that later user can infer out the \n    correct answer from these facts. The template of facts is [option1_name:fact| option2_name:fact|...],e.g: [Ampicillin:High resistance, not first-line. | Ceftriaxone:Overkill (for pyelonephritis/severe UTI).]\n", "hinted_gen_query": "\n    Question:\nA 57-year-old female with a past medical history of alcoholism presents to the emergency room vomiting bright red blood. She is accompanied by her partner, who reports that she had been complaining of black and tarry stools for the past several days. Vital signs are temperature 37 degrees celsius, heart rate 141 beats per minute, blood pressure 90/60, respiratory rate 20, and oxygen saturation 99% on room air. On physical examination, she has splenomegaly and a positive fluid wave. The remainder of her examination is within normal limits. The patient is stabilized with intravenous fluids, and her blood pressure improves. Subsequent emergent upper endoscopy reveals bleeding from the submucosal veins in the lower 1/3 of the esophagus, but no gastric bleed. In the endoscopy suite she also receives IV octreotide. After intervention and resolution of her acute bleed, which of the following pharmacologic agents is indicated?\n\n Option:\nA:Phentolamine;\nB:Prazosin;\nC:Nifedipine;\nD:Nadalol;\n \n\n Hint:\nNone \n\n Answer:\n"}
{"question": "A 65-year-old man with a history of hypertension, obesity, and alcoholic cirrhosis is seen in clinic for follow-up. He feels well and currently drinks 5 glasses of wine each night. Medications include atenolol and lisinopril. On physical exam, temperature is 98.1 deg F (36.7 deg C), blood pressure is 151/82 mmHg, pulse is 71/min, and respirations are 14/min. He has spider angiomata on his chest; no asterixis, jaundice, ascites, or peripheral edema is noted. Screening ultrasound reveals a new liver nodule, and follow up CT demonstrates a 2 cm right hepatic lobe lesion with enhancement in the arterial phase. No hypodense attenuation is seen on the venous or delayed phase. What is the next step in management?", "answer": "Proceed with liver biopsy", "options": {"A": "Proceed with liver biopsy", "B": "Refer for surgical resection", "C": "Refer for radiofrequency ablation", "D": "Observe and get follow-up imaging in 3 months"}, "meta_info": "step1", "answer_idx": "A", "metamap_phrases": ["65-year-old man", "history of hypertension", "obesity", "alcoholic cirrhosis", "seen in clinic", "follow-up", "feels well", "currently drinks 5 glasses", "wine", "night", "Medications include atenolol", "lisinopril", "physical exam", "temperature", "98", "deg F", "36", "blood pressure", "mmHg", "pulse", "71 min", "respirations", "min", "spider angiomata", "chest", "asterixis", "jaundice", "ascites", "peripheral edema", "noted", "Screening ultrasound reveals", "new liver nodule", "follow up CT demonstrates", "2 cm right hepatic lesion", "enhancement", "arterial phase", "attenuation", "seen", "venous", "delayed phase", "next step", "management"], "model_answer": "The patient has a history of alcoholic cirrhosis and presents with a new liver nodule found on imaging. The CT findings (enhancement in the arterial phase without hypodense attenuation in the venous or delayed phase) are characteristic of a hepatocellular carcinoma (HCC) in a cirrhotic liver. According to current guidelines, biopsy is not required for diagnosis if imaging findings are typical for HCC in a cirrhotic patient. The next step in management is definitive treatment, which for a solitary lesion <5 cm in a patient with compensated cirrhosis is typically surgical resection or liver transplantation. \n\nThe correct answer is [B:Refer for surgical resection].", "fact_gen_query": "\n    nQuestion:\nA 65-year-old man with a history of hypertension, obesity, and alcoholic cirrhosis is seen in clinic for follow-up. He feels well and currently drinks 5 glasses of wine each night. Medications include atenolol and lisinopril. On physical exam, temperature is 98.1 deg F (36.7 deg C), blood pressure is 151/82 mmHg, pulse is 71/min, and respirations are 14/min. He has spider angiomata on his chest; no asterixis, jaundice, ascites, or peripheral edema is noted. Screening ultrasound reveals a new liver nodule, and follow up CT demonstrates a 2 cm right hepatic lobe lesion with enhancement in the arterial phase. No hypodense attenuation is seen on the venous or delayed phase. What is the next step in management?\n\n Option:\nProceed with liver biopsy;\nRefer for surgical resection;\nRefer for radiofrequency ablation;\nObserve and get follow-up imaging in 3 months;\n\n\n Answer:\nProceed with liver biopsy\n For this QA example, you need to give netural fact info for each\n    option according to question context, so that later user can infer out the \n    correct answer from these facts. The template of facts is [option1_name:fact| option2_name:fact|...],e.g: [Ampicillin:High resistance, not first-line. | Ceftriaxone:Overkill (for pyelonephritis/severe UTI).]\n", "hinted_gen_query": "\n    Question:\nA 65-year-old man with a history of hypertension, obesity, and alcoholic cirrhosis is seen in clinic for follow-up. He feels well and currently drinks 5 glasses of wine each night. Medications include atenolol and lisinopril. On physical exam, temperature is 98.1 deg F (36.7 deg C), blood pressure is 151/82 mmHg, pulse is 71/min, and respirations are 14/min. He has spider angiomata on his chest; no asterixis, jaundice, ascites, or peripheral edema is noted. Screening ultrasound reveals a new liver nodule, and follow up CT demonstrates a 2 cm right hepatic lobe lesion with enhancement in the arterial phase. No hypodense attenuation is seen on the venous or delayed phase. What is the next step in management?\n\n Option:\nA:Proceed with liver biopsy;\nB:Refer for surgical resection;\nC:Refer for radiofrequency ablation;\nD:Observe and get follow-up imaging in 3 months;\n \n\n Hint:\nNone \n\n Answer:\n"}
{"question": "A 66-year-old man is brought to the emergency room by his wife due to abdominal distension and persistent somnolence for the past 2 weeks. The patient’s wife says that he has been sleeping much more than usual for the past 5 days. His bowel and bladder habit have not changed. His past medical history is significant for alcoholic liver cirrhosis. His vital signs include: pulse 76/min, respiratory rate 15/min, temperature 38.0°C (100.4°F) and blood pressure 122/75 mm Hg. On physical examination, the patient is altered and not responsive to commands. Oriented x 0. The abdomen is significantly distended. Shifting dullness is present and a positive fluid wave can be elicited. Hyperreflexia and asterixis are noted. Laboratory findings are significant for the following:\nLaboratory test\nSodium 140 mEq/L\nPotassium 3.5 mEq/L\nChloride 97 mEq/L\nGlucose 90 mg/dL\nAmmonia 100 µg/dL (ref: 19-60 µg/dL)\nArterial blood gas\npH 7.4\npCO2 40 mm Hg\npO2 90 mm Hg\nHCO3 26 mEq/L\nAn abdominal ultrasound shows surface nodularity compatible with cirrhosis but no other changes aside from ascites. An upper GI endoscopy is performed which shows gastric varices with no signs of active bleeding. An MRI of the brain is insignificant. What is the most likely precipitating factor that led to this patient’s condition?", "answer": "Spontaneous bacterial peritonitis", "options": {"A": "Spontaneous bacterial peritonitis", "B": "Metabolic alkalosis", "C": "Portal vein thrombosis", "D": "Hypoglycemia"}, "meta_info": "step1", "answer_idx": "A", "metamap_phrases": ["66 year old man", "brought", "emergency room", "wife due to abdominal distension", "persistent somnolence", "past 2 weeks", "patients wife", "sleeping much", "usual", "past", "days", "bowel", "bladder habit", "not changed", "past medical history", "significant", "alcoholic liver cirrhosis", "vital signs include", "pulse 76 min", "respiratory rate", "min", "temperature", "100 4F", "blood pressure", "75 mm Hg", "physical examination", "patient", "altered", "not responsive", "commands", "Oriented", "0", "abdomen", "distended", "Shifting dullness", "present", "positive fluid wave", "elicited", "Hyperreflexia", "asterixis", "noted", "Laboratory findings", "significant", "following", "Laboratory", "mEq", "Potassium", "Chloride", "Glucose", "mg dL Ammonia", "dL", "ref", "60 g/dL", "Arterial blood gas pH 7", "pCO2", "mm Hg pO2", "HCO3", "mEq/L", "abdominal ultrasound shows surface nodularity compatible", "cirrhosis", "changes", "ascites", "upper GI endoscopy", "performed", "shows gastric varices", "signs of active bleeding", "MRI of", "brain", "most likely precipitating factor", "led", "patients condition"], "model_answer": "The patient presents with altered mental status, asterixis, and hyperreflexia, along with elevated ammonia levels, which are consistent with hepatic encephalopathy. Given his history of alcoholic liver cirrhosis and the presence of ascites, the most likely precipitating factor for his hepatic encephalopathy is an infection, such as spontaneous bacterial peritonitis (SBP), which is a common trigger in cirrhotic patients. The fever (38.0°C) further supports the possibility of an infectious process. \n\nThe other options are less likely: \n- Metabolic alkalosis is not supported by the arterial blood gas (pH 7.4, HCO3 26 mEq/L). \n- Portal vein thrombosis would typically present with abdominal pain and possibly worsening ascites, but not necessarily hepatic encephalopathy. \n- Hypoglycemia is ruled out by the normal glucose level (90 mg/dL).\n\nThus, the most likely precipitating factor is spontaneous bacterial peritonitis. \n\n[A]", "fact_gen_query": "\n    nQuestion:\nA 66-year-old man is brought to the emergency room by his wife due to abdominal distension and persistent somnolence for the past 2 weeks. The patient’s wife says that he has been sleeping much more than usual for the past 5 days. His bowel and bladder habit have not changed. His past medical history is significant for alcoholic liver cirrhosis. His vital signs include: pulse 76/min, respiratory rate 15/min, temperature 38.0°C (100.4°F) and blood pressure 122/75 mm Hg. On physical examination, the patient is altered and not responsive to commands. Oriented x 0. The abdomen is significantly distended. Shifting dullness is present and a positive fluid wave can be elicited. Hyperreflexia and asterixis are noted. Laboratory findings are significant for the following:\nLaboratory test\nSodium 140 mEq/L\nPotassium 3.5 mEq/L\nChloride 97 mEq/L\nGlucose 90 mg/dL\nAmmonia 100 µg/dL (ref: 19-60 µg/dL)\nArterial blood gas\npH 7.4\npCO2 40 mm Hg\npO2 90 mm Hg\nHCO3 26 mEq/L\nAn abdominal ultrasound shows surface nodularity compatible with cirrhosis but no other changes aside from ascites. An upper GI endoscopy is performed which shows gastric varices with no signs of active bleeding. An MRI of the brain is insignificant. What is the most likely precipitating factor that led to this patient’s condition?\n\n Option:\nSpontaneous bacterial peritonitis;\nMetabolic alkalosis;\nPortal vein thrombosis;\nHypoglycemia;\n\n\n Answer:\nSpontaneous bacterial peritonitis\n For this QA example, you need to give netural fact info for each\n    option according to question context, so that later user can infer out the \n    correct answer from these facts. The template of facts is [option1_name:fact| option2_name:fact|...],e.g: [Ampicillin:High resistance, not first-line. | Ceftriaxone:Overkill (for pyelonephritis/severe UTI).]\n", "hinted_gen_query": "\n    Question:\nA 66-year-old man is brought to the emergency room by his wife due to abdominal distension and persistent somnolence for the past 2 weeks. The patient’s wife says that he has been sleeping much more than usual for the past 5 days. His bowel and bladder habit have not changed. His past medical history is significant for alcoholic liver cirrhosis. His vital signs include: pulse 76/min, respiratory rate 15/min, temperature 38.0°C (100.4°F) and blood pressure 122/75 mm Hg. On physical examination, the patient is altered and not responsive to commands. Oriented x 0. The abdomen is significantly distended. Shifting dullness is present and a positive fluid wave can be elicited. Hyperreflexia and asterixis are noted. Laboratory findings are significant for the following:\nLaboratory test\nSodium 140 mEq/L\nPotassium 3.5 mEq/L\nChloride 97 mEq/L\nGlucose 90 mg/dL\nAmmonia 100 µg/dL (ref: 19-60 µg/dL)\nArterial blood gas\npH 7.4\npCO2 40 mm Hg\npO2 90 mm Hg\nHCO3 26 mEq/L\nAn abdominal ultrasound shows surface nodularity compatible with cirrhosis but no other changes aside from ascites. An upper GI endoscopy is performed which shows gastric varices with no signs of active bleeding. An MRI of the brain is insignificant. What is the most likely precipitating factor that led to this patient’s condition?\n\n Option:\nA:Spontaneous bacterial peritonitis;\nB:Metabolic alkalosis;\nC:Portal vein thrombosis;\nD:Hypoglycemia;\n \n\n Hint:\nNone \n\n Answer:\n"}
{"question": "A 27-year-old man presents to the emergency department after a motor vehicle collision. The patient was the front seat unrestrained driver in a head on collision. The patient’s echocardiogram (ECG) is notable only for sinus tachycardia. His temperature is 99.5°F (37.5°C), blood pressure is 107/58 mmHg, pulse is 120/min, respirations are 17/min, and oxygen saturation is 98% on room air. The patient is given 2 liters of Ringer lactate solution and morphine. Initial workup demonstrates that the patient’s pulmonary capillary wedge pressure and troponins are elevated. The patient is currently complaining of chest pain. Physical exam is notable for an uncomfortable young man with bruising over his chest wall. Which of the following is the most likely diagnosis?", "answer": "Cardiac contusion", "options": {"A": "Cardiac contusion", "B": "Hemorrhage", "C": "Pulmonary contusion", "D": "Takotsubo cardiomyopathy"}, "meta_info": "step2&3", "answer_idx": "A", "metamap_phrases": ["27 year old man presents", "emergency department", "motor vehicle collision", "patient", "front", "driver", "head", "collision", "patients echocardiogram", "notable only", "sinus tachycardia", "temperature", "99", "blood pressure", "58 mmHg", "pulse", "min", "respirations", "min", "oxygen saturation", "98", "room air", "patient", "given 2 liters", "Ringer lactate solution", "morphine", "Initial workup demonstrates", "patients pulmonary capillary wedge pressure", "troponins", "elevated", "patient", "currently", "of chest pain", "Physical exam", "notable", "young man", "bruising", "chest wall", "following", "most likely diagnosis"], "model_answer": "The most likely diagnosis in this scenario is **A: Cardiac contusion**. \n\nHere's the reasoning:  \n1. The patient was in a high-impact motor vehicle collision (unrestrained driver, head-on collision), which is a classic mechanism for blunt cardiac injury.  \n2. He has chest pain, sinus tachycardia, and elevated troponins, which are consistent with myocardial injury.  \n3. The elevated pulmonary capillary wedge pressure suggests impaired cardiac function, likely due to contusion-induced myocardial dysfunction.  \n4. Physical exam findings (chest wall bruising) support blunt trauma to the chest.  \n\nOther options are less likely:  \n- **B: Hemorrhage** – Unlikely as the patient is hemodynamically stable after fluid resuscitation, and there is no evidence of ongoing bleeding or anemia.  \n- **C: Pulmonary contusion** – Would typically present with hypoxia, respiratory distress, or imaging findings (not mentioned here).  \n- **D: Takotsubo cardiomyopathy** – Rare in young trauma patients and usually associated with emotional stress, not physical trauma.  \n\nThe correct answer is [A].", "fact_gen_query": "\n    nQuestion:\nA 27-year-old man presents to the emergency department after a motor vehicle collision. The patient was the front seat unrestrained driver in a head on collision. The patient’s echocardiogram (ECG) is notable only for sinus tachycardia. His temperature is 99.5°F (37.5°C), blood pressure is 107/58 mmHg, pulse is 120/min, respirations are 17/min, and oxygen saturation is 98% on room air. The patient is given 2 liters of Ringer lactate solution and morphine. Initial workup demonstrates that the patient’s pulmonary capillary wedge pressure and troponins are elevated. The patient is currently complaining of chest pain. Physical exam is notable for an uncomfortable young man with bruising over his chest wall. Which of the following is the most likely diagnosis?\n\n Option:\nCardiac contusion;\nHemorrhage;\nPulmonary contusion;\nTakotsubo cardiomyopathy;\n\n\n Answer:\nCardiac contusion\n For this QA example, you need to give netural fact info for each\n    option according to question context, so that later user can infer out the \n    correct answer from these facts. The template of facts is [option1_name:fact| option2_name:fact|...],e.g: [Ampicillin:High resistance, not first-line. | Ceftriaxone:Overkill (for pyelonephritis/severe UTI).]\n", "hinted_gen_query": "\n    Question:\nA 27-year-old man presents to the emergency department after a motor vehicle collision. The patient was the front seat unrestrained driver in a head on collision. The patient’s echocardiogram (ECG) is notable only for sinus tachycardia. His temperature is 99.5°F (37.5°C), blood pressure is 107/58 mmHg, pulse is 120/min, respirations are 17/min, and oxygen saturation is 98% on room air. The patient is given 2 liters of Ringer lactate solution and morphine. Initial workup demonstrates that the patient’s pulmonary capillary wedge pressure and troponins are elevated. The patient is currently complaining of chest pain. Physical exam is notable for an uncomfortable young man with bruising over his chest wall. Which of the following is the most likely diagnosis?\n\n Option:\nA:Cardiac contusion;\nB:Hemorrhage;\nC:Pulmonary contusion;\nD:Takotsubo cardiomyopathy;\n \n\n Hint:\nNone \n\n Answer:\n"}
{"question": "A 56-year-old man presents to the emergency department for progressively worsening fatigue, malaise, fever, and abdominal pain. He reports that his symptoms began approximately 1 week ago and he has noticed episodes of diarrhea. He recently started melatonin and magnesium supplementation in hopes of improving his sleep. Medical history is significant for alcohol use disorder that required multiple hospital admissions for management of acute pancreatitis and cirrhosis. He states that he occasionally injects heroin intravenously. Temperature is 100°F (37.8°C), blood pressure is 105/70 mmHg, pulse is 92/min, and respirations are 17/min. Physical examination is significant for scleral icterus, hepatomegaly, ascites, and diffuse abdominal tenderness. Laboratory testing is significant for leukocytosis and metabolic acidosis. A paracentesis is performed and he is admitted into the hospital to receive intravenous cefotaxime and albumin. Ascitic fluid analysis demonstrates a polymorphonuclear cell count of 280 cells/mm^3, serum-ascites albumin gradient of 1.3 g/dL, and a culture positive for Escherichia coli sensitive to cefotaxime and ceftriaxone. On hospital day 2, the nurse reports that the patient is oliguric in the setting of constant fluid intake. Physical examination is unchanged. Laboratory testing is significant for a serum sodium of 131 mEq/L and creatinine of 1.8 mg/dL (it was 0.9 mg/dL on admission). Urine studies are significant for a low urine sodium level, without evidence of blood or protein. Since the hospital admission, he has not been started on any new medications. Which of the following will be the best treatment option for this patient?", "answer": "Liver transplantation", "options": {"A": "Adding dopamine to his treatment regimen", "B": "Adding lisinopril to his treatment regimen", "C": "Liver transplantation", "D": "Transjugular intrahepatic portosystemic shunting"}, "meta_info": "step2&3", "answer_idx": "C", "metamap_phrases": ["year old man presents", "emergency department", "worsening fatigue", "malaise", "fever", "abdominal pain", "reports", "symptoms began approximately", "week", "episodes of diarrhea", "recently started melatonin", "magnesium supplementation", "hopes", "improving", "sleep", "Medical history", "significant", "alcohol use disorder", "required multiple hospital", "management", "acute pancreatitis", "cirrhosis", "states", "occasionally injects heroin", "Temperature", "blood pressure", "70 mmHg", "pulse", "min", "respirations", "min", "Physical examination", "significant", "scleral icterus", "hepatomegaly", "ascites", "diffuse abdominal tenderness", "Laboratory testing", "significant", "leukocytosis", "metabolic acidosis", "paracentesis", "performed", "admitted", "hospital to receive intravenous cefotaxime", "albumin", "Ascitic demonstrates", "polymorphonuclear cell count", "cells mm", "serum-ascites albumin gradient", "g/dL", "culture positive", "Escherichia coli sensitive to cefotaxime", "ceftriaxone", "hospital", "nurse reports", "patient", "oliguric", "setting", "constant fluid intake", "Physical examination", "unchanged", "Laboratory testing", "significant", "serum sodium", "mEq/L", "creatinine", "1.8 mg/dL", "0.9 mg/dL on admission", "Urine studies", "significant", "low urine sodium level", "evidence", "blood", "protein", "hospital admission", "not", "started", "new medications", "following", "best treatment", "patient"], "model_answer": "The patient presents with spontaneous bacterial peritonitis (SBP) due to Escherichia coli, as evidenced by the ascitic fluid analysis (polymorphonuclear cell count >250 cells/mm³ and positive culture). He now has developed hepatorenal syndrome (HRS), likely type 1, given the rapid rise in creatinine (from 0.9 to 1.8 mg/dL) and oliguria in the setting of cirrhosis and SBP. The low urine sodium level and absence of proteinuria or hematuria further support this diagnosis. \n\nThe best treatment for HRS in this setting is **albumin and vasoconstrictors** (e.g., terlipressin, midodrine + octreotide, or norepinephrine), but none of these options are listed. Among the choices provided, **liver transplantation (C)** is the definitive treatment for HRS and cirrhosis, though it is not an immediate solution. \n\nThe other options are incorrect:\n- **A (Dopamine)**: Dopamine is not effective for HRS.\n- **B (Lisinopril)**: ACE inhibitors are contraindicated in HRS due to the risk of worsening hypotension and renal perfusion.\n- **D (TIPS)**: TIPS is not typically used for HRS and may worsen hepatic encephalopathy in this patient with advanced liver disease.\n\nThe most appropriate answer is [C].", "fact_gen_query": "\n    nQuestion:\nA 56-year-old man presents to the emergency department for progressively worsening fatigue, malaise, fever, and abdominal pain. He reports that his symptoms began approximately 1 week ago and he has noticed episodes of diarrhea. He recently started melatonin and magnesium supplementation in hopes of improving his sleep. Medical history is significant for alcohol use disorder that required multiple hospital admissions for management of acute pancreatitis and cirrhosis. He states that he occasionally injects heroin intravenously. Temperature is 100°F (37.8°C), blood pressure is 105/70 mmHg, pulse is 92/min, and respirations are 17/min. Physical examination is significant for scleral icterus, hepatomegaly, ascites, and diffuse abdominal tenderness. Laboratory testing is significant for leukocytosis and metabolic acidosis. A paracentesis is performed and he is admitted into the hospital to receive intravenous cefotaxime and albumin. Ascitic fluid analysis demonstrates a polymorphonuclear cell count of 280 cells/mm^3, serum-ascites albumin gradient of 1.3 g/dL, and a culture positive for Escherichia coli sensitive to cefotaxime and ceftriaxone. On hospital day 2, the nurse reports that the patient is oliguric in the setting of constant fluid intake. Physical examination is unchanged. Laboratory testing is significant for a serum sodium of 131 mEq/L and creatinine of 1.8 mg/dL (it was 0.9 mg/dL on admission). Urine studies are significant for a low urine sodium level, without evidence of blood or protein. Since the hospital admission, he has not been started on any new medications. Which of the following will be the best treatment option for this patient?\n\n Option:\nAdding dopamine to his treatment regimen;\nAdding lisinopril to his treatment regimen;\nLiver transplantation;\nTransjugular intrahepatic portosystemic shunting;\n\n\n Answer:\nLiver transplantation\n For this QA example, you need to give netural fact info for each\n    option according to question context, so that later user can infer out the \n    correct answer from these facts. The template of facts is [option1_name:fact| option2_name:fact|...],e.g: [Ampicillin:High resistance, not first-line. | Ceftriaxone:Overkill (for pyelonephritis/severe UTI).]\n", "hinted_gen_query": "\n    Question:\nA 56-year-old man presents to the emergency department for progressively worsening fatigue, malaise, fever, and abdominal pain. He reports that his symptoms began approximately 1 week ago and he has noticed episodes of diarrhea. He recently started melatonin and magnesium supplementation in hopes of improving his sleep. Medical history is significant for alcohol use disorder that required multiple hospital admissions for management of acute pancreatitis and cirrhosis. He states that he occasionally injects heroin intravenously. Temperature is 100°F (37.8°C), blood pressure is 105/70 mmHg, pulse is 92/min, and respirations are 17/min. Physical examination is significant for scleral icterus, hepatomegaly, ascites, and diffuse abdominal tenderness. Laboratory testing is significant for leukocytosis and metabolic acidosis. A paracentesis is performed and he is admitted into the hospital to receive intravenous cefotaxime and albumin. Ascitic fluid analysis demonstrates a polymorphonuclear cell count of 280 cells/mm^3, serum-ascites albumin gradient of 1.3 g/dL, and a culture positive for Escherichia coli sensitive to cefotaxime and ceftriaxone. On hospital day 2, the nurse reports that the patient is oliguric in the setting of constant fluid intake. Physical examination is unchanged. Laboratory testing is significant for a serum sodium of 131 mEq/L and creatinine of 1.8 mg/dL (it was 0.9 mg/dL on admission). Urine studies are significant for a low urine sodium level, without evidence of blood or protein. Since the hospital admission, he has not been started on any new medications. Which of the following will be the best treatment option for this patient?\n\n Option:\nA:Adding dopamine to his treatment regimen;\nB:Adding lisinopril to his treatment regimen;\nC:Liver transplantation;\nD:Transjugular intrahepatic portosystemic shunting;\n \n\n Hint:\nNone \n\n Answer:\n"}
{"question": "A 29-year-old woman presents to the clinic after several months of weight loss. She noticed a 6.8 kg (15 lb) unintentional weight loss over the preceding several months. She has not changed her diet or exercise habits. She also reports feuding with her boyfriend over the temperature of their shared apartment, as she always feels warmer than he does. The vital signs include: heart rate 110/min and blood pressure 146/78 mm Hg. The physical exam is notable for warm and slightly moist skin. She also exhibits a fine tremor in her hands when her arms are outstretched. The urine pregnancy test is negative. Which of the following is the best single treatment option for this patient?", "answer": "Methimazole", "options": {"A": "Glucocorticoids", "B": "Methimazole", "C": "Propranolol", "D": "Radioiodine therapy"}, "meta_info": "step2&3", "answer_idx": "B", "metamap_phrases": ["29 year old woman presents", "clinic", "several months of weight loss", "kg", "unintentional weight loss", "preceding", "months", "not changed", "diet", "exercise habits", "reports", "boyfriend", "temperature", "shared apartment", "always feels warmer", "vital signs include", "heart rate", "min", "blood pressure", "mm Hg", "physical exam", "notable", "warm", "slightly moist skin", "exhibits", "fine", "hands", "arms", "urine pregnancy test", "negative", "following", "best single treatment", "patient"], "model_answer": "The patient's presentation is consistent with hyperthyroidism, which includes symptoms such as unintentional weight loss, heat intolerance, tachycardia, hypertension, warm and moist skin, and a fine tremor. The best single treatment option for this patient is an antithyroid medication to reduce thyroid hormone production. \n\nThe correct answer is [B:Methimazole].", "fact_gen_query": "\n    nQuestion:\nA 29-year-old woman presents to the clinic after several months of weight loss. She noticed a 6.8 kg (15 lb) unintentional weight loss over the preceding several months. She has not changed her diet or exercise habits. She also reports feuding with her boyfriend over the temperature of their shared apartment, as she always feels warmer than he does. The vital signs include: heart rate 110/min and blood pressure 146/78 mm Hg. The physical exam is notable for warm and slightly moist skin. She also exhibits a fine tremor in her hands when her arms are outstretched. The urine pregnancy test is negative. Which of the following is the best single treatment option for this patient?\n\n Option:\nGlucocorticoids;\nMethimazole;\nPropranolol;\nRadioiodine therapy;\n\n\n Answer:\nMethimazole\n For this QA example, you need to give netural fact info for each\n    option according to question context, so that later user can infer out the \n    correct answer from these facts. The template of facts is [option1_name:fact| option2_name:fact|...],e.g: [Ampicillin:High resistance, not first-line. | Ceftriaxone:Overkill (for pyelonephritis/severe UTI).]\n", "hinted_gen_query": "\n    Question:\nA 29-year-old woman presents to the clinic after several months of weight loss. She noticed a 6.8 kg (15 lb) unintentional weight loss over the preceding several months. She has not changed her diet or exercise habits. She also reports feuding with her boyfriend over the temperature of their shared apartment, as she always feels warmer than he does. The vital signs include: heart rate 110/min and blood pressure 146/78 mm Hg. The physical exam is notable for warm and slightly moist skin. She also exhibits a fine tremor in her hands when her arms are outstretched. The urine pregnancy test is negative. Which of the following is the best single treatment option for this patient?\n\n Option:\nA:Glucocorticoids;\nB:Methimazole;\nC:Propranolol;\nD:Radioiodine therapy;\n \n\n Hint:\nNone \n\n Answer:\n"}
{"question": "A 21-year-old man comes to the physician because of pruritus and a hypopigmented rash on his upper body for 5 days. He first noticed the symptoms after returning from a business trip last week in the Bahamas. While he was there, he visited a couple of beaches and went hiking with some coworkers. The rash initially started as a single lesion on his upper back but since then has extended to his shoulders. He has a history of type 1 diabetes mellitus controlled with an insulin pump. He works as an office manager and has no known exposure to melanocytotoxic chemicals. He has been sexually active with three female partners over the past year and uses condoms inconsistently. He is 183 cm (6 ft) tall and weighs 80 kg (176 lb); BMI is 23.9 kg/m2. His temperature is 37.2°C (99°F), pulse is 78/min, and blood pressure is 130/84 mm Hg. A photograph of the rash is shown. One month ago, his hemoglobin A1C was 7.8%. Which of the following is most likely to confirm the diagnosis?", "answer": "Potassium hydroxide preparation", "options": {"A": "Wood lamp examination", "B": "Skin culture", "C": "Potassium hydroxide preparation", "D": "Skin biopsy"}, "meta_info": "step2&3", "answer_idx": "C", "metamap_phrases": ["21-year-old man", "physician", "pruritus", "hypopigmented rash", "upper body", "5 days", "first", "symptoms", "returning", "business trip", "week", "Bahamas", "visited", "couple", "beaches", "hiking", "coworkers", "rash initially started", "single lesion", "upper back", "since then", "extended", "shoulders", "history of type 1 diabetes mellitus controlled", "insulin pump", "works", "office", "known exposure to", "chemicals", "sexually active", "three female partners", "past year", "uses condoms", "ft", "tall", "80 kg", "BMI", "23", "kg/m2", "temperature", "pulse", "min", "blood pressure", "84 mm Hg", "photograph", "rash", "shown", "One month", "hemoglobin A1C", "following", "most likely to confirm", "diagnosis"], "model_answer": "The patient's presentation of pruritus, hypopigmented rash, and recent travel to a tropical location (Bahamas) suggests a possible fungal infection, such as tinea versicolor, which is caused by Malassezia species. The rash started as a single lesion and spread, which is typical for tinea versicolor. \n\nThe most likely diagnostic test to confirm this would be a **potassium hydroxide (KOH) preparation**, which would reveal hyphae and spores (\"spaghetti and meatballs\" appearance) characteristic of tinea versicolor. \n\nWood lamp examination (A) may show yellow-green fluorescence in tinea versicolor, but it is less specific than KOH preparation. Skin culture (B) is not typically needed for tinea versicolor, and skin biopsy (D) is usually reserved for cases where the diagnosis is unclear or malignancy is suspected. \n\nThe correct answer is [C].", "fact_gen_query": "\n    nQuestion:\nA 21-year-old man comes to the physician because of pruritus and a hypopigmented rash on his upper body for 5 days. He first noticed the symptoms after returning from a business trip last week in the Bahamas. While he was there, he visited a couple of beaches and went hiking with some coworkers. The rash initially started as a single lesion on his upper back but since then has extended to his shoulders. He has a history of type 1 diabetes mellitus controlled with an insulin pump. He works as an office manager and has no known exposure to melanocytotoxic chemicals. He has been sexually active with three female partners over the past year and uses condoms inconsistently. He is 183 cm (6 ft) tall and weighs 80 kg (176 lb); BMI is 23.9 kg/m2. His temperature is 37.2°C (99°F), pulse is 78/min, and blood pressure is 130/84 mm Hg. A photograph of the rash is shown. One month ago, his hemoglobin A1C was 7.8%. Which of the following is most likely to confirm the diagnosis?\n\n Option:\nWood lamp examination;\nSkin culture;\nPotassium hydroxide preparation;\nSkin biopsy;\n\n\n Answer:\nPotassium hydroxide preparation\n For this QA example, you need to give netural fact info for each\n    option according to question context, so that later user can infer out the \n    correct answer from these facts. The template of facts is [option1_name:fact| option2_name:fact|...],e.g: [Ampicillin:High resistance, not first-line. | Ceftriaxone:Overkill (for pyelonephritis/severe UTI).]\n", "hinted_gen_query": "\n    Question:\nA 21-year-old man comes to the physician because of pruritus and a hypopigmented rash on his upper body for 5 days. He first noticed the symptoms after returning from a business trip last week in the Bahamas. While he was there, he visited a couple of beaches and went hiking with some coworkers. The rash initially started as a single lesion on his upper back but since then has extended to his shoulders. He has a history of type 1 diabetes mellitus controlled with an insulin pump. He works as an office manager and has no known exposure to melanocytotoxic chemicals. He has been sexually active with three female partners over the past year and uses condoms inconsistently. He is 183 cm (6 ft) tall and weighs 80 kg (176 lb); BMI is 23.9 kg/m2. His temperature is 37.2°C (99°F), pulse is 78/min, and blood pressure is 130/84 mm Hg. A photograph of the rash is shown. One month ago, his hemoglobin A1C was 7.8%. Which of the following is most likely to confirm the diagnosis?\n\n Option:\nA:Wood lamp examination;\nB:Skin culture;\nC:Potassium hydroxide preparation;\nD:Skin biopsy;\n \n\n Hint:\nNone \n\n Answer:\n"}
{"question": "A 5-year-old female is brought to a speech therapist for continuing work on improving her communication skills. She is only able to verbalize two word sentences and has generalized developmental delay. When she was born it was noticed that she had a high pitched mewing cry and subsequent physical exam revealed microcephaly, prominent epicanthal folds, and a holosystolic murmur best heard in the left 5th intercostal space near the sternum. An abnormality of which of the following chromosomes is most likely responsible for this patient's disorder?", "answer": "5", "options": {"A": "5", "B": "7", "C": "18", "D": "21"}, "meta_info": "step1", "answer_idx": "A", "metamap_phrases": ["5 year old female", "brought", "speech therapist", "continuing work", "improving", "communication skills", "only able to", "two word sentences", "generalized developmental delay", "born", "high pitched", "cry", "subsequent physical exam revealed microcephaly", "prominent epicanthal folds", "holosystolic murmur best heard", "left 5th intercostal space", "sternum", "abnormality", "following chromosomes", "most likely responsible", "patient's disorder"], "model_answer": "The patient's presentation is consistent with **Cri-du-chat syndrome**, which is characterized by a high-pitched mewing cry, microcephaly, developmental delay, and distinctive facial features (e.g., prominent epicanthal folds). This condition is caused by a deletion on the short arm of **chromosome 5 (5p-)**.\n\nThus, the correct answer is:  \n\n[A]", "fact_gen_query": "\n    nQuestion:\nA 5-year-old female is brought to a speech therapist for continuing work on improving her communication skills. She is only able to verbalize two word sentences and has generalized developmental delay. When she was born it was noticed that she had a high pitched mewing cry and subsequent physical exam revealed microcephaly, prominent epicanthal folds, and a holosystolic murmur best heard in the left 5th intercostal space near the sternum. An abnormality of which of the following chromosomes is most likely responsible for this patient's disorder?\n\n Option:\n5;\n7;\n18;\n21;\n\n\n Answer:\n5\n For this QA example, you need to give netural fact info for each\n    option according to question context, so that later user can infer out the \n    correct answer from these facts. The template of facts is [option1_name:fact| option2_name:fact|...],e.g: [Ampicillin:High resistance, not first-line. | Ceftriaxone:Overkill (for pyelonephritis/severe UTI).]\n", "hinted_gen_query": "\n    Question:\nA 5-year-old female is brought to a speech therapist for continuing work on improving her communication skills. She is only able to verbalize two word sentences and has generalized developmental delay. When she was born it was noticed that she had a high pitched mewing cry and subsequent physical exam revealed microcephaly, prominent epicanthal folds, and a holosystolic murmur best heard in the left 5th intercostal space near the sternum. An abnormality of which of the following chromosomes is most likely responsible for this patient's disorder?\n\n Option:\nA:5;\nB:7;\nC:18;\nD:21;\n \n\n Hint:\nNone \n\n Answer:\n"}
{"question": "A 62-year old female comes to the physician because of vaginal spotting and urinary urgency for the past 4 days. She has had no fever, abdominal pain, or diarrhea. Menopause occurred at 52 years of age. Her last Pap smear 1 year ago was normal. She has hypertension, hypercholesterolemia, and diabetes. Medications include atorvastatin, hydrochlorothiazide, metformin, and aspirin. She is sexually active with her husband. Her temperature is 37°C (98.6°F), pulse is 95/min, respirations are 12/min, and blood pressure is 155/65 mm Hg. Pelvic exam demonstrates a 4 x 3 cm firm, immobile erythematous mass on the right inner vaginal wall. Which of the following is the most appropriate next step in management?", "answer": "Biopsy of the mass", "options": {"A": "Pap smear", "B": "Biopsy of the mass", "C": "Incision and drainage", "D": "Urine gonorrhea and chlamydia testing"}, "meta_info": "step2&3", "answer_idx": "B", "metamap_phrases": ["62 year old female", "physician", "vaginal spotting", "urinary urgency", "past 4 days", "fever", "abdominal pain", "diarrhea", "Menopause occurred", "years", "age", "last Pap smear 1 year", "normal", "hypertension", "hypercholesterolemia", "diabetes", "Medications include atorvastatin", "hydrochlorothiazide", "metformin", "aspirin", "sexually active", "husband", "temperature", "98", "pulse", "95 min", "respirations", "min", "blood pressure", "65 mm Hg", "Pelvic exam demonstrates", "4", "firm", "immobile erythematous mass", "right inner vaginal", "following", "most appropriate next step", "management"], "model_answer": "The most appropriate next step in management for this patient with a firm, immobile erythematous mass on the right inner vaginal wall, postmenopausal vaginal spotting, and urinary urgency is to perform a biopsy of the mass to evaluate for malignancy, such as vaginal cancer. \n\nThe other options are less appropriate:\n- A Pap smear (A) is not the next step as her last Pap smear was normal and it does not evaluate the mass directly.\n- Incision and drainage (C) is not indicated as there is no evidence of abscess or fluctuance.\n- Urine gonorrhea and chlamydia testing (D) is unlikely to be helpful given her age, lack of risk factors, and the presence of a mass.\n\nThe correct answer is [B].", "fact_gen_query": "\n    nQuestion:\nA 62-year old female comes to the physician because of vaginal spotting and urinary urgency for the past 4 days. She has had no fever, abdominal pain, or diarrhea. Menopause occurred at 52 years of age. Her last Pap smear 1 year ago was normal. She has hypertension, hypercholesterolemia, and diabetes. Medications include atorvastatin, hydrochlorothiazide, metformin, and aspirin. She is sexually active with her husband. Her temperature is 37°C (98.6°F), pulse is 95/min, respirations are 12/min, and blood pressure is 155/65 mm Hg. Pelvic exam demonstrates a 4 x 3 cm firm, immobile erythematous mass on the right inner vaginal wall. Which of the following is the most appropriate next step in management?\n\n Option:\nPap smear;\nBiopsy of the mass;\nIncision and drainage;\nUrine gonorrhea and chlamydia testing;\n\n\n Answer:\nBiopsy of the mass\n For this QA example, you need to give netural fact info for each\n    option according to question context, so that later user can infer out the \n    correct answer from these facts. The template of facts is [option1_name:fact| option2_name:fact|...],e.g: [Ampicillin:High resistance, not first-line. | Ceftriaxone:Overkill (for pyelonephritis/severe UTI).]\n", "hinted_gen_query": "\n    Question:\nA 62-year old female comes to the physician because of vaginal spotting and urinary urgency for the past 4 days. She has had no fever, abdominal pain, or diarrhea. Menopause occurred at 52 years of age. Her last Pap smear 1 year ago was normal. She has hypertension, hypercholesterolemia, and diabetes. Medications include atorvastatin, hydrochlorothiazide, metformin, and aspirin. She is sexually active with her husband. Her temperature is 37°C (98.6°F), pulse is 95/min, respirations are 12/min, and blood pressure is 155/65 mm Hg. Pelvic exam demonstrates a 4 x 3 cm firm, immobile erythematous mass on the right inner vaginal wall. Which of the following is the most appropriate next step in management?\n\n Option:\nA:Pap smear;\nB:Biopsy of the mass;\nC:Incision and drainage;\nD:Urine gonorrhea and chlamydia testing;\n \n\n Hint:\nNone \n\n Answer:\n"}
{"question": "A 59-year-old man is evaluated for progressive joint pain. There is swelling and tenderness over the first, second, and third metacarpophalangeal joints of both hands. His hand radiograph is shown. He has had diabetes mellitus for 2 years which is not well controlled with medications. Lab studies show a transferrin saturation of 88% and serum ferritin of 1,200 ng/mL. Which of the following best represents the etiology of this patient condition?", "answer": "Deposition of calcium pyrophosphate (CPP) crystals", "options": {"A": "Deposition of urate crystals", "B": "Deposition of calcium pyrophosphate (CPP) crystals", "C": "Inflammatory rheumatological syndrome", "D": "Pathogenic inoculation of microbes"}, "meta_info": "step2&3", "answer_idx": "B", "metamap_phrases": ["59 year old man", "evaluated", "progressive joint pain", "swelling", "tenderness", "first", "second", "third", "joints of", "hands", "hand radiograph", "shown", "diabetes mellitus", "years", "not well controlled with medications", "Lab studies show", "transferrin saturation", "88", "serum ferritin", "1 200 ng mL", "following best represents", "etiology", "patient condition"], "model_answer": "The patient's presentation includes joint pain and swelling in the metacarpophalangeal joints, along with poorly controlled diabetes mellitus, elevated transferrin saturation (88%), and high serum ferritin (1,200 ng/mL). These findings are consistent with hemochromatosis, a condition characterized by iron overload. Hemochromatosis can lead to arthropathy due to the deposition of calcium pyrophosphate (CPP) crystals in the joints, a condition known as pseudogout or CPP deposition disease. \n\nThe other options are less likely:\n- A (Deposition of urate crystals) would suggest gout, but there is no mention of hyperuricemia or typical gout findings.\n- C (Inflammatory rheumatological syndrome) is less likely given the lack of systemic inflammatory markers or other features of inflammatory arthritis.\n- D (Pathogenic inoculation of microbes) is not supported by any evidence of infection.\n\nThe best answer is [B].", "fact_gen_query": "\n    nQuestion:\nA 59-year-old man is evaluated for progressive joint pain. There is swelling and tenderness over the first, second, and third metacarpophalangeal joints of both hands. His hand radiograph is shown. He has had diabetes mellitus for 2 years which is not well controlled with medications. Lab studies show a transferrin saturation of 88% and serum ferritin of 1,200 ng/mL. Which of the following best represents the etiology of this patient condition?\n\n Option:\nDeposition of urate crystals;\nDeposition of calcium pyrophosphate (CPP) crystals;\nInflammatory rheumatological syndrome;\nPathogenic inoculation of microbes;\n\n\n Answer:\nDeposition of calcium pyrophosphate (CPP) crystals\n For this QA example, you need to give netural fact info for each\n    option according to question context, so that later user can infer out the \n    correct answer from these facts. The template of facts is [option1_name:fact| option2_name:fact|...],e.g: [Ampicillin:High resistance, not first-line. | Ceftriaxone:Overkill (for pyelonephritis/severe UTI).]\n", "hinted_gen_query": "\n    Question:\nA 59-year-old man is evaluated for progressive joint pain. There is swelling and tenderness over the first, second, and third metacarpophalangeal joints of both hands. His hand radiograph is shown. He has had diabetes mellitus for 2 years which is not well controlled with medications. Lab studies show a transferrin saturation of 88% and serum ferritin of 1,200 ng/mL. Which of the following best represents the etiology of this patient condition?\n\n Option:\nA:Deposition of urate crystals;\nB:Deposition of calcium pyrophosphate (CPP) crystals;\nC:Inflammatory rheumatological syndrome;\nD:Pathogenic inoculation of microbes;\n \n\n Hint:\nNone \n\n Answer:\n"}
{"question": "A newborn is found to be extremely cyanotic immediately after birth. He then develops progressive respiratory failure and is admitted to the neonatal ICU. A single loud S2 heart sound is appreciated as well as a machine-like murmur at the left upper sternal border. Radiography shows an enlarged \"egg-shaped\" heart. The newborn is then taken for a atrial septostomy to alleviate the condition pending definitive surgical correction. Which of the following is the most likely cause of this newborn's condition?", "answer": "Transposition of great vessels", "options": {"A": "Coarctation of the aorta", "B": "Persistent truncus arteriosus", "C": "Transposition of great vessels", "D": "Tricuspid atresia"}, "meta_info": "step1", "answer_idx": "C", "metamap_phrases": ["newborn", "found to", "extremely cyanotic immediately", "birth", "then", "progressive respiratory failure", "admitted", "neonatal ICU", "single loud S2 heart sound", "machine", "murmur", "left upper sternal border", "Radiography shows", "enlarged", "egg shaped", "heart", "newborn", "then taken", "atrial septostomy to", "condition", "definitive surgical correction", "following", "most likely cause", "newborn", "ondition?"], "model_answer": "The newborn's condition is most consistent with **transposition of the great vessels (TGA)**, given the following key findings:  \n\n1. **Severe cyanosis immediately after birth** (due to parallel circulation and lack of mixing of oxygenated and deoxygenated blood).  \n2. **Single loud S2** (due to anterior displacement of the aorta, causing it to be the only audible valve).  \n3. **Machine-like murmur** (from a patent ductus arteriosus attempting to provide mixing).  \n4. **\"Egg-shaped\" heart on radiography** (classic due to the anterior-posterior relationship of the great vessels).  \n5. **Atrial septostomy as emergent management** (to improve mixing by creating an ASD).  \n\nThe other options do not fit as well:  \n- **Coarctation of the aorta (A)** typically presents with differential cyanosis or shock, not an \"egg-shaped\" heart.  \n- **Persistent truncus arteriosus (B)** would have a single outflow tract and usually presents with a systolic murmur, not a machine-like murmur.  \n- **Tricuspid atresia (D)** would have a hypoplastic right ventricle and no murmur at the left upper sternal border.  \n\nThe correct answer is [C].", "fact_gen_query": "\n    nQuestion:\nA newborn is found to be extremely cyanotic immediately after birth. He then develops progressive respiratory failure and is admitted to the neonatal ICU. A single loud S2 heart sound is appreciated as well as a machine-like murmur at the left upper sternal border. Radiography shows an enlarged \"egg-shaped\" heart. The newborn is then taken for a atrial septostomy to alleviate the condition pending definitive surgical correction. Which of the following is the most likely cause of this newborn's condition?\n\n Option:\nCoarctation of the aorta;\nPersistent truncus arteriosus;\nTransposition of great vessels;\nTricuspid atresia;\n\n\n Answer:\nTransposition of great vessels\n For this QA example, you need to give netural fact info for each\n    option according to question context, so that later user can infer out the \n    correct answer from these facts. The template of facts is [option1_name:fact| option2_name:fact|...],e.g: [Ampicillin:High resistance, not first-line. | Ceftriaxone:Overkill (for pyelonephritis/severe UTI).]\n", "hinted_gen_query": "\n    Question:\nA newborn is found to be extremely cyanotic immediately after birth. He then develops progressive respiratory failure and is admitted to the neonatal ICU. A single loud S2 heart sound is appreciated as well as a machine-like murmur at the left upper sternal border. Radiography shows an enlarged \"egg-shaped\" heart. The newborn is then taken for a atrial septostomy to alleviate the condition pending definitive surgical correction. Which of the following is the most likely cause of this newborn's condition?\n\n Option:\nA:Coarctation of the aorta;\nB:Persistent truncus arteriosus;\nC:Transposition of great vessels;\nD:Tricuspid atresia;\n \n\n Hint:\nNone \n\n Answer:\n"}
{"question": "A 25-year-old male involved in a knife fight presents with a penetrating wound to the chest. The patient is unconscious and cannot provide any further history. Vitals show a temperature of 37-0°C (98.6°F), blood pressure of 85/55 mm Hg, pulse of 115/min, respirations of 19/min, and oxygen saturation of 92% on room air. On physical examination, the patient is diaphoretic and unresponsive. Extremities are pale and cool. There is a 3-inch long penetrating wound between the 3rd and 4th intercostal space on the left side of the chest, which is bleeding profusely. Transthoracic echocardiography reveals a full thickness penetrating injury to the right ventricular free wall. There are no apparent injuries to any coronary arteries or major branches. The patient is intubated and aggressive fluid resuscitation is initiated, including a blood transfusion. Which of the following is the best definitive surgical approach to take in this patient?", "answer": "Interrupted 2-0 polypropylene suture with supporting pledgets", "options": {"A": "Immediate cardiac transplant", "B": "Watchful waiting while resuscitative fluids are initiated", "C": "Interrupted 2-0 polypropylene suture with supporting pledgets", "D": "Needle thoracostomy over the 2nd intercostal space"}, "meta_info": "step2&3", "answer_idx": "C", "metamap_phrases": ["year old male involved", "knife fight presents", "penetrating wound", "chest", "patient", "unconscious", "provide", "further history", "show", "temperature", "98", "blood pressure", "85 55 mm Hg", "pulse", "min", "respirations", "min", "oxygen saturation", "room air", "physical examination", "patient", "diaphoretic", "unresponsive", "Extremities", "pale", "cool", "3 inch long penetrating", "3rd", "4th intercostal space", "left side of", "chest", "bleeding", "Transthoracic echocardiography reveals", "full thickness penetrating injury", "right ventricular free wall", "apparent injuries", "coronary", "major branches", "patient", "intubated", "aggressive fluid resuscitation", "initiated", "including", "blood transfusion", "following", "best definitive surgical approach to take", "patient"], "model_answer": "The patient has a penetrating chest wound with evidence of cardiac tamponade or hemorrhage (hypotension, tachycardia, diaphoresis, unresponsiveness, and cool extremities). The echocardiography confirms a full-thickness injury to the right ventricular free wall. The definitive treatment for a penetrating cardiac injury with hemodynamic instability is immediate surgical repair. \n\n- **Option A (Immediate cardiac transplant)** is incorrect because transplant is not indicated for acute trauma and is not feasible in this emergency scenario.  \n- **Option B (Watchful waiting while resuscitative fluids are initiated)** is incorrect because the patient is unstable and requires immediate surgical intervention.  \n- **Option C (Interrupted 2-0 polypropylene suture with supporting pledgets)** is correct because this is the standard surgical repair for a ventricular wall injury, as it provides a secure closure without tearing the myocardium.  \n- **Option D (Needle thoracostomy over the 2nd intercostal space)** is incorrect because this is used for tension pneumothorax, not a cardiac injury.  \n\nThe best definitive surgical approach is **C**.  \n\n[C]", "fact_gen_query": "\n    nQuestion:\nA 25-year-old male involved in a knife fight presents with a penetrating wound to the chest. The patient is unconscious and cannot provide any further history. Vitals show a temperature of 37-0°C (98.6°F), blood pressure of 85/55 mm Hg, pulse of 115/min, respirations of 19/min, and oxygen saturation of 92% on room air. On physical examination, the patient is diaphoretic and unresponsive. Extremities are pale and cool. There is a 3-inch long penetrating wound between the 3rd and 4th intercostal space on the left side of the chest, which is bleeding profusely. Transthoracic echocardiography reveals a full thickness penetrating injury to the right ventricular free wall. There are no apparent injuries to any coronary arteries or major branches. The patient is intubated and aggressive fluid resuscitation is initiated, including a blood transfusion. Which of the following is the best definitive surgical approach to take in this patient?\n\n Option:\nImmediate cardiac transplant;\nWatchful waiting while resuscitative fluids are initiated;\nInterrupted 2-0 polypropylene suture with supporting pledgets;\nNeedle thoracostomy over the 2nd intercostal space;\n\n\n Answer:\nInterrupted 2-0 polypropylene suture with supporting pledgets\n For this QA example, you need to give netural fact info for each\n    option according to question context, so that later user can infer out the \n    correct answer from these facts. The template of facts is [option1_name:fact| option2_name:fact|...],e.g: [Ampicillin:High resistance, not first-line. | Ceftriaxone:Overkill (for pyelonephritis/severe UTI).]\n", "hinted_gen_query": "\n    Question:\nA 25-year-old male involved in a knife fight presents with a penetrating wound to the chest. The patient is unconscious and cannot provide any further history. Vitals show a temperature of 37-0°C (98.6°F), blood pressure of 85/55 mm Hg, pulse of 115/min, respirations of 19/min, and oxygen saturation of 92% on room air. On physical examination, the patient is diaphoretic and unresponsive. Extremities are pale and cool. There is a 3-inch long penetrating wound between the 3rd and 4th intercostal space on the left side of the chest, which is bleeding profusely. Transthoracic echocardiography reveals a full thickness penetrating injury to the right ventricular free wall. There are no apparent injuries to any coronary arteries or major branches. The patient is intubated and aggressive fluid resuscitation is initiated, including a blood transfusion. Which of the following is the best definitive surgical approach to take in this patient?\n\n Option:\nA:Immediate cardiac transplant;\nB:Watchful waiting while resuscitative fluids are initiated;\nC:Interrupted 2-0 polypropylene suture with supporting pledgets;\nD:Needle thoracostomy over the 2nd intercostal space;\n \n\n Hint:\nNone \n\n Answer:\n"}
{"question": "A post-mortem lung examination of a 68-year-old male overweight male with evidence of chronic lower extremity edema, a 60 pack-year smoking history and daily productive cough would be most likely to reveal:", "answer": "Reid Index > 50%", "options": {"A": "Hypereosinophilia", "B": "Reid Index > 50%", "C": "Non-caseating granulomas", "D": "Evidence of a necrotizing infection"}, "meta_info": "step1", "answer_idx": "B", "metamap_phrases": ["post-mortem lung examination", "68 year old male overweight", "evidence of chronic lower extremity edema", "60 pack-year smoking history", "daily productive cough", "most likely to reveal"], "model_answer": "The patient's history of a 60 pack-year smoking history and daily productive cough strongly suggests chronic bronchitis, a component of chronic obstructive pulmonary disease (COPD). The Reid Index is a histological measure used to assess the severity of chronic bronchitis, defined as the ratio of the thickness of the mucous gland layer to the total thickness of the bronchial wall. A Reid Index > 50% is indicative of chronic bronchitis.\n\n- **Hypereosinophilia (A)** is more associated with asthma or parasitic infections.\n- **Non-caseating granulomas (C)** are characteristic of sarcoidosis.\n- **Evidence of a necrotizing infection (D)** would suggest an acute infectious process, not chronic bronchitis.\n\nThe most likely finding in this patient is **B: Reid Index > 50%**.\n\n[B]", "fact_gen_query": "\n    nQuestion:\nA post-mortem lung examination of a 68-year-old male overweight male with evidence of chronic lower extremity edema, a 60 pack-year smoking history and daily productive cough would be most likely to reveal:\n\n Option:\nHypereosinophilia;\nReid Index > 50%;\nNon-caseating granulomas;\nEvidence of a necrotizing infection;\n\n\n Answer:\nReid Index > 50%\n For this QA example, you need to give netural fact info for each\n    option according to question context, so that later user can infer out the \n    correct answer from these facts. The template of facts is [option1_name:fact| option2_name:fact|...],e.g: [Ampicillin:High resistance, not first-line. | Ceftriaxone:Overkill (for pyelonephritis/severe UTI).]\n", "hinted_gen_query": "\n    Question:\nA post-mortem lung examination of a 68-year-old male overweight male with evidence of chronic lower extremity edema, a 60 pack-year smoking history and daily productive cough would be most likely to reveal:\n\n Option:\nA:Hypereosinophilia;\nB:Reid Index > 50%;\nC:Non-caseating granulomas;\nD:Evidence of a necrotizing infection;\n \n\n Hint:\nNone \n\n Answer:\n"}
{"question": "A 54-year-old male makes an appointment with his primary care physician due to chronic fatigue that has left him unable to hike or do other physically demanding activities with his friends. He has well-controlled hypertension and diabetes but has otherwise been healthy. He does not smoke but drinks socially with his friends. Physical exam reveals enlarged nodules that are not tender to palpation. A biopsy is obtained showing a characteristic change in chromosome 18. The regulation of which of the following proteins will be most abnormal in this patient?", "answer": "Caspase-9", "options": {"A": "Caspase-9", "B": "CD15", "C": "Cyclin-dependent kinase 4", "D": "Ras pathway transcription factors"}, "meta_info": "step1", "answer_idx": "A", "metamap_phrases": ["54 year old male makes", "appointment", "primary care physician", "chronic fatigue", "left", "unable to", "physically demanding activities", "friends", "well-controlled hypertension", "diabetes", "healthy", "not smoke", "drinks", "friends", "Physical exam reveals enlarged nodules", "not tender", "palpation", "biopsy", "obtained showing", "characteristic change", "chromosome 18", "regulation", "following proteins", "most abnormal", "patient"], "model_answer": "The patient's presentation of chronic fatigue, non-tender enlarged nodules, and a biopsy showing a characteristic change in chromosome 18 is highly suggestive of follicular lymphoma. Follicular lymphoma is associated with the t(14;18) translocation, which leads to overexpression of the BCL-2 protein. BCL-2 is an anti-apoptotic protein that inhibits caspase-9, a key enzyme in the apoptosis pathway. \n\nThe regulation of caspase-9 will be most abnormal in this patient due to the overexpression of BCL-2.\n\n[A]", "fact_gen_query": "\n    nQuestion:\nA 54-year-old male makes an appointment with his primary care physician due to chronic fatigue that has left him unable to hike or do other physically demanding activities with his friends. He has well-controlled hypertension and diabetes but has otherwise been healthy. He does not smoke but drinks socially with his friends. Physical exam reveals enlarged nodules that are not tender to palpation. A biopsy is obtained showing a characteristic change in chromosome 18. The regulation of which of the following proteins will be most abnormal in this patient?\n\n Option:\nCaspase-9;\nCD15;\nCyclin-dependent kinase 4;\nRas pathway transcription factors;\n\n\n Answer:\nCaspase-9\n For this QA example, you need to give netural fact info for each\n    option according to question context, so that later user can infer out the \n    correct answer from these facts. The template of facts is [option1_name:fact| option2_name:fact|...],e.g: [Ampicillin:High resistance, not first-line. | Ceftriaxone:Overkill (for pyelonephritis/severe UTI).]\n", "hinted_gen_query": "\n    Question:\nA 54-year-old male makes an appointment with his primary care physician due to chronic fatigue that has left him unable to hike or do other physically demanding activities with his friends. He has well-controlled hypertension and diabetes but has otherwise been healthy. He does not smoke but drinks socially with his friends. Physical exam reveals enlarged nodules that are not tender to palpation. A biopsy is obtained showing a characteristic change in chromosome 18. The regulation of which of the following proteins will be most abnormal in this patient?\n\n Option:\nA:Caspase-9;\nB:CD15;\nC:Cyclin-dependent kinase 4;\nD:Ras pathway transcription factors;\n \n\n Hint:\nNone \n\n Answer:\n"}
{"question": "A 44-year-old African-American woman comes to the physician for a routine examination. She is concerned about cancer because her uncle died of metastatic melanoma 1 year ago. She has no history of serious illness and does not take any medication. She has been working in a law firm for the past 20 years and travels to the Carribean regularly with her husband. Examination of her skin shows no abnormal moles or warts. This woman is at greatest risk of which of the following types of melanoma?", "answer": "Acral lentiginous", "options": {"A": "Desmoplastic", "B": "Nodular", "C": "Acral lentiginous", "D": "Superficial spreading"}, "meta_info": "step1", "answer_idx": "C", "metamap_phrases": ["year old African-American woman", "physician", "routine examination", "concerned", "cancer", "uncle died", "metastatic melanoma", "year", "history", "serious illness", "not take", "medication", "working", "law firm", "past 20 years", "travels", "husband", "Examination of", "skin shows", "abnormal moles", "warts", "woman", "greatest risk", "following types", "melanoma"], "model_answer": "The patient is a 44-year-old African-American woman with a family history of melanoma but no personal history of significant sun exposure (works indoors, travels to the Caribbean but no mention of prolonged sun exposure). Examination shows no abnormal moles or warts. \n\nKey points:\n1. African-American individuals are at higher risk for **acral lentiginous melanoma**, which occurs on the palms, soles, and nail beds, and is less associated with UV exposure.  \n2. The other types (superficial spreading, nodular, and desmoplastic) are more common in fair-skinned individuals with significant sun exposure.  \n\nThus, the correct answer is:  \n\n[C]", "fact_gen_query": "\n    nQuestion:\nA 44-year-old African-American woman comes to the physician for a routine examination. She is concerned about cancer because her uncle died of metastatic melanoma 1 year ago. She has no history of serious illness and does not take any medication. She has been working in a law firm for the past 20 years and travels to the Carribean regularly with her husband. Examination of her skin shows no abnormal moles or warts. This woman is at greatest risk of which of the following types of melanoma?\n\n Option:\nDesmoplastic;\nNodular;\nAcral lentiginous;\nSuperficial spreading;\n\n\n Answer:\nAcral lentiginous\n For this QA example, you need to give netural fact info for each\n    option according to question context, so that later user can infer out the \n    correct answer from these facts. The template of facts is [option1_name:fact| option2_name:fact|...],e.g: [Ampicillin:High resistance, not first-line. | Ceftriaxone:Overkill (for pyelonephritis/severe UTI).]\n", "hinted_gen_query": "\n    Question:\nA 44-year-old African-American woman comes to the physician for a routine examination. She is concerned about cancer because her uncle died of metastatic melanoma 1 year ago. She has no history of serious illness and does not take any medication. She has been working in a law firm for the past 20 years and travels to the Carribean regularly with her husband. Examination of her skin shows no abnormal moles or warts. This woman is at greatest risk of which of the following types of melanoma?\n\n Option:\nA:Desmoplastic;\nB:Nodular;\nC:Acral lentiginous;\nD:Superficial spreading;\n \n\n Hint:\nNone \n\n Answer:\n"}
{"question": "A 60-year-old woman is brought to the clinic by her daughter for evaluation. The daughter reports that her mother has recently been having difficulty combing her hair in the mornings. The patient’s family history is significant for an ischemic stroke in her father. The patient’s past medical history is positive for diverticulosis. She takes no medication. Her blood pressure is 120/70 mm Hg, heart rate is 75/min, respiratory rate is 14/min, and temperature is 37.6°C (99.7°F). On physical examination, the patient’s neck is stiff and she also has bilateral shoulder tenderness; muscle strength is intact. Laboratory work is performed and presented below:\nHemoglobin 12.9 g/dL\nHematocrit 37.7% \nLeukocyte count 5,500/mm3\nNeutrophils 65%\nLymphocytes 30%\nMonocytes 5%\nMean corpuscular volume 82.2 μm3\nPlatelet count 190,000/mm3\nErythrocyte sedimentation rate 65 mm/h\nC-reactive protein 44 mg/dL\nFor which of the symptoms below should the patient be screened?", "answer": "Jaw claudication", "options": {"A": "Jaw claudication", "B": "Heliotrope rash", "C": "Gastroesophageal reflux", "D": "Pink plaques with silvery scales"}, "meta_info": "step2&3", "answer_idx": "A", "metamap_phrases": ["60 year old woman", "brought", "clinic", "daughter", "evaluation", "daughter reports", "mother", "recently", "difficulty combing", "hair", "mornings", "patients family history", "significant", "ischemic stroke", "father", "patients past medical history", "positive", "diverticulosis", "takes", "medication", "blood pressure", "70 mm Hg", "heart rate", "75 min", "respiratory rate", "min", "temperature", "99", "physical examination", "patients neck", "stiff", "bilateral shoulder tenderness", "muscle strength", "intact", "Laboratory work", "performed", "presented", "dL", "count", "mm3", "Mean corpuscular volume", "Platelet count", "rate", "mm/h C-reactive protein", "dL", "symptoms", "patient", "screened"], "model_answer": "The patient's presentation includes difficulty combing her hair (suggesting possible proximal muscle weakness or stiffness), neck stiffness, bilateral shoulder tenderness, and elevated inflammatory markers (ESR and CRP). These findings are highly suggestive of polymyalgia rheumatica (PMR). Given her age and the potential association with giant cell arteritis (GCA), she should be screened for symptoms of GCA, such as jaw claudication.\n\nThe other options are less relevant:\n- B: Heliotrope rash is seen in dermatomyositis.\n- C: Gastroesophageal reflux is not related to this presentation.\n- D: Pink plaques with silvery scales are seen in psoriasis.\n\nThe correct answer is [A].", "fact_gen_query": "\n    nQuestion:\nA 60-year-old woman is brought to the clinic by her daughter for evaluation. The daughter reports that her mother has recently been having difficulty combing her hair in the mornings. The patient’s family history is significant for an ischemic stroke in her father. The patient’s past medical history is positive for diverticulosis. She takes no medication. Her blood pressure is 120/70 mm Hg, heart rate is 75/min, respiratory rate is 14/min, and temperature is 37.6°C (99.7°F). On physical examination, the patient’s neck is stiff and she also has bilateral shoulder tenderness; muscle strength is intact. Laboratory work is performed and presented below:\nHemoglobin 12.9 g/dL\nHematocrit 37.7% \nLeukocyte count 5,500/mm3\nNeutrophils 65%\nLymphocytes 30%\nMonocytes 5%\nMean corpuscular volume 82.2 μm3\nPlatelet count 190,000/mm3\nErythrocyte sedimentation rate 65 mm/h\nC-reactive protein 44 mg/dL\nFor which of the symptoms below should the patient be screened?\n\n Option:\nJaw claudication;\nHeliotrope rash;\nGastroesophageal reflux;\nPink plaques with silvery scales;\n\n\n Answer:\nJaw claudication\n For this QA example, you need to give netural fact info for each\n    option according to question context, so that later user can infer out the \n    correct answer from these facts. The template of facts is [option1_name:fact| option2_name:fact|...],e.g: [Ampicillin:High resistance, not first-line. | Ceftriaxone:Overkill (for pyelonephritis/severe UTI).]\n", "hinted_gen_query": "\n    Question:\nA 60-year-old woman is brought to the clinic by her daughter for evaluation. The daughter reports that her mother has recently been having difficulty combing her hair in the mornings. The patient’s family history is significant for an ischemic stroke in her father. The patient’s past medical history is positive for diverticulosis. She takes no medication. Her blood pressure is 120/70 mm Hg, heart rate is 75/min, respiratory rate is 14/min, and temperature is 37.6°C (99.7°F). On physical examination, the patient’s neck is stiff and she also has bilateral shoulder tenderness; muscle strength is intact. Laboratory work is performed and presented below:\nHemoglobin 12.9 g/dL\nHematocrit 37.7% \nLeukocyte count 5,500/mm3\nNeutrophils 65%\nLymphocytes 30%\nMonocytes 5%\nMean corpuscular volume 82.2 μm3\nPlatelet count 190,000/mm3\nErythrocyte sedimentation rate 65 mm/h\nC-reactive protein 44 mg/dL\nFor which of the symptoms below should the patient be screened?\n\n Option:\nA:Jaw claudication;\nB:Heliotrope rash;\nC:Gastroesophageal reflux;\nD:Pink plaques with silvery scales;\n \n\n Hint:\nNone \n\n Answer:\n"}
{"question": "A 30-year-old woman comes to the physician because she has been unable to conceive for 3 years. Analysis of her husband's semen has shown normal sperm counts during this time. The patient also reports episodic pelvic and back pain accompanied by painful diarrhea for 5 years. She has about one such episode on average per month for 4–6 days. She has taken ibuprofen for the pain, which has provided some relief. Menses have occurred at regular 29-day intervals since menarche at the age of 14 years and last for 7 days. She is sexually active with her husband and does not use contraception. Vital signs are within normal limits. Pelvic and bimanual examinations are normal; rectal examination is unremarkable. A hysterosalpingogram 6 months prior showed normal results. Which of the following is the most likely underlying mechanism of this patient's symptoms?", "answer": "Endometrial tissue outside the uterine cavity", "options": {"A": "Loss of fallopian tube function following infection", "B": "Smooth muscle tumor arising from the myometrium", "C": "Endometrial tissue outside the uterine cavity", "D": "Increased secretion of androgens and luteinizing hormone"}, "meta_info": "step2&3", "answer_idx": "C", "metamap_phrases": ["30 year old woman", "physician", "unable to", "years", "Analysis", "husband's semen", "shown normal sperm counts", "time", "patient", "reports episodic pelvic", "back pain", "painful diarrhea", "5 years", "about one", "episode", "average per month", "days", "taken ibuprofen", "pain", "provided", "relief", "Menses", "occurred", "regular 29 day intervals", "menarche at", "age", "years", "last", "7 days", "sexually active", "husband", "not use contraception", "Vital signs", "normal limits", "Pelvic", "bimanual examinations", "normal", "rectal examination", "unremarkable", "hysterosalpingogram", "months prior showed normal results", "following", "most likely underlying mechanism", "patient's symptoms"], "model_answer": "The patient's symptoms include chronic pelvic pain, dysmenorrhea, dyschezia (painful diarrhea), and infertility, which are classic for endometriosis. Endometriosis is characterized by the presence of endometrial tissue outside the uterine cavity, which can lead to inflammation, pain, and adhesions that may contribute to infertility. \n\nThe hysterosalpingogram was normal, ruling out fallopian tube dysfunction (option A). There is no evidence of a smooth muscle tumor (option B) such as a fibroid, which would likely present with abnormal uterine bleeding or a palpable mass on examination. The patient's regular menstrual cycles and lack of signs of hyperandrogenism make polycystic ovary syndrome (option D) unlikely.\n\nThe most likely underlying mechanism of this patient's symptoms is [C:Endometrial tissue outside the uterine cavity].", "fact_gen_query": "\n    nQuestion:\nA 30-year-old woman comes to the physician because she has been unable to conceive for 3 years. Analysis of her husband's semen has shown normal sperm counts during this time. The patient also reports episodic pelvic and back pain accompanied by painful diarrhea for 5 years. She has about one such episode on average per month for 4–6 days. She has taken ibuprofen for the pain, which has provided some relief. Menses have occurred at regular 29-day intervals since menarche at the age of 14 years and last for 7 days. She is sexually active with her husband and does not use contraception. Vital signs are within normal limits. Pelvic and bimanual examinations are normal; rectal examination is unremarkable. A hysterosalpingogram 6 months prior showed normal results. Which of the following is the most likely underlying mechanism of this patient's symptoms?\n\n Option:\nLoss of fallopian tube function following infection;\nSmooth muscle tumor arising from the myometrium;\nEndometrial tissue outside the uterine cavity;\nIncreased secretion of androgens and luteinizing hormone;\n\n\n Answer:\nEndometrial tissue outside the uterine cavity\n For this QA example, you need to give netural fact info for each\n    option according to question context, so that later user can infer out the \n    correct answer from these facts. The template of facts is [option1_name:fact| option2_name:fact|...],e.g: [Ampicillin:High resistance, not first-line. | Ceftriaxone:Overkill (for pyelonephritis/severe UTI).]\n", "hinted_gen_query": "\n    Question:\nA 30-year-old woman comes to the physician because she has been unable to conceive for 3 years. Analysis of her husband's semen has shown normal sperm counts during this time. The patient also reports episodic pelvic and back pain accompanied by painful diarrhea for 5 years. She has about one such episode on average per month for 4–6 days. She has taken ibuprofen for the pain, which has provided some relief. Menses have occurred at regular 29-day intervals since menarche at the age of 14 years and last for 7 days. She is sexually active with her husband and does not use contraception. Vital signs are within normal limits. Pelvic and bimanual examinations are normal; rectal examination is unremarkable. A hysterosalpingogram 6 months prior showed normal results. Which of the following is the most likely underlying mechanism of this patient's symptoms?\n\n Option:\nA:Loss of fallopian tube function following infection;\nB:Smooth muscle tumor arising from the myometrium;\nC:Endometrial tissue outside the uterine cavity;\nD:Increased secretion of androgens and luteinizing hormone;\n \n\n Hint:\nNone \n\n Answer:\n"}
{"question": "A 55-year-old truck driver is brought to a physician by his wife. She states that her husband developed a fever and began feeling weak 3 days ago, but has refused medical help. He has been unable to go to work because of his symptoms. The patient has been previously hospitalized for a tricuspid valve replacement surgery 1 year ago and takes aspirin daily. The medical history is also relevant for myocardial infarction 3 years ago and hypertension for the past 10 years, for which he takes lisinopril. His blood pressure is 140/80 mm Hg, the pulse is 82/min, the respirations are 18/minute, and the temperature is 37.2°C (98.9°F). On examination, several hemorrhages are noted on the nail beds of several fingers. Which of the following findings would be most helpful in establishing a diagnosis?", "answer": "Friable irregular masses attached to the valve", "options": {"A": "Bicuspid valve", "B": "Friable irregular masses attached to the valve", "C": "Papillary muscle rupture", "D": "Annular calcification"}, "meta_info": "step1", "answer_idx": "B", "metamap_phrases": ["55 year old truck driver", "brought", "physician", "wife", "states", "husband", "fever", "began feeling weak", "days", "refused medical help", "unable to go to work", "symptoms", "patient", "hospitalized", "tricuspid valve replacement surgery 1 year", "takes aspirin daily", "medical history", "relevant", "myocardial infarction", "years", "hypertension", "past 10 years", "takes lisinopril", "blood pressure", "80 mm Hg", "pulse", "min", "respirations", "minute", "temperature", "98 9F", "examination", "several hemorrhages", "noted", "nail beds of", "fingers", "following findings", "most helpful", "establishing", "diagnosis"], "model_answer": "The patient's history of tricuspid valve replacement surgery, fever, weakness, and nail bed hemorrhages (splinter hemorrhages) suggests infective endocarditis. The most helpful finding in establishing this diagnosis would be **friable irregular masses attached to the valve**, as these are likely vegetations, a hallmark of infective endocarditis.\n\nThe correct answer is: [B]", "fact_gen_query": "\n    nQuestion:\nA 55-year-old truck driver is brought to a physician by his wife. She states that her husband developed a fever and began feeling weak 3 days ago, but has refused medical help. He has been unable to go to work because of his symptoms. The patient has been previously hospitalized for a tricuspid valve replacement surgery 1 year ago and takes aspirin daily. The medical history is also relevant for myocardial infarction 3 years ago and hypertension for the past 10 years, for which he takes lisinopril. His blood pressure is 140/80 mm Hg, the pulse is 82/min, the respirations are 18/minute, and the temperature is 37.2°C (98.9°F). On examination, several hemorrhages are noted on the nail beds of several fingers. Which of the following findings would be most helpful in establishing a diagnosis?\n\n Option:\nBicuspid valve;\nFriable irregular masses attached to the valve;\nPapillary muscle rupture;\nAnnular calcification;\n\n\n Answer:\nFriable irregular masses attached to the valve\n For this QA example, you need to give netural fact info for each\n    option according to question context, so that later user can infer out the \n    correct answer from these facts. The template of facts is [option1_name:fact| option2_name:fact|...],e.g: [Ampicillin:High resistance, not first-line. | Ceftriaxone:Overkill (for pyelonephritis/severe UTI).]\n", "hinted_gen_query": "\n    Question:\nA 55-year-old truck driver is brought to a physician by his wife. She states that her husband developed a fever and began feeling weak 3 days ago, but has refused medical help. He has been unable to go to work because of his symptoms. The patient has been previously hospitalized for a tricuspid valve replacement surgery 1 year ago and takes aspirin daily. The medical history is also relevant for myocardial infarction 3 years ago and hypertension for the past 10 years, for which he takes lisinopril. His blood pressure is 140/80 mm Hg, the pulse is 82/min, the respirations are 18/minute, and the temperature is 37.2°C (98.9°F). On examination, several hemorrhages are noted on the nail beds of several fingers. Which of the following findings would be most helpful in establishing a diagnosis?\n\n Option:\nA:Bicuspid valve;\nB:Friable irregular masses attached to the valve;\nC:Papillary muscle rupture;\nD:Annular calcification;\n \n\n Hint:\nNone \n\n Answer:\n"}
{"question": "A previously healthy 30-year-old woman comes to the physician for the evaluation of pain during sexual intercourse for 6 months. She also reports frequent episodes of crampy pelvic pain that starts one day before menses and lasts for 7 days. Her symptoms are not relieved with pain medication. Menses occur at regular 28-day intervals and last 5 days. Her last menstrual period was 2 weeks ago. She is sexually active with her husband. She uses a combined oral contraceptive pill. Her vital signs are within normal limits. Physical examination shows rectovaginal tenderness. Cervical and urethral swabs are negative. Transvaginal ultrasonography shows no abnormalities. Which of the following is the most appropriate next step in management?", "answer": "Laparoscopy", "options": {"A": "Measurement of CA-125 levels", "B": "Hysterectomy", "C": "Laparoscopy", "D": "Hysteroscopy"}, "meta_info": "step2&3", "answer_idx": "C", "metamap_phrases": ["healthy 30 year old woman", "physician", "evaluation", "pain", "sexual intercourse", "months", "reports frequent episodes of crampy pelvic pain", "starts one day", "menses", "lasts", "7 days", "symptoms", "not relieved", "pain medication", "Menses occur", "regular", "day intervals", "last 5 days", "last menstrual period", "2 weeks", "sexually active", "husband", "uses", "combined oral contraceptive pill", "vital signs", "normal", "Physical examination shows rectovaginal tenderness", "Cervical", "urethral swabs", "negative", "Transvaginal ultrasonography shows", "abnormalities", "following", "most appropriate next step", "management"], "model_answer": "The patient's symptoms of dyspareunia, chronic pelvic pain that worsens around menses, and rectovaginal tenderness are highly suggestive of endometriosis, despite the normal transvaginal ultrasonography. The most appropriate next step in management is diagnostic laparoscopy, which is the gold standard for diagnosing endometriosis. \n\n[C]", "fact_gen_query": "\n    nQuestion:\nA previously healthy 30-year-old woman comes to the physician for the evaluation of pain during sexual intercourse for 6 months. She also reports frequent episodes of crampy pelvic pain that starts one day before menses and lasts for 7 days. Her symptoms are not relieved with pain medication. Menses occur at regular 28-day intervals and last 5 days. Her last menstrual period was 2 weeks ago. She is sexually active with her husband. She uses a combined oral contraceptive pill. Her vital signs are within normal limits. Physical examination shows rectovaginal tenderness. Cervical and urethral swabs are negative. Transvaginal ultrasonography shows no abnormalities. Which of the following is the most appropriate next step in management?\n\n Option:\nMeasurement of CA-125 levels;\nHysterectomy;\nLaparoscopy;\nHysteroscopy;\n\n\n Answer:\nLaparoscopy\n For this QA example, you need to give netural fact info for each\n    option according to question context, so that later user can infer out the \n    correct answer from these facts. The template of facts is [option1_name:fact| option2_name:fact|...],e.g: [Ampicillin:High resistance, not first-line. | Ceftriaxone:Overkill (for pyelonephritis/severe UTI).]\n", "hinted_gen_query": "\n    Question:\nA previously healthy 30-year-old woman comes to the physician for the evaluation of pain during sexual intercourse for 6 months. She also reports frequent episodes of crampy pelvic pain that starts one day before menses and lasts for 7 days. Her symptoms are not relieved with pain medication. Menses occur at regular 28-day intervals and last 5 days. Her last menstrual period was 2 weeks ago. She is sexually active with her husband. She uses a combined oral contraceptive pill. Her vital signs are within normal limits. Physical examination shows rectovaginal tenderness. Cervical and urethral swabs are negative. Transvaginal ultrasonography shows no abnormalities. Which of the following is the most appropriate next step in management?\n\n Option:\nA:Measurement of CA-125 levels;\nB:Hysterectomy;\nC:Laparoscopy;\nD:Hysteroscopy;\n \n\n Hint:\nNone \n\n Answer:\n"}
{"question": "A 50-year-old man visits his physician after 20 years of not seeking any medical care. He is concerned about his health after a colleague recently had a heart attack. The patient has no active complaints and says he feels healthy; however, he does not exercise regularly and lives a sedentary lifestyle. He is employed as an administrative position at a local college, and is seated at a desk most of the day. His father had a heart attack at age 54 and his mother is still alive with no health concerns. He does not smoke, only drinks socially, and does not use drugs. Today, his blood pressure is 130/90 mm Hg, pulse is 84/min, and respiratory rate is 14/min. Physical examination reveals an obese male with no significant findings. An ECG shows no abnormalities, and laboratory testing shows the following:\nLaboratory test\nSerum glucose (fasting)  105 mg/dL\nSerum electrolytes \nSodium  142 mEq/L\nPotassium 3.9 mEq/L\nChloride 101 mEq/L\nSerum creatinine 0.8 mg/dl\nBlood urea nitrogen 10 mg/dl\nCholesterol, total 250 mg/dL\nHDL-cholesterol 35 mg/dL\nLDL-cholesterol 186 mg/dL\nTriglycerides 170 mg/dL\nUrinalysis \nGlucose  negative\nKetones negative\nLeucocytes negative\nNitrites negative \nRed blood cells (RBC) negative \nCasts negative \nWhich of the following lab abnormalities in this patient is an indication for treatment?", "answer": "High LDL-cholesterol", "options": {"A": "Blood pressure reading", "B": "Patient’s weight", "C": "High LDL-cholesterol", "D": "Serum glucose level"}, "meta_info": "step1", "answer_idx": "C", "metamap_phrases": ["50 year old man visits", "physician", "20 years", "not", "medical care", "concerned", "health", "recently", "heart attack", "patient", "active complaints", "feels healthy", "not exercise", "lives", "sedentary lifestyle", "employed", "administrative position", "local college", "seated", "day", "father", "heart attack", "age 54", "mother", "alive", "health concerns", "not smoke", "only drinks", "not use drugs", "Today", "blood pressure", "90 mm Hg", "pulse", "84 min", "respiratory rate", "min", "Physical examination reveals", "obese male", "significant findings", "ECG shows", "abnormalities", "laboratory testing shows", "following", "Laboratory test Serum glucose", "fasting", "mg", "L Potassium", "creatinine 0.8 mg", "Blood", "nitrogen 10", "Cholesterol", "total", "mg/dL", "cholesterol", "LDL", "Urinalysis", "Ketones", "Leucocytes", "Nitrites", "Red blood cells", "Casts negative", "following lab abnormalities", "patient", "indication", "treatment"], "model_answer": "The patient's laboratory results show several abnormalities, but the most significant one that is an indication for treatment is the high LDL-cholesterol level (186 mg/dL). According to current guidelines, an LDL-cholesterol level above 190 mg/dL is considered very high, but in this patient with other risk factors (sedentary lifestyle, obesity, family history of early heart disease, and borderline high blood pressure), an LDL-cholesterol level of 186 mg/dL would warrant treatment to reduce cardiovascular risk. \n\nThe other options:\n- A: Blood pressure reading (130/90 mm Hg) is borderline high but not yet an immediate indication for treatment unless confirmed on repeat measurements.\n- B: Patient’s weight (obesity) is a modifiable risk factor but not a direct lab abnormality.\n- D: Serum glucose level (105 mg/dL) is borderline (prediabetes range) but not yet an indication for pharmacologic treatment; lifestyle modifications would be recommended first.\n\nThus, the correct answer is [C].", "fact_gen_query": "\n    nQuestion:\nA 50-year-old man visits his physician after 20 years of not seeking any medical care. He is concerned about his health after a colleague recently had a heart attack. The patient has no active complaints and says he feels healthy; however, he does not exercise regularly and lives a sedentary lifestyle. He is employed as an administrative position at a local college, and is seated at a desk most of the day. His father had a heart attack at age 54 and his mother is still alive with no health concerns. He does not smoke, only drinks socially, and does not use drugs. Today, his blood pressure is 130/90 mm Hg, pulse is 84/min, and respiratory rate is 14/min. Physical examination reveals an obese male with no significant findings. An ECG shows no abnormalities, and laboratory testing shows the following:\nLaboratory test\nSerum glucose (fasting)  105 mg/dL\nSerum electrolytes \nSodium  142 mEq/L\nPotassium 3.9 mEq/L\nChloride 101 mEq/L\nSerum creatinine 0.8 mg/dl\nBlood urea nitrogen 10 mg/dl\nCholesterol, total 250 mg/dL\nHDL-cholesterol 35 mg/dL\nLDL-cholesterol 186 mg/dL\nTriglycerides 170 mg/dL\nUrinalysis \nGlucose  negative\nKetones negative\nLeucocytes negative\nNitrites negative \nRed blood cells (RBC) negative \nCasts negative \nWhich of the following lab abnormalities in this patient is an indication for treatment?\n\n Option:\nBlood pressure reading;\nPatient’s weight;\nHigh LDL-cholesterol;\nSerum glucose level;\n\n\n Answer:\nHigh LDL-cholesterol\n For this QA example, you need to give netural fact info for each\n    option according to question context, so that later user can infer out the \n    correct answer from these facts. The template of facts is [option1_name:fact| option2_name:fact|...],e.g: [Ampicillin:High resistance, not first-line. | Ceftriaxone:Overkill (for pyelonephritis/severe UTI).]\n", "hinted_gen_query": "\n    Question:\nA 50-year-old man visits his physician after 20 years of not seeking any medical care. He is concerned about his health after a colleague recently had a heart attack. The patient has no active complaints and says he feels healthy; however, he does not exercise regularly and lives a sedentary lifestyle. He is employed as an administrative position at a local college, and is seated at a desk most of the day. His father had a heart attack at age 54 and his mother is still alive with no health concerns. He does not smoke, only drinks socially, and does not use drugs. Today, his blood pressure is 130/90 mm Hg, pulse is 84/min, and respiratory rate is 14/min. Physical examination reveals an obese male with no significant findings. An ECG shows no abnormalities, and laboratory testing shows the following:\nLaboratory test\nSerum glucose (fasting)  105 mg/dL\nSerum electrolytes \nSodium  142 mEq/L\nPotassium 3.9 mEq/L\nChloride 101 mEq/L\nSerum creatinine 0.8 mg/dl\nBlood urea nitrogen 10 mg/dl\nCholesterol, total 250 mg/dL\nHDL-cholesterol 35 mg/dL\nLDL-cholesterol 186 mg/dL\nTriglycerides 170 mg/dL\nUrinalysis \nGlucose  negative\nKetones negative\nLeucocytes negative\nNitrites negative \nRed blood cells (RBC) negative \nCasts negative \nWhich of the following lab abnormalities in this patient is an indication for treatment?\n\n Option:\nA:Blood pressure reading;\nB:Patient’s weight;\nC:High LDL-cholesterol;\nD:Serum glucose level;\n \n\n Hint:\nNone \n\n Answer:\n"}
{"question": "A 26-year-old woman is brought to the emergency department 20 minutes after being involved in a high-speed motor vehicle collision in which she was a restrained passenger. On arrival, she is lethargic and incoherent. She has severe facial lacerations and is in respiratory distress. Her pulse is 130/min, respirations are 29/min, and blood pressure is 90/58 mm Hg. Pulse oximetry on room air shows an oxygen saturation of 70%. Examination shows multiple facial lacerations. There is dullness to percussion and decreased breath sounds over the left lung base. Abdominal examination shows diffuse tenderness with no guarding or rebound. Bowel sounds are normal. The remainder of the examination shows no abnormalities. Her hemoglobin concentration is 12.1 g/dL. An x-ray of the chest shows a fractured left second rib, depression of the left mainstem bronchus, deviation of the nasogastric tube to the right, and a widened mediastinum. Which of the following is the most likely diagnosis?", "answer": "Thoracic aortic rupture", "options": {"A": "Diaphragmatic rupture", "B": "Traumatic bronchial rupture", "C": "Thoracic aortic rupture", "D": "Tension pneumothorax"}, "meta_info": "step2&3", "answer_idx": "C", "metamap_phrases": ["year old woman", "brought", "emergency department 20 minutes", "involved", "high speed motor vehicle collision", "restrained passenger", "arrival", "lethargic", "incoherent", "severe facial lacerations", "respiratory distress", "pulse", "min", "respirations", "29 min", "blood pressure", "90 58 mm Hg", "Pulse oximetry", "room air shows", "oxygen", "70", "Examination shows multiple facial", "dullness", "percussion", "decreased breath sounds", "left lung base", "Abdominal examination shows diffuse tenderness", "guarding", "Bowel sounds", "normal", "examination shows", "abnormalities", "hemoglobin concentration", "g/dL", "x-ray of", "chest shows", "fractured left second rib", "depression", "left mainstem bronchus", "deviation", "nasogastric tube", "right", "widened mediastinum", "following", "most likely diagnosis"], "model_answer": "The patient's presentation includes respiratory distress, hypotension, and findings on chest x-ray such as a widened mediastinum, depression of the left mainstem bronchus, and deviation of the nasogastric tube to the right. These findings are most consistent with a thoracic aortic rupture, which is a life-threatening condition that requires immediate intervention. \n\nThe widened mediastinum is a classic finding in thoracic aortic rupture, and the other findings (depression of the left mainstem bronchus and deviation of the nasogastric tube) further support this diagnosis. \n\nThe other options are less likely:\n- Diaphragmatic rupture (A) would not typically cause a widened mediastinum or the specific bronchial and nasogastric tube deviations seen here.\n- Traumatic bronchial rupture (B) might cause respiratory distress but would not explain the widened mediastinum or hemodynamic instability.\n- Tension pneumothorax (D) would cause tracheal deviation away from the affected side and hyperresonance, not dullness, on percussion. \n\nThe most likely diagnosis is [C:Thoracic aortic rupture].", "fact_gen_query": "\n    nQuestion:\nA 26-year-old woman is brought to the emergency department 20 minutes after being involved in a high-speed motor vehicle collision in which she was a restrained passenger. On arrival, she is lethargic and incoherent. She has severe facial lacerations and is in respiratory distress. Her pulse is 130/min, respirations are 29/min, and blood pressure is 90/58 mm Hg. Pulse oximetry on room air shows an oxygen saturation of 70%. Examination shows multiple facial lacerations. There is dullness to percussion and decreased breath sounds over the left lung base. Abdominal examination shows diffuse tenderness with no guarding or rebound. Bowel sounds are normal. The remainder of the examination shows no abnormalities. Her hemoglobin concentration is 12.1 g/dL. An x-ray of the chest shows a fractured left second rib, depression of the left mainstem bronchus, deviation of the nasogastric tube to the right, and a widened mediastinum. Which of the following is the most likely diagnosis?\n\n Option:\nDiaphragmatic rupture;\nTraumatic bronchial rupture;\nThoracic aortic rupture;\nTension pneumothorax;\n\n\n Answer:\nThoracic aortic rupture\n For this QA example, you need to give netural fact info for each\n    option according to question context, so that later user can infer out the \n    correct answer from these facts. The template of facts is [option1_name:fact| option2_name:fact|...],e.g: [Ampicillin:High resistance, not first-line. | Ceftriaxone:Overkill (for pyelonephritis/severe UTI).]\n", "hinted_gen_query": "\n    Question:\nA 26-year-old woman is brought to the emergency department 20 minutes after being involved in a high-speed motor vehicle collision in which she was a restrained passenger. On arrival, she is lethargic and incoherent. She has severe facial lacerations and is in respiratory distress. Her pulse is 130/min, respirations are 29/min, and blood pressure is 90/58 mm Hg. Pulse oximetry on room air shows an oxygen saturation of 70%. Examination shows multiple facial lacerations. There is dullness to percussion and decreased breath sounds over the left lung base. Abdominal examination shows diffuse tenderness with no guarding or rebound. Bowel sounds are normal. The remainder of the examination shows no abnormalities. Her hemoglobin concentration is 12.1 g/dL. An x-ray of the chest shows a fractured left second rib, depression of the left mainstem bronchus, deviation of the nasogastric tube to the right, and a widened mediastinum. Which of the following is the most likely diagnosis?\n\n Option:\nA:Diaphragmatic rupture;\nB:Traumatic bronchial rupture;\nC:Thoracic aortic rupture;\nD:Tension pneumothorax;\n \n\n Hint:\nNone \n\n Answer:\n"}
{"question": "A 26-year-old G1P0 woman presents to her primary care physician’s office with feelings of anxiety and trouble with sleep. She finds it difficult initiating sleep, occasionally has palpitations, and feels fatigued. She denies having similar symptoms in the past or starting any new medications or illicit drugs. She is currently 10 weeks pregnant and is closely followed by her obstetrician. Her temperature is 98.6°F (37°C), blood pressure is 125/70 mmHg, pulse is 105/min, and respirations are 18/min. On physical exam, the patient is mildly diaphoretic. The skin is warm and the thyroid gland is diffusely enlarged with thyroid bruits. Laboratory studies are significant for a thyroid-stimulating hormone level of 0.01 µU/mL (normal is 0.5-5.0 µU/mL) and an elevated free thyroxine (FT4) that is inappropriate for her pregnancy. Which of the following is the best treatment option for this patient?", "answer": "Propylthiouracil", "options": {"A": "Methimazole", "B": "Propylthiouracil", "C": "Radioiodine therapy", "D": "Thyroidectomy"}, "meta_info": "step1", "answer_idx": "B", "metamap_phrases": ["year old", "woman presents", "primary care physicians office", "feelings", "anxiety", "sleep", "finds", "difficult initiating sleep", "occasionally", "palpitations", "feels fatigued", "denies", "similar symptoms", "past", "starting", "new medications", "illicit drugs", "currently 10 weeks pregnant", "followed by", "obstetrician", "temperature", "98", "blood pressure", "70 mmHg", "pulse", "min", "respirations", "min", "physical exam", "patient", "mildly diaphoretic", "skin", "warm", "thyroid gland", "enlarged", "thyroid bruits", "Laboratory studies", "significant", "thyroid-stimulating hormone level", "0.01 U/mL", "normal", "mL", "elevated free thyroxine", "inappropriate", "pregnancy", "following", "best treatment", "patient"], "model_answer": "The patient presents with symptoms and signs consistent with hyperthyroidism, likely due to Graves' disease (given the diffuse thyroid enlargement with bruits). In pregnancy, the treatment of hyperthyroidism requires special consideration due to the potential teratogenic effects of medications and the contraindication of radioiodine therapy. \n\n- **Methimazole** is associated with teratogenic effects (e.g., aplasia cutis, choanal atresia) when used in the first trimester, so it is avoided during this time. \n- **Propylthiouracil (PTU)** is preferred in the first trimester due to its lower risk of teratogenicity, although it carries a small risk of hepatotoxicity. \n- **Radioiodine therapy** is contraindicated in pregnancy due to the risk of fetal thyroid ablation. \n- **Thyroidectomy** is reserved for cases where medical therapy fails or is contraindicated, but it is not the first-line treatment. \n\nThe best treatment option for this patient, who is in her first trimester, is **Propylthiouracil (PTU)**. \n\n[B]", "fact_gen_query": "\n    nQuestion:\nA 26-year-old G1P0 woman presents to her primary care physician’s office with feelings of anxiety and trouble with sleep. She finds it difficult initiating sleep, occasionally has palpitations, and feels fatigued. She denies having similar symptoms in the past or starting any new medications or illicit drugs. She is currently 10 weeks pregnant and is closely followed by her obstetrician. Her temperature is 98.6°F (37°C), blood pressure is 125/70 mmHg, pulse is 105/min, and respirations are 18/min. On physical exam, the patient is mildly diaphoretic. The skin is warm and the thyroid gland is diffusely enlarged with thyroid bruits. Laboratory studies are significant for a thyroid-stimulating hormone level of 0.01 µU/mL (normal is 0.5-5.0 µU/mL) and an elevated free thyroxine (FT4) that is inappropriate for her pregnancy. Which of the following is the best treatment option for this patient?\n\n Option:\nMethimazole;\nPropylthiouracil;\nRadioiodine therapy;\nThyroidectomy;\n\n\n Answer:\nPropylthiouracil\n For this QA example, you need to give netural fact info for each\n    option according to question context, so that later user can infer out the \n    correct answer from these facts. The template of facts is [option1_name:fact| option2_name:fact|...],e.g: [Ampicillin:High resistance, not first-line. | Ceftriaxone:Overkill (for pyelonephritis/severe UTI).]\n", "hinted_gen_query": "\n    Question:\nA 26-year-old G1P0 woman presents to her primary care physician’s office with feelings of anxiety and trouble with sleep. She finds it difficult initiating sleep, occasionally has palpitations, and feels fatigued. She denies having similar symptoms in the past or starting any new medications or illicit drugs. She is currently 10 weeks pregnant and is closely followed by her obstetrician. Her temperature is 98.6°F (37°C), blood pressure is 125/70 mmHg, pulse is 105/min, and respirations are 18/min. On physical exam, the patient is mildly diaphoretic. The skin is warm and the thyroid gland is diffusely enlarged with thyroid bruits. Laboratory studies are significant for a thyroid-stimulating hormone level of 0.01 µU/mL (normal is 0.5-5.0 µU/mL) and an elevated free thyroxine (FT4) that is inappropriate for her pregnancy. Which of the following is the best treatment option for this patient?\n\n Option:\nA:Methimazole;\nB:Propylthiouracil;\nC:Radioiodine therapy;\nD:Thyroidectomy;\n \n\n Hint:\nNone \n\n Answer:\n"}
{"question": "A 32-year-old woman comes to the physician because of a 3-week history of intermittent loose stools and a 1.2-kg (2.6-lb) weight loss. She immigrated to the US from Uganda 6 weeks ago. Abdominal examination shows diffuse tenderness with no guarding or rebound. The liver is firm and palpable 3 cm below the right costal margin, and the spleen is palpable just below the left costal margin. Her leukocyte count is 12,800/mm3 (12% eosinophils). Stool culture shows several oval-shaped eggs with lateral spines. Microscopic examination of a liver biopsy specimen shows granulomatous inflammation with periportal fibrosis. Exposure to which of the following is most likely to have played a role in the development of this patient's symptoms?", "answer": "Freshwater snails", "options": {"A": "Undercooked pork meat", "B": "Undercooked fish meat", "C": "Dog feces", "D": "Freshwater snails"}, "meta_info": "step1", "answer_idx": "D", "metamap_phrases": ["year old woman", "physician", "3 week history", "intermittent loose stools", "a", "2 kg", "2.6", "weight loss", "Uganda", "weeks", "Abdominal examination shows diffuse tenderness", "guarding", "liver", "firm", "palpable 3 cm", "right costal margin", "spleen", "palpable", "left costal margin", "leukocyte count", "800 mm3", "eosinophils", "Stool culture shows several oval eggs", "lateral spines", "Microscopic examination of", "liver biopsy specimen shows granulomatous inflammation with", "fibrosis", "Exposure", "following", "most likely to", "played", "role", "development", "patient's symptoms"], "model_answer": "The patient's symptoms, including intermittent loose stools, weight loss, hepatosplenomegaly, eosinophilia, and the presence of oval-shaped eggs with lateral spines in stool culture, along with granulomatous inflammation and periportal fibrosis on liver biopsy, are consistent with schistosomiasis. Schistosomiasis is caused by trematode parasites of the genus Schistosoma. The lateral-spined eggs are characteristic of Schistosoma mansoni, which is transmitted through exposure to freshwater contaminated with cercariae released by infected freshwater snails.\n\nThe correct answer is: [D]", "fact_gen_query": "\n    nQuestion:\nA 32-year-old woman comes to the physician because of a 3-week history of intermittent loose stools and a 1.2-kg (2.6-lb) weight loss. She immigrated to the US from Uganda 6 weeks ago. Abdominal examination shows diffuse tenderness with no guarding or rebound. The liver is firm and palpable 3 cm below the right costal margin, and the spleen is palpable just below the left costal margin. Her leukocyte count is 12,800/mm3 (12% eosinophils). Stool culture shows several oval-shaped eggs with lateral spines. Microscopic examination of a liver biopsy specimen shows granulomatous inflammation with periportal fibrosis. Exposure to which of the following is most likely to have played a role in the development of this patient's symptoms?\n\n Option:\nUndercooked pork meat;\nUndercooked fish meat;\nDog feces;\nFreshwater snails;\n\n\n Answer:\nFreshwater snails\n For this QA example, you need to give netural fact info for each\n    option according to question context, so that later user can infer out the \n    correct answer from these facts. The template of facts is [option1_name:fact| option2_name:fact|...],e.g: [Ampicillin:High resistance, not first-line. | Ceftriaxone:Overkill (for pyelonephritis/severe UTI).]\n", "hinted_gen_query": "\n    Question:\nA 32-year-old woman comes to the physician because of a 3-week history of intermittent loose stools and a 1.2-kg (2.6-lb) weight loss. She immigrated to the US from Uganda 6 weeks ago. Abdominal examination shows diffuse tenderness with no guarding or rebound. The liver is firm and palpable 3 cm below the right costal margin, and the spleen is palpable just below the left costal margin. Her leukocyte count is 12,800/mm3 (12% eosinophils). Stool culture shows several oval-shaped eggs with lateral spines. Microscopic examination of a liver biopsy specimen shows granulomatous inflammation with periportal fibrosis. Exposure to which of the following is most likely to have played a role in the development of this patient's symptoms?\n\n Option:\nA:Undercooked pork meat;\nB:Undercooked fish meat;\nC:Dog feces;\nD:Freshwater snails;\n \n\n Hint:\nNone \n\n Answer:\n"}
{"question": "A 3-month-old girl is brought to a pediatrician by her parents. She has central cyanosis without signs of respiratory distress or signs of heart failure. An echocardiogram reveals severe pulmonary outflow obstruction, right ventricular hypertrophy, a ventricular septal defect, and an overriding of the aorta. An elective primary surgical repair is planned at 4 months of age. Which of the following statements is true about this girl’s condition?", "answer": "Normal hemoglobin in patients with tetralogy of Fallot does not rule out iron deficiency anemia.", "options": {"A": "The tricuspid valve is the most common valve affected by bacterial endocarditis in uncorrected tetralogy of Fallot.", "B": "Normal hemoglobin in patients with tetralogy of Fallot does not rule out iron deficiency anemia.", "C": "Cerebral arterial thrombosis is more common than cerebral venous thrombosis.", "D": "Refractory heart failure is a common complication of tetralogy of Fallot."}, "meta_info": "step1", "answer_idx": "B", "metamap_phrases": ["3 month old girl", "brought", "pediatrician", "parents", "central cyanosis", "signs", "respiratory distress", "signs", "heart failure", "echocardiogram reveals severe pulmonary", "obstruction", "right ventricular hypertrophy", "ventricular septal defect", "overriding", "aorta", "elective primary", "planned", "months", "age", "following statements", "true", "girls condition"], "model_answer": "The clinical scenario describes a patient with tetralogy of Fallot (TOF), which consists of four classic findings: ventricular septal defect (VSD), pulmonary outflow obstruction, right ventricular hypertrophy, and overriding aorta. \n\nLet's evaluate each option:\n\nA: The tricuspid valve is NOT the most common valve affected by bacterial endocarditis in uncorrected TOF. The most common site is the pulmonary valve or the VSD. This is incorrect.\n\nB: Normal hemoglobin in patients with TOF does not rule out iron deficiency anemia. This is correct because patients with TOF often have polycythemia due to chronic hypoxemia, which can mask iron deficiency anemia (normal hemoglobin but with microcytosis and hypochromia).\n\nC: Cerebral venous thrombosis is more common than cerebral arterial thrombosis in TOF due to polycythemia and hyperviscosity. This is incorrect.\n\nD: Refractory heart failure is NOT a common complication of TOF. Heart failure is rare in TOF because the right ventricular outflow obstruction protects the lungs from excessive blood flow. This is incorrect.\n\nThe correct answer is [B].", "fact_gen_query": "\n    nQuestion:\nA 3-month-old girl is brought to a pediatrician by her parents. She has central cyanosis without signs of respiratory distress or signs of heart failure. An echocardiogram reveals severe pulmonary outflow obstruction, right ventricular hypertrophy, a ventricular septal defect, and an overriding of the aorta. An elective primary surgical repair is planned at 4 months of age. Which of the following statements is true about this girl’s condition?\n\n Option:\nThe tricuspid valve is the most common valve affected by bacterial endocarditis in uncorrected tetralogy of Fallot.;\nNormal hemoglobin in patients with tetralogy of Fallot does not rule out iron deficiency anemia.;\nCerebral arterial thrombosis is more common than cerebral venous thrombosis.;\nRefractory heart failure is a common complication of tetralogy of Fallot.;\n\n\n Answer:\nNormal hemoglobin in patients with tetralogy of Fallot does not rule out iron deficiency anemia.\n For this QA example, you need to give netural fact info for each\n    option according to question context, so that later user can infer out the \n    correct answer from these facts. The template of facts is [option1_name:fact| option2_name:fact|...],e.g: [Ampicillin:High resistance, not first-line. | Ceftriaxone:Overkill (for pyelonephritis/severe UTI).]\n", "hinted_gen_query": "\n    Question:\nA 3-month-old girl is brought to a pediatrician by her parents. She has central cyanosis without signs of respiratory distress or signs of heart failure. An echocardiogram reveals severe pulmonary outflow obstruction, right ventricular hypertrophy, a ventricular septal defect, and an overriding of the aorta. An elective primary surgical repair is planned at 4 months of age. Which of the following statements is true about this girl’s condition?\n\n Option:\nA:The tricuspid valve is the most common valve affected by bacterial endocarditis in uncorrected tetralogy of Fallot.;\nB:Normal hemoglobin in patients with tetralogy of Fallot does not rule out iron deficiency anemia.;\nC:Cerebral arterial thrombosis is more common than cerebral venous thrombosis.;\nD:Refractory heart failure is a common complication of tetralogy of Fallot.;\n \n\n Hint:\nNone \n\n Answer:\n"}
{"question": "Six days after undergoing surgical repair of a hip fracture, a previously healthy 79-year-old woman is agitated and confused. She is unarousable during the day, but then is awake and impulsive during the night, requiring frequent reorientation. Her husband says that she usually drinks one to two glasses of wine weekly. Her only current medication is oxycodone for pain. Her vital signs are within normal limits. She is distressed and oriented to person but not to place or time. Neurologic examination shows inattentiveness but no focal deficits. Urine dipstick is normal. Which of the following is the most likely cause of her current condition?", "answer": "Delirium", "options": {"A": "Dementia", "B": "Opioid intoxication", "C": "Delirium", "D": "Urinary tract infection"}, "meta_info": "step1", "answer_idx": "C", "metamap_phrases": ["Six days", "surgical", "hip", "healthy", "year old woman", "agitated", "confused", "day", "then", "awake", "impulsive", "night", "frequent reorientation", "husband", "usually drinks one", "two glasses", "wine weekly", "only current medication", "oxycodone", "pain", "vital signs", "normal limits", "distressed", "oriented to person", "not to place", "time", "Neurologic examination shows inattentiveness", "focal deficits", "Urine dipstick", "normal", "following", "most likely cause", "current condition"], "model_answer": "The most likely cause of her current condition is delirium, given the acute onset of confusion, agitation, and altered sleep-wake cycle in the setting of recent surgery and opioid use. \n\n[C]", "fact_gen_query": "\n    nQuestion:\nSix days after undergoing surgical repair of a hip fracture, a previously healthy 79-year-old woman is agitated and confused. She is unarousable during the day, but then is awake and impulsive during the night, requiring frequent reorientation. Her husband says that she usually drinks one to two glasses of wine weekly. Her only current medication is oxycodone for pain. Her vital signs are within normal limits. She is distressed and oriented to person but not to place or time. Neurologic examination shows inattentiveness but no focal deficits. Urine dipstick is normal. Which of the following is the most likely cause of her current condition?\n\n Option:\nDementia;\nOpioid intoxication;\nDelirium;\nUrinary tract infection;\n\n\n Answer:\nDelirium\n For this QA example, you need to give netural fact info for each\n    option according to question context, so that later user can infer out the \n    correct answer from these facts. The template of facts is [option1_name:fact| option2_name:fact|...],e.g: [Ampicillin:High resistance, not first-line. | Ceftriaxone:Overkill (for pyelonephritis/severe UTI).]\n", "hinted_gen_query": "\n    Question:\nSix days after undergoing surgical repair of a hip fracture, a previously healthy 79-year-old woman is agitated and confused. She is unarousable during the day, but then is awake and impulsive during the night, requiring frequent reorientation. Her husband says that she usually drinks one to two glasses of wine weekly. Her only current medication is oxycodone for pain. Her vital signs are within normal limits. She is distressed and oriented to person but not to place or time. Neurologic examination shows inattentiveness but no focal deficits. Urine dipstick is normal. Which of the following is the most likely cause of her current condition?\n\n Option:\nA:Dementia;\nB:Opioid intoxication;\nC:Delirium;\nD:Urinary tract infection;\n \n\n Hint:\nNone \n\n Answer:\n"}
{"question": "A 54-year-old woman with a past medical history of mental retardation, hypertension, and diabetes presents to the emergency department with a change in her behavior. Her caretakers state that the patient’s gait suddenly became ataxic, and she became less responsive than her normal non-verbal baseline. Her temperature is 98.5°F (36.9°C), blood pressure is 125/68 mmHg, pulse is 90/min, respirations are 15/min, and oxygen saturation is 99% on room air. Physical exam is notable for an unremarkable HEENT exam with normal facial features and no signs of airway compromise. Neurological exam is remarkable for new onset spasticity. The patient has 3+ reflexes and a positive Babinski sign. Musculoskeletal exam is only notable for symmetric swelling and deformities of the patient’s hands bilaterally. Additionally, there is a \"clunk\" when posterior force is applied to the head while anterior force is applied to the cervical spine. Which of the following is the most likely risk factor that predisposed this patient to this condition?", "answer": "Rheumatoid arthritis", "options": {"A": "Cerebral palsy", "B": "Diabetes mellitus", "C": "Down syndrome", "D": "Rheumatoid arthritis"}, "meta_info": "step2&3", "answer_idx": "D", "metamap_phrases": ["54 year old woman", "past medical history of mental retardation", "hypertension", "diabetes presents", "emergency department", "change in", "behavior", "caretakers state", "patients gait", "ataxic", "less responsive than", "normal non-verbal baseline", "temperature", "98", "36", "blood pressure", "68 mmHg", "pulse", "90 min", "respirations", "min", "oxygen saturation", "99", "room air", "Physical exam", "notable", "unremarkable HEENT exam", "normal facial features", "signs", "airway compromise", "Neurological exam", "new onset spasticity", "patient", "3", "reflexes", "positive Babinski sign", "Musculoskeletal exam", "only notable", "symmetric swelling", "deformities", "patients hands", "posterior force", "applied", "head", "anterior force", "applied", "cervical spine", "following", "most likely risk factor", "predisposed", "patient", "condition"], "model_answer": "The patient presents with new-onset neurological symptoms including ataxia, spasticity, hyperreflexia, and a positive Babinski sign, along with a positive \"clunk\" sign on cervical spine manipulation. These findings suggest cervical myelopathy, likely due to atlantoaxial instability. The symmetric hand swelling and deformities are characteristic of rheumatoid arthritis (RA), which is a known risk factor for atlantoaxial subluxation and subsequent myelopathy. \n\nWhile Down syndrome (C) can also predispose to atlantoaxial instability, the patient's age and physical findings (symmetric hand deformities) are more consistent with RA. Diabetes mellitus (B) and cerebral palsy (A) are not directly associated with this condition.\n\nThe most likely risk factor is [D].", "fact_gen_query": "\n    nQuestion:\nA 54-year-old woman with a past medical history of mental retardation, hypertension, and diabetes presents to the emergency department with a change in her behavior. Her caretakers state that the patient’s gait suddenly became ataxic, and she became less responsive than her normal non-verbal baseline. Her temperature is 98.5°F (36.9°C), blood pressure is 125/68 mmHg, pulse is 90/min, respirations are 15/min, and oxygen saturation is 99% on room air. Physical exam is notable for an unremarkable HEENT exam with normal facial features and no signs of airway compromise. Neurological exam is remarkable for new onset spasticity. The patient has 3+ reflexes and a positive Babinski sign. Musculoskeletal exam is only notable for symmetric swelling and deformities of the patient’s hands bilaterally. Additionally, there is a \"clunk\" when posterior force is applied to the head while anterior force is applied to the cervical spine. Which of the following is the most likely risk factor that predisposed this patient to this condition?\n\n Option:\nCerebral palsy;\nDiabetes mellitus;\nDown syndrome;\nRheumatoid arthritis;\n\n\n Answer:\nRheumatoid arthritis\n For this QA example, you need to give netural fact info for each\n    option according to question context, so that later user can infer out the \n    correct answer from these facts. The template of facts is [option1_name:fact| option2_name:fact|...],e.g: [Ampicillin:High resistance, not first-line. | Ceftriaxone:Overkill (for pyelonephritis/severe UTI).]\n", "hinted_gen_query": "\n    Question:\nA 54-year-old woman with a past medical history of mental retardation, hypertension, and diabetes presents to the emergency department with a change in her behavior. Her caretakers state that the patient’s gait suddenly became ataxic, and she became less responsive than her normal non-verbal baseline. Her temperature is 98.5°F (36.9°C), blood pressure is 125/68 mmHg, pulse is 90/min, respirations are 15/min, and oxygen saturation is 99% on room air. Physical exam is notable for an unremarkable HEENT exam with normal facial features and no signs of airway compromise. Neurological exam is remarkable for new onset spasticity. The patient has 3+ reflexes and a positive Babinski sign. Musculoskeletal exam is only notable for symmetric swelling and deformities of the patient’s hands bilaterally. Additionally, there is a \"clunk\" when posterior force is applied to the head while anterior force is applied to the cervical spine. Which of the following is the most likely risk factor that predisposed this patient to this condition?\n\n Option:\nA:Cerebral palsy;\nB:Diabetes mellitus;\nC:Down syndrome;\nD:Rheumatoid arthritis;\n \n\n Hint:\nNone \n\n Answer:\n"}
{"question": "A 24-year-old man is brought to the emergency department 15 minutes after he sustained a stab wound to the left chest just below the clavicle. On arrival, he has rapid, shallow breathing and appears anxious. His pulse is 135/min, respirations are 30/min and shallow, and palpable systolic blood pressure is 80 mm Hg. He is intubated and mechanically ventilated. Infusion of 0.9% saline is begun. Five minutes later, his pulse is 133/min and blood pressure is 82/45 mm Hg. Examination shows no active external bleeding. There is a 2.5-cm single stab wound to the left chest at the 4th intercostal space at the midclavicular line. Cardiovascular examination shows muffled heart sounds and jugular venous distention. Breath sounds are normal. Further evaluation of this patient is most likely to show which of the following findings?", "answer": "A drop in systolic blood pressure of 14 mmHg during inspiration", "options": {"A": "Tracheal deviation toward the right side", "B": "Hemoptysis", "C": "A drop in systolic blood pressure of 14 mmHg during inspiration", "D": "Paradoxical motion of part of the chest with breathing\n\""}, "meta_info": "step2&3", "answer_idx": "C", "metamap_phrases": ["year old man", "brought", "emergency department 15 minutes", "sustained", "stab wound", "left chest", "clavicle", "arrival", "rapid", "shallow breathing", "appears anxious", "pulse", "min", "respirations", "30/min", "shallow", "palpable systolic blood pressure", "80 mm Hg", "intubated", "ventilated", "Infusion", "0.9", "saline", "begun", "Five minutes later", "pulse", "min", "blood pressure", "mm Hg", "Examination shows", "active external bleeding", "2.5 cm single stab wound", "left chest", "4th intercostal space", "midclavicular line", "Cardiovascular examination shows", "heart sounds", "jugular venous distention", "Breath sounds", "normal", "Further evaluation", "patient", "most likely to show", "following findings"], "model_answer": "The patient presents with a stab wound to the left chest, exhibiting signs of hypotension, tachycardia, muffled heart sounds, and jugular venous distention, which are classic findings of **cardiac tamponade**. \n\nKey findings in cardiac tamponade include:\n- **Beck's triad** (hypotension, muffled heart sounds, jugular venous distention)\n- **Pulsus paradoxus** (a drop in systolic blood pressure >10 mmHg during inspiration, which is not always present but is highly suggestive)\n\nOther options:\n- **A: Tracheal deviation toward the right side** → This is seen in **tension pneumothorax**, but the patient has normal breath sounds and no evidence of pneumothorax.\n- **B: Hemoptysis** → This is more common with pulmonary contusion or tracheobronchial injury, not cardiac tamponade.\n- **D: Paradoxical motion of part of the chest with breathing** → This is seen in **flail chest**, which is not relevant here.\n\nThe most likely finding in this patient is **pulsus paradoxus**, which corresponds to a drop in systolic blood pressure during inspiration.\n\n[C]", "fact_gen_query": "\n    nQuestion:\nA 24-year-old man is brought to the emergency department 15 minutes after he sustained a stab wound to the left chest just below the clavicle. On arrival, he has rapid, shallow breathing and appears anxious. His pulse is 135/min, respirations are 30/min and shallow, and palpable systolic blood pressure is 80 mm Hg. He is intubated and mechanically ventilated. Infusion of 0.9% saline is begun. Five minutes later, his pulse is 133/min and blood pressure is 82/45 mm Hg. Examination shows no active external bleeding. There is a 2.5-cm single stab wound to the left chest at the 4th intercostal space at the midclavicular line. Cardiovascular examination shows muffled heart sounds and jugular venous distention. Breath sounds are normal. Further evaluation of this patient is most likely to show which of the following findings?\n\n Option:\nTracheal deviation toward the right side;\nHemoptysis;\nA drop in systolic blood pressure of 14 mmHg during inspiration;\nParadoxical motion of part of the chest with breathing\n\";\n\n\n Answer:\nA drop in systolic blood pressure of 14 mmHg during inspiration\n For this QA example, you need to give netural fact info for each\n    option according to question context, so that later user can infer out the \n    correct answer from these facts. The template of facts is [option1_name:fact| option2_name:fact|...],e.g: [Ampicillin:High resistance, not first-line. | Ceftriaxone:Overkill (for pyelonephritis/severe UTI).]\n", "hinted_gen_query": "\n    Question:\nA 24-year-old man is brought to the emergency department 15 minutes after he sustained a stab wound to the left chest just below the clavicle. On arrival, he has rapid, shallow breathing and appears anxious. His pulse is 135/min, respirations are 30/min and shallow, and palpable systolic blood pressure is 80 mm Hg. He is intubated and mechanically ventilated. Infusion of 0.9% saline is begun. Five minutes later, his pulse is 133/min and blood pressure is 82/45 mm Hg. Examination shows no active external bleeding. There is a 2.5-cm single stab wound to the left chest at the 4th intercostal space at the midclavicular line. Cardiovascular examination shows muffled heart sounds and jugular venous distention. Breath sounds are normal. Further evaluation of this patient is most likely to show which of the following findings?\n\n Option:\nA:Tracheal deviation toward the right side;\nB:Hemoptysis;\nC:A drop in systolic blood pressure of 14 mmHg during inspiration;\nD:Paradoxical motion of part of the chest with breathing\n\";\n \n\n Hint:\nNone \n\n Answer:\n"}
{"question": "A 40-year-old man presents to his primary-care doctor for a follow-up of his hypertension. He is asymptomatic at his office visit and denies any new complaints. He has a 10-year history of hypertension that remains poorly controlled on maximum doses of lisinopril, hydrochlorothiazide, and amlodipine. His past medical history is otherwise unremarkable. He has no smoking history, drinks alcohol occasionally, and denies any illicit drug use. His father required a kidney transplant in his forties. The physical exam is notable for palpable flank masses bilaterally. Laboratory studies show a creatinine of 2.5. The physician orders a renal ultrasound, and the results are shown. Which of the following is the most appropriate test to screen for additional complications of this patient's condition?", "answer": "MR angiography of the brain", "options": {"A": "Colonoscopy", "B": "Esophagogastroduodenoscopy", "C": "Liver function tests", "D": "MR angiography of the brain"}, "meta_info": "step2&3", "answer_idx": "D", "metamap_phrases": ["40 year old man presents", "primary-care doctor", "follow-up", "hypertension", "asymptomatic", "office visit", "denies", "new complaints", "a 10 year history of hypertension", "poorly controlled", "maximum doses", "lisinopril", "hydrochlorothiazide", "amlodipine", "past medical history", "unremarkable", "smoking history", "drinks alcohol occasionally", "denies", "illicit drug use", "father required", "kidney transplant", "forties", "physical exam", "notable", "palpable flank masses", "Laboratory studies show", "creatinine", "physician orders", "renal ultrasound", "results", "shown", "following", "most appropriate test to screen", "additional complications", "patient's condition"], "model_answer": "The patient's presentation (hypertension, palpable flank masses, elevated creatinine, and family history of kidney disease) is highly suggestive of autosomal dominant polycystic kidney disease (ADPKD). ADPKD is associated with several extrarenal manifestations, including intracranial aneurysms, which can lead to subarachnoid hemorrhage. Therefore, the most appropriate test to screen for additional complications in this patient is MR angiography of the brain to evaluate for intracranial aneurysms.\n\nThe other options are not directly related to the complications of ADPKD:\n- Colonoscopy (A) is not indicated unless there are gastrointestinal symptoms or concerns for malignancy.\n- Esophagogastroduodenoscopy (B) is not routinely indicated in ADPKD.\n- Liver function tests (C) may show abnormalities due to liver cysts, but they are not the most appropriate screening test for complications in this context.\n\nThe correct answer is [D].", "fact_gen_query": "\n    nQuestion:\nA 40-year-old man presents to his primary-care doctor for a follow-up of his hypertension. He is asymptomatic at his office visit and denies any new complaints. He has a 10-year history of hypertension that remains poorly controlled on maximum doses of lisinopril, hydrochlorothiazide, and amlodipine. His past medical history is otherwise unremarkable. He has no smoking history, drinks alcohol occasionally, and denies any illicit drug use. His father required a kidney transplant in his forties. The physical exam is notable for palpable flank masses bilaterally. Laboratory studies show a creatinine of 2.5. The physician orders a renal ultrasound, and the results are shown. Which of the following is the most appropriate test to screen for additional complications of this patient's condition?\n\n Option:\nColonoscopy;\nEsophagogastroduodenoscopy;\nLiver function tests;\nMR angiography of the brain;\n\n\n Answer:\nMR angiography of the brain\n For this QA example, you need to give netural fact info for each\n    option according to question context, so that later user can infer out the \n    correct answer from these facts. The template of facts is [option1_name:fact| option2_name:fact|...],e.g: [Ampicillin:High resistance, not first-line. | Ceftriaxone:Overkill (for pyelonephritis/severe UTI).]\n", "hinted_gen_query": "\n    Question:\nA 40-year-old man presents to his primary-care doctor for a follow-up of his hypertension. He is asymptomatic at his office visit and denies any new complaints. He has a 10-year history of hypertension that remains poorly controlled on maximum doses of lisinopril, hydrochlorothiazide, and amlodipine. His past medical history is otherwise unremarkable. He has no smoking history, drinks alcohol occasionally, and denies any illicit drug use. His father required a kidney transplant in his forties. The physical exam is notable for palpable flank masses bilaterally. Laboratory studies show a creatinine of 2.5. The physician orders a renal ultrasound, and the results are shown. Which of the following is the most appropriate test to screen for additional complications of this patient's condition?\n\n Option:\nA:Colonoscopy;\nB:Esophagogastroduodenoscopy;\nC:Liver function tests;\nD:MR angiography of the brain;\n \n\n Hint:\nNone \n\n Answer:\n"}
{"question": "A 17-year-old female is brought to the emergency room by her father because she has been experiencing shortness of breath and chest pain. She says that the chest pain is worse when she breathes or coughs. Furthermore, on the way to the hospital she noticed that there were specks of blood on a tissue that she coughed into. She has no previous medical history and does not recall anything that could have provoked these symptoms. On presentation her temperature is 99°F (37.2°C), blood pressure is 107/65 mmHg, pulse is 102/min, respirations are 21/min, and O2 saturation is 91% on room air. Further testing shows a large filling defect in the pulmonary vessels, and the patient is started on an appropriate treatment intravenously. After drug administration, the effects of the drug are monitored using a standard blood test. Surprisingly, the test results come back within normal parameters. The most likely underlying cause of this patient's symptoms has which of the following modes of inheritance?", "answer": "Autosomal dominant", "options": {"A": "Autosomal dominant", "B": "Autosomal partial dominance", "C": "X-linked dominant", "D": "X-linked recessive"}, "meta_info": "step1", "answer_idx": "A", "metamap_phrases": ["year old female", "brought", "emergency room", "father", "experiencing shortness of breath", "chest pain", "chest pain", "worse", "coughs", "hospital", "blood", "tissue", "coughed", "previous medical history", "not recall", "provoked", "symptoms", "presentation", "temperature", "blood pressure", "65 mmHg", "pulse", "min", "respirations", "min", "O2 saturation", "room air", "Further testing shows", "large filling defect in", "pulmonary", "patient", "started", "appropriate treatment", "drug administration", "effects of", "drug", "monitored using", "standard blood test", "test results", "back", "normal parameters", "most likely underlying cause", "patient's symptoms", "of", "following modes", "inheritance"], "model_answer": "The patient's symptoms and findings (shortness of breath, chest pain, hemoptysis, low O2 saturation, and a large filling defect in the pulmonary vessels) are consistent with a pulmonary embolism (PE). The patient was started on an appropriate intravenous treatment (likely heparin), and the effects were monitored using aPTT (activated partial thromboplastin time). The aPTT results were normal despite heparin administration, suggesting heparin resistance, which can occur in antithrombin III (ATIII) deficiency. ATIII deficiency is an autosomal dominant disorder.\n\nThe most likely underlying cause of this patient's symptoms is antithrombin III deficiency, which has an autosomal dominant mode of inheritance. \n\n[A]", "fact_gen_query": "\n    nQuestion:\nA 17-year-old female is brought to the emergency room by her father because she has been experiencing shortness of breath and chest pain. She says that the chest pain is worse when she breathes or coughs. Furthermore, on the way to the hospital she noticed that there were specks of blood on a tissue that she coughed into. She has no previous medical history and does not recall anything that could have provoked these symptoms. On presentation her temperature is 99°F (37.2°C), blood pressure is 107/65 mmHg, pulse is 102/min, respirations are 21/min, and O2 saturation is 91% on room air. Further testing shows a large filling defect in the pulmonary vessels, and the patient is started on an appropriate treatment intravenously. After drug administration, the effects of the drug are monitored using a standard blood test. Surprisingly, the test results come back within normal parameters. The most likely underlying cause of this patient's symptoms has which of the following modes of inheritance?\n\n Option:\nAutosomal dominant;\nAutosomal partial dominance;\nX-linked dominant;\nX-linked recessive;\n\n\n Answer:\nAutosomal dominant\n For this QA example, you need to give netural fact info for each\n    option according to question context, so that later user can infer out the \n    correct answer from these facts. The template of facts is [option1_name:fact| option2_name:fact|...],e.g: [Ampicillin:High resistance, not first-line. | Ceftriaxone:Overkill (for pyelonephritis/severe UTI).]\n", "hinted_gen_query": "\n    Question:\nA 17-year-old female is brought to the emergency room by her father because she has been experiencing shortness of breath and chest pain. She says that the chest pain is worse when she breathes or coughs. Furthermore, on the way to the hospital she noticed that there were specks of blood on a tissue that she coughed into. She has no previous medical history and does not recall anything that could have provoked these symptoms. On presentation her temperature is 99°F (37.2°C), blood pressure is 107/65 mmHg, pulse is 102/min, respirations are 21/min, and O2 saturation is 91% on room air. Further testing shows a large filling defect in the pulmonary vessels, and the patient is started on an appropriate treatment intravenously. After drug administration, the effects of the drug are monitored using a standard blood test. Surprisingly, the test results come back within normal parameters. The most likely underlying cause of this patient's symptoms has which of the following modes of inheritance?\n\n Option:\nA:Autosomal dominant;\nB:Autosomal partial dominance;\nC:X-linked dominant;\nD:X-linked recessive;\n \n\n Hint:\nNone \n\n Answer:\n"}
{"question": "A 26-year-old male presents to his primary care physician with complaints of burning with urination, penile discharge, and intermittent fevers. A urethral smear shows gram negative diplococci within white blood cells. The organism grows well when cultured on Thayer-Martin agar. The patient is prescribed a course of ceftriaxone and the infection resolves without further complication. One year later, the patient returns with the same infection. Which of the following best explains this lack of lasting immunity?", "answer": "Antigenic variation", "options": {"A": "Exotoxin release", "B": "Antigenic variation", "C": "Polysaccharide capsule", "D": "Bruton's agammaglobulinemia"}, "meta_info": "step1", "answer_idx": "B", "metamap_phrases": ["year old male presents", "primary care physician", "complaints", "burning", "urination", "penile discharge", "intermittent fevers", "urethral smear shows gram negative diplococci", "white blood cells", "organism", "well", "cultured", "Thayer-Martin agar", "patient", "prescribed", "course", "ceftriaxone", "infection resolves", "further complication", "One year later", "patient returns", "same infection", "following best", "lack", "immunity"], "model_answer": "The best explanation for the lack of lasting immunity in this patient is due to **antigenic variation** by the organism, which allows it to evade the immune system by altering its surface antigens. \n\nThe correct answer is [B].", "fact_gen_query": "\n    nQuestion:\nA 26-year-old male presents to his primary care physician with complaints of burning with urination, penile discharge, and intermittent fevers. A urethral smear shows gram negative diplococci within white blood cells. The organism grows well when cultured on Thayer-Martin agar. The patient is prescribed a course of ceftriaxone and the infection resolves without further complication. One year later, the patient returns with the same infection. Which of the following best explains this lack of lasting immunity?\n\n Option:\nExotoxin release;\nAntigenic variation;\nPolysaccharide capsule;\nBruton's agammaglobulinemia;\n\n\n Answer:\nAntigenic variation\n For this QA example, you need to give netural fact info for each\n    option according to question context, so that later user can infer out the \n    correct answer from these facts. The template of facts is [option1_name:fact| option2_name:fact|...],e.g: [Ampicillin:High resistance, not first-line. | Ceftriaxone:Overkill (for pyelonephritis/severe UTI).]\n", "hinted_gen_query": "\n    Question:\nA 26-year-old male presents to his primary care physician with complaints of burning with urination, penile discharge, and intermittent fevers. A urethral smear shows gram negative diplococci within white blood cells. The organism grows well when cultured on Thayer-Martin agar. The patient is prescribed a course of ceftriaxone and the infection resolves without further complication. One year later, the patient returns with the same infection. Which of the following best explains this lack of lasting immunity?\n\n Option:\nA:Exotoxin release;\nB:Antigenic variation;\nC:Polysaccharide capsule;\nD:Bruton's agammaglobulinemia;\n \n\n Hint:\nNone \n\n Answer:\n"}
{"question": "A 37-year-old man with no significant past medical history is rear-ended in a motor vehicle accident. He reported significant neck pain to emergency responders, but otherwise denies weakness, numbness or tingling in his extremities. His vitals on presentation to the ED are HR 90, BP 140/80, RR 20, SpO2 98%. What is the most appropriate next step upon presentation to the emergency room?", "answer": "Cervical immobilization", "options": {"A": "Lateral cervical film", "B": "Cervical immobilization", "C": "IV methylprednisolone", "D": "Observation overnight"}, "meta_info": "step2&3", "answer_idx": "B", "metamap_phrases": ["year old man", "significant past medical history", "rear-ended", "motor vehicle accident", "reported significant neck pain", "emergency responders", "denies weakness", "numbness", "tingling", "extremities", "presentation", "ED", "90", "BP", "80", "RR 20", "98", "most appropriate next step", "presentation", "emergency room"], "model_answer": "The most appropriate next step upon presentation to the emergency room for this patient with significant neck pain following a motor vehicle accident is cervical immobilization to prevent potential spinal cord injury until further evaluation can be completed. \n\n[B:Cervical immobilization]", "fact_gen_query": "\n    nQuestion:\nA 37-year-old man with no significant past medical history is rear-ended in a motor vehicle accident. He reported significant neck pain to emergency responders, but otherwise denies weakness, numbness or tingling in his extremities. His vitals on presentation to the ED are HR 90, BP 140/80, RR 20, SpO2 98%. What is the most appropriate next step upon presentation to the emergency room?\n\n Option:\nLateral cervical film;\nCervical immobilization;\nIV methylprednisolone;\nObservation overnight;\n\n\n Answer:\nCervical immobilization\n For this QA example, you need to give netural fact info for each\n    option according to question context, so that later user can infer out the \n    correct answer from these facts. The template of facts is [option1_name:fact| option2_name:fact|...],e.g: [Ampicillin:High resistance, not first-line. | Ceftriaxone:Overkill (for pyelonephritis/severe UTI).]\n", "hinted_gen_query": "\n    Question:\nA 37-year-old man with no significant past medical history is rear-ended in a motor vehicle accident. He reported significant neck pain to emergency responders, but otherwise denies weakness, numbness or tingling in his extremities. His vitals on presentation to the ED are HR 90, BP 140/80, RR 20, SpO2 98%. What is the most appropriate next step upon presentation to the emergency room?\n\n Option:\nA:Lateral cervical film;\nB:Cervical immobilization;\nC:IV methylprednisolone;\nD:Observation overnight;\n \n\n Hint:\nNone \n\n Answer:\n"}
{"question": "A 43-year-old man with a history of schizophrenia, currently controlled with medication, comes in for an appointment with his internist. He is concerned about abnormal discharge from both nipples over the past 3 months. The fluid is white, and he wonders if it could be milk. On further review of systems, he endorses a diminished sexual drive. The physician suspects that one of the patient's medications may be the culprit for these symptoms. Which of the following medications is NOT likely to be the cause?", "answer": "Bromocriptine", "options": {"A": "Haloperidol", "B": "Bromocriptine", "C": "Fluphenazine", "D": "Risperidone"}, "meta_info": "step1", "answer_idx": "B", "metamap_phrases": ["year old man", "history of schizophrenia", "currently controlled", "medication", "appointment", "internist", "concerned", "abnormal discharge", "nipples", "past 3 months", "fluid", "white", "milk", "further review of systems", "diminished sexual drive", "physician suspects", "one", "patient's medications", "symptoms", "following medications", "NOT likely to", "cause"], "model_answer": "The patient is presenting with galactorrhea (abnormal nipple discharge) and diminished libido, which are symptoms suggestive of hyperprolactinemia. Antipsychotic medications, particularly typical antipsychotics (e.g., haloperidol, fluphenazine) and some atypical antipsychotics (e.g., risperidone), are known to cause hyperprolactinemia due to dopamine D2 receptor blockade in the pituitary, which disinhibits prolactin secretion. \n\n- **Haloperidol (A)** and **Fluphenazine (C)** are typical antipsychotics and are likely causes of hyperprolactinemia.  \n- **Risperidone (D)** is an atypical antipsychotic but also has a high affinity for D2 receptors and is a common cause of hyperprolactinemia.  \n- **Bromocriptine (B)**, however, is a dopamine agonist (D2 receptor stimulant) used to treat hyperprolactinemia and would not cause these symptoms.  \n\nThus, the medication **NOT likely to be the cause** is [B].", "fact_gen_query": "\n    nQuestion:\nA 43-year-old man with a history of schizophrenia, currently controlled with medication, comes in for an appointment with his internist. He is concerned about abnormal discharge from both nipples over the past 3 months. The fluid is white, and he wonders if it could be milk. On further review of systems, he endorses a diminished sexual drive. The physician suspects that one of the patient's medications may be the culprit for these symptoms. Which of the following medications is NOT likely to be the cause?\n\n Option:\nHaloperidol;\nBromocriptine;\nFluphenazine;\nRisperidone;\n\n\n Answer:\nBromocriptine\n For this QA example, you need to give netural fact info for each\n    option according to question context, so that later user can infer out the \n    correct answer from these facts. The template of facts is [option1_name:fact| option2_name:fact|...],e.g: [Ampicillin:High resistance, not first-line. | Ceftriaxone:Overkill (for pyelonephritis/severe UTI).]\n", "hinted_gen_query": "\n    Question:\nA 43-year-old man with a history of schizophrenia, currently controlled with medication, comes in for an appointment with his internist. He is concerned about abnormal discharge from both nipples over the past 3 months. The fluid is white, and he wonders if it could be milk. On further review of systems, he endorses a diminished sexual drive. The physician suspects that one of the patient's medications may be the culprit for these symptoms. Which of the following medications is NOT likely to be the cause?\n\n Option:\nA:Haloperidol;\nB:Bromocriptine;\nC:Fluphenazine;\nD:Risperidone;\n \n\n Hint:\nNone \n\n Answer:\n"}
