{"question": "A junior orthopaedic surgery resident is completing a carpal tunnel repair with the department chairman as the attending physician. During the case, the resident inadvertently cuts a flexor tendon. The tendon is repaired without complication. The attending tells the resident that the patient will do fine, and there is no need to report this minor complication that will not harm the patient, as he does not want to make the patient worry unnecessarily. He tells the resident to leave this complication out of the operative report. Which of the following is the correct next action for the resident to take?", "answer": "Tell the attending that he cannot fail to disclose this mistake", "options": {"A": "Disclose the error to the patient and put it in the operative report", "B": "Tell the attending that he cannot fail to disclose this mistake", "C": "Report the physician to the ethics committee", "D": "Refuse to dictate the operative report"}, "meta_info": "step1", "answer_idx": "B", "metamap_phrases": ["junior orthopaedic surgery resident", "completing", "carpal tunnel repair", "department chairman", "attending physician", "case", "resident", "cuts", "flexor tendon", "tendon", "repaired", "complication", "attending", "resident", "patient", "fine", "need to report", "minor complication", "not", "patient", "not", "to make", "patient worry", "resident to leave", "complication out", "operative report", "following", "correct next action", "resident to take"], "model_answer": "[Disclose the error to the patient and put it in the operative report:Ethically required for transparency and patient autonomy. | Tell the attending that he cannot fail to disclose this mistake:Appropriate professional response to advocate for ethical standards. | Report the physician to the ethics committee:May be necessary if the attending insists on non-disclosure. | Refuse to dictate the operative report:Passive resistance but does not address the core ethical issue.]", "fact_gen_query": "\n    nQuestion:\nA junior orthopaedic surgery resident is completing a carpal tunnel repair with the department chairman as the attending physician. During the case, the resident inadvertently cuts a flexor tendon. The tendon is repaired without complication. The attending tells the resident that the patient will do fine, and there is no need to report this minor complication that will not harm the patient, as he does not want to make the patient worry unnecessarily. He tells the resident to leave this complication out of the operative report. Which of the following is the correct next action for the resident to take?\n\n Option:\nDisclose the error to the patient and put it in the operative report;\nTell the attending that he cannot fail to disclose this mistake;\nReport the physician to the ethics committee;\nRefuse to dictate the operative report;\n\n\n Answer:\nTell the attending that he cannot fail to disclose this mistake\n For this QA example, you need to give netural fact info for each\n    option according to question context, so that later user can infer out the \n    correct answer from these facts. The template of facts is [option1_name:fact| option2_name:fact|...],e.g: [Ampicillin:High resistance, not first-line. | Ceftriaxone:Overkill (for pyelonephritis/severe UTI).]\n"}
{"question": "A 67-year-old man with transitional cell carcinoma of the bladder comes to the physician because of a 2-day history of ringing sensation in his ear. He received this first course of neoadjuvant chemotherapy 1 week ago. Pure tone audiometry shows a sensorineural hearing loss of 45 dB. The expected beneficial effect of the drug that caused this patient's symptoms is most likely due to which of the following actions?", "answer": "Cross-linking of DNA", "options": {"A": "Inhibition of proteasome", "B": "Hyperstabilization of microtubules", "C": "Generation of free radicals", "D": "Cross-linking of DNA"}, "meta_info": "step1", "answer_idx": "D", "metamap_phrases": ["67 year old man", "transitional cell carcinoma of the bladder", "physician", "2-day history", "ringing sensation", "ear", "received", "first course", "neoadjuvant chemotherapy 1 week", "Pure tone audiometry shows", "sensorineural hearing loss", "dB", "expected beneficial effect", "drug", "caused", "patient's symptoms", "most likely due to", "following actions"], "model_answer": "[Inhibition of proteasome:Not associated with ototoxicity or platinum-based chemotherapy. | Hyperstabilization of microtubules:Causes neuropathy, not ototoxicity. | Generation of free radicals:Mechanism of cisplatin-induced ototoxicity but not its therapeutic effect. | Cross-linking of DNA:Therapeutic effect of cisplatin, which also causes ototoxicity.]", "fact_gen_query": "\n    nQuestion:\nA 67-year-old man with transitional cell carcinoma of the bladder comes to the physician because of a 2-day history of ringing sensation in his ear. He received this first course of neoadjuvant chemotherapy 1 week ago. Pure tone audiometry shows a sensorineural hearing loss of 45 dB. The expected beneficial effect of the drug that caused this patient's symptoms is most likely due to which of the following actions?\n\n Option:\nInhibition of proteasome;\nHyperstabilization of microtubules;\nGeneration of free radicals;\nCross-linking of DNA;\n\n\n Answer:\nCross-linking of DNA\n For this QA example, you need to give netural fact info for each\n    option according to question context, so that later user can infer out the \n    correct answer from these facts. The template of facts is [option1_name:fact| option2_name:fact|...],e.g: [Ampicillin:High resistance, not first-line. | Ceftriaxone:Overkill (for pyelonephritis/severe UTI).]\n"}
{"question": "Two weeks after undergoing an emergency cardiac catherization with stenting for unstable angina pectoris, a 61-year-old man has decreased urinary output and malaise. He has type 2 diabetes mellitus and osteoarthritis of the hips. Prior to admission, his medications were insulin and naproxen. He was also started on aspirin, clopidogrel, and metoprolol after the coronary intervention. His temperature is 38°C (100.4°F), pulse is 93/min, and blood pressure is 125/85 mm Hg. Examination shows mottled, reticulated purplish discoloration of the feet. Laboratory studies show:\nHemoglobin count 14 g/dL\nLeukocyte count 16,400/mm3\nSegmented neutrophils 56%\nEosinophils 11%\nLymphocytes 31%\nMonocytes 2%\nPlatelet count 260,000/mm3\nErythrocyte sedimentation rate 68 mm/h\nSerum\nUrea nitrogen 25 mg/dL\nCreatinine 4.2 mg/dL\nRenal biopsy shows intravascular spindle-shaped vacuoles. Which of the following is the most likely cause of this patient's symptoms?\"", "answer": "Cholesterol embolization", "options": {"A": "Renal papillary necrosis", "B": "Cholesterol embolization", "C": "Eosinophilic granulomatosis with polyangiitis", "D": "Polyarteritis nodosa"}, "meta_info": "step2&3", "answer_idx": "B", "metamap_phrases": ["Two weeks", "emergency cardiac", "stenting", "unstable angina pectoris", "61 year old man", "decreased urinary output", "malaise", "type 2 diabetes mellitus", "osteoarthritis of", "hips", "admission", "medications", "insulin", "naproxen", "started", "aspirin", "clopidogrel", "metoprolol", "coronary intervention", "temperature", "100 4F", "pulse", "min", "blood pressure", "85 mm Hg", "Examination shows mottled", "reticulated", "discoloration", "feet", "Laboratory studies show", "Hemoglobin count", "Leukocyte 16", "neutrophils", "Platelet count", "Erythrocyte sedimentation rate", "h Serum Urea nitrogen", "mg", "Creatinine", "mg", "Renal biopsy shows intravascular spindle shaped vacuoles", "following", "most likely cause", "patient", "ymptoms?"], "model_answer": "[Renal papillary necrosis:Associated with chronic NSAID use (naproxen) and diabetes, but lacks eosinophilia and skin findings.| Cholesterol embolization:History of vascular procedure (cardiac catheterization), eosinophilia, mottled skin, and renal dysfunction with intravascular spindle-shaped vacuoles on biopsy.| Eosinophilic granulomatosis with polyangiitis:Features eosinophilia and renal involvement, but typically has asthma, neuropathy, and lacks procedure-related triggers.| Polyarteritis nodosa:Causes renal ischemia but lacks eosinophilia and cholesterol crystal emboli; associated with hypertension and systemic symptoms.]", "fact_gen_query": "\n    nQuestion:\nTwo weeks after undergoing an emergency cardiac catherization with stenting for unstable angina pectoris, a 61-year-old man has decreased urinary output and malaise. He has type 2 diabetes mellitus and osteoarthritis of the hips. Prior to admission, his medications were insulin and naproxen. He was also started on aspirin, clopidogrel, and metoprolol after the coronary intervention. His temperature is 38°C (100.4°F), pulse is 93/min, and blood pressure is 125/85 mm Hg. Examination shows mottled, reticulated purplish discoloration of the feet. Laboratory studies show:\nHemoglobin count 14 g/dL\nLeukocyte count 16,400/mm3\nSegmented neutrophils 56%\nEosinophils 11%\nLymphocytes 31%\nMonocytes 2%\nPlatelet count 260,000/mm3\nErythrocyte sedimentation rate 68 mm/h\nSerum\nUrea nitrogen 25 mg/dL\nCreatinine 4.2 mg/dL\nRenal biopsy shows intravascular spindle-shaped vacuoles. Which of the following is the most likely cause of this patient's symptoms?\"\n\n Option:\nRenal papillary necrosis;\nCholesterol embolization;\nEosinophilic granulomatosis with polyangiitis;\nPolyarteritis nodosa;\n\n\n Answer:\nCholesterol embolization\n For this QA example, you need to give netural fact info for each\n    option according to question context, so that later user can infer out the \n    correct answer from these facts. The template of facts is [option1_name:fact| option2_name:fact|...],e.g: [Ampicillin:High resistance, not first-line. | Ceftriaxone:Overkill (for pyelonephritis/severe UTI).]\n"}
{"question": "A 39-year-old woman is brought to the emergency department because of fevers, chills, and left lower quadrant pain. Her temperature is 39.1°C (102.3°F), pulse is 126/min, respirations are 28/min, and blood pressure is 80/50 mm Hg. There is blood oozing around the site of a peripheral intravenous line. Pelvic examination shows mucopurulent discharge from the cervical os and left adnexal tenderness. Laboratory studies show:\nPlatelet count 14,200/mm3\nFibrinogen 83 mg/mL (N = 200–430 mg/dL)\nD-dimer 965 ng/mL (N < 500 ng/mL)\nWhen phenol is applied to a sample of the patient's blood at 90°C, a phosphorylated N-acetylglucosamine dimer with 6 fatty acids attached to a polysaccharide side chain is identified. A blood culture is most likely to show which of the following?\"", "answer": "Lactose-fermenting, gram-negative rods forming pink colonies on MacConkey agar", "options": {"A": "Coagulase-positive, gram-positive cocci forming mauve-colored colonies on methicillin-containing agar", "B": "Encapsulated, gram-negative coccobacilli forming grey-colored colonies on charcoal blood agar", "C": "Spore-forming, gram-positive bacilli forming yellow colonies on casein agar", "D": "Lactose-fermenting, gram-negative rods forming pink colonies on MacConkey agar"}, "meta_info": "step1", "answer_idx": "D", "metamap_phrases": ["year old woman", "brought", "emergency department", "fevers", "chills", "left lower quadrant pain", "temperature", "pulse", "min", "respirations", "min", "blood pressure", "80 50 mm Hg", "blood", "site of", "peripheral line", "Pelvic examination shows mucopurulent discharge", "cervical os", "left adnexal tenderness", "Laboratory studies show", "Platelet count", "200 mm3 Fibrinogen 83 mg/mL", "N", "mg/dL", "D-dimer", "ng/mL", "N", "500 ng/mL", "phenol", "applied", "sample", "patient", "lood ", "cetylglucosamine  imer ", "atty acids  ttached ", "olysaccharide  ide  hain ", "dentified.", "lood culture ", "ost likely  o  how ", "ollowing?"], "model_answer": "[Coagulase-positive, gram-positive cocci forming mauve-colored colonies on methicillin-containing agar: Typically Staphylococcus aureus, not associated with DIC or septic abortion. | Encapsulated, gram-negative coccobacilli forming grey-colored colonies on charcoal blood agar: Suggests Haemophilus influenzae, unlikely in this context. | Spore-forming, gram-positive bacilli forming yellow colonies on casein agar: Indicates Bacillus species, not typical for pelvic infection. | Lactose-fermenting, gram-negative rods forming pink colonies on MacConkey agar: Consistent with Escherichia coli, common cause of septic abortion and DIC.]", "fact_gen_query": "\n    nQuestion:\nA 39-year-old woman is brought to the emergency department because of fevers, chills, and left lower quadrant pain. Her temperature is 39.1°C (102.3°F), pulse is 126/min, respirations are 28/min, and blood pressure is 80/50 mm Hg. There is blood oozing around the site of a peripheral intravenous line. Pelvic examination shows mucopurulent discharge from the cervical os and left adnexal tenderness. Laboratory studies show:\nPlatelet count 14,200/mm3\nFibrinogen 83 mg/mL (N = 200–430 mg/dL)\nD-dimer 965 ng/mL (N < 500 ng/mL)\nWhen phenol is applied to a sample of the patient's blood at 90°C, a phosphorylated N-acetylglucosamine dimer with 6 fatty acids attached to a polysaccharide side chain is identified. A blood culture is most likely to show which of the following?\"\n\n Option:\nCoagulase-positive, gram-positive cocci forming mauve-colored colonies on methicillin-containing agar;\nEncapsulated, gram-negative coccobacilli forming grey-colored colonies on charcoal blood agar;\nSpore-forming, gram-positive bacilli forming yellow colonies on casein agar;\nLactose-fermenting, gram-negative rods forming pink colonies on MacConkey agar;\n\n\n Answer:\nLactose-fermenting, gram-negative rods forming pink colonies on MacConkey agar\n For this QA example, you need to give netural fact info for each\n    option according to question context, so that later user can infer out the \n    correct answer from these facts. The template of facts is [option1_name:fact| option2_name:fact|...],e.g: [Ampicillin:High resistance, not first-line. | Ceftriaxone:Overkill (for pyelonephritis/severe UTI).]\n"}
{"question": "A 35-year-old man comes to the physician because of itchy, watery eyes for the past week. He has also been sneezing multiple times a day during this period. He had a similar episode 1 year ago around springtime. He has iron deficiency anemia and ankylosing spondylitis. Current medications include ferrous sulfate, artificial tear drops, and indomethacin. He works as an elementary school teacher. His vital signs are within normal limits. Visual acuity is 20/20 without correction. Physical examination shows bilateral conjunctival injection with watery discharge. The pupils are 3 mm, equal, and reactive to light. Examination of the anterior chamber of the eye is unremarkable. Which of the following is the most appropriate treatment?", "answer": "Ketotifen eye drops", "options": {"A": "Erythromycin ointment", "B": "Ketotifen eye drops", "C": "Warm compresses", "D": "Fluorometholone eye drops"}, "meta_info": "step2&3", "answer_idx": "B", "metamap_phrases": ["35 year old man", "physician", "of itchy", "watery", "past week", "sneezing multiple times", "day", "period", "similar episode", "year", "iron deficiency anemia", "ankylosing spondylitis", "Current medications include ferrous sulfate", "artificial tear drops", "indomethacin", "works", "elementary school teacher", "vital signs", "normal limits", "Visual acuity", "20/20", "correction", "Physical examination shows bilateral injection", "watery", "pupils", "3 mm", "equal", "reactive to light", "Examination of the anterior chamber", "eye", "unremarkable", "following", "most appropriate treatment"], "model_answer": "[Erythromycin ointment:Used for bacterial conjunctivitis, not indicated for allergic symptoms. | Ketotifen eye drops:Antihistamine/mast cell stabilizer, effective for allergic conjunctivitis. | Warm compresses:Helpful for blepharitis or dry eyes, not for allergic symptoms. | Fluorometholone eye drops:Steroid for inflammation, not first-line for allergic conjunctivitis.]", "fact_gen_query": "\n    nQuestion:\nA 35-year-old man comes to the physician because of itchy, watery eyes for the past week. He has also been sneezing multiple times a day during this period. He had a similar episode 1 year ago around springtime. He has iron deficiency anemia and ankylosing spondylitis. Current medications include ferrous sulfate, artificial tear drops, and indomethacin. He works as an elementary school teacher. His vital signs are within normal limits. Visual acuity is 20/20 without correction. Physical examination shows bilateral conjunctival injection with watery discharge. The pupils are 3 mm, equal, and reactive to light. Examination of the anterior chamber of the eye is unremarkable. Which of the following is the most appropriate treatment?\n\n Option:\nErythromycin ointment;\nKetotifen eye drops;\nWarm compresses;\nFluorometholone eye drops;\n\n\n Answer:\nKetotifen eye drops\n For this QA example, you need to give netural fact info for each\n    option according to question context, so that later user can infer out the \n    correct answer from these facts. The template of facts is [option1_name:fact| option2_name:fact|...],e.g: [Ampicillin:High resistance, not first-line. | Ceftriaxone:Overkill (for pyelonephritis/severe UTI).]\n"}
{"question": "A 39-year-old man presents to the emergency department because of progressively worsening chest pain and nausea that started at a local bar 30 minutes prior. The pain radiates to the epigastric area. He has a 5-year history of untreated hypertension. He has smoked 1 pack of cigarettes daily for the past 5 years and started abusing cocaine 2 weeks before his emergency room visit. The patient is diaphoretic and in marked distress. What should be the first step in management?", "answer": "Reassurance and continuous monitoring", "options": {"A": "Diltiazem", "B": "Labetalol", "C": "Propranolol", "D": "Reassurance and continuous monitoring"}, "meta_info": "step2&3", "answer_idx": "D", "metamap_phrases": ["year old man presents", "emergency department", "worsening chest pain", "nausea", "started", "local", "30 minutes prior", "pain radiates", "epigastric area", "5 year history of untreated hypertension", "smoked 1 pack", "cigarettes daily", "past", "years", "started abusing cocaine 2 weeks", "emergency room visit", "patient", "diaphoretic", "marked distress", "first step", "management"], "model_answer": "[Diltiazem:Calcium channel blocker; can reduce blood pressure but not first-line for cocaine-associated chest pain due to risk of unopposed alpha-adrenergic stimulation. | Labetalol:Combined alpha and beta blocker; may be used for hypertensive crisis but caution with cocaine use due to potential unopposed alpha effects. | Propranolol:Non-selective beta blocker; contraindicated in cocaine-induced chest pain due to risk of coronary vasoconstriction and worsened ischemia. | Reassurance and continuous monitoring:Initial step to assess stability, provide supportive care, and rule out life-threatening causes like myocardial infarction or aortic dissection.]", "fact_gen_query": "\n    nQuestion:\nA 39-year-old man presents to the emergency department because of progressively worsening chest pain and nausea that started at a local bar 30 minutes prior. The pain radiates to the epigastric area. He has a 5-year history of untreated hypertension. He has smoked 1 pack of cigarettes daily for the past 5 years and started abusing cocaine 2 weeks before his emergency room visit. The patient is diaphoretic and in marked distress. What should be the first step in management?\n\n Option:\nDiltiazem;\nLabetalol;\nPropranolol;\nReassurance and continuous monitoring;\n\n\n Answer:\nReassurance and continuous monitoring\n For this QA example, you need to give netural fact info for each\n    option according to question context, so that later user can infer out the \n    correct answer from these facts. The template of facts is [option1_name:fact| option2_name:fact|...],e.g: [Ampicillin:High resistance, not first-line. | Ceftriaxone:Overkill (for pyelonephritis/severe UTI).]\n"}
{"question": "A 68-year-old male comes to the physician for evaluation of right flank pain. He has a history of diabetes and peripheral artery disease. His blood pressure is 160/90 mm Hg. Physical examination shows abdominal tenderness and right flank tenderness. An ultrasound shows dilation of the right ureter and renal pelvis. Which of the following is the most likely underlying cause of this patient's condition?", "answer": "Common iliac artery aneurysm", "options": {"A": "Renal artery stenosis", "B": "Benign prostatic hyperplasia", "C": "Common iliac artery aneurysm", "D": "Urethral stricture"}, "meta_info": "step1", "answer_idx": "C", "metamap_phrases": ["68 year old male", "physician", "evaluation", "right flank pain", "history", "diabetes", "peripheral artery disease", "blood pressure", "90 mm Hg", "Physical examination shows abdominal tenderness", "right", "ultrasound shows dilation of", "right ureter", "renal pelvis", "following", "most likely underlying cause", "patient's condition"], "model_answer": "[Renal artery stenosis:Can cause hypertension and renal dysfunction, but typically does not lead to ureteral dilation.|Benign prostatic hyperplasia:Can cause urinary obstruction and hydronephrosis, but flank pain is less common.|Common iliac artery aneurysm:Can compress the ureter, leading to hydronephrosis and flank pain, especially in patients with peripheral artery disease.|Urethral stricture:Typically causes lower urinary tract symptoms, not unilateral flank pain or hydronephrosis.]", "fact_gen_query": "\n    nQuestion:\nA 68-year-old male comes to the physician for evaluation of right flank pain. He has a history of diabetes and peripheral artery disease. His blood pressure is 160/90 mm Hg. Physical examination shows abdominal tenderness and right flank tenderness. An ultrasound shows dilation of the right ureter and renal pelvis. Which of the following is the most likely underlying cause of this patient's condition?\n\n Option:\nRenal artery stenosis;\nBenign prostatic hyperplasia;\nCommon iliac artery aneurysm;\nUrethral stricture;\n\n\n Answer:\nCommon iliac artery aneurysm\n For this QA example, you need to give netural fact info for each\n    option according to question context, so that later user can infer out the \n    correct answer from these facts. The template of facts is [option1_name:fact| option2_name:fact|...],e.g: [Ampicillin:High resistance, not first-line. | Ceftriaxone:Overkill (for pyelonephritis/severe UTI).]\n"}
{"question": "A 65-year-old man is brought to the emergency department 30 minutes after the onset of acute chest pain. He has hypertension and asthma. Current medications include atorvastatin, lisinopril, and an albuterol inhaler. He appears pale and diaphoretic. His pulse is 114/min and blood pressure is 130/88 mm Hg. An ECG shows ST-segment depressions in leads II, III, and aVF. Laboratory studies show an increased serum troponin T concentration. The patient is treated for acute coronary syndrome and undergoes percutaneous transluminal coronary angioplasty. At the time of discharge, echocardiography shows a left ventricular ejection fraction of 58%. In addition to aspirin, which of the following drugs should be added to this patient's medication regimen?", "answer": "Clopidogrel", "options": {"A": "Nifedipine", "B": "Enoxaparin", "C": "Clopidogrel", "D": "Spironolactone"}, "meta_info": "step2&3", "answer_idx": "C", "metamap_phrases": ["65 year old man", "brought", "emergency department 30 minutes", "onset of acute", "hypertension", "asthma", "Current medications include atorvastatin", "lisinopril", "albuterol inhaler", "appears pale", "diaphoretic", "pulse", "min", "blood pressure", "88 mm Hg", "ECG shows ST-segment depressions", "leads", "III", "aVF", "Laboratory studies show", "increased serum troponin T concentration", "patient", "treated", "acute coronary syndrome", "percutaneous transluminal coronary angioplasty", "time", "discharge", "echocardiography shows", "left ventricular ejection fraction of 58", "aspirin", "following drugs", "added", "patient's medication regimen"], "model_answer": "[Nifedipine:Not typically used in acute coronary syndrome; may cause reflex tachycardia. | Enoxaparin:Used for initial anticoagulation in ACS but not for long-term therapy. | Clopidogrel:Indicated for dual antiplatelet therapy with aspirin post-PCI to prevent stent thrombosis. | Spironolactone:Not indicated unless heart failure with reduced ejection fraction is present.]", "fact_gen_query": "\n    nQuestion:\nA 65-year-old man is brought to the emergency department 30 minutes after the onset of acute chest pain. He has hypertension and asthma. Current medications include atorvastatin, lisinopril, and an albuterol inhaler. He appears pale and diaphoretic. His pulse is 114/min and blood pressure is 130/88 mm Hg. An ECG shows ST-segment depressions in leads II, III, and aVF. Laboratory studies show an increased serum troponin T concentration. The patient is treated for acute coronary syndrome and undergoes percutaneous transluminal coronary angioplasty. At the time of discharge, echocardiography shows a left ventricular ejection fraction of 58%. In addition to aspirin, which of the following drugs should be added to this patient's medication regimen?\n\n Option:\nNifedipine;\nEnoxaparin;\nClopidogrel;\nSpironolactone;\n\n\n Answer:\nClopidogrel\n For this QA example, you need to give netural fact info for each\n    option according to question context, so that later user can infer out the \n    correct answer from these facts. The template of facts is [option1_name:fact| option2_name:fact|...],e.g: [Ampicillin:High resistance, not first-line. | Ceftriaxone:Overkill (for pyelonephritis/severe UTI).]\n"}
{"question": "A 37-year-old-woman presents to her primary care physician requesting a new form of birth control. She has been utilizing oral contraceptive pills (OCPs) for the past 8 years, but asks to switch to an intrauterine device (IUD). Her vital signs are: blood pressure 118/78 mm Hg, pulse 73/min and respiratory rate 16/min. She is afebrile. Physical examination is within normal limits. Which of the following past medical history statements would make copper IUD placement contraindicated in this patient?", "answer": "Active or recurrent pelvic inflammatory disease (PID)", "options": {"A": "A history of stroke or venous thromboembolism", "B": "Active or recurrent pelvic inflammatory disease (PID)", "C": "Past medical history of breast cancer", "D": "Known liver neoplasm"}, "meta_info": "step2&3", "answer_idx": "B", "metamap_phrases": ["year old woman presents", "primary care physician requesting", "new form", "birth control", "oral contraceptive pills", "past", "years", "to switch", "intrauterine device", "vital signs", "blood pressure", "mm Hg", "pulse", "min", "respiratory rate", "min", "afebrile", "Physical examination", "normal limits", "of", "following past medical statements", "make copper IUD placement contraindicated", "patient"], "model_answer": "Here are the neutral facts for each option based on the question context:  \n\n- **A history of stroke or venous thromboembolism:** Copper IUD does not contain hormones, so it does not increase thrombotic risk. This history is not a contraindication.  \n- **Active or recurrent pelvic inflammatory disease (PID):** Copper IUD placement is contraindicated due to the risk of exacerbating infection or causing complications like tubo-ovarian abscess.  \n- **Past medical history of breast cancer:** Copper IUD is hormone-free and safe for patients with a history of hormone-sensitive cancers (unlike hormonal IUDs).  \n- **Known liver neoplasm:** Copper IUD metabolism does not involve the liver, so liver neoplasms are not a contraindication.  \n\nFormatted as requested:  \n[A history of stroke or venous thromboembolism:No increased thrombotic risk with copper IUD.|Active or recurrent pelvic inflammatory disease (PID):Contraindicated due to infection risk.|Past medical history of breast cancer:Safe, no hormonal influence.|Known liver neoplasm:No liver-related contraindication.]", "fact_gen_query": "\n    nQuestion:\nA 37-year-old-woman presents to her primary care physician requesting a new form of birth control. She has been utilizing oral contraceptive pills (OCPs) for the past 8 years, but asks to switch to an intrauterine device (IUD). Her vital signs are: blood pressure 118/78 mm Hg, pulse 73/min and respiratory rate 16/min. She is afebrile. Physical examination is within normal limits. Which of the following past medical history statements would make copper IUD placement contraindicated in this patient?\n\n Option:\nA history of stroke or venous thromboembolism;\nActive or recurrent pelvic inflammatory disease (PID);\nPast medical history of breast cancer;\nKnown liver neoplasm;\n\n\n Answer:\nActive or recurrent pelvic inflammatory disease (PID)\n For this QA example, you need to give netural fact info for each\n    option according to question context, so that later user can infer out the \n    correct answer from these facts. The template of facts is [option1_name:fact| option2_name:fact|...],e.g: [Ampicillin:High resistance, not first-line. | Ceftriaxone:Overkill (for pyelonephritis/severe UTI).]\n"}
{"question": "A 23-year-old woman comes to the physician because she is embarrassed about the appearance of her nails. She has no history of serious illness and takes no medications. She appears well. A photograph of the nails is shown. Which of the following additional findings is most likely in this patient?", "answer": "Silvery plaques on extensor surfaces", "options": {"A": "Silvery plaques on extensor surfaces", "B": "Flesh-colored papules in the lumbosacral region", "C": "Erosions of the dental enamel", "D": "Holosystolic murmur at the left lower sternal border"}, "meta_info": "step1", "answer_idx": "A", "metamap_phrases": ["23 year old woman", "physician", "embarrassed", "appearance of", "nails", "history", "serious illness", "takes", "medications", "appears well", "photograph", "nails", "shown", "following additional findings", "most likely", "patient"], "model_answer": "[Silvery plaques on extensor surfaces:Associated with psoriasis, which can also cause nail pitting or dystrophy.|Flesh-colored papules in the lumbosacral region:Suggestive of neurofibromatosis or other skin conditions, unrelated to nail changes.|Erosions of the dental enamel:Indicative of bulimia or GERD, not linked to nail abnormalities.|Holosystolic murmur at the left lower sternal border:Suggests a ventricular septal defect, unrelated to nail appearance.]", "fact_gen_query": "\n    nQuestion:\nA 23-year-old woman comes to the physician because she is embarrassed about the appearance of her nails. She has no history of serious illness and takes no medications. She appears well. A photograph of the nails is shown. Which of the following additional findings is most likely in this patient?\n\n Option:\nSilvery plaques on extensor surfaces;\nFlesh-colored papules in the lumbosacral region;\nErosions of the dental enamel;\nHolosystolic murmur at the left lower sternal border;\n\n\n Answer:\nSilvery plaques on extensor surfaces\n For this QA example, you need to give netural fact info for each\n    option according to question context, so that later user can infer out the \n    correct answer from these facts. The template of facts is [option1_name:fact| option2_name:fact|...],e.g: [Ampicillin:High resistance, not first-line. | Ceftriaxone:Overkill (for pyelonephritis/severe UTI).]\n"}
{"question": "A 24-year-old G2P1 woman at 39 weeks’ gestation presents to the emergency department complaining of painful contractions occurring every 10 minutes for the past 2 hours, consistent with latent labor. She says she has not experienced vaginal discharge, bleeding, or fluid leakage, and is currently taking no medications. On physical examination, her blood pressure is 110/70 mm Hg, heart rate is 86/min, and temperature is 37.6°C (99.7°F). She has had little prenatal care and uses condoms inconsistently. Her sexually transmitted infections status is unknown. As part of the patient’s workup, she undergoes a series of rapid screening tests that result in the administration of zidovudine during delivery. The infant is also given zidovudine to reduce the risk of transmission. A confirmatory test is then performed in the mother to confirm the diagnosis of HIV. Which of the following is most true about the confirmatory test?", "answer": "It is an HIV-1/HIV2 antibody differentiation immunoassay", "options": {"A": "It is a Southwestern blot, identifying the presence of DNA-binding proteins", "B": "It is a Northern blot, identifying the presence of RNA", "C": "It is a Northern blot, identifying the presence of DNA", "D": "It is an HIV-1/HIV2 antibody differentiation immunoassay"}, "meta_info": "step1", "answer_idx": "D", "metamap_phrases": ["year old", "woman", "weeks presents", "emergency department", "painful contractions occurring", "10", "past", "hours", "consistent with latent labor", "not experienced vaginal discharge", "bleeding", "fluid leakage", "currently taking", "medications", "physical examination", "blood pressure", "70 mm Hg", "heart rate", "min", "temperature", "99", "little prenatal care", "uses condoms", "sexually transmitted infections status", "unknown", "part of", "patients workup", "series", "rapid screening tests", "result", "administration", "zidovudine", "delivery", "infant", "zidovudine to", "risk", "transmission", "confirmatory test", "then performed", "mother to confirm", "diagnosis", "HIV", "following", "most true", "confirmatory test"], "model_answer": "[Southwestern blot:Identifies DNA-binding proteins, not used for HIV diagnosis. | Northern blot:Detects RNA, not standard for HIV confirmation. | HIV-1/HIV2 antibody differentiation immunoassay:Standard confirmatory test for HIV, distinguishes between HIV-1 and HIV-2 antibodies.]", "fact_gen_query": "\n    nQuestion:\nA 24-year-old G2P1 woman at 39 weeks’ gestation presents to the emergency department complaining of painful contractions occurring every 10 minutes for the past 2 hours, consistent with latent labor. She says she has not experienced vaginal discharge, bleeding, or fluid leakage, and is currently taking no medications. On physical examination, her blood pressure is 110/70 mm Hg, heart rate is 86/min, and temperature is 37.6°C (99.7°F). She has had little prenatal care and uses condoms inconsistently. Her sexually transmitted infections status is unknown. As part of the patient’s workup, she undergoes a series of rapid screening tests that result in the administration of zidovudine during delivery. The infant is also given zidovudine to reduce the risk of transmission. A confirmatory test is then performed in the mother to confirm the diagnosis of HIV. Which of the following is most true about the confirmatory test?\n\n Option:\nIt is a Southwestern blot, identifying the presence of DNA-binding proteins;\nIt is a Northern blot, identifying the presence of RNA;\nIt is a Northern blot, identifying the presence of DNA;\nIt is an HIV-1/HIV2 antibody differentiation immunoassay;\n\n\n Answer:\nIt is an HIV-1/HIV2 antibody differentiation immunoassay\n For this QA example, you need to give netural fact info for each\n    option according to question context, so that later user can infer out the \n    correct answer from these facts. The template of facts is [option1_name:fact| option2_name:fact|...],e.g: [Ampicillin:High resistance, not first-line. | Ceftriaxone:Overkill (for pyelonephritis/severe UTI).]\n"}
{"question": "A 72-year-old man comes to the physician because of a 2-month history of fatigue and worsening abdominal pain. During this period, he also has excessive night sweats and shortness of breath on exertion. Over the past 3 months, he has had a 5.6-kg (12-lb) weight loss. He had a myocardial infarction 3 years ago. He has hypertension, diabetes mellitus, and chronic bronchitis. His medications include insulin, aspirin, lisinopril, and an albuterol inhaler. He has smoked half a pack of cigarettes for the past 45 years. Vital signs are within normal limits. The spleen is palpated 6 cm below the left costal margin. Laboratory studies show:\nHemoglobin 6.4 g/dL\nMean corpuscular volume 85 μm3\nLeukocyte count 5,200/mm3\nPlatelet count 96,000/mm3\nA blood smear is shown. Bone marrow aspiration shows extensive fibrosis and a few scattered plasma cells. A JAK 2 assay is positive. Which of the following is the most appropriate next step in management?\"", "answer": "Ruxolitinib", "options": {"A": "Cladribine", "B": "Prednisone", "C": "Imatinib", "D": "Ruxolitinib"}, "meta_info": "step2&3", "answer_idx": "D", "metamap_phrases": ["72 year old man", "physician", "2 month history", "fatigue", "worsening abdominal pain", "period", "excessive night sweats", "shortness of breath", "exertion", "past 3 months", "5.6 kg", "weight loss", "myocardial infarction", "years", "hypertension", "diabetes mellitus", "chronic bronchitis", "medications include insulin", "aspirin", "lisinopril", "albuterol inhaler", "smoked half", "pack", "cigarettes", "past", "years", "Vital signs", "normal limits", "spleen", "palpated", "cm", "left costal margin", "Laboratory studies show", "Hemoglobin", "g Mean corpuscular volume 85 m3 Leukocyte count", "200 mm3 Platelet count 96", "blood smear", "shown", "Bone marrow aspiration shows extensive fibrosis", "few scattered plasma cells", "JAK 2 assay", "positive", "following", "most appropriate next step", "management"], "model_answer": "[Cladribine:Used for hairy cell leukemia, not indicated for myelofibrosis. | Prednisone:May help with inflammatory symptoms but does not treat underlying myelofibrosis. | Imatinib:Targets BCR-ABL in CML, ineffective in JAK2-positive myelofibrosis. | Ruxolitinib:JAK2 inhibitor, first-line therapy for symptomatic myelofibrosis.]", "fact_gen_query": "\n    nQuestion:\nA 72-year-old man comes to the physician because of a 2-month history of fatigue and worsening abdominal pain. During this period, he also has excessive night sweats and shortness of breath on exertion. Over the past 3 months, he has had a 5.6-kg (12-lb) weight loss. He had a myocardial infarction 3 years ago. He has hypertension, diabetes mellitus, and chronic bronchitis. His medications include insulin, aspirin, lisinopril, and an albuterol inhaler. He has smoked half a pack of cigarettes for the past 45 years. Vital signs are within normal limits. The spleen is palpated 6 cm below the left costal margin. Laboratory studies show:\nHemoglobin 6.4 g/dL\nMean corpuscular volume 85 μm3\nLeukocyte count 5,200/mm3\nPlatelet count 96,000/mm3\nA blood smear is shown. Bone marrow aspiration shows extensive fibrosis and a few scattered plasma cells. A JAK 2 assay is positive. Which of the following is the most appropriate next step in management?\"\n\n Option:\nCladribine;\nPrednisone;\nImatinib;\nRuxolitinib;\n\n\n Answer:\nRuxolitinib\n For this QA example, you need to give netural fact info for each\n    option according to question context, so that later user can infer out the \n    correct answer from these facts. The template of facts is [option1_name:fact| option2_name:fact|...],e.g: [Ampicillin:High resistance, not first-line. | Ceftriaxone:Overkill (for pyelonephritis/severe UTI).]\n"}
{"question": "A 20-year-old man comes to the physician because of worsening gait unsteadiness and bilateral hearing loss for 1 month. He has had intermittent tingling sensations on both cheeks over this time period. He has no history of serious medical illness and takes no medications. Audiometry shows bilateral sensorineural hearing loss. Genetic evaluation shows a mutation of a tumor suppressor gene on chromosome 22 that encodes merlin. This patient is at increased risk for which of the following conditions?", "answer": "Meningioma", "options": {"A": "Renal cell carcinoma", "B": "Meningioma", "C": "Astrocytoma", "D": "Vascular malformations"}, "meta_info": "step1", "answer_idx": "B", "metamap_phrases": ["20 year old man", "physician", "worsening gait unsteadiness", "bilateral hearing loss", "month", "intermittent tingling sensations", "cheeks", "time period", "history of serious medical illness", "takes", "medications", "Audiometry shows bilateral sensorineural hearing loss", "Genetic evaluation shows", "mutation", "tumor suppressor gene", "chromosome 22", "encodes merlin", "patient", "increased risk", "following conditions"], "model_answer": "[Renal cell carcinoma:Not associated with NF2 gene mutation or merlin protein deficiency. | Meningioma:Associated with NF2 gene mutation on chromosome 22, which encodes merlin, a tumor suppressor protein. | Astrocytoma:More commonly linked to NF1 gene mutations, not NF2. | Vascular malformations:Not typically associated with NF2 gene mutations or merlin deficiency.]", "fact_gen_query": "\n    nQuestion:\nA 20-year-old man comes to the physician because of worsening gait unsteadiness and bilateral hearing loss for 1 month. He has had intermittent tingling sensations on both cheeks over this time period. He has no history of serious medical illness and takes no medications. Audiometry shows bilateral sensorineural hearing loss. Genetic evaluation shows a mutation of a tumor suppressor gene on chromosome 22 that encodes merlin. This patient is at increased risk for which of the following conditions?\n\n Option:\nRenal cell carcinoma;\nMeningioma;\nAstrocytoma;\nVascular malformations;\n\n\n Answer:\nMeningioma\n For this QA example, you need to give netural fact info for each\n    option according to question context, so that later user can infer out the \n    correct answer from these facts. The template of facts is [option1_name:fact| option2_name:fact|...],e.g: [Ampicillin:High resistance, not first-line. | Ceftriaxone:Overkill (for pyelonephritis/severe UTI).]\n"}
{"question": "A 47-year-old executive schedules an appointment his physician for a routine medical check-up. He currently has no complaints and claims to be “as fit as a fiddle.” The physical examination findings are unremarkable, except for a mid-systolic murmur heard in the 2nd left intercostal space that radiates to the carotids on auscultation. The physician instructs the patient to stand from a supine position with the stethoscope still placed on his chest. Which of the following changes would occur with this maneuver?", "answer": "A reduction in diastolic filling time", "options": {"A": "An increase in right atrial pressure", "B": "An increase in pulmonary capillary wedge pressure", "C": "A reduction in the slope of the pacemaker potential", "D": "A reduction in diastolic filling time"}, "meta_info": "step1", "answer_idx": "D", "metamap_phrases": ["year old executive schedules", "appointment", "physician", "routine medical check-up", "currently", "complaints", "to", "fit", "physical examination findings", "unremarkable", "except for", "systolic murmur heard", "2nd left intercostal space", "radiates", "carotids", "auscultation", "physician", "patient to stand", "supine position", "stethoscope", "placed", "chest", "following changes", "occur"], "model_answer": "[An increase in right atrial pressure:Standing reduces venous return, decreasing right atrial pressure.|An increase in pulmonary capillary wedge pressure:Standing decreases preload, lowering pulmonary capillary wedge pressure.|A reduction in the slope of the pacemaker potential:Standing does not directly affect cardiac pacemaker cells.|A reduction in diastolic filling time:Standing reduces venous return, decreasing ventricular filling and shortening diastole.]", "fact_gen_query": "\n    nQuestion:\nA 47-year-old executive schedules an appointment his physician for a routine medical check-up. He currently has no complaints and claims to be “as fit as a fiddle.” The physical examination findings are unremarkable, except for a mid-systolic murmur heard in the 2nd left intercostal space that radiates to the carotids on auscultation. The physician instructs the patient to stand from a supine position with the stethoscope still placed on his chest. Which of the following changes would occur with this maneuver?\n\n Option:\nAn increase in right atrial pressure;\nAn increase in pulmonary capillary wedge pressure;\nA reduction in the slope of the pacemaker potential;\nA reduction in diastolic filling time;\n\n\n Answer:\nA reduction in diastolic filling time\n For this QA example, you need to give netural fact info for each\n    option according to question context, so that later user can infer out the \n    correct answer from these facts. The template of facts is [option1_name:fact| option2_name:fact|...],e.g: [Ampicillin:High resistance, not first-line. | Ceftriaxone:Overkill (for pyelonephritis/severe UTI).]\n"}
{"question": "A microbiologist is studying the emergence of a virulent strain of the virus. After a detailed study of the virus and its life cycle, he proposes a theory: Initially, a host cell is co-infected with 2 viruses from the same virus family. Within the host cell, concomitant production of various genome segments from both viruses occurs. Ultimately, the different genome segments from the viruses are packaged into a unique and novel virus particle. The newly formed virus particle is both stable and viable and is a new strain from the virus family that caused the outbreak of infection. Which of the following viruses is capable of undergoing the above-mentioned process?", "answer": "Rotavirus", "options": {"A": "Epstein-Barr virus", "B": "Human immunodeficiency virus", "C": "Rotavirus", "D": "Vaccinia virus"}, "meta_info": "step1", "answer_idx": "C", "metamap_phrases": ["microbiologist", "studying", "emergence", "virulent strain", "virus", "detailed study", "virus", "life cycle", "theory", "Initially", "host cell", "co infected", "viruses", "same virus family", "host cell", "concomitant production", "various genome segments", "viruses occurs", "different genome segments", "viruses", "packaged", "unique", "novel virus particle", "newly formed virus particle", "stable", "viable", "new strain", "virus family", "caused", "outbreak", "infection", "following viruses", "capable", "process"], "model_answer": "[Epstein-Barr virus:DNA virus, herpesvirus family, does not undergo reassortment. | Human immunodeficiency virus:RNA retrovirus, replicates via reverse transcription, no segmented genome. | Rotavirus:RNA virus with segmented genome, capable of reassortment during co-infection. | Vaccinia virus:DNA virus, poxvirus family, no segmented genome, replication occurs in cytoplasm.]", "fact_gen_query": "\n    nQuestion:\nA microbiologist is studying the emergence of a virulent strain of the virus. After a detailed study of the virus and its life cycle, he proposes a theory: Initially, a host cell is co-infected with 2 viruses from the same virus family. Within the host cell, concomitant production of various genome segments from both viruses occurs. Ultimately, the different genome segments from the viruses are packaged into a unique and novel virus particle. The newly formed virus particle is both stable and viable and is a new strain from the virus family that caused the outbreak of infection. Which of the following viruses is capable of undergoing the above-mentioned process?\n\n Option:\nEpstein-Barr virus;\nHuman immunodeficiency virus;\nRotavirus;\nVaccinia virus;\n\n\n Answer:\nRotavirus\n For this QA example, you need to give netural fact info for each\n    option according to question context, so that later user can infer out the \n    correct answer from these facts. The template of facts is [option1_name:fact| option2_name:fact|...],e.g: [Ampicillin:High resistance, not first-line. | Ceftriaxone:Overkill (for pyelonephritis/severe UTI).]\n"}